Participante,Texto,Sentimiento,Palabras,Dia,Mes,Anio
PRESIDENTE ANDRES MANUEL LOPEZ OBRADOR, Muy buenos días.,0.0,3,06,12,2021
PRESIDENTE ANDRES MANUEL LOPEZ OBRADOR,"Pues vamos a iniciar la semana con el Quién es quién en los precios de los combustibles y también vamos a entregar reconocimientos a concesionarios de gasolineras que han actuado con rectitud, esto es entregando litros de a litro y buscando vender a buen precio las gasolinas y otros combustibles. Pero el que va a explicarnos más sobre esto pues es Ricardo Sheffield, al que le tenemos toda la confianza y yo nada más agradecerle por esta actitud responsable.",0.0,79,06,12,2021
PRESIDENTE ANDRES MANUEL LOPEZ OBRADOR,"Todos tenemos, los mexicanos, que hacer lo que nos corresponde para actuar con honestidad. La mayor riqueza del pueblo de México es la honestidad y si actuamos así vamos a seguir saliendo adelante ante cualquier adversidad. La honestidad es la mayor riqueza del pueblo de México.",0.0,46,06,12,2021
PRESIDENTE ANDRES MANUEL LOPEZ OBRADOR,"Y el principal problema de México es la corrupción, esa es la causa principal de la desigualdad económica, social. Por la corrupción hay pobreza, por la corrupción hay violencia, por la corrupción se produce ingobernabilidad. Entonces, acabar con la corrupción y establecer como forma de vida y como forma de gobierno la honestidad es el proyecto de México, es lo que más nos conviene. Y tenemos que participar todos, tanto los que estamos en el gobierno como los integrantes de la sociedad.",0.0,82,06,12,2021
PRESIDENTE ANDRES MANUEL LOPEZ OBRADOR,"Y por eso, muchas gracias.",0.0,5,06,12,2021
PRESIDENTE ANDRES MANUEL LOPEZ OBRADOR,"Adelante, Ricardo.",0.0,2,06,12,2021
RICARDO SHEFFIELD PADILLA," Buenos días, señor presidente. Muchas gracias.",0.0,6,06,12,2021
RICARDO SHEFFIELD PADILLA,Muy buenos días a todas y a todos ustedes.,0.0,9,06,12,2021
RICARDO SHEFFIELD PADILLA,"Empezamos primero por el quién es quién en los combustibles de esta semana que cerró. El corte con 1º de diciembre de la mezcla mexicana de petróleo, 61 dólares con 59 centavos. Ha venido bajando el costo del petróleo a nivel internacional; por tanto, también ha bajado el incentivo fiscal al IEPS, que en esta semana que está transcurriendo será del 58.68 por ciento. Y eso es algo que hay que reconocer al día de hoy a las estaciones de servicio que se nombrarán porque ese incentivo fiscal lo están transmitiendo totalmente al consumidor, son aliados de los consumidores.",0.0,99,06,12,2021
RICARDO SHEFFIELD PADILLA,"El precio promedio de la gasolina regular en el país, 20 pesos con 51 centavos; de la Premium, 22 pesos con 52 centavos; y del diésel, 21 pesos con 71 centavos.",0.0,31,06,12,2021
RICARDO SHEFFIELD PADILLA,"Las tres marcas más caras, con el margen más alto, Redco, Crevron y CorpoGas.",0.0,14,06,12,2021
RICARDO SHEFFIELD PADILLA,"Qué bueno que Oxxo Gas ya se bajó, por ser una cadena muy importante, más de 800 gasolineras, influye mucho en los promedios que esta cadena se mueva hacia el promedio de la tabla y gracias a Oxxo Gas, que ya redujo, sobre todo el norte del país, sus precios.",0.0,50,06,12,2021
RICARDO SHEFFIELD PADILLA,"Exxon Mobil, Rendichicas y Orsan las tres marcas más económicas en esta semana.",0.0,13,06,12,2021
RICARDO SHEFFIELD PADILLA,"Combustibles BP, con un precio al público de 22 pesos 55 centavos y un margen de tres pesos 64 centavos es la opción más cara, con el margen más alto en la gasolina regular; mientras que de la franquicia Pemex es en Tekantó, Yucatán, 19.71 por litro y un margen de 21 centavos son la opción más económica de regular.",0.0,60,06,12,2021
RICARDO SHEFFIELD PADILLA,"Para la Premium, Combustibles BP en Benito Juárez, en Cancún, en Quintana Roo, 24 pesos con cuatro centavos por litro, con un margen de tres pesos 91 centavos, un margen bastante alto, es la opción más cara, con el margen más alto; mientras que en La Paz, Baja California Sur, una de franquicia Pemex tiene el precio de 21 pesos 38 centavos por litro y un margen de 18 centavos, muy buen precio para Baja California Sur, que tiene bastantes problemas de logística que influyen al precio al consumidor.",0.0,89,06,12,2021
RICARDO SHEFFIELD PADILLA,"Del diésel, Combustibles BP, en Carmen, Campeche, 23 pesos con 95 centavos por litro y un margen de tres pesos 85 centavos es la opción más cara, con el margen más alto, comparado con los 18 centavos de margen que tiene franquicia Pemex, en Gómez Palacio, Durango, teniendo un precio al público de 20 con 99 centavos.",0.0,57,06,12,2021
RICARDO SHEFFIELD PADILLA,"En el tema de verificaciones, que lo hacemos a través de las quejas que se presentan en la app de Litro por Litro en ambos sistemas, Android y de iOS, son 296 quejas que se atendieron en esta semana que pasó a través de 188 visitas o verificaciones.",0.0,48,06,12,2021
RICARDO SHEFFIELD PADILLA,"Seis gasolineras no se dejaron verificar en esta semana. Bueno, nos van a hacer batallar, pero van a batallar al final más ellos por no cumplir con la ley. Son dos en Aguascalientes, dos en La Paz, Baja California, una en Centro, Tabasco, y otra en Salamanca, Guanajuato.",0.0,48,06,12,2021
RICARDO SHEFFIELD PADILLA,¿Y por qué van a batallar más ellos?,0.0,8,06,12,2021
RICARDO SHEFFIELD PADILLA,"Pues por no dejarse verificar, pues ya de entrada se ganaron una multa de 800 mil pesos en números redondos.",0.0,20,06,12,2021
RICARDO SHEFFIELD PADILLA,"Y luego les pongo el ejemplo de Comacalco, Tabasco, donde esta gasolinera, llegamos pues ya no con ASEA y la CRE nada más, llegamos con la Fiscalía General de la República y una orden de cateo, se descubrieron estos aparatos para robar a los consumidores en las 10 bombas y toda la gasolinera quedó clausurada, incluso ya intervenida por la propia Fiscalía General de la República.",0.0,66,06,12,2021
RICARDO SHEFFIELD PADILLA,"Si tomamos en cuenta solamente el precio del consumidor por litro y no vemos el margen, las más baratas, de acuerdo a la app, es 18.58 por litro de Mobil en la regular en Puebla, Puebla, y en Toluca, Estado de México, también Mobil, a 19 pesos con nueve centavos por litro.",0.0,52,06,12,2021
RICARDO SHEFFIELD PADILLA,"Mientras que las más caras, 23 pesos con 19 centavos de franquicia Pemex en Tepelmeme, Oaxaca, en 22 pesos con 99 centavos de Shell, en Moloacán, Veracruz.",0.0,27,06,12,2021
RICARDO SHEFFIELD PADILLA,"Para la Premium, la más barata, 20.39 de Servifácil en Coatzacoalcos, Veracruz, y 20.76 de franquicia Pemex, en Veracruz, Veracruz.",0.0,20,06,12,2021
RICARDO SHEFFIELD PADILLA,"Mientras que las más caras 24.99 en Santa Ana, Sonora, y 24.89 de Shell, en la Miguel Hidalgo, aquí en la Ciudad de México.",0.0,24,06,12,2021
RICARDO SHEFFIELD PADILLA,"Para el diésel, la más barata 19.89 de Mobil, en Tapatlaxco de Hidalgo, Puebla, y 20.19 de Valero, en Zapopan, Jalisco.",0.0,21,06,12,2021
RICARDO SHEFFIELD PADILLA,"Las más caras, para el diésel, 24.34 por litro de franquicia Pemex, en Taxco de Alarcón, Guerrero, y 23.95 de BP, en el Carmen, Campeche.",0.0,25,06,12,2021
RICARDO SHEFFIELD PADILLA,"También seguimos monitoreando el tema de los sanitarios, que eso es algo que también se tomó en cuenta para los reconocimientos que estará entregando el señor presidente en un momento más.",0.0,31,06,12,2021
RICARDO SHEFFIELD PADILLA,"Quién es quién en los precios del gas LP. Tenemos los precios promedios internacionales convertidos ya a pesos para el gas LP por kilo en cilindros. El precio internacional convertido a pesos sería de 25 pesos con 73 centavos; sin embargo, el promedio de precios máximos en México 23 pesos con 57 centavos por kilo. Esto es para cilindros, con corte el 1º de diciembre de este año.",0.0,68,06,12,2021
RICARDO SHEFFIELD PADILLA,"Ese mismo día 13 pesos con 74 centavos por litro ya convertido a pesos el precio internacional de este producto, 12.68 es el precio promedio de todas las regiones en nuestro país para tanques estacionarios.",0.0,35,06,12,2021
RICARDO SHEFFIELD PADILLA,"Vemos una baja, es una baja contracíclica, un poco anormal.",0.0,10,06,12,2021
RICARDO SHEFFIELD PADILLA,¿Por qué contracíclica?,0.0,3,06,12,2021
RICARDO SHEFFIELD PADILLA,"Porque el ciclo normal es que como vaya bajando las temperaturas va subiendo el consumo de gas LP a nivel mundial, eso hablamos de diciembre, enero, febrero, marzo.",0.0,28,06,12,2021
RICARDO SHEFFIELD PADILLA,Normalmente estaríamos viendo subir los precios a nivel internacional. Ahora afortunadamente para todos los consumidores y las familias mexicanas viene este contraciclo de ya más de 30 centavos de dólar que ha bajado a nivel internacional los precios del gas LP.,0.0,41,06,12,2021
RICARDO SHEFFIELD PADILLA,"Y aun así seguimos encontrando varias empresas solidarias con los consumidores que dan por debajo de los precios máximos de sus regiones. Encontramos ejemplos en Hidalgo, en Tlaxcala, en Puebla, en Guerrero, en Jalisco y en San Luis Potosí para tanques estacionarios. De llamar la atención Flamagas de Zimapán, Hidalgo, con un precio al público por kilo, digo, por litro de 13 pesos con un centavo cuando el precio máximo de la región es 14 pesos con 13 centavos, casi un peso 30 centavos por abajo del precio máximo.",0.0,89,06,12,2021
RICARDO SHEFFIELD PADILLA,"Y tenemos también la misma situación para cilindros de gas Flamagas en Zimapán, Hidalgo, 24 pesos con nueve centavos por kilo, cuando el precio máximo en la región es de 26 pesos con 61 centavos, 2.50 por kilo por debajo, siendo muy solidarios con los consumidores en esa región.",0.0,49,06,12,2021
RICARDO SHEFFIELD PADILLA,"En verificación de gas realizamos 820 verificaciones o visitas, 808 resultaron sin infracción, 10 con infracción.",0.0,16,06,12,2021
RICARDO SHEFFIELD PADILLA,"Ahora encontramos muchos cilindros en mal estado, 9.6 por ciento de lo que se verificó en la semana en mal estado, sobre todo porque recargamos mucho las verificaciones al Estado de México y a la Ciudad de México donde ahorita voy a explicarles por qué hemos estado encontrando mucho cilindro en mal estado.",0.0,53,06,12,2021
RICARDO SHEFFIELD PADILLA,"Dos negativas de verificación que de seguro traen problemas serios, uno es Tempo Gas en la carretera de Aguascalientes a Zacatecas, donde no quisieron colaborar con la verificación y los estaremos visitando con Guardia Nacional.",0.0,35,06,12,2021
RICARDO SHEFFIELD PADILLA,"Y los otros pues estuvieron como los niños, les tocábamos la puerta y estaban todos adentro y nos decían: ‘No te voy a abrir, no te voy a abrir’, y, bueno, no nos abrirán a nosotros, pero sí a la Guardia Nacional, estuvimos casi una hora tocándoles la puerta y ellos encerrados adentro.",0.0,53,06,12,2021
RICARDO SHEFFIELD PADILLA,"Otro ejemplo del trabajo conjunto entre la Profeco, la CRE y la ASEA es esta estación de carburación, estación de venta de gas LP en el parque industrial Ixtapaluca, en el municipio de Ixtapaluca, Estado de México, donde actuamos las tres instituciones de manera conjunta. La ASEA los clausuró porque no tenían ningún tipo de permiso relacionado a la seguridad, no cumplían con nada, bueno, ni siquiera tenían permiso de concesión de la CRE, por lo cual este lugar fue totalmente cerrado.",0.0,82,06,12,2021
RICARDO SHEFFIELD PADILLA,"Y como ha instruido el señor presidente Andrés Manuel López Obrador, la idea no es sólo señalar los que se portan mal, los que incumplen la ley, para ellos hay las sanciones, no sólo las multas, incluso algunos de ellos hasta el tema penal.",0.0,44,06,12,2021
RICARDO SHEFFIELD PADILLA,"Pero hay que reconocer a los que son solidarios con los consumidores, como se hizo hace un año. Todos estos empresarios y empresas han sido verificadas también por la Unidad de Inteligencia Financiera para constatar que no comercian ni con gas ni gasolina robada, que pagan sus impuestos; en otras palabras, que son empresas y empresarios ejemplares, y que son solidarios con los consumidores, porque han mantenido precios bajos en promedio para el consumidor, márgenes muy razonables de utilidad y eso es lo que les queremos reconocer a nombre del gobierno federal por instrucción del señor presidente a estas empresas y empresarios, y sobre todo que dan litros y kilos de a kilo y litros de a litro.",0.0,118,06,12,2021
RICARDO SHEFFIELD PADILLA,Vamos a comenzar por los que reciben reconocimiento en gas LP. De las ocho regiones están aquí presentes tres que reciben el reconocimiento. Voy a mencionar quién viene en nombre de la empresa y le agradecería que pasara al frente para recibir este distintivo que podrán poner en sus negocios.,0.0,50,06,12,2021
RICARDO SHEFFIELD PADILLA,"Bertha Judith Ceja Urbiola, por parte de Gas Exprés Nieto de México, S.A. de C.V. Muchas gracias por su solidaridad y su trabajo a favor de los consumidores.",0.0,28,06,12,2021
RICARDO SHEFFIELD PADILLA,"El siguiente es Cynthia Desirée Calcáneo Rojano de Gas Express Nieto S.A. de C.V. Gracias, Cynthia. Es tuya.",0.0,18,06,12,2021
RICARDO SHEFFIELD PADILLA,"Y Kino Gas, de Tijuana, representada por Francisco Javier Duarte Rodríguez.",0.0,11,06,12,2021
RICARDO SHEFFIELD PADILLA,"Y como aliado del consumidor marca a nivel nacional es Diegas S.A de C.V. por su mejor comportamiento y promedio de precios a lo largo del año, representado por Aldo Paúl Pérez Valerio. Gracias a Diegas por esa solidaridad con el consumidor, aliados del consumidor. Muchas gracias. Felicidades.",0.0,48,06,12,2021
RICARDO SHEFFIELD PADILLA,Con eso concluimos el tema de gas LP. Agradecemos a Diegas por ser aliado del consumidor en este año que concluye.,0.0,21,06,12,2021
RICARDO SHEFFIELD PADILLA,"Y ahora pasamos al tema de las gasolineras. Ahí tenemos, de las ocho regiones, presentes a cinco representantes de estas estaciones de servicio.",0.0,23,06,12,2021
RICARDO SHEFFIELD PADILLA,Y comenzamos por Gasolineras Terán. El doctor Saraín Montero representa a Gasolineras Terán. Felicidades por ser un aliado del consumidor en su región.,0.0,23,06,12,2021
RICARDO SHEFFIELD PADILLA,"El siguiente, Servicios Apache, de Jesús José Soto. Gracias por ser uno de los aliados del consumidor en su región.",0.0,20,06,12,2021
RICARDO SHEFFIELD PADILLA,"Servicios de Gasolinera Gasgal, viene Jorge Arturo Martín Garibaldi. Bienvenido. Felicidades. Comercialmente son Rendichicas, con mucha presencia y aliados de los consumidores en la zona del Pacífico Norte.",0.0,28,06,12,2021
RICARDO SHEFFIELD PADILLA,"Combustibles Rodríguez Guerra, de Matamoros, representado por José Luis Rodríguez Guerra. Bienvenido y felicidades por ser un aliado del consumidor en su región.",0.0,23,06,12,2021
RICARDO SHEFFIELD PADILLA,"Estación de Servicios para Autos, circuito, Isla Regia, S.A. de C.V. Perdón, están juntos, es Estación de Servicios para Autocircuito, representado por Luis Gómez Pérez. Ahora sí, Isla Regia, aliados del consumidor en su región Roberto Guillermo Ugalde Reynaud, el representante de esta estación de servicio. Felicidades. Muchas gracias.",0.0,49,06,12,2021
RICARDO SHEFFIELD PADILLA,"Y para concluir esta premiación los aliados como cadena de los consumidores a nivel nacional es Estaciones de Servicio Alto S.A. de C.V. la marca Orsan, representada por el arquitecto Carlos Sandoval. Felicidades Orsan por ser aliados de los consumidores a nivel nacional. Felicidades.",0.0,44,06,12,2021
RICARDO SHEFFIELD PADILLA,"Muchas gracias, señor presidente, y gracias a los gaseros y a los gasolineros reconocidos por ser aliados de los consumidores y por cumplir cabalmente la ley. Felicidades.",0.0,27,06,12,2021
PRESIDENTE ANDRES MANUEL LOPEZ OBRADOR, Los invitamos a que continúen en esta conferencia en este diálogo circular.,0.0,12,06,12,2021
PRESIDENTE ANDRES MANUEL LOPEZ OBRADOR,Vamos con videos de las obras.,0.0,6,06,12,2021
PREGUNTA, La Secretaría de la Defensa Nacional informa los avances en la construcción del Aeropuerto Internacional ‘Felipe Ángeles’ al 6 de diciembre de 2021.,0.0,23,06,12,2021
PREGUNTA,"En la pista norte y central plataformas y rodajes se efectúan los trabajos de tendido de concreto de alta resistencia como superficie de rodamiento, aplicación de pintura en pistas y calles de rodaje para el señalamiento horizontal y colocación de bases iluminarias para los sistemas de luces.",0.0,47,06,12,2021
PREGUNTA,"En la terminal de pasajeros se realizan trabajos de construcción de muros de mampostería con tabique multiperforado, colocación de plafón de panel y baños temáticos del cine mexicano.",0.0,28,06,12,2021
PREGUNTA,"En la interconexión vial tramo caseta Tultepec-Santa Lucía se ejecuta el cubrimiento final en el corredor comercial, montaje de tableta prefabricada para el Tren Suburbano y trabajos en el paso deprimido de la interconexión vial.",0.0,35,06,12,2021
PREGUNTA,"En el eje troncal de circulación y obras complementarias se continúa con la urbanización y paisajismo desde la manzana 1 a la 16, equipamiento de alojamientos y comandancia en el área de transferencia de seguridad del AIFA, además de la colocación de redes generales de voz y datos.",0.0,48,06,12,2021
PREGUNTA,En la vialidad y barda perimetral se lleva a cabo el habilitado de acero para muros de contención y guarniciones en la vialidad perimetral.,0.0,24,06,12,2021
PREGUNTA,"A la fecha se han generado 135 mil 397 empleos civiles bajo el control, dirección y supervisión de 195 militares.",0.0,20,06,12,2021
PREGUNTA,Faltan 105 días de construcción.,0.0,5,06,12,2021
ROCIO NAHLE GARCIA," Hoy es 3 de diciembre y hoy estamos trasladando desde puerto de Dos Bocas un reactor, hornos, que vienen de Corea y que vienen de Guadalajara, es un puente especial que se hizo para que pueda transitar equipo de estas dimensiones.",0.0,41,06,12,2021
ROCIO NAHLE GARCIA,Va el reporte de esta semana.,0.0,6,06,12,2021
PREGUNTA," Esta semana se finalizó la construcción del acceso para el transporte del equipo pesado desde el puerto de Dos Bocas hacia el interior de la refinería Olmeca, en el cual se realiza el ingreso de los primeros equipos a través de esta vía que cuenta con dimensiones de 140 metros de largo por 20 metros de ancho y con capacidad de soporte de cuatro mil toneladas.",0.0,66,06,12,2021
PREGUNTA,Una de las grandes ventajas de la ubicación de la refinería es la facilidad de abastecer los equipos críticos y pesados que llegan por vía marítima y en tan sólo 500 metros se transportan hacia el sitio.,0.0,37,06,12,2021
PREGUNTA,Se reporta la llegada del reactor y hornos provenientes de Corea y el intercambiador de calor fabricados en Guadalajara y Altamira.,0.0,21,06,12,2021
PREGUNTA,"Mientras tanto, en la planta catalítica se terminaron de instalar los módulos Merox y en la planta isomerizadora de pentanos y hexanos se llevó a cabo el izaje de la columna estabilizadora con un peso de 101.5 toneladas.",0.0,38,06,12,2021
PREGUNTA,"También arribó a la planta reformadora la columna absorbedora de la unidad de purificación de LPG de 35 metros de largo, la cual ya se encuentra en sitio para su instalación de acuerdo a programa.",0.0,35,06,12,2021
PREGUNTA,En la planta de cogeneración de electricidad se avanza en la cimentación superficial para preparar el sitio de las turbinas que llegan en 40 días.,0.0,25,06,12,2021
PREGUNTA,Continúan los trabajos de pintura y soldadura en el área de almacenamiento.,0.0,12,06,12,2021
PREGUNTA,"En los edificios administrativas continúa la instalación de aire acondicionado, plafón y piso cerámico.",0.0,14,06,12,2021
PREGUNTA,En el cuarto de control el trabajo continúa en el interior para revestir y acondicionar el sitio.,0.0,17,06,12,2021
PREGUNTA,Y en el laboratorio se realizan trabajos de construcción de muros.,0.0,11,06,12,2021
PREGUNTA,Continúan los trabajos en las bases estructurales del área de afluentes y se realizan el montaje de tubería y colocación de lámina en las torres de enfriamiento.,0.0,27,06,12,2021
PREGUNTA,Se avanza en la construcción de las 39 subestaciones y se lleva a cabo la colocación de soportes y concertina en la barra perimetral de la zona de almacenamiento.,0.0,29,06,12,2021
PREGUNTA,En el acueducto se reporta un 67 por ciento de avance en la instalación de la tubería.,0.0,17,06,12,2021
PREGUNTA,Continúa el trasplante de plantas de ornato cultivadas en el vivero hacia las áreas verdes de la refinería Olmeca.,0.0,19,06,12,2021
PREGUNTA," Tren Maya, reporte de avances, semana 56 de 157.",0.0,9,06,12,2021
PREGUNTA,"En el tramo 1 continuamos con las labores de 79 obras de drenaje transversal. En Balancán, Tabasco, avanzamos con la conformación de terraplén, en el águila continuamos con el subyacente, hemos finalizado 71 kilómetros de terracerías y tenemos en ejecución 41 kilómetros.",0.0,42,06,12,2021
PREGUNTA,"En el tramo 2, en Pocboc, Campeche, en colaboración con el INAH descubrimos un espacio prehispánico sacro. En este espacio se ubicaron dos altares, un monolito con la forma de un caparazón de tortuga y también una cabeza trabajada en roca. Los hallazgos fueron recuperados y se encuentran en un taller de restauración. Al día de hoy tenemos registro de 18 mil 325 hallazgos arqueológicos en toda la ruta del Tren Maya.",0.0,72,06,12,2021
PREGUNTA,"En el tramo 3, en Halachó, Yucatán, finalizamos la conformación de terraplén, en Maxcanú finalizamos el pedraplén, también avanzamos en la construcción de 14 pasos vehiculares y construimos obra complementaria de drenaje transversal. Hemos finalizado 31 ODT.",0.0,37,06,12,2021
PREGUNTA,"En el tramo 4, avanzamos con labores de construcción en la carretera Kantunil-Cancún con actividades de colocación de tuberías para el cableado subterráneo. También avanzamos en la construcción de 31 pasos ganaderos, todas las ubicaciones de los pasos ganaderos responden a las solicitudes de los ejidatarios de la zona.",0.0,49,06,12,2021
PREGUNTA,"En total, hemos activado 77 kilómetros para trabajos de adecuación y tenemos habilitados 56 kilómetros para el tránsito.",0.0,18,06,12,2021
PREGUNTA,"En Ciudad Sahagún, Hidalgo, Alstom la empresa responsable del diseño, fabricación y puesta en marcha de los trenes del Tren Maya celebró el día del proveedor en un evento sin precedentes donde reunió a más de 130 empresas interesadas en ser parte del proyecto del Tren Maya.",0.0,47,06,12,2021
PREGUNTA,El siguiente paso será solicitar las cotizaciones de los proveedores y hacer una evaluación detallada de sus capacidades. Con esto avanzamos en la construcción de material rodante.,0.0,27,06,12,2021
PREGUNTA,Los empleos generados por el Tren Maya en el sureste ya ascienden a 92 mil 145.,0.0,16,06,12,2021
VOZ DE MUJER," Construcción del Tren Interurbano México-Toluca, reporte semanal.",0.0,7,06,12,2021
VOZ DE MUJER,Vía catenaria y obra electromecánica. Avance: 45.6 por ciento.,0.0,9,06,12,2021
VOZ DE MUJER,"Tendido de catenaria. Continúa la instalación del sistema de catenaria en terracerías 3 del kilómetro 32 al 33. El cable de tierra se instala directamente con un aislador sobre los postes metálicos, los cables de corriente eléctrica se instalan lateralmente sobre ménsulas.",0.0,42,06,12,2021
VOZ DE MUJER,"Instalación de vía. Una vez instalados los tramos de riel, las juntas son unidas mediante soldadura eléctrica y posteriormente esmerilados para el acabado final con la ayuda de un equipo robotizado que garantiza la fusión entre los rieles y el perfil conforme a proyecto.",0.0,44,06,12,2021
VOZ DE MUJER,Portal Toluca. Se coloca el acero de refuerzo para la losa de concreto sobre la cual se fijará la vía en los portales del túnel para las transiciones geométricas con los viaductos adyacentes.,0.0,33,06,12,2021
VOZ DE MUJER,"Tramo 3, 17 kilómetros. Avance de obra: 53.6 por ciento.",0.0,10,06,12,2021
VOZ DE MUJER,"Viaducto mixto 2. En horario nocturno fueron colocadas dos trabes metálicas de este viaducto en la zona de casetas, falta una sola sección por montar para cerrar este tramo. Una vez colocadas todas las piezas metálicas, se realizarán trabajos de soldadura y colados de concreto hidráulico para formar la sección estructural mixta de este viaducto.",0.0,55,06,12,2021
VOZ DE MUJER,"Estación Santa Fe. Concluyó el montaje de las secciones metálicas sobre los ocho apoyos de la estación, estas secciones se unen mediante soldadura, posteriormente se colocará concreto hidráulico en su interior.",0.0,31,06,12,2021
VOZ DE MUJER,"Estación Vasco de Quiroga. Avanza la cimentación profunda de la estación con la perforación y armado de pilas, las instalaciones existentes se desmantelarán para su posterior reubicación.",0.0,27,06,12,2021
VOZ DE MUJER,"El Tren Interurbano será un medio de transporte sostenible porque traerá beneficios a la población, al medio ambiente y a la economía de la región.",0.0,25,06,12,2021
VOZ DE MUJER,"Secretaría de Infraestructura, Comunicaciones y Transportes.",0.0,6,06,12,2021
PREGUNTA," En el Istmo de Tehuantepec viven alrededor de 2.4 millones de personas. Mediante la modernización de la infraestructura, las y los habitantes de la región podrán comercializar productos a otras partes de México y el mundo.",0.0,36,06,12,2021
PREGUNTA,"A continuación, se informa el avance de otras a 6 de diciembre de 2021.",0.0,14,06,12,2021
PREGUNTA,En el puerto de Salina Cruz continuamos la construcción de 1.6 kilómetros del Rompeolas Oeste. La creación de elementos de concreto tiene un avance del 48 por ciento.,0.0,28,06,12,2021
PREGUNTA,"Al día de hoy hemos colado seis mil 287 elementos, los cuales serán utilizados al final de la obra con el propósito de reforzar la construcción y disminuir la energía de las olas.",0.0,33,06,12,2021
PREGUNTA,La rehabilitación de las vías en el ferrocarril del Istmo de Tehuantepec continúa.,0.0,13,06,12,2021
