Participante,Texto,Sentimiento,Palabras,Dia,Mes,Anio
PREGUNTA,"Lo cierto es, señor presidente, que a dos décadas de estar al frente de esta dirección Almaguer González, quien por cierto también es paisano de Vicente Fox, no ha escuchado las necesidades de los que representan los intereses de los grupos originarios de México y quienes también ya han pedido su renuncia.",0.0,52,06,12,2021
PREGUNTA,"Y yo le quiero preguntar, señor presidente: ¿a 20 años de estar al frente de una dirección en la que no se han alcanzado los objetivos planteados será el momento de darle la oportunidad a alguien más que esté comprometido con los intereses de los grupos originarios de México? Y si usted cree que es momento de fortalecer esta dirección y cambiar a su titular.",0.0,65,06,12,2021
PRESIDENTE ANDRES MANUEL LOPEZ OBRADOR," Bueno, vamos a… Ya presentaste tu denuncia y le vamos a pedir al secretario de Salud, al doctor Jorge Alcocer, que se haga una evaluación sobre el trabajo de este servidor público y que se pueda informar si continúa o hay un relevo, dependiendo de su desempeño, si te parece.",0.0,50,06,12,2021
PREGUNTA," Me parece y me gustaría que me diera la oportunidad de darle seguimiento, Jesús Ramírez, por favor. Gracias.",0.0,18,06,12,2021
PREGUNTA,"Tengo otro tema también, señor presidente. Usted acaba de decir que uno de los peores males que vive el país es la corrupción y precisamente en este espacio el pasado 22 de diciembre un colega de un medio hizo una denuncia de cómo se concedieron contratos para instalar las carpas COVID en Quintana Roo a nombre del empresario Jorge Luis Brizuela Guevara, alías ‘el Venezolano’. Estos contratos —ya está documentado— recibieron un presupuesto de más de 500 mil pesos por la instalación de dos carpas COVID.",0.0,86,06,12,2021
PREGUNTA,"El asunto es que este empresario Luis Brizuela Guevara no ha pagado a los empresarios a los que les subarrendó este servicio y como ya tiene un año que se hizo la denuncia aquí, señor presidente, yo quería saber si usted ya está informado de cómo se dieron estos contratos, si se está lucrando con los presupuestos para atender a la gente con las carpas COVID, si usted tiene información de esto y si el gobierno federal puede intervenir para que se les pague a los empresarios que instalaron estas carpas.",0.0,91,06,12,2021
PRESIDENTE ANDRES MANUEL LOPEZ OBRADOR," Bueno, te pregunto: ¿Es un contrato del estado o de la federación?",0.0,12,06,12,2021
PREGUNTA, Es un contrato del estado de Quintana Roo.,0.0,8,06,12,2021
PRESIDENTE ANDRES MANUEL LOPEZ OBRADOR," Bueno, nosotros lo que podemos hacer es ayudar para que se informe sobre esta situación, vamos a comunicarnos con el gobierno de Quintana Roo para que informe y se resuelva el problema.",0.0,32,06,12,2021
PREGUNTA," Sí, porque precisamente, le digo, ya a va a ser un año que se hizo la denuncia aquí y está por vencer el contrato y ya se dio el recurso al empresario Brizuela Guevara y no ha pagado lo que rentó, y esas carpas están rentadas y nos las quiere regresar.",0.0,51,06,12,2021
PRESIDENTE ANDRES MANUEL LOPEZ OBRADOR, Sí vamos a tratarlo.,0.0,4,06,12,2021
PRESIDENTE ANDRES MANUEL LOPEZ OBRADOR,Ya lo denunciaste y yo creo que van a tomar nota en el gobierno de Quintana Roo.,0.0,17,06,12,2021
PREGUNTA," Y, finalmente, nada más saber su opinión, señor presidente. Después de la boda de Santiago Nieto, unas semanas después, vimos que el senador hidalguense Julio Menchaca contrató un taxi aéreo para ir a la toma de posesión del gobierno de Sinaloa.",0.0,41,06,12,2021
PREGUNTA,"Usted había dicho que no le parecen este tipo de extravagancias y más que el senador es de Morena. ¿Qué opina al respecto, señor presidente?",0.0,25,06,12,2021
PRESIDENTE ANDRES MANUEL LOPEZ OBRADOR," Pues no tengo mucha información, pero cuando escucho así ‘senador Menchaca’ sí sé, porque mi trabajo también consiste en tener información, no hacemos espionaje, pero sí hay inteligencia, sobre todo porque me informa la gente de todo lo que pasa y este senador es uno de los que aspira a ser candidato en Hidalgo, para tener toda la película completa ¿no? y aprovecho también para decir que en esta temporada, como vienen elecciones en Hidalgo y vienen elecciones en Quintana Roo, en Oaxaca, Tamaulipas, Aguascalientes, Durango, pues siempre hay lo que se conoce coloquialmente como grilla.",0.0,96,06,12,2021
PRESIDENTE ANDRES MANUEL LOPEZ OBRADOR,"Entonces, que ustedes tengan cuidado para que los competidores no utilicen este espacio para hablar mal de sus rivales o adversarios, o los otros precandidatos, no nos metamos en eso.",0.0,30,06,12,2021
PRESIDENTE ANDRES MANUEL LOPEZ OBRADOR,"Y que si hay una denuncia formal, presentarla a la fiscalía, pero que no nos metamos en la cuestión electoral, porque sí se afecta, se degrada este espacio, este diálogo, que tiene muy bien nivel por ustedes, porque aquí se ventila todo, no hay censura, se hacen denuncias con límites, siempre buscando que haya pruebas, que no haya linchamientos políticos en contra de nadie.",0.0,64,06,12,2021
PRESIDENTE ANDRES MANUEL LOPEZ OBRADOR,"Pero esto es un foro. No es para presumir, pero entre todos hemos logrado que sea el foro más visto por los mexicanos, están pendientes todos de lo que pasa en la mañanera. Entonces, nada más cuidar eso.",0.0,38,06,12,2021
PRESIDENTE ANDRES MANUEL LOPEZ OBRADOR,"Y en este caso no tengo información, pero, si hay una ilegalidad, que se presente una denuncia.",0.0,17,06,12,2021
PRESIDENTE ANDRES MANUEL LOPEZ OBRADOR,"Adelante, la compañera.",0.0,3,06,12,2021
PREGUNTA," Presidente, buenos días.",0.0,3,06,12,2021
PREGUNTA,"Susana Carreño, de Puerto Vallarta, Jalisco.",0.0,6,06,12,2021
PREGUNTA,"Habíamos quedado que nos iban a dar información para lo del pacto fiscal, pero como usted se fue de gira, a ver si me pueden dar información sobre lo que la federación le ha aportado a Puerto Vallarta. Recuerde que vino la gente del SAT a dar información y Hacienda, pero ese día yo no estuve porque usted se había ido el jueves a Mérida.",0.0,65,06,12,2021
PREGUNTA,"Entonces, para ver si nos pueden dar, porque el 11 de diciembre el gobernador Enrique Alfaro tiene su pacto fiscal en Puerto Vallarta, las mesas de trabajo. No tenemos información. Él habla de un trato justo, pero sentimos que a Puerto Vallarta el gobernador no lo ha tratado bien.",0.0,49,06,12,2021
PREGUNTA,"Queremos saber cuánto la federación le da a Puerto Vallarta para tener cifras, números para cuando se hagan esas mesas de trabajo e informar a la población de lo que sí ha dado la federación.",0.0,35,06,12,2021
PREGUNTA,"Se le preguntó al gobernador en la más reciente rueda de prensa que tuvo en Puerto Vallarta, le comentamos cuánto la federación le ha dado a Puerto Vallarta y nada más dijo que así, no dijo cifras, pero bueno.",0.0,39,06,12,2021
PREGUNTA,"Por otro lado, yo he estado viniendo dando seguimiento a la cuestión de infraestructura de Puerto Vallarta. Recordará que vine a comentarle poco antes de que se llevara el derrumbe que hubo en la zona turística por una construcción que estaban realizando.",0.0,42,06,12,2021
PREGUNTA,"Bueno, ese derrumbe ¿qué provocó?, que las residencias que están arriba tuvieran ya cuarteaduras y los edificios que están más arriba.",0.0,21,06,12,2021
PREGUNTA,"Se le preguntó también al gobernador: ‘Oiga, gobernador, los edificios, las licencias’, dijo que no era de su competencia, pero yo le quiero decir algo, presidente, porque lo veo venir. Así como vine a decir lo del derrumbe, yo le quiero pedir por favor que manden a unos peritos de Protección Civil, del área que corresponda, a que chequen ese deslave, a que vean cómo están las residencias, porque tuvieron que evacuar a la gente.",0.0,75,06,12,2021
PREGUNTA,"Es algo que no se dice mucho en Puerto Vallarta, nosotros sí lo comentamos en el medio es Radio Universidad de Guadalajara, Foro Nacional de Periodistas, y decirle que en estos días que no he podido venir aquí a la conferencia, pero me he dado a la tarea de investigar el último mes de la administración de Arturo Dávalos el mes de septiembre estuve pidiendo información vía Transparencia, no se daba, pero finalmente la administración que acaba de entrar nos da la información que aquí tengo, presidente, y que no es justo que tan sólo en un mes, en el último mes, en septiembre dieron 55 licencias de construcción de edificios de 10 a 25 pisos, aquí los tengo, en un mes.",0.0,122,06,12,2021
PREGUNTA,"Pero ya revisé otro, ya llevo 95 licencias que dio la administración pasada irregulares, sin estudios de impacto ambiental, sin estudio de suelo.",0.0,23,06,12,2021
PREGUNTA,"En estos momentos en la colonia Versalles hay edificios que están sobre mantos freáticos. Mientras nosotros estamos acá, allá en Vallarta, en la colonia Versalles está saliendo agua en abundancia. Nos quejamos de que el agua falta en otros lugares y lo que ahí se está cometiendo es un ecocidio.",0.0,50,06,12,2021
PREGUNTA,"También quien acaba de entrar al gobierno municipal tiene la obligación de poner ordenamiento allá en Puerto Vallarta, un ordenamiento que están pidiendo todos los ciudadanos y especialmente los empresarios.",0.0,30,06,12,2021
PREGUNTA,"Aquí le traigo, y para no extenderme, para pasarle el micrófono a la compañera, aquí tengo un documento que firman asociaciones, 70 asociaciones, líderes, empresarios. Aquí traigo el documento, se lo voy a dejar a la señorita Leti Ramírez, si usted me lo permite, le voy a entregar estos documentos.",0.0,50,06,12,2021
PREGUNTA,"Punto número uno, la petición que hacen los ciudadanos, es un riesgo latente porque, así como dio una… este derrumbe, se va a venir otro. No quiero ser fatalista, pero sí es necesario que, si se debilitó la parte de abajo, lo que sigue está debilitándose y lo demás arriba también.",0.0,51,06,12,2021
PREGUNTA,"Entonces, le pido, por favor, presidente, gente técnica, que hagan un diagnóstico antes de que pase algo.",0.0,17,06,12,2021
PREGUNTA,"Eso es lo que me trae aquí principalmente, la seguridad de Puerto Vallarta y la cuestión de la información para lo del pacto fiscal y trato justo que está impulsando el gobernador.",0.0,32,06,12,2021
PRESIDENTE ANDRES MANUEL LOPEZ OBRADOR," Muy bien. Mira, es probable que todavía esté por aquí Laura Velasco, porque nos acompaña a la reunión del Gabinete de Seguridad todos los días para que de una vez se establezca comunicación y que vaya ella, que vaya Laura, la coordinadora de Protección Civil, que ella vaya y atienda lo que estás planteando.",0.0,54,06,12,2021
PRESIDENTE ANDRES MANUEL LOPEZ OBRADOR,"Y acerca de la información sobre las transferencias de fondos de recursos a Puerto Vallarta, vamos a que los de Hacienda entreguen la información que nos corresponde, porque hay una transferencia que se hace al gobierno del estado, el gobierno del estado tiene que entregar a los municipios de Jalisco, pero lo que nosotros tengamos se te va a entregar ahora, hoy mismo.",0.0,63,06,12,2021
PREGUNTA," Le agradezco mucho, presidente, porque no sabemos cuánta la federación nos manda y, si usted se lo manda al estado, va a pasar también como ha estado pasando, que el gobernador decide quitarle recursos, por ejemplo, a Puerto Vallarta, a la universidad, que ahorita traen un conflicto ahí porque está decidiendo y está violando la autonomía también de la universidad para los recursos que también es un clamor por parte de los estudiantes del propio actual rector y son varios millones, 140 millones de pesos, que se van a otro tipo de situaciones.",0.0,93,06,12,2021
PREGUNTA,"Lo que usted anunció en Puerto Vallarta, los 650 millones, acaba el presidente de la Comisión Estatal de Derechos Humanos de Jalisco dar 125 recomendaciones a todo el estado, son 125 municipios, a Puerto Vallarta por la infraestructura, porque acaba de pasar el día de las personas con discapacidad y no hay una política sensible para dotar de esto.",0.0,59,06,12,2021
PREGUNTA,Entonces por eso se lo estamos pidiendo.,0.0,7,06,12,2021
PREGUNTA,"Hemos visto las obras que su gobierno ha hecho allá como La Lija, la 5 de Diciembre, lo hemos visto, pero queremos saber cifras para informarle a la gente.",0.0,29,06,12,2021
PRESIDENTE ANDRES MANUEL LOPEZ OBRADOR, Muy bien.,0.0,2,06,12,2021
PREGUNTA, Muchas gracias.,0.0,2,06,12,2021
PRESIDENTE ANDRES MANUEL LOPEZ OBRADOR," También la información de Román Meyer, porque se han llevado a cabo ahí en Vallarta algunas intervenciones de desarrollo urbano, que tú sepas cuánto se ha invertido.",0.0,27,06,12,2021
PRESIDENTE ANDRES MANUEL LOPEZ OBRADOR,"Yo tengo mucha confianza que el maestro que acaba de entrar, no sé si ya tomó posesión.",0.0,17,06,12,2021
PREGUNTA," Ya, ahorita están en el proceso de entrega-recepción, presidente.",0.0,9,06,12,2021
PREGUNTA,Y aprovecho para decirle: hay muchos que están revoloteando al lado del presidente…,0.0,13,06,12,2021
PRESIDENTE ANDRES MANUEL LOPEZ OBRADOR," Sí, que no se deje, que no se deje nada más y ya.",0.0,13,06,12,2021
PREGUNTA," Había uno, uno que se quería meter de asesor, pero lo exhibí como persona —Víctor Manuel Bernal— lo exhibí como persona que firmó la venta de patrimonio de Puerto Vallarta, se lo mostré al profe y a la comunidad. Él ya se había anunciado como asesor. Ya lo ‘chisparon’, pero así debe pasar con todos los demás.",0.0,57,06,12,2021
PRESIDENTE ANDRES MANUEL LOPEZ OBRADOR," Sí ‘el Profe’ es una gente bien intencionada, esa es mi opinión y yo creo que va a ser un buen presidente.",0.0,22,06,12,2021
PRESIDENTE ANDRES MANUEL LOPEZ OBRADOR,"Y, también, no quiero descalificar al gobernador de Jalisco, o sea, que todos tengamos la libertad de expresarnos, pero vamos buscando la unidad para trabajar en bien del pueblo.",0.0,29,06,12,2021
PREGUNTA, Muy bien. Muchas gracias.,0.0,4,06,12,2021
PRESIDENTE ANDRES MANUEL LOPEZ OBRADOR, La compañera.,0.0,2,06,12,2021
PREGUNTA," Gracias, presidente.",0.0,2,06,12,2021
PREGUNTA,"Sandra Aguilera, de Grupo Larsa Comunicaciones.",0.0,6,06,12,2021
PREGUNTA,"Presidente, abonando un poquito a lo que está hablando la compañera acerca de Jalisco, tenemos información que las dependencias de Jalisco solicitaron la devolución de impuestos al SAT, la cual está en trámite o ya las devolvieron. Son muchos millones, tengo la lista, se la voy a pasar. No sabemos si ya se las devolvieron o siguen en trámite.",0.0,59,06,12,2021
PREGUNTA,"Y también quisiera saber en qué se va a ocupar ese dinero que se devolvió a estas instituciones. Por ejemplo, de lo que tengo ahorita, de lo que me acuerdo, porque tengo la lista, por ejemplo, a Tlaquepaque se le devolvió a la presidenta municipal que estaba en ese entonces, a María Elena Limón, aproximadamente 40 millones 400 mil.",0.0,59,06,12,2021
PREGUNTA,"Tengo la lista, no la traigo en este momento, pero sí me gustaría saber en qué y si ya usted tiene razón de esto, o si mañana, que va a estar en Guadalajara, el gobernador nos pudiera decir, porque los tapatíos quieren saber en qué se está ocupando esta devolución que se está solicitando.",0.0,54,06,12,2021
PREGUNTA,"Por otra parte, presidente, yo quería preguntarle acerca de la amnistía de los presos. Hemos estado haciendo investigaciones donde la familia no sabe cómo hacerlo y han preguntado a los funcionarios de los penales y no tienen idea cuál es el camino para poder sacar a sus familiares de los penales.",0.0,51,06,12,2021
PREGUNTA,"Les preguntamos a los mismos funcionarios y nos dicen que no tienen claro cómo es esto, ya que viene en la Ley de Amnistía publicada que tienen que promoverlo en el artículo 3º del párrafo 3º de la comisión, pero no tienen idea de qué es esto, no hay mucha información",0.0,51,06,12,2021
PREGUNTA,"Y, por otra parte, los presos, los presos que ya están dentro, tampoco saben cómo hacerlo y hay mucha gente enferma.",0.0,21,06,12,2021
PREGUNTA,"Entonces, quería preguntarle cómo va a ser esto y si ya tienen gente que esté fuera.",0.0,16,06,12,2021
PREGUNTA,"En general, bueno, yo estuve preguntando e indagando en el penal de Jalisco de Puente Grande, pero me imagino que esto ha de ser en todo el país.",0.0,28,06,12,2021
PREGUNTA,"Entonces, quería saber cómo están haciendo la promoción para que puedan ellos salir de la cárcel, presidente.",0.0,17,06,12,2021
PREGUNTA,Gracias.,0.0,1,06,12,2021
PRESIDENTE ANDRES MANUEL LOPEZ OBRADOR, Muy bien.,0.0,2,06,12,2021
PRESIDENTE ANDRES MANUEL LOPEZ OBRADOR,"Mira sobre lo de la devolución del IVA, lo puede ver Raquel Buenrostro hoy mismo.",0.0,15,06,12,2021
PREGUNTA, Yo le doy la lista de lo que yo tengo investigado.,0.0,11,06,12,2021
PRESIDENTE ANDRES MANUEL LOPEZ OBRADOR, Sí.,0.0,1,06,12,2021
PRESIDENTE ANDRES MANUEL LOPEZ OBRADOR,"Y de la amnistía, sí creo que vale la pena que el secretario de Gobernación y el subsecretario aquí presenten, den a conocer un informe de cómo vamos para que se dé a conocer cuántos han obtenido su libertad, que se vuelva a dar a conocer cuáles son los criterios para dejar en libertad a reclusos, lo que tiene que ver con la edad, lo que tiene que ver…",0.0,69,06,12,2021
PREGUNTA," Con la enfermedad, también.",0.0,4,06,12,2021
PRESIDENTE ANDRES MANUEL LOPEZ OBRADOR," Con la enfermedad y reactivar este mecanismo, porque puede haber, en efecto, estas disposiciones, pero se cae en inercias o la burocracia no permite que se lleven a cabo estos propósitos.",0.0,31,06,12,2021
PREGUNTA," E informarles, presidente.",0.0,3,06,12,2021
PRESIDENTE ANDRES MANUEL LOPEZ OBRADOR, Y estar informando.,0.0,3,06,12,2021
PRESIDENTE ANDRES MANUEL LOPEZ OBRADOR,"Entonces, le vamos a pedir al secretario de Gobernación y al subsecretario Alejandro Encinas que vengan aquí un día a la mañanera e informen sobre esto, si te parece.",0.0,29,06,12,2021
PREGUNTA," Muchas gracias, presidente.",0.0,3,06,12,2021
PRESIDENTE ANDRES MANUEL LOPEZ OBRADOR," Bueno, vámonos de este lado.",0.0,5,06,12,2021
PRESIDENTE ANDRES MANUEL LOPEZ OBRADOR,"Adelante, tú y los dos, y hasta mero atrás después.",0.0,10,06,12,2021
PREGUNTA," Buenos días, señor presidente; buenos días, procurador; buenos días a todas y a todos.",0.0,14,06,12,2021
PREGUNTA,"Diego Elías Cedillo, de Tabasco, Campeche Hoy, Quintana Roo y Diario Basta en la Ciudad de México del Grupo Cantón.",0.0,20,06,12,2021
PREGUNTA,"Señor presidente, este fin de semana la consultora, la consultora, la empresa Morning Consult publicó lo que usted ha venido comentando varias veces, que es el índice de aprobación que ha mantenido.",0.0,32,06,12,2021
PREGUNTA,"Me gustaría compartirle la portada corporativa de todo Grupo Cantón al respecto de la aprobación que mantiene con base en todos los líderes mundiales, estando a la par e incluso por encima del presidente Modi, de India, si no me equivoco.",0.0,41,06,12,2021
PREGUNTA,"Entonces, presidente, yo me permitiría preguntarle: ¿a qué adjudica usted esta aprobación de toda la ciudadanía y cuál consideraría que sería este eje rector que ha llevado a que su gobierno tenga este nivel de aprobación?, ¿Alguna obra en especial, alguna política pública? ¿Cuál, a su consideración, sería esta premisa que ha dado este resultado de aprobación, presidente?",0.0,58,06,12,2021
PREGUNTA,Gracias.,0.0,1,06,12,2021
PRESIDENTE ANDRES MANUEL LOPEZ OBRADOR," Pues son dos cosas que están estrechamente relacionadas: es el combate a la corrupción y apoyar las necesidades de la gente. Eso es lo que nos ha funcionado, esa es la clave.",0.0,32,06,12,2021
PRESIDENTE ANDRES MANUEL LOPEZ OBRADOR,"Decía yo al principio que el principal problema de México era la corrupción, desde tiempo atrás, bueno, desde que… Lo he dicho en otras ocasiones, no quiero que se vaya a malinterpretar: pero no hay noticias, no hay evidencias, no hay pruebas documentales de la corrupción en la época prehispánica, pero sí hay pruebas documentales de la corrupción desde que llegaron los invasores, conquistadores, los españoles, porque Bernal Díaz del Castillo en La historia verdadera de la Nueva España habla de que el tesoro de Moctezuma cada vez se hacía menos, porque se lo robaban los jefes de los soldados españoles, que cuando lo reparten ya lo que les tocó a cada uno de los soldados que participaron en la invasión, en la conquista, fue muy poco, porque Cortés se había quedado con una parte y ya era muy poco lo que quedaba. O sea, que esto de la corrupción viene de cuando menos desde el inicio de la colonización.",0.0,160,06,12,2021
PRESIDENTE ANDRES MANUEL LOPEZ OBRADOR,"Y en la Colonia dos veces, pero en una ocasión, en el siglo XVII, quemaron el Palacio, este, porque hubo por corrupción una denuncia del virrey contra el arzobispo, el virrey acusando al arzobispo de corrupción, de tener el monopolio de los alimentos e inició un proceso de excomunión el arzobispo en contra del virrey, y el virrey mandó a detenerlo, y la gente apoyó al arzobispo y tomaron el Palacio y lo quemaron.",0.0,74,06,12,2021
PRESIDENTE ANDRES MANUEL LOPEZ OBRADOR,"Ese virrey, lo habían mandado de España porque no les llegaba la renta, la cuota que debía de llegarles, entonces lo mandaron para combatir la corrupción y lo expulsaron, y hubo ese antecedente.",0.0,33,06,12,2021
PRESIDENTE ANDRES MANUEL LOPEZ OBRADOR,"Pues luego, durante el proceso de Independencia lo mismo. Imagínese, Santa Anna 11 veces presidente, la última vez vendió La Mesilla, otro territorio que era de México, otra franja del territorio, además de que fue el responsable de que nos arrebataran la mitad del territorio y luego cuando regresa todavía vende en 10 millones otra franja del territorio y derrocha todo.",0.0,61,06,12,2021
PRESIDENTE ANDRES MANUEL LOPEZ OBRADOR,"En la época de Porfirio Díaz, bueno, pues se quedaron con todo: las minas, las tierras, el agua, el petróleo, todo. Es el primer Fobaproa.",0.0,25,06,12,2021
PRESIDENTE ANDRES MANUEL LOPEZ OBRADOR,"Porfirio da concesiones para la construcción de ferrocarriles, les daba una subvención a las empresas extranjeras de siete mil pesos de aquellos, por kilómetro que construían, era un subsidio.",0.0,29,06,12,2021
PRESIDENTE ANDRES MANUEL LOPEZ OBRADOR,"Entonces, se construyeron más de 20 mil kilómetros de vías férreas, se comunicó todo el país con ese mecanismo, pero las compañías, las empresas, fracasan y las rescata el gobierno, les compra las acciones, como un Fobaproa, y desde luego mucho chanchullo, porque ya se sabía que iba a haber ese rescate.",0.0,52,06,12,2021
PRESIDENTE ANDRES MANUEL LOPEZ OBRADOR,"El hermano de Limantour, que era un financiero, con información privilegiada empieza a comprar acciones que no tenían precio, se lleva a cabo la operación y esas acciones suben, aumentan su valor.",0.0,32,06,12,2021
PRESIDENTE ANDRES MANUEL LOPEZ OBRADOR,"Ese tipo de negocios, por ejemplo, en el porfiriato, porque siempre suele decirse que era un gobierno honesto el de Porfirio Díaz; pues no, no es así. Y también que fue muy buena la administración y que no se endeudó; pues no es cierto, fue de los gobiernos que más endeudaron al país. Son de esos mitos que se van creando, desde luego hay que conocer la historia y quitarle la parte ideológica y ver los datos.",0.0,77,06,12,2021
PRESIDENTE ANDRES MANUEL LOPEZ OBRADOR,"El primer ferrocarril que se construye es el ferrocarril de la Ciudad de México a Veracruz, 600 kilómetros, y es público y lo venden, venden también las acciones, y lo mismo, acciones que valían más las entregaron a un valor inferior y los tres que compran estas acciones están vinculados a Porfirio, uno de ellos había actuado unos meses antes como padrino en su boda, cuando Porfirio se casó con Carmelita, había firmado de padrino.",0.0,75,06,12,2021
PRESIDENTE ANDRES MANUEL LOPEZ OBRADOR,Y así.,0.0,2,06,12,2021
PRESIDENTE ANDRES MANUEL LOPEZ OBRADOR,"En la Revolución, pues acuérdense de lo que contaba el mismo Obregón, que cuando en Celaya le quitan el brazo de un cañonazo no encontraban su brazo y él mismo recomienda que sacaran una moneda, un azteca, sí, de oro, y que pasearan por donde supuestamente podía estar el brazo y que se hizo el milagro porque el brazo vino y agarró la azteca, él mismo lo contaba.",0.0,68,06,12,2021
PRESIDENTE ANDRES MANUEL LOPEZ OBRADOR,"Y, bueno, imagínense lo que pasó en el periodo neoliberal, en estos últimos 36 años. Yo creo que fue el saqueo más grande que se haya cometido en la historia del país, como nunca, se saqueó a México.",0.0,38,06,12,2021
PRESIDENTE ANDRES MANUEL LOPEZ OBRADOR,"Entonces, ese es el principal problema, la corrupción.",0.0,8,06,12,2021
PRESIDENTE ANDRES MANUEL LOPEZ OBRADOR,"Entonces, si eso lo desterramos, si se acaba esa corrupción, claro que el país sale adelante, y eso lo está viendo la gente, porque tu pregunta es: ¿por qué nos apoyan?, porque ahora no permitimos esa corrupción y lo que ahorramos… Porque es mucho el dinero que se va a unas cuantas manos cuando hay corrupción, mucho el dinero que se va por el caño de la corrupción. Si eso se ahorra y se le entrega a la gente que no recibía nada, pues hay un efecto positivo, primero, porque se moraliza al país, se purifica la vida pública y para el gobernante es un respaldo porque no se puede transformar… ¿Cómo se acaba la corrupción si no se tiene el apoyo del pueblo?",0.0,124,06,12,2021
