Participante,Texto,Sentimiento,Palabras,Dia,Mes,Anio
PRESIDENTE ANDRES MANUEL LOPEZ OBRADOR," Buenos días. Ánimo, mucho ánimo. Iniciamos la semana.",0.6625419598672511,8,18,5,2020
PRESIDENTE ANDRES MANUEL LOPEZ OBRADOR,"Vamos a tratar varios temas importantes, empezando por celebrar el que está aquí de nuevo con nosotros Ricardo Sheffield, procurador de la defensa del consumidor, que estuvo separado porque fue afectado por el coronavirus; ya se recuperó y nos da mucho gusto que esté aquí con nosotros de nuevo.",0.1943599244529296,49,18,5,2020
PRESIDENTE ANDRES MANUEL LOPEZ OBRADOR,"Vamos también a informar, esta es una buena noticia, que ya están por iniciar los trabajos del Tren Maya, ya se tienen tres contratos para tres tramos, se está en proceso de conclusión un cuatro tramo, lo cual nos va a permitir ya comunicar, cuando se construya, se termine esta obra, desde Palenque, con estos cuatro tramos, hasta Cancún, pasando por Campeche, por Yucatán y Quintana Roo. Es Chiapas, Tabasco, Campeche, Yucatán y Quintana Roo, y vamos a continuar con el tramo Cancún-Tulum y luego Tulum-Calakmul y Calakmul-Escárcega, en total cerca de mil 500 kilómetros.",0.009682831346750099,95,18,5,2020
PRESIDENTE ANDRES MANUEL LOPEZ OBRADOR,"Esta obra, independientemente de la comunicación, del impulso al turismo, del traslado de carga, va a significar la generación de muchos empleos, ahora que se requieren, se necesitan; calculamos de 80 a 100 mil nuevos empleos con esta obra en el sureste.",0.13780079085369054,42,18,5,2020
PRESIDENTE ANDRES MANUEL LOPEZ OBRADOR,"También, además del arquitecto Rogelio Jiménez Pons, que es el director general de Fonatur y el encargado del Tren Maya, que va a presentarles un video.",0.29692256309538445,26,18,5,2020
PRESIDENTE ANDRES MANUEL LOPEZ OBRADOR,"También el general Gustavo Ricardo Vallejo Suárez les va a presentar un informe detallado y al mismo tiempo breve sobre la construcción del aeropuerto de Santa Lucía, para que todo el pueblo de México sepa cuánto se ha ejercido en esta obra, cómo vamos, cuál es el avance, cuánto se tiene contemplado invertir y también cuáles son los beneficios, en particular cuántos empleos se están generando en esta obra. Por eso también nos acompaña el secretario de la Defensa, el general Sandoval, que está con nosotros.",0.02047296328309502,86,18,5,2020
PRESIDENTE ANDRES MANUEL LOPEZ OBRADOR,Y al final se presenta el video ya del aeropuerto y el video sobre la construcción de la refinería de Dos Bocas. Ahí terminamos y abrimos para preguntas y respuestas.,0.07488745095903164,30,18,5,2020
PRESIDENTE ANDRES MANUEL LOPEZ OBRADOR,"Entonces, comenzamos con Ricardo Sheffield para ver Quién es Quién en los precios.",0.20644141328224455,13,18,5,2020
RICARDO SHEFFIELD PADILLA," Buenos días, señor presidente; buenos días a todas y todos ustedes. Con mucho gusto.",0.838037141380934,14,18,5,2020
RICARDO SHEFFIELD PADILLA,"Tenemos la presentación con algunas novedades, ya que esta presentación cumple ya el año y entonces hemos hecho algunos ajustes para que la información sea todavía más útil a todos los consumidores en nuestro país.",0.4885024406452231,35,18,5,2020
RICARDO SHEFFIELD PADILLA,"Estamos ahora dividiendo el país en ocho regiones, de acuerdo a la logística, infraestructura y capacidad de almacenamiento, son las regiones en las que Pemex divide el país y también sobre esas mismas regiones trabajan las franquicias que importan de manera directa sus combustibles.",0.3301673661966739,44,18,5,2020
RICARDO SHEFFIELD PADILLA,"Las regiones son ocho, las ven rápidamente ahí y estas ocho regiones estamos sacando el del precio más alto y el del precio más bajo en cada región. Por eso en la primera lámina, que es del combustible regional, la gasolina regular, tenemos quién es el que da más caro, el más pasado de rosca en cada una de las ocho regiones.",0.6512907170367513,62,18,5,2020
RICARDO SHEFFIELD PADILLA,Vemos cuál es el precio que está dando y el margen que tiene partiendo del precio de la TAR que le corresponde.,0.339287843587474,22,18,5,2020
RICARDO SHEFFIELD PADILLA,"Y, finalmente, al pasadísimo de rosca de los 10… de los ocho de los 10 que quedan ahí reseñados, perdón, ocho, como había mencionado, no por región, en este caso de RedCo, la empresa se llama Servigas La Espiga, esta es para identificarla adecuadamente de qué marca se trata el combustible, es en Hermosillo, Sonora, 19 pesos con un centavo por litro, el precio más alto para la gasolina regular con un margen de dos pesos 72 centavos.",0.010277271831372859,78,18,5,2020
RICARDO SHEFFIELD PADILLA,"En el caso de la regular más económica es Total Gasolinas Red Gas, Puebla, Puebla, 13 pesos con 85 centavos por litro, un peso 28 centavos de margen.",0.005562810667029924,28,18,5,2020
RICARDO SHEFFIELD PADILLA,"Mientras que para la gasolina Premium, la gasolinera más cara es Pemex ServiVllas S.A., Angostura, Sinaloa, 20 pesos con 99 centavos por litro con un margen de tres pesos 32 centavos; comparado con la más económica, que es de franquicia Pemex en Autoservicio Jano, Veracruz, Veracruz, 13 pesos con 95 centavos por litro, 16 centavos de margen.",0.0034489242231992468,57,18,5,2020
RICARDO SHEFFIELD PADILLA,"Para el diésel de franquicia Pemex, la más cara en este caso es Estación de Servicios El Temazcal en Tiquicheo, Michoacán 22 pesos por litro con un margen de cinco pesos con cuatro centavos, estos sí son unos angelitos mandados con esa cantidad de dinero en el margen; Combustibles BP, BP Estaciones de Servicios Energéticos en Puebla, Puebla 15 pesos con 53 centavos por litro, un margen de 78 centavos es el más económico para el combustible diésel.",0.0013280755949584115,78,18,5,2020
RICARDO SHEFFIELD PADILLA,"Si lo vemos por marcas, son los promedios de las marcas de todo el país descartando la zona fronteriza estrictamente la zona fronteriza es Arco, RedCo y Chevron los que tienen los precios más altos; Total, G500 y Exxon Mobil los que lo tienen más económico, pero en general bastante plana, o sea, muy parecidos los precios de los tres combustibles.",0.5650788152090106,61,18,5,2020
RICARDO SHEFFIELD PADILLA,"Y ahora vemos la tabla y en la tabla podemos ver que el precio promedio en la semana que cerró fue de 18.59 para el diésel, 17 pesos con 27 centavos por litro para la Premium y 16.58 para la regular, pero también ese pequeño incremento que se ha venido dando es correspondiente a que afortunadamente la mezcla mexicana de petróleo también ha venido subiendo, hay una correspondencia entre uno y otro, que eso es lo importante, que cuando baje el precio, baje de manera pareja también las gasolinas, junto con el petróleo.",0.09921841689985808,93,18,5,2020
RICARDO SHEFFIELD PADILLA,"Hemos estado trabajando fuertemente en el tema de verificación a las gasolineras, realizamos 251 visitas o verificaciones, correspondiendo a 319 quejas y denuncias presentadas a través de la app de litro por litro.",0.06537039567383042,33,18,5,2020
RICARDO SHEFFIELD PADILLA,"Nos hemos topado ya con más gasolineras dando dolores de cabeza, cuatro se negaron a ser verificadas y cuatro se negaron a colocar, a que pudiéramos colocar los sellos, pero las estaremos atendiendo con el apoyo de la Fiscalía General de la República y la Guardia Nacional, a ambas instituciones les agradecemos el respaldo que nos han dado a la CRE, Profeco y ASEA para estas verificaciones conjuntas.",0.0011260944906390303,68,18,5,2020
RICARDO SHEFFIELD PADILLA,"Las que no se dejaron colocar los sellos para no dar la apariencia de que están mal, pero lo pueden ver en la  app de Litro por Litro, ahí aparecen las tachitas, es Servicio Los Lagos, en Jalostotitlán, Jalisco; Servicio Estrella del Sur, en Villa de Álvarez, Colima; Mónica y Sergio Sanabria, Axochiapan, Morelos, y Gasolineras Fas de Occidente, Tlajomulco de Zúñiga, Jalisco; y que se negaron a la verificación Martha Erika Chacón, en Coatzacoalcos, Veracruz; Autoservicio Exprés de Combustibles, en Acapetahua, Chiapas; Tecnoenergías de Combustibles en Tapachula, Chiapas, y Gabino Rafael Vergara, en Jantetelco, Morelos.",0.00015236710545151304,96,18,5,2020
RICARDO SHEFFIELD PADILLA,"Ellos ya aparecen con tachas, con una crucecita en la app de Litro por Litro para que eviten comprar en esos lugares porque de seguro no les van a dar litros completos, como no estaba dando litros completos en Puebla, en Tulcingo, Puebla, esta gasolinera en donde encontramos un rastrillo, que ahora que a algunos se les han bajado las ventas lo quieren compensar robando y no lo vamos a permitir.",0.006238447163245628,71,18,5,2020
RICARDO SHEFFIELD PADILLA,"Ahí ya intervino la Fiscalía General de la República, como también, aparte de esa denuncia, tuvimos el respaldo, en este y en otros operativos de la Guardia Nacional, donde visitamos varias gasolineras en los estados de Morelos, Tlaxcala y Veracruz, donde ya pudimos colocar los sellos.",0.016928033849024325,46,18,5,2020
RICARDO SHEFFIELD PADILLA,"Si vemos que no toma en cuenta regiones y que no toma en cuenta margen, la gasolina regular más barata, 13.99, franquicia Pemex, en Guadalupe, Nuevo León; 14.20, por litro, Franquicia Pemex, en Veracruz, Veracruz; mientras que la más cara 18.81, de RedCo, con Hermosillo, Sonora, como vimos en la tabla ahí hay coincidencia y 18.80, franquicia Pemex en Cherán, Michoacán.",0.009081797563924859,61,18,5,2020
RICARDO SHEFFIELD PADILLA,"Para Premium la más barata 13.59 en San Martín, Puebla y 14.60 franquicia Pemex en Veracruz, Veracruz, la primera era franquicia BP; las más caras Mobil en Monclova, Coahuila, 20.29 por litro y para la Premium y también Mobil en Monclova, Coahuila 20 pesos con 15 centavos, mientras que para el diésel la más barata 15.49 franquicia Pemex, Medellín de Bravo, Veracruz 15.50, franquicia Pemex Veracruz, Veracruz y el diésel el más caro 21.90, franquicia Pemex en Tiquicheo de Nicolás, Michoacán y Mobil 20.89 en Chiautla, Puebla.",0.0037686827138838294,87,18,5,2020
RICARDO SHEFFIELD PADILLA,Seguimos revisando los sanitarios con un servicio que es importante y que deben de estar muy limpios ahora con la contingencia.,0.3820212576961221,21,18,5,2020
RICARDO SHEFFIELD PADILLA,"Y vamos al Quién es Quién en las remesas, que se los debíamos de la semana pasada y el señor presidente hizo el compromiso de que ahora lo presentásemos.",0.4477828961289817,29,18,5,2020
RICARDO SHEFFIELD PADILLA,"Tenemos que en el mes de marzo de este año se recibieron remesas por cuatro mil 16 millones de dólares, un incremento del 50.13 por ciento con respecto al 2018 y del 35.76 por ciento con respecto al 19.",0.08666482947309584,39,18,5,2020
RICARDO SHEFFIELD PADILLA,"Creemos que nuestras paisanas y paisanos aprovechando el tipo cambiario quisieron apoyar a su mamá, a su esposa que son las principales receptoras y ellas y ellos enviaron un poco más del promedio de 300 dólares, que normalmente es lo que se envía cada mes.",0.6723605072787212,45,18,5,2020
RICARDO SHEFFIELD PADILLA,"Y vamos viendo del lado de los Estados Unidos, estas remesadoras la que te da más por tus dólares, más pesos por tus dólares es Vía Américas, Vía Américas está cobrando una comisión en promedio de dos pesos 99 centavos por esos 300 dólares.",0.026927141205236437,44,18,5,2020
RICARDO SHEFFIELD PADILLA,"El tipo cambiario, que es otro factor muy importante, 23 pesos con 72 centavos.",0.6717830697845127,14,18,5,2020
RICARDO SHEFFIELD PADILLA,"Finalmente, Vía Américas le hace llegar por 300 dólares siete mil 45 pesos con ocho centavos a tu familia aquí en México, mientras que el que menos conviene es Xoom, porque Xoom te está dejando al final llegar solamente seis mil 736.64 centavos de peos.",0.03765601913274696,45,18,5,2020
RICARDO SHEFFIELD PADILLA,"Si ustedes ven, Xoom no cobra tanto más de comisión, son 4.99 contra 2.99, lo que sí es que se pasan de rosca en el tipo de cambio, porque el promedio fue de 22 pesos con 84 centavos por dólar, por eso al final quien menos te conviene es Xoom, con seis mil 736 pesos con 64 centavos lo que recibe tu familia aquí en México. Y eso es para el efectivo.",0.03875932252638184,72,18,5,2020
RICARDO SHEFFIELD PADILLA,"Para depósito a cuenta la mejor opción uLink, que te da siete mil 134 pesos por 300 dólares, mientras que MoneyGram, que ha estado apareciendo continuamente como una de las peores opciones, MoneyGram te da seis mil 827 pesos con 27 centavos por tus 300 dólares que envías, esa es la peor opción para depósito en cuenta.",0.010388142866195509,57,18,5,2020
RICARDO SHEFFIELD PADILLA,¿Y quiénes son los pagadores?,0.07424357264889242,5,18,5,2020
RICARDO SHEFFIELD PADILLA,"Ya es del lado de México, porque una decisión la toman nuestros paisanos que están trabajando en los Estados Unidos, ellas y ellos deciden cuál es la vía, ya dijimos cuál le conviene más, cuál le conviene menos, pero la otra decisión es aquí en México, dónde ir a cobrar esos pesos por los dólares que les envían los paisanos y las paisanas.",0.2965400770633335,63,18,5,2020
RICARDO SHEFFIELD PADILLA,"Tenemos que Banco del Bienestar, el que tiene la cobertura con más municipios, mil 305, mientras que Oxxo tiene la mayor cantidad de sucursales con 19 mil 146 y el mejor horario, abren de 6:00 de la mañana a 10:00 de la noche, pero solamente cubren mil 40 municipios contra los mil 305 que cubre Banco del Bienestar.",0.09616772380895137,58,18,5,2020
RICARDO SHEFFIELD PADILLA,"Y dan seguro contra robo Elektra, Walmart y Caja Popular Mexicana, mientras que Farmacias Guadalajara e Inbursa, siguen sin proporcionarnos toda la información para ser evaluados adecuadamente.",0.0012954689188640167,27,18,5,2020
RICARDO SHEFFIELD PADILLA,"Muchas gracias, señor presidente. Gracias a ustedes.",0.4753916978729404,7,18,5,2020
ROGELIO JIMENEZ PONS," Gracias, señor presidente.",0.393030772130476,3,18,5,2020
ROGELIO JIMENEZ PONS,"A continuación, me permito presentarles un video que da un informe inicial, un mensaje inicial sobre el inicio de trabajos del Tren Maya, le hemos puesto esta ventana de Observatorio Tren Maya, haciendo una referencia a la cuestión del observatorio que ven aquí en Chichén Itzá.",0.15870544274692405,46,18,5,2020
ROGELIO JIMENEZ PONS,"Entonces, con ustedes el video.  Por favor.",0.10212636164057627,7,18,5,2020
VOZ DE MUJER," El Gobierno de México avanza para reactivar la economía. Las obras del Tren Maya inician en el momento exacto en que otras actividades pasan por un momento difícil. El proyecto traerá. El proyecto traerá empleo, oportunidades y derrama económica para el sureste.",0.25703931877571823,42,18,5,2020
VOZ DE MUJER,"En el último mes se concluyó el proceso de licitación para los tres primeros tramos del tren. Para el tramo uno que va de Palenque a Escárcega resultó ganador el consorcio liderado Mota-Engil México en convenio con China Comunications Constructions Company, Grupo Cosh Eyasa y Gavil Ingeniería.",0.038137311271690684,47,18,5,2020
VOZ DE MUJER,En el caso del tramo dos que recorre de Escárcega hasta Calkiní resultó ganador el consorcio integrado por Operadora Cicsa en convenio con FCC Construcción.,0.09345354180544976,25,18,5,2020
VOZ DE MUJER,Para el tramo tres que va de Calkiní a Izamal resultó ganador el consorcio integrado por Construcciones Urales en convenio con GAMI Ingeniería e Instalaciones y Azvi.,0.08586850412406659,27,18,5,2020
VOZ DE MUJER,Respecto al tramo cuatro que va de Izamal a Cancún se prevé que sea construido por la concesionaria de la carretera Mérida-Cancún. En los siguientes días se anunciarán los detalles técnicos y jurídicos de la adjudicación.,0.0006384499146969373,36,18,5,2020
VOZ DE MUJER,Hace unos meses adquirimos los derechos de vía para el proyecto y descubrimos una deuda pendiente. El Gobierno de México inició el pago legítimo de 757 millones de pesos a los propietarios. El Tren Maya está comprometido con el bienestar y la justicia.,0.039393789172727144,43,18,5,2020
VOZ DE MUJER,"Los primeros trabajos en el territorio serán tan variados como la instalación de campamentos, reclutamiento masivo de personal de construcción, remodelación de estaciones con valor histórico, trabajos de limpieza, deshierbe y adecuación de la infraestructura existente, entre otros.",0.592879632548895,38,18,5,2020
VOZ DE MUJER,"Mientras tanto, los consorcios ganadores contratan una gran variedad de técnicos y profesionistas para ejecutar tareas como el desarrollo de los proyectos ejecutivos, la ampliación de los estudios y los planes de remediación ambiental.",0.03398480023790812,34,18,5,2020
VOZ DE MUJER,El equipo del Tren Maya continúa con la planeación y gestión del proyecto.,0.04278914526152197,13,18,5,2020
LUIS MIGUEL DEL VILLAR, El Tren Maya es un proyecto que ha cumplido al 100 por ciento con la aplicación y legislación ambientales. En este contexto de desarrollo regional nos permite la mejor iniciación con los mayores rendimientos y al menor costo ambiental posible.,0.0951057774926968,40,18,5,2020
GABRIEL ARELLANO, A finales del año pasado se llevaron 30 asambleas regionales a través de las cuales las comunidades y pueblos indígenas nos dieron la anuencia para el proyecto.,0.5093097985519588,27,18,5,2020
GABRIEL ARELLANO,"En estos momentos nos encontramos en la fase de seguimiento de acuerdos, la cual está acompañada por más de 28 instituciones y dependencias del ámbito federales quienes estarán atendiendo y respondiendo a todos estos compromisos que se hicieron con ellos.",0.32101258849192865,40,18,5,2020
PREGUNTA," Los trabajos del Tren Maya cumplen con los más altos estándares sanitarios. Los ganadores de los procesos de licitación se han comprometido a dar un cumplimiento cabal a los lineamientos internacionales para proyectos de infraestructura, así cuidamos la salud y la economía del sureste, del lado de la gente, con trabajo, con un proyecto que salda una deuda histórica y da certeza económica en tiempos de incertidumbre.",0.18312489698770432,67,18,5,2020
ROGELIO JIMENEZ PONS, Estaremos atentos a sus preguntas. Muy amables. Gracias.,0.8185446442802433,8,18,5,2020
PRESIDENTE ANDRES MANUEL LOPEZ OBRADOR, General.,0.7667782720545917,1,18,5,2020
RICARDO VALLEJO SUAREZ," Con su permiso, señor presidente.  Buenos días a todas y a todos.",0.5728111875964014,12,18,5,2020
RICARDO VALLEJO SUAREZ,Procedemos a informar la situación que guardan los trabajos de construcción del Aeropuerto Internacional General Felipe Ángeles.,0.4235097278722963,17,18,5,2020
RICARDO VALLEJO SUAREZ,"Tenemos 214 días de construcción, contemplamos todavía 672 días más para concluir en tiempo y forma los trabajos. La obra tiene un avance físico del 18.1 por ciento y, como podrán ver en la gráfica, avanzamos conforme a lo programado y sin incidentes.",0.7939432786926028,43,18,5,2020
RICARDO VALLEJO SUAREZ,"En cuanto a recursos de la obra, la obra tiene, a pesar de que el techo financiero es de 79 mil millones para construir edificaciones, incluida la reubicación de las instalaciones militares, 70 mil millones de pesos distribuidos en este calendario financiero a tres años.",0.4040478690663847,45,18,5,2020
RICARDO VALLEJO SUAREZ,"A la fecha ya hemos recibido 14 mil 678 millones de pesos, de los cuales hemos ejercido casi cinco mil millones de pesos.",0.13904883460615813,23,18,5,2020
RICARDO VALLEJO SUAREZ,¿Cómo se han ejercido esos gastos?,0.09403782517745918,6,18,5,2020
RICARDO VALLEJO SUAREZ,"Casi 30 por ciento corresponde al pago de mano de obra, 50 por ciento aproximadamente a la adquisición de materiales, 16 por ciento lo que corresponde a la renta de maquinaría adicional, seis por ciento de combustibles y uno por ciento de gastos administrativos de seguridad y de higiene.",0.15425159741312688,49,18,5,2020
RICARDO VALLEJO SUAREZ,"Tenemos en estos momentos en las cuentas de la obra nueve mil 710 millones de pesos y en este año contemplamos recibir 25 mil millones de pesos más, lo cual nos permite avanzar con el ímpetu que llevamos hasta el momento.",0.42563375157813826,41,18,5,2020
RICARDO VALLEJO SUAREZ,"También tenemos etiquetados recursos para la adquisición de predios, fueron etiquetados cuatro mil millones de pesos, de los cuales ya recibimos los recursos correspondientes a 2019 y al 2020, que son tres mil 500 millones de pesos, de los cuales ya ejercimos tres mil 100 millones de pesos en la compra de estos terrenos que les llamamos la suma de amortiguamiento acústico y una franja de terreno para la conexión del aeropuerto. Llevamos un total de avance del 90.61 por ciento y se avanza conforme a lo programado.",0.03422579144483133,88,18,5,2020
RICARDO VALLEJO SUAREZ,"También tenemos recursos etiquetados para estudios de ejecución, de ellos ya hemos recibido los recursos que corresponden al 2019 y al 2020; es decir, hemos ejercicio ya 490 millones de pesos y llevamos un 55 por ciento de avance.",0.0987465084837276,39,18,5,2020
RICARDO VALLEJO SUAREZ,"Hemos hecho todos los estudios indispensables para la operación del aeropuerto y con las economías de gasto del año pasado procedemos a hacer estudios ahora más especializados también. Es muy importante esto, porque etiquetamos recursos para el 2021.",0.5769404943696033,38,18,5,2020
RICARDO VALLEJO SUAREZ,"Es muy importante decir que tenemos la oportunidad y la responsabilidad de estar construyendo un gran aeropuerto de gran tamaño que será uno de los primeros aeropuertos pos-COVID; es decir, hoy estamos analizando el fenómeno, todavía no sale la normatividad, pero seguramente los nuevos aeropuertos tendrán otra dinámica distinta de atención al pasajero y eso lo tenemos que tener considerado nosotros y estudiarlo desde estos momentos para construirlo y terminarlo de acuerdo a esas nuevas especificaciones.",0.6923005008685408,76,18,5,2020
RICARDO VALLEJO SUAREZ,"Es importante hablar de la generación de empleos, de ese 30 por ciento que se traduce en más de mil 400 millones de pesos que se han repartido en estos 23 mil trabajadores. El rango de edad de los 18 a 40 es casi la mayor parte de la obra de 75 por ciento, tenemos otros cuatro mil 200 de trabajadores que están entre 41 años y 60 y más de 60 años tenemos 200 trabajadores.",0.09732625780710068,76,18,5,2020
RICARDO VALLEJO SUAREZ,Hemos repartido en nómina pagado directamente al trabajador mil 145 millones de pesos y debo de mencionar que en un gran esfuerzo entre el Banco del Ejército y esta secretaría se dispersa todas las semanas puro billete nuevo como una medida de contención de la contingencia también entre todos los trabajadores.,0.019414369769823362,51,18,5,2020
RICARDO VALLEJO SUAREZ,"Hemos reintegrado a la federación por concepto de Impuesto Sobre la Renta 150 millones de pesos y hemos pagado nuestras cuotas al Seguro Social y al Infonavit. Y esto es muy importante, estos casi 100 millones de pesos que pagamos de cuotas al Seguro Social permite a cada trabajador y si consideramos que tiene esposa y dos hijos, hablamos de casi 100 mil personas que por este pago de cuotas tienen derecho a la seguridad social.",0.590100086148906,76,18,5,2020
RICARDO VALLEJO SUAREZ,"En cuanto a todos los frentes, lo veremos también en el video, se avanza sin contratiempo alguno.",0.3642242304649028,17,18,5,2020
RICARDO VALLEJO SUAREZ,"Uno de los frentes más delicados es la construcción de las pistas, calles de rodaje, plataformas por el gran volumen de movimiento de tierras y de tendido de concreto. No solamente se avanza conforme al programa, sino más adelante ya ustedes pueden ver la pista central casi prácticamente terminada en concreto.",0.8391671187278816,51,18,5,2020
RICARDO VALLEJO SUAREZ,"Nos ha permitido trabajar en los rodajes paralelos y salidas rápidas, pero también ya iniciamos la construcción de la pista norte, ya estamos en la fase de excavación.",0.7227964480901294,28,18,5,2020
RICARDO VALLEJO SUAREZ,"En cuanto a la terminal de pasajeros, efectivamente también avanzamos conforme al programa, ya prácticamente estamos terminando la cimentación, colocando los últimos aisladores sísmicos y estamos trabajando en tres frentes de colocación de estructura metálica; por cierto, esta estructura metálica viene toda de los depósitos de acero que se quedaron en Texcoco, esto nos permite mayor economía de recursos.",0.024239727504653707,59,18,5,2020
RICARDO VALLEJO SUAREZ,"También tenemos ya por iniciar los trabajos de tendido de los entrepisos y tenemos pagado, inclusive, el material de la superestructura de la cubierta, en cuanto a la cubierta.",0.027414436917771144,29,18,5,2020
RICARDO VALLEJO SUAREZ,"En cuanto a la torre de control de tráfico aéreo ya salimos de cimentación, estamos trabajando en los edificios adosados, los edificios de apoyo, administrativos y de capacitación; y también ya estamos levantando el fuste de acero, que es la torre principal, que es el distinto de la torre de control. Este acero también está siendo reutilizado.",0.12999386384216116,57,18,5,2020
RICARDO VALLEJO SUAREZ,"La estación del estacionamiento, la estación intermodal de transporte terrestre, se trabaja en la cimentación y en los muros de contención, y de manera paralela se está trabajando también en la prefabricación de los elementos estructurales de columnas, trabes y losas para que sea un armado in situ y rápido.",0.5131501200312295,50,18,5,2020
RICARDO VALLEJO SUAREZ,"La terminal de combustibles igualmente, estamos terminando los edificios de apoyo, administrativos y técnicos, y estamos empezando a habilitar el acero ya de los tanques de combustible y empezar a construir las zanjas de los 14 kilómetros de la red de distribución.",0.030975576563813768,42,18,5,2020
