Participante,Texto,Sentimiento,Palabras,Dia,Mes,Anio
RICARDO VALLEJO SUAREZ,"El eje troncal de llegadas y salidas, esa vialidad que entra a la terminal de pasajeros también avanza conforme a su programa, tenemos ya las zapatas de cimentación y estamos empezando a colar las columnas, los capiteles y las losas de esa gran avenida que va a llegar tanto arriba como abajo a la zona de llegada y salidas del aeropuerto, y se avanza también sin contratiempos.",0.6622249384799237,67,18,5,2020
RICARDO VALLEJO SUAREZ,"Todo el camino perimetral de más de 30 kilómetros, que incluye bardas, sistemas de seguridad, iluminación y vigilancia, también se construye conforme al programa.",0.5743620766037749,24,18,5,2020
RICARDO VALLEJO SUAREZ,"Las redes hidráulicas y sanitarias, estamos hablando de más de 50 kilómetros de conducción de agua potable al interior del campo militar y 21 kilómetros de sistemas de drenaje, también con sus respectivos tanques de almacenamiento y ya pueden ver la construcción de una de las siete plantas tratadoras de aguas residuales.",0.1717730983568157,52,18,5,2020
RICARDO VALLEJO SUAREZ,"En cuanto a las redes eléctricas de voz y datos, es importante mencionarles que la totalidad del material eléctrico de alta tensión que estaba en Texcoco será reutilizado en este proyecto.",0.009124500050713821,31,18,5,2020
RICARDO VALLEJO SUAREZ,Ya está dentro de nuestras instalaciones y estamos ya construyendo las instalaciones para la subestación switcheo y la subestación reductora junto con sus trincheras para la conducción de las líneas de alta tensión.,0.43301296653820714,33,18,5,2020
RICARDO VALLEJO SUAREZ,"Y en cuanto a la habilidad de interconexión del aeropuerto, conforme se van liberando los terrenos también seguimos avanzando para interconectar el aeropuerto con las principales vías de comunicación, se trabaja sin incidente alguno.",0.08685498068262476,34,18,5,2020
RICARDO VALLEJO SUAREZ,"De manera paralela también el esfuerzo es para la reubicación de las instalaciones militares. Este gran esfuerzo contempla la reubicación de la totalidad de las instalaciones de la Base Aérea Número 1 a su nueva instalación, a su nueva ubicación, ello nos permitirá disponer de ese espacio para construir infraestructura de apoyo al aeropuerto.",0.7858242454942995,54,18,5,2020
RICARDO VALLEJO SUAREZ,"Avanza sin contratiempos hangares, plataformas y demás almacenes.",0.8673035826070931,8,18,5,2020
RICARDO VALLEJO SUAREZ,"Adicional al esfuerzo de las pistas civiles sus plataformas y sus calles de rodaje, también hay un gran esfuerzo para construir la pista militar. Ya la pueden ver ustedes al centro que también tiene sus rodajes, sus sedes rápidas y una plataforma de más de dos kilómetros para aviación militar, ese incluso deberá acabarse todavía antes que la pista principal.",0.27356479155838054,60,18,5,2020
RICARDO VALLEJO SUAREZ,Consideramos que toda la infraestructura de aeronáutica de la base aérea deberá estar concluida al finalizar este año.,0.6701764813730069,18,18,5,2020
RICARDO VALLEJO SUAREZ,"También estamos reubicando las instalaciones del Ejército a un nuevo complejo, esto pretendemos que a finales de octubre estén listas sus instalaciones para ser reubicadas.",0.09247773370570915,25,18,5,2020
RICARDO VALLEJO SUAREZ,"También hay un esfuerzo de reubicación de vivienda. Ya estamos muy adelantados, es uno de los frentes más adelantados y pretendemos que las familias ubiquen, se reubiquen a sus nuevas instalaciones, a nuevos departamentos mejor diseñados antes de concluir este año.",0.5335521703890228,41,18,5,2020
RICARDO VALLEJO SUAREZ,"Gracias a la completud en el diseño, a la fortaleza de la planeación y el ímpetu de la constricción, ya hemos podido inclusive iniciar cinco nuevos frentes de trabajo que tenemos considerados para… y pretendemos construir otros dos más en lo que es la zona del aeropuerto.",0.05429505321101561,47,18,5,2020
RICARDO VALLEJO SUAREZ,"Por lo que corresponde a nuevas instalaciones que estamos iniciando en el componente del Ejército, lo estamos haciendo gracias a la economía de gasto que tenemos para que cuando las familias se pasen a su nuevo lugar dispongan de todos los servicios adicionales como es el hospital militar de zona, el centro comercial, Sedena, el campus educativo de las escuelas públicas del gobierno del estado que están dentro del campo militar a un nuevo complejo y dos escuelas de nuestro sistema educativo militar, la escuela militar de materiales de guerra y la escuela militar de tropas especialistas de la Fuerza Aérea.",0.22499377594745165,101,18,5,2020
RICARDO VALLEJO SUAREZ,"De igual manera tenemos pendiente empezar antes que se finalice el año la gran terminal de carga aérea del aeropuerto y el acueducto para satisfacer las necesidades del líquido vital, no solamente el aeropuerto, sino de los municipios conurbados a la instalación aeroportuaria.",0.4183087158782688,43,18,5,2020
RICARDO VALLEJO SUAREZ,"Es necesario mencionarles que seguimos con el esfuerzo de traslado de materiales desde Texcoco, seguimos moviendo material pétreo, material eléctrico, tuberías, campamentos, acero estructural y varilla en estas cantidades.",0.03008836034138356,29,18,5,2020
RICARDO VALLEJO SUAREZ,Quiero recalcarles cómo es el mecanismo de construcción de la obra. Los trabajos de construcción del aeropuerto están siendo realizados por la Secretaría de la Defensa Nacional bajo la modalidad de administración directa.,0.26786062059074706,33,18,5,2020
RICARDO VALLEJO SUAREZ,¿Por qué administración directa?,0.32175141547751424,4,18,5,2020
RICARDO VALLEJO SUAREZ,"Porque tenemos la capacidad técnica, humana y material, y los equipos para poder emprender estos trabajos y únicamente contratar el resto de insumos, renta de maquinaría y materiales adicionales.",0.04238318063644438,29,18,5,2020
RICARDO VALLEJO SUAREZ,"Por otra parte, la propia ley nos dice que si utilizamos esta modalidad de administración directa, estamos impedidos de manera jurídica para contratar o subcontratar obra pública; es decir, nosotros solamente tenemos los recursos necesarios para construir la obra sin utilidades ni indirectos.",0.05370411374892802,43,18,5,2020
RICARDO VALLEJO SUAREZ,"Esto lo mencionamos porque en múltiples ocasiones se presentan empresas constructoras que nos ofrecen sus servicios donde nosotros les mencionamos que la ingeniería es nuestro trabajo, no somos una autoridad administrativa que se siente a supervisar el avance de los trabajos. No, somos una dependencia ejecutora, que diseñamos y construimos.",0.0063995063832918185,50,18,5,2020
RICARDO VALLEJO SUAREZ,"Eso permite ahorrarle recursos a la federación porque disponemos de los recursos técnicos, humanos y materiales, y la ingeniería necesaria para emprender estos trabajos y reducirlos en un 30, 40 o 50 por ciento del costo que tendrían si se licitaran públicamente.",0.025054986565949244,42,18,5,2020
RICARDO VALLEJO SUAREZ,Contaremos a la par que estamos construyendo con todas las tecnologías de información que debe tener un aeropuerto de clase mundial.,0.5015045251324051,21,18,5,2020
RICARDO VALLEJO SUAREZ,"Tenemos cinco grandes rubros de sistemas que ya se están trabajando desde estos momentos para que cuando el aeropuerto se termine su construcción esté debidamente equipado. La infraestructura y sistemas de comunicaciones, sistemas de operación y gestión aeroportuaria ya están priorizados de acuerdo a lo que nos marca la normatividad, las mejores prácticas profesionales y la experiencia de buenos aeropuertos.",0.5378834108520049,60,18,5,2020
RICARDO VALLEJO SUAREZ,"También tendremos sistemas de seguridad de aviación, sistemas de ciberseguridad porque este aeropuerto, por estar en una instalación militar, deberá intrínsecamente muy seguro y sistemas orientados al usuario y pasajero para que la experiencia del pasajero al viajar sea única, que el aeropuerto se destaque por ser un aeropuerto agradable al viajero.",0.6923809610654261,52,18,5,2020
RICARDO VALLEJO SUAREZ,"La vez pasada que tuve el honor de estar con ustedes se les informó que por el tiempo reducido teníamos superpuesta la planificación, el diseño de la construcción y la futura preparación operacional.",0.7306423935254098,33,18,5,2020
RICARDO VALLEJO SUAREZ,"Es un gusto poderles decir que estamos adelantando ya la última fase de la preparación operacional que pensábamos empezar al finalizar el año, ya la iniciamos, ya estamos trabajando mano a mano con la Secretaría de Comunicaciones y Transportes para empezar a preparar la transición del aeropuerto, porque la preparación operacional consiste en llenar ese vacío que hay entre la construcción de una edificación nueva y la operación exitosa, segura y funcional de un aeropuerto, es propiamente la interfase que alinea el esfuerzo de todas las partes involucradas, desde los constructores y los futuros usuarios. Esta preparación operacional nos permitirá que tengamos un aeropuerto que funcione desde el primer día como debe de ser.",0.12053778230013323,114,18,5,2020
RICARDO VALLEJO SUAREZ,"También lo hemos dicho en otras ocasiones, estamos priorizando la construcción, las instalaciones indispensables y estratégicas serán terminadas en tiempo y forma en la fecha adecuada con recursos del Presupuesto de Egresos de la Federación.",0.756080606387458,35,18,5,2020
RICARDO VALLEJO SUAREZ,"Sin embargo, hay otras instalaciones de servicios aeroportuarios y complementarios como son la base de mantenimiento, otras gasolinerías en el lado de tierra, hoteles, centros comerciales, ciudades aeroportuarias que tendrán que ver el mecanismo de construcción, construirlos con el Presupuesto de Egresos de la Federación o bien bajo un modelo de concesiones a particulares conforme tengamos recursos, vayamos avanzando y la estrategia comercial del futuro operador aeroportuario.",0.3353749867721478,67,18,5,2020
RICARDO VALLEJO SUAREZ,¿Cuál es la intensión?,0.3785854839475438,4,18,5,2020
RICARDO VALLEJO SUAREZ,"Que en el tiempo que tenemos señalado construyamos la parte de la infraestructura, porque eso le representa un ahorro al Estado mexicano.",0.8610196302839574,22,18,5,2020
RICARDO VALLEJO SUAREZ,De esta manera podemos sintetizar lo siguiente:,0.37202355310140667,7,18,5,2020
RICARDO VALLEJO SUAREZ,Los trabajos de construcción avanzan sin incidentes en todos los frentes y conforme al programa de obra. El ejercicio del gasto se mantiene dentro del presupuesto autorizado.,0.5179431089797758,27,18,5,2020
RICARDO VALLEJO SUAREZ,"La construcción del aeropuerto internacional Felipe Ángeles es una gran obra de infraestructura necesaria para el país y es un proyecto prioritario para el gobierno de la República, es además en estos momentos un detonador de trabajo dentro de la reactivación económica y de generación de empleos, distribuye recursos desde la base de la pirámide socioeconómica y coadyuva en la reactivación de toda la planta productiva del país.",0.30768623836258807,68,18,5,2020
RICARDO VALLEJO SUAREZ,"Que no quede duda, el Aeropuerto Internacional Felipe Ángeles será una instalación concluida y funcional en el tiempo programado y en todos los recursos asignados.",0.6247838421070159,25,18,5,2020
RICARDO VALLEJO SUAREZ,"Es cuanto, señor presidente.",0.01045651494289542,4,18,5,2020
PRESIDENTE ANDRES MANUEL LOPEZ OBRADOR,": Bueno, vamos ahora a pasar los videos de todos los lunes, aunque ya se habló ampliamente en el Aeropuerto Felipe Ángeles. No sé si tienen el video y luego el de la refinería de Dos Bocas.",0.11969626149063065,37,18,5,2020
PREGUNTA, La Secretaría de la Defensa Nacional informa los avances en la construcción del Aeropuerto Internacional Felipe Ángeles al 18 de mayo de 2020.,0.24717006024265567,23,18,5,2020
PREGUNTA,"El proceso de la obra del nuevo aeropuerto se lleva a cabo de manera simultánea en 22 frentes. En el estacionamiento y terminal intermodal de transporte terrestre se realiza excavación en zanja con maquinaría y afine de caras laterales a mano en área de rampa vehicula, acarreo de material de excavación, colados, ranuras de coronas y armado de acero para contra trabes, principales y secundarias.",0.23912009051273955,65,18,5,2020
PREGUNTA,En la terminal de pasajeros se continúa el montaje de la estructura de acero en procesador central y salas de última espera de manera continua en cuatro frentes de trabajo.,0.44340018725794816,30,18,5,2020
PREGUNTA,Se inició la colocación de quinta grúa torre para incrementar la velocidad del montaje.,0.19596476496355222,14,18,5,2020
PREGUNTA,"En la vialidad y barda perimetral se trabaja el relleno con material de banco de préstamo para la conformación de subyacente, acarreo y compactación en vialidades.",0.10234239565632923,26,18,5,2020
PREGUNTA,"En barda perimetral se realiza la excavación, habilitado y colocación de acero de refuerzo para dados, columnas y dovelas",0.1260964033439121,19,18,5,2020
PREGUNTA,"En la torre de control y servicios, extinción de incendios y edificios administrativos continúa el montaje de la estructura metálica del fuste de la torre de control, así como los trabajos de ramaleo del sistema de iluminación y de traslado de acero de predio Texcoco.",0.18713575183040126,45,18,5,2020
PREGUNTA,En sus vialidades se continúa la conformación de terraplenes y la colocación de base hidráulica.,0.967451075412126,15,18,5,2020
PREGUNTA,"En la terminal de combustible y red de distribución, en la edificación se lleva a cabo colado de concreto en escalones de acceso, colocación de persianas, cancelería, construcción de muros de block aplanado y habilitado de rejillas en trincheras.",0.02378854491433639,39,18,5,2020
PREGUNTA,"A la fecha, se han generado 23 mil 425 empleos civiles, faltan 672 días de construcción.",0.05045144804857664,16,18,5,2020
VOZ DE MUJER, Gobierno de México.,0.541333260777616,3,18,5,2020
ROCIO NAHLE GARCIA, Es 15 de mayo y estamos en el sitio donde se va a levantar la planta combinada totalmente de tecnología mexicana del IMP. Aquí es donde se va a recibir el petróleo crudo para procesar en toda la refinería.,0.3226712856558304,39,18,5,2020
ROCIO NAHLE GARCIA,Va el reporte.,0.04255545665174131,3,18,5,2020
PRESIDENTE ANDRES MANUEL LOPEZ OBRADOR, Terminamos con las exposiciones y abrimos para preguntas y respuestas.,0.5031640662507993,10,18,5,2020
PREGUNTA," Buenos días, presidente. Yo quería preguntarle primero que nada, ¿cuál es su opinión sobre la batalla legal que anunció el Consejo Coordinador Empresarial contra el plan energético de su administración?",0.07107580744435489,30,18,5,2020
PRESIDENTE ANDRES MANUEL LOPEZ OBRADOR," Están en su derecho, lo hemos dicho en otras ocasiones, el gobierno que encabezo representa a todos los mexicanos.",0.6330070392181422,19,18,5,2020
PRESIDENTE ANDRES MANUEL LOPEZ OBRADOR,"Creo que ese es uno de los cambios sustanciales, de los más importantes, lo que distingue a la nueva etapa que se está viviendo en México en lo que tiene que ver con las actividades públicas.",0.7233446548458727,36,18,5,2020
PRESIDENTE ANDRES MANUEL LOPEZ OBRADOR,"Ya hay una separación que no la había entre poder económico y poder político. Antes el poder económico dominaba y se atendía nada más el interés de los grupos de grupos de intereses creados, solo los hombres de negocios y no se atendía el interés del pueblo de México.",0.12032156519905692,49,18,5,2020
PRESIDENTE ANDRES MANUEL LOPEZ OBRADOR,"Se decía inclusive que había que apoyar a los de arriba, porque si les iba bien a los de arriba, les iba a ir bien a los de abajo; que si llovía fuerte arriba, goteaba abajo, como si la riqueza fuese permeable o contagiosa, ahora ya no es así.",0.7158796946801791,49,18,5,2020
PRESIDENTE ANDRES MANUEL LOPEZ OBRADOR,"Ahora se cumple con el mandato constitucional, con el artículo 25 de la Constitución, que establece que es el Estado el que debe conducir, planear, llevar a cabo las acciones del desarrollo de nuestro país, el Estado, que representa a todos los mexicanos.",0.5757372441589402,43,18,5,2020
PRESIDENTE ANDRES MANUEL LOPEZ OBRADOR,"Y los recursos ahora se están destinando debajo de la pirámide social y esto, ya lo he explicado en un texto reciente, también ayuda a los a los de arriba.",0.6691056173526663,30,18,5,2020
PRESIDENTE ANDRES MANUEL LOPEZ OBRADOR,"Antes se decía, desde hace muchos años, siglos, se decía: ‘¿Qué haremos con los pobres?’ Ahora no es así, ahora podríamos decir: ¿Qué haremos con los ricos?",0.5531541041224544,27,18,5,2020
PRESIDENTE ANDRES MANUEL LOPEZ OBRADOR,"Los pobres primero, sin que esto signifique abandonar a los que tienen más recursos económicos, pero es para explicar por qué el cambio.",0.26005122495615657,23,18,5,2020
PRESIDENTE ANDRES MANUEL LOPEZ OBRADOR,"Entonces, ¿cuál es la inconformidad ahora?",0.01891205258718567,6,18,5,2020
PRESIDENTE ANDRES MANUEL LOPEZ OBRADOR,"Se habían apoderado del sector energético, en particular de la industria petrolera y de la industria eléctrica, y estaban conspirando para destruir a Pemex y la Comisión Federal de Electricidad. Y hay constancia de lo que estoy diciendo, se entregaron contratos, en el caso de Pemex se dejó de invertir para que se dejara de producir petróleo, se entregaron estos contratos a particulares con la llamada Reforma Energética y según esos contratos, y así lo dijeron, engañando a todo el pueblo, iban a significar más producción petrolera y más beneficios.",0.0021536310877472175,90,18,5,2020
PRESIDENTE ANDRES MANUEL LOPEZ OBRADOR,¿Cuáles beneficios se obtuvieron?,0.008445841732957055,4,18,5,2020
PRESIDENTE ANDRES MANUEL LOPEZ OBRADOR,"Nada. Bajó la producción, acabaron con la industria petroquímica, dejaron en ruina las refinerías, se esmeraron en no construir una nueva refinería en 40 años, aumentaron lo que quisieron el precio de las gasolinas.",0.001846377418034738,34,18,5,2020
PRESIDENTE ANDRES MANUEL LOPEZ OBRADOR,"En el caso de la industria eléctrica lo mismo, les entregaron el mercado de la electricidad a particulares violando la Constitución al inicio, en el gobierno de Salinas entregaron contratos a empresas particulares nacionales, pero fundamentalmente extranjeras, empresas que luego se llevaron a trabajar a los altos funcionarios públicos, que les permitieron esas privatizaciones, hasta un expresidente se fue de consejero de una empresa eléctrica española, de Iberdrola, un expresidente de la República.",0.06447983137648278,73,18,5,2020
PRESIDENTE ANDRES MANUEL LOPEZ OBRADOR,"Contratos leoninos muy favorables a las empresas particulares, tanto en la adquisición de gas como en la compra de la energía eléctrica, dejando de lado a la Comisión Federal de Electricidad con un plan de cerrar las plantas de la Comisión Federal de Electricidad para dejarles todo el mercado a las particulares, al grado de que llegaron a venderle a la Comisión Federal de Electricidad el 50 por ciento de toda la energía eléctrica que consumimos en el país.",0.521975523804435,79,18,5,2020
PRESIDENTE ANDRES MANUEL LOPEZ OBRADOR,"Y también, ¿en qué se beneficiaron los consumidores si subía y subía el precio de la luz?, ¿por qué entonces no protestaban los que ahora se inconforman?",0.05513303777051869,27,18,5,2020
PRESIDENTE ANDRES MANUEL LOPEZ OBRADOR,"¿Cómo va a salir adelante el país?, ¿cómo va a desarrollarse México?, ¿cómo se va a impulsar su industria, sus actividades productivas si el precio de la luz es más caro que en otras partes del mundo? Es más cara la luz en México que en Estados Unidos.",0.6059521622460589,48,18,5,2020
PRESIDENTE ANDRES MANUEL LOPEZ OBRADOR,"Llegamos, estamos poniendo orden, no ha aumentado el precio de la luz como ellos lo hicieron, pero necesitamos también poner orden y que ya no se siga consumando el saqueo del periodo neoliberal.",0.010164583683615398,33,18,5,2020
PRESIDENTE ANDRES MANUEL LOPEZ OBRADOR,"Están en todos sus derechos de acudir a los tribunales, como también nosotros tenemos el derecho de hacerlo en el marco de la legalidad vigente y en defensa de los intereses de los mexicanos.",0.06013844926595241,34,18,5,2020
PRESIDENTE ANDRES MANUEL LOPEZ OBRADOR,"Si no ponemos orden, va a seguir lo mismo: la corrupción, van a seguir viendo a México como tierra de conquista, como lo hacían. Venían las empresas extranjeras a saquear, saquearon más en este periodo neoliberal que lo que saquearon durante los tres siglos de dominación colonial, hicieron lo que quisieron.",0.01186766790290361,51,18,5,2020
PRESIDENTE ANDRES MANUEL LOPEZ OBRADOR,"Y, la verdad, me sorprende que algunos, no todos desde luego, empresarios mexicanos defiendan este sistema, este régimen de corrupción, si a todos nos conviene que haya honestidad.",0.18865974295202922,28,18,5,2020
PRESIDENTE ANDRES MANUEL LOPEZ OBRADOR,"Sacan una campaña estos privilegiados, de desprestigio a nuestro gobierno. Ya como no les da el desinformar en la prensa de México, ahora han acudido a los periódicos de otras partes del mundo, periódicos famosos, el Wall Street Journal, el New York Times, el Washington Post, el Finacial Times, El País.",0.12111717486657438,51,18,5,2020
PRESIDENTE ANDRES MANUEL LOPEZ OBRADOR,¿Cuál es la característica de esos periódicos?,0.2204256627319756,7,18,5,2020
PRESIDENTE ANDRES MANUEL LOPEZ OBRADOR,"Hablando con franqueza, pues que están también tomados por las grandes corporaciones internacionales, económicas y financieras. Es una decadencia también expresada en los medios de comunicación del mundo.",0.4024332861740876,28,18,5,2020
PRESIDENTE ANDRES MANUEL LOPEZ OBRADOR,"Así como necesitamos revisar la política económica que se ha aplicado, el fracaso del modelo neoliberal y optar por algo del todo nuevo, ya no seguir con el mismo camino trillado de siempre, así también hay que hacer una revisión profunda sobre el papel de los medios de información, sobre todo imprimirles -ese es mi punto de vista muy respetuoso- ética. Hace falta imperativo ético en el ejercicio del periodismo.",0.06617519974825546,70,18,5,2020
PRESIDENTE ANDRES MANUEL LOPEZ OBRADOR,"Es muy lamentable que en Estados Unidos, que tenían históricamente desde la fundación de esa gran nación con principios democráticos como los describe Tocqueville, dos cimientos importantísimos:",0.47711440424050977,27,18,5,2020
PRESIDENTE ANDRES MANUEL LOPEZ OBRADOR,"Uno, era su poder judicial independiente, lo siguen manteniendo, incluso siguen hasta eligiendo a sus jueces, el pueblo elige a sus jueces y apego a la legalidad.",0.0457716502508085,27,18,5,2020
PRESIDENTE ANDRES MANUEL LOPEZ OBRADOR,"No es casual que todos los opositores mexicanos en la historia decidían irse a Estados Unidos. A Hidalgo lo detienen en Coahuila y lo llevan preso y lo asesinan, lo fusilan en Chihuahua, porque iban al norte; Juárez estuvo allá en Chihuahua, en Paso del Norte, lo que es ahora Ciudad Juárez, como dos años en el norte; los Flores Magón, cuando la Revolución, allá hacían el periodismo; Madero lanza el Plan de San Luis para derrocar a Porfirio Díaz en Estados Unidos, en San Antonio, Texas.",0.009466725227135986,87,18,5,2020
PRESIDENTE ANDRES MANUEL LOPEZ OBRADOR,¿Por qué se iban allá?,0.7060190611375959,5,18,5,2020
PRESIDENTE ANDRES MANUEL LOPEZ OBRADOR,"Porque allá, si los detenían, los llevaban a un juzgado y los encarcelaban, como fue el caso de los hermanos Flores Magón, que vivieron años, sobre todo Ricardo Flores Magón, en la cárcel, un hombre extraordinario, por sus convicciones, ahí murió, unos dicen, de acuerdo al dictamen, al diagnóstico, que por un infarto, otros no creen esa versión y se habla de que fue ahorcado, estrangulado en su celda.",0.0033751897164401696,69,18,5,2020
PRESIDENTE ANDRES MANUEL LOPEZ OBRADOR,"Pero con todo los metían a la cárcel, acá al opositor le aplicaban la ley fuga, era el ‘mátalos en caliente’.",0.004444551676123961,21,18,5,2020
PRESIDENTE ANDRES MANUEL LOPEZ OBRADOR,¿Qué tenía Estados Unidos en ese entonces y sigue conservando?,0.24830005589455564,10,18,5,2020
PRESIDENTE ANDRES MANUEL LOPEZ OBRADOR,"Sus instituciones judiciales, independientes.",0.41293165929944314,4,18,5,2020
PRESIDENTE ANDRES MANUEL LOPEZ OBRADOR,"Y lo otro que era importantísimo, su prensa independiente, libre. Y eso se ha ido perdiendo porque se ha ido convirtiendo su prensa en defensora de intereses de grupos, y la prensa, en cualquier parte del mundo debe ser independiente, alejada del poder económico, del poder político y cercana siempre a los ciudadanos, al pueblo, a la verdad.",0.4782075564002505,58,18,5,2020
PRESIDENTE ANDRES MANUEL LOPEZ OBRADOR,"En el caso de El País, de España, era el periódico, y sigue siendo, que defendía a las empresas españolas que hacían negocios en México, por eso un día sí y el otro también nos cuestiona. Y todavía hay quienes piensan -no muchos y cada vez menos- que son objetivos, profesionales, incluso de izquierda o progresista. Nada de eso.",0.20208662669048988,59,18,5,2020
PRESIDENTE ANDRES MANUEL LOPEZ OBRADOR,"Por eso -concluyo con tu pregunta o termino de responder tu pregunta- vamos nosotros a defender la industria eléctrica nacional, porque tengo el compromiso y lo voy a cumplir de que no va a aumentar el precio de la luz, no va a aumentar, ya no va a ser como antes.",0.10607099719814307,51,18,5,2020
PRESIDENTE ANDRES MANUEL LOPEZ OBRADOR,"Y en el caso de las gasolinas lo mismo. Ahora está subiendo porque, como lo expresó Ricardo Sheffield, está aumentando el precio del petróleo crudo.",0.028175932160655757,25,18,5,2020
