Participante,Texto,Sentimiento,Palabras,Dia,Mes,Anio
PRESIDENTE ANDRES MANUEL LOPEZ OBRADOR," Buenos días. Se tardó la reunión de seguridad, pero ya estamos aquí.",0.8672946475785087,12,17,08,2020
PRESIDENTE ANDRES MANUEL LOPEZ OBRADOR,"Vamos a iniciar la semana informando sobre los precios de los combustibles y, posteriormente, como lo hacemos todos los lunes, se van a presentar los dos videos sobre el avance de las obras del aeropuerto ‘Felipe Ángeles’ y de la refinería de Dos Bocas.",0.012808895291059523,44,17,08,2020
PRESIDENTE ANDRES MANUEL LOPEZ OBRADOR,Vamos a darle a Ricardo Sheffield la palabra para que nos informe cómo está la situación de los precios de los combustibles.,0.022003908642448656,22,17,08,2020
RICARDO SHEFFIELD PADILLA," Buenos días, señor presidente; buenos días a todas y a todos ustedes.",0.8469471086767334,12,17,08,2020
RICARDO SHEFFIELD PADILLA,"Tenemos el precio de la gasolina regular en esta semana que cerró, el más alto, con el margen más alto es Oxxo Gas, en Zapopan, Jalisco, 20 pesos 38 centavos por litro, un margen de tres pesos 25 centavos. Normalmente Oxxo Gas está a la media de los precios, ojalá tomen en cuenta esto que les está pasando en Jalisco y nos apoyen a los consumidores.",0.007546870209118665,66,17,08,2020
RICARDO SHEFFIELD PADILLA,"El precio más bajo lo tiene franquicia Pemex en Súper Servicio Abi, Navolato, Sinaloa, 17 pesos 85 centavos por litro, un margen de 19 centavos.",0.001332154988078535,25,17,08,2020
RICARDO SHEFFIELD PADILLA,"Para la gasolina Premium, el precio más alto está en Exxon Mobil en San Pedro Garza García, 20 pesos 94 por litro, un margen de cuatro pesos 73 centavos; la más económica en comparación la tiene franquicia Pemex en Acajete, Puebla, 17 pesos con 10 centavos por litro, un margen de 42 centavos.",0.003154797605035452,53,17,08,2020
RICARDO SHEFFIELD PADILLA,"Para el diésel, el más alto otra vez Exxon Mobil, ahora en Monterrey, Nuevo León, 20 pesos 80 centavos por litro, un margen de tres pesos 48 centavos; el más económico franquicia Pemex, Tapachula, Chiapas, 18 pesos con 50 centavos por litro, 32 centavos de margen.",0.02360579679702915,46,17,08,2020
RICARDO SHEFFIELD PADILLA,"Las más económicas se han mantenido en los últimos tres meses Total, G500 y Orsan; las marcas, en promedio, Chrevron, Arco y RedCo.",0.43962104142872066,23,17,08,2020
RICARDO SHEFFIELD PADILLA,"Con corte al 14 de agosto el precio de la mezcla mexicana, 39 dólares 90 centavos; el precio promedio ese día del diésel, 19.79 por litro al público, 19 28 de la Premium, 18.844 de la regular. Si ustedes ven, ya se están estabilizando otra vez los precios del petróleo y en consecuencia lo precios de los combustibles derivados de este.",0.05117043617485665,61,17,08,2020
RICARDO SHEFFIELD PADILLA,"En verificación, todas ellas denuncias atendidas a través de la app Litro por Litro, son 290 con 205 visitas o verificaciones, una gasolinera no dejó colocar los sellos y 15 bombas que fueron inmovilizadas en 10 estaciones de servicio.",0.11181290125268463,39,17,08,2020
RICARDO SHEFFIELD PADILLA,"La que no se dejó verificar, me sorprende la franquicia porque normalmente son muy serios, que es BP. Ojalá la franquicia BP tome cartas en el asunto, es una gasolinera en Atizapán de Zaragoza, Estado de México, carretera Lago de Guadalupe, para que los consumidores la eviten porque no dejó colocar sellos y ahí se detectó fallas y violaciones a las normas.",0.5080128637982685,62,17,08,2020
RICARDO SHEFFIELD PADILLA,"Las más baratas en la app, que no toma en cuenta el margen, G500, de Guadalupe, Nuevo León, 16 pesos 89 centavos; y Coatzacolacos, Veracruz, franquicia Pemex, 17 pesos cuatro centavos.",0.005349525880709919,31,17,08,2020
RICARDO SHEFFIELD PADILLA,"Las más caras, Talpan de Allende, Jalisco, franquicia Pemex, 21.45, esta sí se va a llevar el premio de la más pasada de rosca en todo el año, esta gasolinera carera y abusiva de Talpa de Allende, Jalisco; y 20.80 en Chrevron, Culiacán Sinaloa.",0.002781994403860967,44,17,08,2020
RICARDO SHEFFIELD PADILLA,"Para la Premium, la más barata, franquicia Pemex, 17 pesos en Coatzacoalcos, Veracruz y 17.10 en franquicia Pemex en Acajete, Puebla; las más caras, Guasave, Sinaloa, 22 pesos 32 centavos, y 22.29 de Shell en Aguascalientes, Aguascalientes.",0.0023799428646628803,37,17,08,2020
RICARDO SHEFFIELD PADILLA,"Para el diésel la más económica 16.99 Max Gas, en Saltillo, Coahuila; 16.99 en San Fernando, Tamaulipas; las más caras, 22.89, Sinaloa, Sinaloa, franquicia Pemex, y 22.32, franquicia Pemex en Talpa de Allende, Jalisco.",0.0006831385920570596,34,17,08,2020
RICARDO SHEFFIELD PADILLA,Seguimos monitoreando también los servicios sanitarios.,0.0727979990195331,6,17,08,2020
RICARDO SHEFFIELD PADILLA,"Quién es quién el precio del gas LP. Caligas 12 pesos 17 centavos por litro, en Los Cabos, Baja California, con un margen de 2.98 para tanques estacionarios; y para tanques estacionarios, la más económica, Gas Providencia en San José Iturbide, Guanajuato, ocho pesos por litro, 1.36 de margen.",0.05674675219200803,49,17,08,2020
RICARDO SHEFFIELD PADILLA,"Caligas en cilindros la más cara en Los Cabos, Baja California, 22.54 pesos por kilo, 4.92 de margen.",0.007567596003476647,18,17,08,2020
RICARDO SHEFFIELD PADILLA,"Pero si ustedes ven, Gas Express Nieto en centro, la zona centro en Ciudad de México, en Azcapotzalco está teniendo un margen de 11 pesos 27 centavos por kilo, esos sí, unos angelitos muy mandados que ojalá den los precios que dan en otros lados del país, que también llegan a ser de los más económicos, no sé qué les estará pasando por acá.",0.09529984944301531,64,17,08,2020
RICARDO SHEFFIELD PADILLA,"Flama Azul, en Asunción Cuyotepeji, Oaxaca, 16 pesos 84 centavos por kilo, un margen de 3.86 es la opción más barata en cilindros y tenemos estabilidad a lo largo de este año en los precios de Gas LP.",0.004489406120008478,38,17,08,2020
RICARDO SHEFFIELD PADILLA,"Hicimos 78 verificaciones a gaseras, 71 salieron bien, cuatro con infracciones, tres no se dejaron verificar, que fue Gasipo, en Chalco, Estado de México; Gas Las Albricias, en San Martín de las Pirámides, Estado de México; y Mercantil Distribuidora, en Reynosa, Tamaulipas.",0.002306280145727384,42,17,08,2020
RICARDO SHEFFIELD PADILLA,"Toca remesas el día de hoy, presentamos, como cada mes, las remesas para que nuestras paisanas y paisanos que hacen un gran esfuerzo en favor de sus familias y de México en los Estados Unidos sepan dónde les conviene enviar sus dólares.",0.6137317270551259,42,17,08,2020
RICARDO SHEFFIELD PADILLA,"Tenemos que en el mes de junio las remesas fueron tres mil 537 millones de dólares, aumentó 12.62 por ciento este año con relación al 2018 y 11.10 por ciento con relación al año pasado.",0.48980995675856137,35,17,08,2020
RICARDO SHEFFIELD PADILLA,¿Quién es el que nos da la mejor tasa de cambio y menor comisión?,0.027570806634659523,14,17,08,2020
RICARDO SHEFFIELD PADILLA,"Ulink, esto para que decidan nuestras hermanas, hermanos allá en los Estados Unidos, nuestros paisanos, que Ulink les da por 300 dólares, seis mil 684 pesos; y el tipo de cambio que estuvo dando fue de 22 pesos 28 centavos por dólar, cobra cero pesos, cero centavos de dólar por comisión.",0.026347626412831136,51,17,08,2020
RICARDO SHEFFIELD PADILLA,"Mientras que lo comparamos con la peor opción, esto es para efectivo, lo es Western Union, que nos da por 300 dólares sólo seis mil 326 pesos con 99 centavos. Además, ustedes pueden ver que ha crecido bastante la diferencia entre el peor y el mejor, por eso conviene más fijarse para escoger cuál nos más da pesos por nuestros dólares.",0.17486333078605223,61,17,08,2020
RICARDO SHEFFIELD PADILLA,"Si es depósito a cuenta, Ulink sigue siendo la mejor opción, nos da por 300 dólares, que es el promedio del envío, seis mil 684 pesos; mientras que aquí la peor opción en depósito a cuenta es Money Gram, que nos da seis mil 390 pesos con 66 centavos.",0.10563843186039842,49,17,08,2020
RICARDO SHEFFIELD PADILLA,¿Quién es el que tiene más municipios cubiertos?,0.2972099511813503,8,17,08,2020
RICARDO SHEFFIELD PADILLA,"Telegram Telecomm, tiene más municipios cubiertos en el país. Oxxo tiene más sucursales, tiene 19 mil 146, abre de las 6:00 de la mañana a las 10:00 de la noche, también tiene el horario más amplio.",0.1785037656983865,36,17,08,2020
RICARDO SHEFFIELD PADILLA,"Y luego tenemos que Walmart, Elektra y Caja Popular Mexicana dan seguro contra robo como un beneficio adicional. Hay que fijarse más en los Estados Unidos que en el caso de México, en el caso de México lo más competitivo es la ubicación y algunos servicios adicionales como el seguro.",0.047609543142957074,50,17,08,2020
RICARDO SHEFFIELD PADILLA,Muchas gracias.,0.500183160728402,2,17,08,2020
PRESIDENTE ANDRES MANUEL LOPEZ OBRADOR, Vamos a los videos.,0.541560780605259,4,17,08,2020
PREGUNTA, La Secretaría de la Defensa Nacional informa los avances en la construcción del Aeropuerto Internacional ‘Felipe Ángeles’ al 17 de agosto de 2020.,0.16146005346500714,23,17,08,2020
PREGUNTA,"En la terminal de pasajeros se realiza la aplicación de pintura en muros de salas de salidas remotas, montaje de estructura metálica y habilitado de acero de refuerzo, colocación de muros divisorios y perimetrales, así como la aplicación de capa rústica en muros de salas de última espera.",0.5725422099739066,48,17,08,2020
PREGUNTA,"En la pista norte, central, plataforma y rodajes se avanza con la excavación en caja para el desplante de la estructura del pavimento, conformación de terraplén, tendido de la capa con base hidráulica y de la capa de concreto magro para incrementar su capacidad de carga.",0.4250901600728641,46,17,08,2020
PREGUNTA,"En el eje troncal de circulación y obras complementarias se continúa con la construcción de vialidades desde las terracerías hasta la estructura de pavimento, además de la construcción de columnas y losas para el viaducto elevado de acceso al nivel de salidas de la terminal.",0.8698745870770104,45,17,08,2020
PREGUNTA,"En la vialidad y barda perimetral se realiza tendido y compactación de material para base hidráulica, trabajos de control topográfico, construcción de dados, columna y colocación de dovelas.",0.042281768323732385,28,17,08,2020
PREGUNTA,"En la interconexión vial, tramo caseta Tultepec-Santa Lucía, se aplica el tendido y compactación de terraplén a nivel subyacente, con una mezcla de material producto de banco y tezontle, conformación de la última capa de terraplén con tepetate.",0.06338480271505617,38,17,08,2020
PREGUNTA,"En las redes eléctricas, red de voz y datos se realiza el detallado de fachada para acabado final en la caseta de monitoreo, además del habilitado, armado de cimbra y acero en losa del edificio de transformadores.",0.01597913702758284,37,17,08,2020
PREGUNTA,"En la construcción de las instalaciones de la 37 Zona Militar se realiza el habilitado de acero y trabajos en columnas, trabes y losas de entrepiso y azotea, construcción de muros con block, así como la aplicación de capa fina en muros interiores y exteriores de los edificios.",0.8517849190393881,48,17,08,2020
PREGUNTA,"A la fecha se han generado 36 mil 606 empleos civiles, faltan 581 días de construcción.",0.05045144804857664,16,17,08,2020
PREGUNTA, Gobierno de México.,0.541333260777616,3,17,08,2020
ROCIO NAHLE GARCIA, Es viernes 14 de agosto y vamos a pasar el reporte del avance de Dos Bocas.,0.10746544283857626,16,17,08,2020
PREGUNTA," Se avanza en los diferentes frentes de construcción de las 17 plantas de proceso, servicios auxiliares, zona de almacenamiento y edificios administrativos.",0.5702779980894364,22,17,08,2020
PREGUNTA,"En el paquete 1 se han concluido las pilas de cimentación y se trabaja en la base de la cimentación de racks, mesas de tambores de coque y soporte de bases estructurales.",0.0289537981981688,32,17,08,2020
PREGUNTA,"En el paquete 2 se continúa con los trabajos de cimentación profunda, se inició el descabezamiento de pilas y tendido de acero para la preparación de colado.",0.028612795156294314,27,17,08,2020
PREGUNTA,"En el paquete 3, donde se preparan las pilas de cimentación de la planta catalítica, se aumentó la carga de trabajo para rebasar el plan propuesto de montaje de acero y pilas.",0.03409305915806136,32,17,08,2020
PREGUNTA,En el paquete 3-B se realizan los trabajos correspondientes a cimentaciones profundas y excavación de dos plantas de procesos con base en la ingeniería de construcción.,0.22798325272540157,26,17,08,2020
PREGUNTA,"En el paquete 4, la empresa Techint avanza con las inclusiones de grava y con la ingeniería de construcción de la planta de aguas amargas y de aminas.",0.49591835531868533,28,17,08,2020
PREGUNTA,"En el paquete 4-B, continúan los trabajos de cimentación profunda y procesos de excavación, así como el colado de concreto hidráulico en las tres plantas de proceso.",0.015464098058055877,27,17,08,2020
PREGUNTA,"En el paquete 5, zona de almacenamiento, las siete empresas encargadas de la construcción de los tanques de almacenamiento han comenzado a recibir zonas preparadas con pilotes para la construcción de la base de tanques y esferas.",0.8452753543436544,37,17,08,2020
PREGUNTA,"En el paquete 6 se implementa la cimentación de los edificios administrativos A, B, C y D, se trabaja en el levantamiento de columnas para el soporte de estructuras, se ha concluido el desplante del cuarto de control y se avance en su cimentación, se levantan muros de block en el edificio de mantenimiento y satélite de servicios, se lleva a cabo el deslinde el área de laboratorios, se continúan con trabajos de ingeniería y levantamiento topográfico en áreas externas hidráulicas y de servicios.",0.012118914438248984,84,17,08,2020
PREGUNTA,Actualmente se cuenta con 27.20 kilómetros de vialidades y se continúan los trabajos de construcción de cunetas pluviales.,0.0259697214492739,18,17,08,2020
PREGUNTA,En el vivero se lleva a cabo la reubicación de especies ornamentales para su desarrollo.,0.9960822890989204,15,17,08,2020
PRESIDENTE ANDRES MANUEL LOPEZ OBRADOR," Muy bien. Nada más informarles que ya el lunes próximo vamos a agregar el video del avance en las obras del Tren Maya y en 15 días se agrega también un video sobre el avance en la construcción del Ferrocarril del Istmo y los puertos; o sea, estos cuatro proyectos, aeropuerto ‘Felipe Ángeles’, la refinería, el Tren Maya y las obras del Istmo de Tehuantepec se van a presentar todos los lunes para ir avanzando.",0.5722301312195357,75,17,08,2020
PREGUNTA, (inaudible),0.541333260777616,1,17,08,2020
PRESIDENTE ANDRES MANUEL LOPEZ OBRADOR," También lo podríamos hacer, porque ya se reiniciaron las obras y se tienen avances, podríamos irlo incorporando para que todos sepamos cómo se van realizando estas obras, cómo se va avanzando, darle seguimiento entre todos porque son obras importantes, además es creación de empleos, que hacen mucha falta en estos tiempos.",0.4716879573562558,51,17,08,2020
PRESIDENTE ANDRES MANUEL LOPEZ OBRADOR,"Entonces, no está mal que también se incorpore el Tren Toluca. Serían cinco proyectos para ir viendo avance, cuándo se tiene contemplado terminar, cuántos están trabajando, cómo se va avanzando por semana.",0.05733174877589852,32,17,08,2020
PRESIDENTE ANDRES MANUEL LOPEZ OBRADOR,"Y me ayudan, porque es empujar al elefante. Así, los técnicos, los responsables que están aplicados, que están trabajando, tendrían que aplicarse más, profundizar más en el trabajo, hacer las cosas de mejor calidad y con menor tiempo y costo, hacer que con la transparencia avancemos.",0.17461085887802666,46,17,08,2020
PRESIDENTE ANDRES MANUEL LOPEZ OBRADOR,"Desde luego son los ingenieros militares los que están a la vanguardia. Ya puedo adelantarles que, en Santa Lucía, en lo que es el aeropuerto militar-civil ‘Felipe Ángeles’, en febrero del año próximo estamos inaugurando ya la pista militar y las instalaciones de la base aérea como una primera etapa y el 21 de marzo del 22 se inaugura completo el aeropuerto. Pero los que están trabajando en la refinería, igual, están aplicados, y en el Tren Maya y en las obras del Istmo.",0.326458389133201,84,17,08,2020
PRESIDENTE ANDRES MANUEL LOPEZ OBRADOR,"Y también en el Tren Toluca-Ciudad de México, ya tenemos el presupuesto para concluirlo, son 20 mil millones adicionales. Ya conocen ustedes la historia, se estimó que iban a ejercerse 30 mil millones, pero se llevan ejercidos más de 60 mil y faltan 20 mil, o sea, que va a terminar costando cerca de 90 mil millones. Es una obra mal planeada, con mucha corrupción, con muchos problemas, pero ni modo de dejarla a la mitad, inconclusa. Pierde más el pueblo, pierde más la hacienda pública, entonces por eso decidimos concluirla.",0.17555267309166636,91,17,08,2020
PRESIDENTE ANDRES MANUEL LOPEZ OBRADOR,"También es muy importante que no se olvide -porque voy a pedir respeto, voy a pedir que ofrezcan disculpas en su momento, va a haber tiempo- lo del aeropuerto de Texcoco, que estaban estimando un costo de 300 mil millones, y se iba a desaparecer el actual aeropuerto y el aeropuerto de Santa Lucía, 300 mil e iba a dejar de funcionar el actual aeropuerto y el de Santa Lucía por interferencia aérea. Inventaron eso porque querían quedarse con los terrenos o querían negociar con los terrenos pues, no quedarse, hacer un Santa Fe en las 600 hectáreas del actual aeropuerto.",0.5920489176112932,101,17,08,2020
PRESIDENTE ANDRES MANUEL LOPEZ OBRADOR,"Entonces, de 300 mil estimados, porque esto se parecía mucho al Tren Toluca-Ciudad de México, nos va a significar una inversión, nos va a costar 70 mil, es decir, 230 mil millones menos de ahorro. Entonces, cuando terminemos, vamos a hacer las cuentas, porque cómo nos atacaron con eso.",0.042990498232024076,49,17,08,2020
PRESIDENTE ANDRES MANUEL LOPEZ OBRADOR,"Pero qué sabio es el pueblo, en la consulta la gente dijo: ‘No’, y nos quitó un peso de encima, nos salvó el pueblo.",0.08821664605820688,24,17,08,2020
PRESIDENTE ANDRES MANUEL LOPEZ OBRADOR,"Imagínense si le hubiésemos seguido con Texcoco, si es un lago. Nos íbamos a llevar -y ese era el plan- todo el sexenio construyendo, iba a estar hasta el 2025.",0.022365522328869875,30,17,08,2020
PRESIDENTE ANDRES MANUEL LOPEZ OBRADOR,"Entonces, sí es importante, para no equivocarnos, preguntar al pueblo, lo mejor es preguntar y el método democrático es lo mejor que hay, la consulta, cada vez que se pueda.",0.49336582756983316,30,17,08,2020
PREGUNTA," Presidente, qué tal. Buen día. Carlos Guzmán, de ABA Noticias.",0.35683615576374994,10,17,08,2020
PREGUNTA,"Dos preguntas para usted y una para el titular de Profeco. De inicio, en este caso del aeropuerto de Texcoco ¿ya tiene listo el proyecto para trabajar este parque se va a construir en esas instalaciones?",0.0036893991314761575,36,17,08,2020
PREGUNTA,"Y la segunda, si nos puede hablar un poquito del mensaje de ayer. Usted mencionaba la cuestión de la vacuna, la Fundación Slim, en este caso Arturo Elías, mencionaba que se va a comenzar a fabricar la vacuna desde ya en México para evitar la cuestión de los tiempos.",0.1664295904866459,49,17,08,2020
PREGUNTA,"Se van a arriesgar, en este caso la Fundación Slim va a poner el dinero en dado caso de que se tenga ya autorizada y se apruebe por Cofepris la vacuna, se tengan inmediatamente las dosis para vacunar. Usted mencionaba que se iba a esperar el tiempo necesario para se propusiese. ¿Nos puede aclarar este punto?",0.0017987562512301427,56,17,08,2020
PREGUNTA,"Y la segunda… bueno, obviamente esta es la segunda pregunta, y la primera la cuestión del aeropuerto, y una más para el procurador.",0.18641266975814544,23,17,08,2020
PRESIDENTE ANDRES MANUEL LOPEZ OBRADOR," Bueno, lo de la vacuna es una buena noticia porque ya hay certidumbre para enfrentar esta pandemia que tanto daño ha causado.",0.1709203164554496,22,17,08,2020
PRESIDENTE ANDRES MANUEL LOPEZ OBRADOR,"Entonces el que se tenga esta investigación ya muy avanzada… Es una vacuna que está en su última etapa, en su última fase, se está terminando de experimentar y piensan tener los resultados definitivos a principios de noviembre para poner a consideración esos resultados de la Cofepris.",0.5023122338773401,47,17,08,2020
PRESIDENTE ANDRES MANUEL LOPEZ OBRADOR,"Nosotros estamos preparándonos para que en la Cofepris no haya demoras, no haya obstáculos burocráticos, cuidando la calidad, que no se pierda tiempo, que se hagan las dos cosas a la vez: que nos cercioremos de que es efectiva la vacuna y que lo hagamos rápido, lo más pronto posible, para que comience su fabricación tanto en Argentina como en México, que es el acuerdo que se tiene.",0.5543106802534218,68,17,08,2020
PRESIDENTE ANDRES MANUEL LOPEZ OBRADOR,"Es muy importante la participación de la Fundación Slim porque aporta un capital de riesgo para llevar a cabo todo el proceso. Nos consultaron sobre esta participación, si veíamos nosotros viable que ellos participaran, dijimos que sí, tengo entendido que van a aportar recursos y es capital de riesgo. Entonces, sí está en proceso esta vacuna, lo cual es muy importante.",0.5135807238896325,61,17,08,2020
PRESIDENTE ANDRES MANUEL LOPEZ OBRADOR,"También estamos nosotros inscritos en otros protocolos de investigación, dos vacunas que se están estudiando en China, una en Francia, otra en Estados Unidos. Se continúa con la comunicación en el caso de Rusia sobre la vacuna que ellos están dando a conocer y que ya van a aplicar pronto.",0.06338189244419043,50,17,08,2020
PRESIDENTE ANDRES MANUEL LOPEZ OBRADOR,"Yo les digo algo que aplica para otras cosas, pero fundamentalmente que tiene que ver con la salud del pueblo de México: en este asunto tan importante no debe de haber ideologías; hay, desde luego, ideas, pero la salud es primero.",0.12080356148270124,41,17,08,2020
PRESIDENTE ANDRES MANUEL LOPEZ OBRADOR,"Si en Rusia, en China, se tiene primero la vacuna y se demuestra que es eficaz para salvar vidas, de inmediato establecemos comunicación. Yo hablaría personalmente con el presidente de China, con el presidente Putin, para que se tenga la vacuna; y lo mismo en el caso de Estados Unidos, que tenemos muy buena relación con el presidente Trump. O sea, lo primero que se tenga.",0.5179790618558161,66,17,08,2020
PRESIDENTE ANDRES MANUEL LOPEZ OBRADOR,"Y México afortunadamente tiene prestigio, tiene respaldo, tiene apoyo de todas las naciones; en el concierto de las naciones, México tiene un sitio especial, que agradecemos mucho, le tienen mucho respeto y consideración a México.",0.7338541648706,35,17,08,2020
PREGUNTA," Rápidamente, en el caso de Rusia, de Putin, ya tiene su vacuna patentada, incluso ya la están aplicando. ¿Se hablaría por parte de usted con el presidente Putin al respecto?",0.09372440317127863,30,17,08,2020
PRESIDENTE ANDRES MANUEL LOPEZ OBRADOR," Sí, si vemos que da resultados, que es eficaz, establecemos comunicación; y si hay disponibilidad, adelante.",0.184012218642063,16,17,08,2020
PRESIDENTE ANDRES MANUEL LOPEZ OBRADOR,"Y para que no quede duda de la importancia que tiene para nosotros, yo sería el primero en dejarme vacunar, porque me importa mucho. Pero tenemos que conocer bien lo que está sucediendo y garantizar que sea algo efectivo y que este también al alcance de toda la gente.",0.5123870203904407,49,17,08,2020
PRESIDENTE ANDRES MANUEL LOPEZ OBRADOR,"Nosotros, yo les comentaba, tenemos un fondo especial para que al tener la vacuna haya una campaña de vacunación nacional, se aplique de manera universal y sea gratuita, porque tenemos los recursos para eso porque no hay corrupción, porque tenemos finanzas públicas sanas, porque no hay lujos en el gobierno, porque no hay derroche.",0.14118487539447858,54,17,08,2020
PRESIDENTE ANDRES MANUEL LOPEZ OBRADOR,"Estos que cuestionaban lo de la austeridad… Imagínense si en una crisis sanitaria, que también es crisis económica, endeudamos al país, sigue la robadera que había y siguen los gastos superfluos, los lujos, pues entonces no se tendrían fondos.",0.003089823243846376,39,17,08,2020
PRESIDENTE ANDRES MANUEL LOPEZ OBRADOR,"Pero si hoy, porque está escuchando o le van a traducir, le van a informar, al presidente de China, al presidente de Rusia, al presidente de Estados Unidos, llaman y dicen: ‘Sí ayudamos, pero se requieren tantos recursos, se necesitan 25 mil millones de pesos para asegurar la primera compra, y se necesitan en esta semana’, en esta semana están los 25 mil millones.",0.07572214171032311,64,17,08,2020
PRESIDENTE ANDRES MANUEL LOPEZ OBRADOR,"O sea, no tenemos problemas de recursos de caja afortunadamente y eso es por la confianza de la gente, de todos, que han seguido pagando sus impuestos a pesar de la situación tan difícil, no se nos ha caído la recaudación, tenemos finanzas sanas.",0.0359982970383292,44,17,08,2020
PREGUNTA," En el caso del aeropuerto de Texcoco, del plan que hay para rehabilitar esta zona.",0.040368656321480845,15,17,08,2020
PRESIDENTE ANDRES MANUEL LOPEZ OBRADOR," Yo creo que esta semana… Bueno, esta no se va a poder porque vamos a estar sólo mañana aquí, vamos a hacer una gira, vamos a estar el miércoles, se va a informar desde Querétaro, el jueves desde Zacatecas y el viernes desde Tamaulipas… Perdón, Aguascalientes, Aguascalientes.",0.5521598901792846,47,17,08,2020
