Participante,Texto,Sentimiento,Palabras,Dia,Mes,Anio
PRESIDENTE ANDRES MANUEL LOPEZ OBRADOR, Buenos días.,0.0,2,26,08,2022
PRESIDENTE ANDRES MANUEL LOPEZ OBRADOR,"Bueno, pues vamos a finalizar la semana con una explicación, lo más breve, pero con la sustancia, con lo fundamental del caso de Ayotzinapa. Por eso Alejandro Encinas nos va a dar una explicación de la comisión, para que ustedes y toda la gente tenga conocimiento del caso. Entonces, Alejandro, adelante.",0.0,51,26,08,2022
ALEJANDRO ENCINAS RODRIGUEZ," Con su autorización, señor presidente.",0.0,5,26,08,2022
ALEJANDRO ENCINAS RODRIGUEZ,Muy buenos días tengan todas y todos ustedes.,0.0,8,26,08,2022
ALEJANDRO ENCINAS RODRIGUEZ,"Como lo ha señalado el señor presidente de la República, vamos a hacer una breve síntesis del informe que presentamos el jueves de la semana pasada a los papás, a las mamás de los estudiantes normalistas desaparecidos en Ayotzinapa, haciendo una recomendación a todo el público, a la opinión pública en general para que se lea el informe. El informe y sus anexos son públicos, se encuentran disponibles en la página de la Secretaría de Gobernación, de la Comisión por la Verdad y el Acceso a la Justicia en el caso Ayotizinapa, en las páginas del gobierno federal.",0.0,98,26,08,2022
ALEJANDRO ENCINAS RODRIGUEZ,"Y creo que valdría mucho la pena que este ejercicio se hiciera porque muchos de los comentarios, opiniones, observaciones que se han hecho al respecto pues dan cuenta de que afirmaciones o críticas que se plantean muestran que el documento no se ha leído.",0.0,44,26,08,2022
ALEJANDRO ENCINAS RODRIGUEZ,"Como lo ha señalado el señor presidente de la República, el informe presenta los resultados de la reconstrucción y análisis de los acontecimientos que se presentaron los días 26 y 27 de septiembre del 2014 en la ciudad de Iguala en dos momentos:",0.0,43,26,08,2022
ALEJANDRO ENCINAS RODRIGUEZ,"El primero es el análisis de los antecedentes, el contexto y los hechos, personas y autoridades que participaron en la desaparición de los estudiantes y las repercusiones que se tuvieron en las semanas posteriores.",0.0,34,26,08,2022
ALEJANDRO ENCINAS RODRIGUEZ,Y una segunda parte de este informe es el análisis de la intervención de las autoridades de distintos órdenes de gobierno en el encubrimiento de los hechos en esta trágica noche.,0.0,31,26,08,2022
ALEJANDRO ENCINAS RODRIGUEZ,"Una de las informaciones que se han hecho frecuentemente al informe es que está es una posición política del gobierno. Y nosotros queremos destacar que este informe es el resultado de un proceso de investigación y de análisis técnico y científico, que contó con el apoyo y asesoría de un comité científico asesor y de un grupo interdisciplinario integrado por personas de diversas instituciones públicas convencidas de que la ciencia y la tecnología deben de estar al servicio de la verdad.",0.0,81,26,08,2022
ALEJANDRO ENCINAS RODRIGUEZ,"Pero sí, también hay un contenido político, pues esclarecer un crimen, y más un crimen de Estado, además de que es una responsabilidad del gobierno, es un asunto que hemos encarado con convicción y con voluntad política para ir al fondo de los hechos.",0.0,44,26,08,2022
ALEJANDRO ENCINAS RODRIGUEZ,"Hay quien sostiene que el informe de basa en una sola fuente de información, lo cual tampoco se apega a la realidad. Hay 13 fuentes de información básicas que es toda la información y documentación que nos han proporcionado la Secretaría de Gobernación, la Defensa Nacional, la Secretaría de Marina, la Secretaría de Seguridad y Protección Ciudadana, el Centro Nacional de Inteligencia, la Guardia Nacional, la Procuraduría y fiscalía del estado de Guerrero, la Procuraduría y Fiscalía General de la República, los informes que ha elaborado el GEI, el Centro GEO de Conacyt, la Comisión Nacional de Derechos Humanos, incluso el Centro de Derechos Humanos Miguel Agustín Pro Juárez y también de manera destacada los testimonios y la colaboración de 115 testimonios de personas que conocen o estuvieron involucradas en los hechos.",0.0,132,26,08,2022
ALEJANDRO ENCINAS RODRIGUEZ,"Dicen algunos de los críticos que el informe no dice nada nuevo, que es lo mismo de la verdad histórica, lo cual es absolutamente falso. La verdad histórica se sustenta en que los estudiantes acudieron a Iguala a boicotear el informe de la presidenta del DIF en ese municipio, lo cual es falso, porque la misión de los estudiantes, el objetivo, era tomar camiones y su llegada a Iguala fue en el momento en que ya había concluido este evento e incluso el festejo organizado en la plaza central de Iguala había concluido.",0.0,93,26,08,2022
ALEJANDRO ENCINAS RODRIGUEZ,"Se dice que tras los enfrentamientos de los estudiantes con los policías municipales —enfrentamientos que no existieron porque fueron agresiones de los policías municipales a los estudiantes— la policía de Iguala entregó al grupo delictivo de Guerreros Unidos a los estudiantes, quienes fueron ultimados e incinerados en el basurero de Cocula y sus restos depositados en bolsas de plástico que fueron vertidas en el río San Juan.",0.0,67,26,08,2022
ALEJANDRO ENCINAS RODRIGUEZ,"Como lo vamos a demostrar, en ningún momento los estudiantes estuvieron juntos. Hubo un operativo especial que dispersó a los estudiantes en distintas regiones del perímetro de Iguala.",0.0,28,26,08,2022
ALEJANDRO ENCINAS RODRIGUEZ,"Y sí hubo actos de agresión en donde el grupo de Guerreros Unidos, en coordinación y complicidad con autoridades y fuerzas de seguridad del estado, municipal y federal, ultimaron y desaparecieron a los estudiantes.",0.0,34,26,08,2022
ALEJANDRO ENCINAS RODRIGUEZ,"Y ahí hay una diferencia sustancial y de fondo: que la verdad histórica se sustentó en las declaraciones obtenidas mediante tortura a las personas detenidas, en la fabricación de pruebas y la manipulación de la escena del crimen. Nosotros no torturamos absolutamente a nadie",0.0,44,26,08,2022
ALEJANDRO ENCINAS RODRIGUEZ,"El análisis que hemos realizado se sustenta en la evaluación de 87 millones de registros telefónicos que fueron depurados para ubicar 84 mil registros telefónicos claves, 17 números telefónicos que han sido analizados rigurosamente a lo largo de los últimos dos años, que nos permitió hacer un mapeo y geolocalización de 116 números telefónicos y al mismo tiempo complementar esta información con los 41 mil 168 documentos que fueron aportados por la Administración Pública Federal y otros órganos autónomos, como la Comisión Nacional de Derechos Humanos, las intervenciones de las llamadas telefónicas que la DEA realizó en ese país a las actividades de Guerreros Unidos en el tráfico de drogas desde Chicago, las intervenciones telefónicas que obran en manos de la Seido, de la Fiscalía General de la República, el análisis de las llamadas de la empresa Proyectos y Diseños VME S.A. de C.V., que es la empresa que la administración anterior prestaba servicios del programa Pegasus a la Secretaría de la Defensa Nacional y otras dependencias; en el análisis de 90 horas de videos de sobrevuelos entregados por Semar de la intervención de distintas autoridades en el basurero de Cocula, en 50 videos que el Centro Nacional de Inteligencia entregó a la Fiscalía General de la República sobre las torturas de que fueron objeto por funcionarios públicos las personas detenidas.",0.0,221,26,08,2022
ALEJANDRO ENCINAS RODRIGUEZ,"Una muy importante, la obtención de 467 capturas de pantalla cinco números telefónicos, que nos permitió ubicar 37 conversaciones entre distintos actores y 36 actores más que están relacionados con las mismas, y por supuesto en el trabajo de campo, en la reconstrucción de los hechos y en la búsqueda de los muchachos que fueron desaparecidos.",0.0,56,26,08,2022
ALEJANDRO ENCINAS RODRIGUEZ,"Este tipo de ejercicios nos permitió hacer, en primer lugar, la evaluación de las llamadas entre los grupos de sicarios. Este es el ejemplo del diagrama de las llamadas realizadas entre las 22:00 horas del día 26 de septiembre y las 6:00 horas del día 27, donde se ve con toda claridad cómo se fue tejiendo la red de complicidades y de operación del grupo delictivo con distintas autoridades para la operación de la persecución, violencia, detención, desaparición de los muchachos.",0.0,81,26,08,2022
ALEJANDRO ENCINAS RODRIGUEZ,"A partir de este tipo de trabajos, pudimos establecer la red de vínculos que se presentó en el caso de Ayotzinapa. En este diagrama en particular, la interrelación y las acciones de Guerreros Unidos con las policías municipales de Cocula, de Iguala y de otros municipios, particularmente Tepecoacuilco y Huitzuco. Un dato diferenciado es el grupo de los bélicos que formaba parte de la policía de Iguala.",0.0,67,26,08,2022
ALEJANDRO ENCINAS RODRIGUEZ,"Este también es el análisis que corresponde a las 22:00 horas del 26 de septiembre, a las 6:00 horas del día 27, lo que también nos llevó a ubicar con mayor precisión en función de la ubicación de las tres redes telefónicas la existencia de seis núcleos combinados de halcones, sicarios, policías municipales y otras autoridades en distintos puntos.",0.0,59,26,08,2022
ALEJANDRO ENCINAS RODRIGUEZ,"Aquí vemos cómo se articularon en las regiones; por ejemplo, en el centro de Iguala, el camino hacia la salida de Taxco y de Cocula, y a Santa Teresa, el camino en el puente del palacio de justicia y en otros lugares, con lo que se demuestra con toda certeza de que en ningún momento los estudiantes estuvieron juntos después de su salida de la terminal de camiones de Iguala en los cinco autobuses que tomaron rutas distintas, de cómo fueron dispersados después de que la intervención de distintas policías municipales y donde, evidentemente, se desmorona esa idea de que todos fueron entregados a Guerreros Unidos y fueron todos trasladados al basurero de Cocula.",0.0,114,26,08,2022
ALEJANDRO ENCINAS RODRIGUEZ,"Y un dato adicional que es muy importante: de manera muy puntual es el análisis de vínculos que hicimos a partir de los mensajes de texto obtenidos de las capturas de pantalla, las más de 426, en donde con toda claridad se pueden observar los vínculos y las relaciones, ya no solamente de Guerreros Unidos con las policías municipales, sino también con autoridades civiles, con población civil y con algunos elementos del 27 Batallón de Infantería de Iguala, en el estado de Guerrero.",0.0,83,26,08,2022
ALEJANDRO ENCINAS RODRIGUEZ,"A este trabajo de reconstrucción de los hechos, que se fue además a hacer los recorridos con los sobrevivientes, con testigos, a todos los sitios, desde la salida de la Escuela Normal de Ayotizinapa, en el municipio de Tixtla, hasta el momento de desaparición, se suma todo el trabajo de campo y búsqueda que hemos venido realizando.",0.0,57,26,08,2022
ALEJANDRO ENCINAS RODRIGUEZ,"Al día de hoy, 26 de agosto —hace un rato veía, es un dato distinto al que viene al informe— hemos realizado 105 acciones de búsqueda de campo, que implica 711 días de búsqueda de jornadas de trabajo en siete municipios de Guerrero, donde también esto no es un asunto de orden político, se hace también con el avance tecnológico más importante al que hemos tenido acceso, donde además más de 50 personas del gobierno federal y la Fiscalía General de la República realizan estas actividades con apoyo de la tecnología líder para la exploración del territorio: georradares, drones, cámaras térmicas espectrales, binomios caninos, modelos matemáticos para la ubicación de concentraciones de hidrogeno, que es algo que no se hace prácticamente en ningún lado del mundo, maquinaria y equipo diverso.",0.0,130,26,08,2022
ALEJANDRO ENCINAS RODRIGUEZ,"Todo ello nos ha permitido avanzar, no solamente en el análisis de contexto, que es muy importante señalar en qué términos se da esta situación de la desaparición, sino también el cómo se presentó el desenlace de los hechos y quién participó,",0.0,42,26,08,2022
ALEJANDRO ENCINAS RODRIGUEZ,"En el caso del análisis de contexto, para nosotros es muy importante destacar cuatro elementos:",0.0,15,26,08,2022
ALEJANDRO ENCINAS RODRIGUEZ,"El primero, cómo la desaparición y el homicidio del dirigente social en Iguala, Arturo Hernández Cardona el 3 de junio de 2013 motivó la movilización de los estudiantes de la Normal de Ayotizinapa, que tomaron las oficinas del ayuntamiento de Iguala e incendiaron documentación en demanda de la presentación de Hernández Cardona, quien finalmente apareció asesinado.",0.0,56,26,08,2022
ALEJANDRO ENCINAS RODRIGUEZ,"Y ese homicidio se le atribuye al entonces presidente municipal José Luis Abarca, que está detenido justamente por este delito, no por el delito de desaparición, sino por el homicidio de Hernández Cardona.",0.0,33,26,08,2022
ALEJANDRO ENCINAS RODRIGUEZ,"Y a partir de ese momento los estudiantes fueron amenazados por el alcalde y por Guerreros Unidos, de que no regresaran a esta ciudad; si no, se iban a atender a las consecuencias.",0.0,33,26,08,2022
ALEJANDRO ENCINAS RODRIGUEZ,"Esta situación se da también en el contexto de una disputa por la plaza para el trasiego de drogas entre el grupo de los Rojos y el grupo de Guerreros Unidos, y donde hay un antecedente importante que uno debe de tomar en cuenta: es cómo el 10 de junio del 2014 en un retén del Ejército Mexicano la Procuraduría General de la República decomisó 107 kilógramos de heroína pura, de los cuales los elementos de la Procuraduría General de la República que hicieron este operativo sólo entregaron 24 kilógramos.",0.0,90,26,08,2022
ALEJANDRO ENCINAS RODRIGUEZ,"Este dato está acreditado, incluso en un documento de la Secretaría de Gobernación que da cuenta de que la disputa por el territorio también era de disputa por el control de la droga y el robo entre estos grupos, asociado a la protección de autoridades, particularmente de la procuraduría.",0.0,49,26,08,2022
ALEJANDRO ENCINAS RODRIGUEZ,"Y el hecho de la presencia de los estudiantes en Iguala se acredita a partir de la resolución que se adoptó en la asamblea de la Federación de Estudiantes Campesinos Socialistas de México, que se celebró en el estado de Morelos en agosto del 2014, donde se resolvió que la normal de Ayotzinapa fuera sede de delegaciones de otras escuelas normales del país para desde ahí trasladarse a las movilizaciones con motivo del 2 de octubre a la Ciudad de México.",0.0,81,26,08,2022
ALEJANDRO ENCINAS RODRIGUEZ,"Con toda esta información avanzamos en todo el proceso de reconstrucción de los hechos, desde la salida de los estudiantes de la normal a Chilpancingo y Tierra Colorada donde la policía federal, la policía estatal, les impidieron la toma de camiones, motivo por el cual se trasladaron posteriormente al municipio de Iguala para tomar los camiones que no pudieron tomar en estos municipios.",0.0,63,26,08,2022
ALEJANDRO ENCINAS RODRIGUEZ,"El análisis del traslado y llegada de los estudiantes a Iguala, a Rancho del Cura, a la caseta de cobro en la salida a Cuernavaca y posteriormente a la central de autobuses, todo el trabajo del seguimiento de la salida a la central de autobuses el inicio de la violencia y el momento del incremento de la violencia y la orden de desaparecer a los estudiantes.",0.0,66,26,08,2022
ALEJANDRO ENCINAS RODRIGUEZ,"Con todos estos elementos de la reconstrucción, que vienen desarrollados de manera muy puntual en el informe minuto a minuto, se ha llevado la reconstrucción desde la salida hasta la desaparición, hemos hecho un análisis de modo, tiempo, lugar y circunstancia de la intervención de diferentes actores e instituciones, y hemos podido determinar la forma en que se articuló el grupo delictivo de Guerreros Unidos con autoridades de distintos órdenes del gobierno en la desaparición de los estudiantes.",0.0,78,26,08,2022
ALEJANDRO ENCINAS RODRIGUEZ,"Hemos acreditado cómo en todo momento las autoridades hicieron el seguimiento de las acciones de los estudiantes, quienes monitoreados desde días previos por las movilizaciones que se iban a realizar el 2 de octubre en la Ciudad de México y cómo estuvieron al tanto de su salida de la escuela normal, su llegada a Iguala y de los hechos de persecución y violencia que precedieron a la desaparición, lo que evidentemente acredita, no solamente responsabilidades por la acción u omisión o negligencia, sino el involucramiento de autoridades, de agentes del Estado en la desaparición de los normalistas.",0.0,97,26,08,2022
ALEJANDRO ENCINAS RODRIGUEZ,"La desaparición debió de haberse evitado. Las omisiones de la autoridad, sin lugar a dudas, permitieron esta desaparición.",0.0,18,26,08,2022
ALEJANDRO ENCINAS RODRIGUEZ,"Y hemos puesto en el informe un dato muy importante: la existencia de un estudiante normalista miembro del Ejército, informante de las Fuerzas Armadas, que desapareció junto con los estudiantes y en ningún momento sus mandos superiores activaron el mecanismo de búsqueda que establece el protocolo de búsqueda de la Secretaría de la Defensa Nacional, que, de haberse aplicado este protocolo para garantizar la integridad física y evitar la desaparición del soldado Patolzin, evidentemente hubiera evitado la desaparición de todos los muchachos.",0.0,82,26,08,2022
ALEJANDRO ENCINAS RODRIGUEZ,"El segundo elemento del que hemos hecho el análisis tiene que ver con la verdad histórica, en qué pasó después de la desaparición y cómo hubo una actuación de las autoridades, en una acción concertada del aparato del poder, desde el más alto nivel del gobierno en el país, que ocultó los hechos, alteró las escenas del crimen, escondió los vínculos de autoridades con el grupo delictivo y su participación con agentes del Estado, generando no solamente vicios, sino deficiencias que obstaculizaron el acceso al derecho y a la verdad y la justicia.",0.0,93,26,08,2022
ALEJANDRO ENCINAS RODRIGUEZ,"Nosotros hemos definido esta actuación como un crimen de Estado porque no solamente se trata de la desaparición, la pérdida de vida de los estudiantes, en donde se conjuga fundamentalmente cuatro delitos graves y violaciones a los derechos humanos en materia de desaparición forzada, como es la privación de la libertad, el homicidio, la participación e involucramiento de agentes estatales o grupos de personas que actúan en apoyo y con consentimiento del Estado, y particularmente lo que es la negativa, ocultamiento y manipulación de información e investigaciones por parte de las autoridades gubernamentales que propició la impunidad de los perpetradores y de los encubridores de estos hechos.",0.0,107,26,08,2022
ALEJANDRO ENCINAS RODRIGUEZ,"En un breve cuadro comparativo entre la verdad histórica del 2014 y el informe de los avances que ha presentado la presidencia de la Comisión de la Verdad vemos con toda claridad las diferencias sustantivas, que son muchas más, entre ambos análisis y conclusiones:",0.0,44,26,08,2022
ALEJANDRO ENCINAS RODRIGUEZ,"Uno, la verdad histórica dice que los estudiantes iban a boicotear el informe de la presidenta del DIF. Eso es absolutamente falso. Ya lo decía yo, iban a la toma de camiones para la marcha del 2 de octubre, pero incluso tenemos el testigo de una persona protegida, Karla, que hace mención de que a ella en particular se le solicitó que tomara fotografías de todos los estudiantes, ya que se creía que entre ellos venían personas pertenecientes al grupo delictivo de los Rojos.",0.0,84,26,08,2022
ALEJANDRO ENCINAS RODRIGUEZ,"La verdad histórica dice que la desaparición fue un hecho fortuito. Es absolutamente falso, ya que todas las autoridades tuvieron conocimiento de la movilización de los muchachos desde día antes de la salida de la normal hasta su desaparición.",0.0,39,26,08,2022
ALEJANDRO ENCINAS RODRIGUEZ,"La verdad histórica dice que los 43 estudiantes fueron llevados a la comandancia municipal de Iguala. Eso es falso. Nunca estuvieron juntos, solamente fueron llevados a la comandancia de Iguala los alumnos que iban en el autobús 1564.",0.0,38,26,08,2022
ALEJANDRO ENCINAS RODRIGUEZ,"Se dice en la verdad histórica que los 43 alumnos fueron sustraídos de la comandancia y entregados a las policías de Iguala y Cocula, quien los entregaron en Lomas de Coyotes a Guerreros Unidos. Esto sólo sucedió con los alumnos que iban en el autobús 1568, ya que otros estudiantes fueron conducidos a Huitzuco y a otros puntos, otros sitios a los que nos vamos a referir.",0.0,67,26,08,2022
ALEJANDRO ENCINAS RODRIGUEZ,Se señala que la desaparición la ordenó ‘el Gil’. Tenemos evidencia de la coalición de autoridades donde A1 y líderes de Guerreros Unidos ordenaron recuperar la mercancía y darles su merecido y un escarmiento ejemplar a los estudiantes.,0.0,38,26,08,2022
ALEJANDRO ENCINAS RODRIGUEZ,"La verdad histórica dice que los 43 estudiantes fueron detenidos, ejecutados y quemados en el basurero de Cocula y esparcidos sus restos en el río San Juan, lo cual no es cierto, porque en muchos de los casos era tal la magnitud de la movilización de sicarios y el número de muchachos que pretendían desaparecer que se reubicaron en distintos puntos, donde están los testimonios: es el río Balsas, es el pozo de Pueblo Viejo, la mina hacia Taxco.",0.0,79,26,08,2022
ALEJANDRO ENCINAS RODRIGUEZ,"Y mandaron cocinar a 10 de los estudiantes e incluso hay la información, corroborada también con llamadas al teléfono de emergencia 089, donde se acredita que presuntamente seis de los estudiantes de los 43 desaparecidos estuvieron retenidos durante varios días y con vida en lo que llaman ‘la bodega vieja’ y de ahí fueron entregados al coronel, como ven en los testimonios, quien se hizo cargo de estos muchachos.",0.0,69,26,08,2022
ALEJANDRO ENCINAS RODRIGUEZ,"Al mismo tiempo, como se ha demostrado, que fueron… no fueron arrojadas las cenizas al río Cocula, queremos señalar que hemos encontrado los restos de tres estudiantes que fueron plenamente identificados en los estudios de la Universidad de Innsbruck, en el laboratorio de identificación genética, y no fueron encontrados en el río San Juan, sino en distintos puntos del ejido de Cocula, y que nos permitió tener ya la identificación y la certeza de tres de ellos.",0.0,77,26,08,2022
ALEJANDRO ENCINAS RODRIGUEZ,"Ya dicen que no se contó con la presencia de elementos de las Fuerzas Armadas, ya señalamos la presencia de Julio Cesar López Patolzin, normalista informante de la Sedena; pero también hay testimonios de la intervención, no solamente en los recorridos, en la conferencia de prensa, en el hospital ‘Cristina’, en otros sitios como el puente del Palacio de Justicia, de los elementos de las Fuerzas Armadas, sino que participaron en otras acciones.",0.0,73,26,08,2022
ALEJANDRO ENCINAS RODRIGUEZ,"Dicen que la desaparición de los estudiantes fue un asunto local. Eso es totalmente absurdo. En estos participaron diversas instituciones, no fue un hecho fortuito. Hubo intervención de autoridades del estado en la desaparición.",0.0,34,26,08,2022
ALEJANDRO ENCINAS RODRIGUEZ,"Y una cuestión que es muy importante es que los testimonios que dan fundamento a la verdad histórica fueron obtenidos por tortura, y tan es así que el juez de Tamaulipas liberó a 77 de los presuntos perpetradores, porque fueron torturados.",0.0,41,26,08,2022
ALEJANDRO ENCINAS RODRIGUEZ,"Nosotros hemos buscado romper el pacto de silencio, hemos ofrecido mecanismos de colaboración eficaz y hemos tenido información sin violar los derechos humanos de absolutamente ninguna persona.",0.0,27,26,08,2022
ALEJANDRO ENCINAS RODRIGUEZ,"Y hemos favorecido la cooperación internacional. Con la verdad histórica, después del segundo informe del GEI, el jefe prácticamente expulsado del país, nosotros hemos invitado y estamos convencidos de la importancia y cooperación del trabajo del GEI ahora, no solamente el apoyo a los padres, sino como coadyuvante de la Fiscalía General de la República.",0.0,55,26,08,2022
ALEJANDRO ENCINAS RODRIGUEZ,"Y también la gran diferencia es que con la verdad histórica se pretendió cerrar la investigación y, como lo hemos señalado, esta investigación continúa abierta, ahí continuamos con la búsqueda el día de hoy en dos puntos del estado de Guerrero, y seguirá en manos de la fiscalía y de la comisión la continuidad de la investigación.",0.0,57,26,08,2022
ALEJANDRO ENCINAS RODRIGUEZ,"Cierro rápido con las conclusiones, que ya las habíamos hecho públicas, señor presidente:",0.0,13,26,08,2022
ALEJANDRO ENCINAS RODRIGUEZ,El hecho de que la desaparición de los estudiantes constituyó un crimen de Estado en el que concurrieron integrantes de Guerreros Unidos y agentes de diversas instituciones del Estado mexicano.,0.0,30,26,08,2022
ALEJANDRO ENCINAS RODRIGUEZ,"Que autoridades federales y estatales del más alto nivel fueron omisas y negligentes, existiendo elementos de presunción respecto a alterar hechos y circunstancias para establecer una conclusión ajena a la verdad de los hechos.",0.0,34,26,08,2022
ALEJANDRO ENCINAS RODRIGUEZ,"Que en todo momento las autoridades federales, estatales y municipales tuvieron conocimiento de la movilización de los estudiantes y que su omisión no solamente llevó a la desaparición de los mismos, sino a la muerte de por lo menos otras seis personas esos días.",0.0,44,26,08,2022
ALEJANDRO ENCINAS RODRIGUEZ,"Que son tanto el ataque sobre el equipo de fútbol Los Avispones, los taxistas y los muchachos que perecieron en la zona de periférico en Iguala.",0.0,26,26,08,2022
ALEJANDRO ENCINAS RODRIGUEZ,Que en ningún momento la presencia de los estudiantes obedeció a la intención de boicotear el acto de la presidenta municipal del DIF en Iguala.,0.0,25,26,08,2022
