Participante,Texto,Sentimiento,Palabras,Dia,Mes,Anio
VOZ DE MUJER," Tren Maya, reporte de avances. Semana 19 de 157.",0.32823650481604266,9,28,12,2020
VOZ DE MUJER,"En el tramo 1 avanzamos en el desmontaje de la vía antigua, la dictaminación arqueológica del INAH y se avanza con trabajos de terracería.",0.32823650481604266,24,28,12,2020
VOZ DE MUJER,"En el tramo 2 se avanza con trabajos de desmonte, desmontaje de vía y terracería en ocho frentes de obra.",0.32823650481604266,20,28,12,2020
VOZ DE MUJER,En el tramo 3 continuamos con la elaboración de subrasante y las actividades de corte y terraplén.,0.32823650481604266,17,28,12,2020
VOZ DE MUJER,"En el tramo 4 seguimos con las actividades preliminares, como el desmonte y despalme.",0.32823650481604266,14,28,12,2020
VOZ DE MUJER,En todos los tramos se prepara el plan de incremento de producción trimestral.,0.32823650481604266,13,28,12,2020
VOZ DE MUJER,"El Tren Maya activó una estrategia de conservación, cuyo objetivo es contribuir de forma histórica a la repoblación de jaguares, el proyecto contempla siete unidades GATO a lo largo de los mil 500 kilómetros de recorrido del tren; cada unidad será un centro de rehabilitación, protección y rescate de especies endémicas de la región. Este proyecto será realizado de la mano con la Fundación Jaguares en la Selva.",0.32823650481604266,68,28,12,2020
VOZ DE MUJER,"En cuatro años, proyectamos que no habrá más ejemplares de vida silvestre en las unidades, sino que se convertirán en centros de interpretación de vida silvestre y capacitación comunitaria. El Tren Maya contribuye a la conservación de la fauna del sureste.",0.32823650481604266,41,28,12,2020
VOZ DE MUJER,El Tren Maya avanza.,0.32823650481604266,4,28,12,2020
