Participante,Texto,Sentimiento,Palabras,Dia,Mes,Anio
CARLOS MONTESINOS,": Buenos días, señores presidentes.",0.541333260777616,5,30,01,2019
CARLOS MONTESINOS,"Dos de las principales instituciones bancarias que operan en México, Santander y BBVA Bancomer, son de capital español y cuentan con beneficios que, si bien están contemplados por la ley, no reflejan un trato de igualdad hacia el consumidor mexicano, toda vez que un porcentaje importante de sus ingresos parten de este mercado.",0.541333260777616,53,30,01,2019
CARLOS MONTESINOS,"Hay una iniciativa por parte del Movimiento de Regeneración Nacional para modificar esos beneficios, y aunque fue recibida de manera negativa en un inicio, hace unos días se reiteró la importancia de esta iniciativa para con el bienestar del pueblo de México.",0.541333260777616,42,30,01,2019
CARLOS MONTESINOS,"Entonces, al presidente López Obrador le pregunto: Usted ya dijo que no contempla cambios al marco jurídico financiero en la primera mitad de su sexenio, pero en caso de que los senadores sigan por su cuenta para esta iniciativa, ¿qué tanto podría intervenir usted para mantener el capital español aquí, en México? Ya mencionaron la importancia que tiene, incluso, si podría llegar a vetar la iniciativa.",0.541333260777616,66,30,01,2019
CARLOS MONTESINOS,"Y al presidente Sánchez: ¿Cuál es la perspectiva de su gobierno ante este cambio latente que podría ocurrir, ya que representaría un impacto directo a dos firmas muy importantes para la economía de España, incluso, afectando su operación internacional?",0.541333260777616,39,30,01,2019
CARLOS MONTESINOS,Muchas gracias,0.541333260777616,2,30,01,2019
