Participante,Texto,Sentimiento,Palabras,Dia,Mes,Anio
PREGUNTA," Gracias, presidente. Buenos días. Dalila Escobar de A Tiempo.tv.",0.32823650481604266,9,25,11,2020
PREGUNTA,"Preguntar, bueno, de acuerdo con los datos del Secretariado Ejecutivo del Sistema Nacional de Seguridad Pública, en lo que va del año, bueno, pues van 777 feminicidios, a diferencia, bueno, por ejemplo, del mismo periodo en 2018, iban 726.",0.32823650481604266,39,25,11,2020
PREGUNTA,"Pero más allá de la cifra, si tienen identificados cuáles son los indicadores específicos de las causas de ese tipo de feminicidios. ¿Cuántas, por ejemplo, mujeres han sido víctimas de este delito en sus propias casas? para saber también qué impacto ha tenido, por ejemplo, el tema de campañas que han emprendido en este gobierno como la de Cuenta hasta 10.",0.32823650481604266,61,25,11,2020
PREGUNTA,Si considera la secretaria de Gobernación si ha sido efectiva este tipo de campañas.,0.32823650481604266,14,25,11,2020
PREGUNTA,"Y bueno, pues también preguntarles qué hay del análisis que pudieron haber hecho en torno a los resultados para saber si este gobierno va a impulsar una fiscalía que únicamente esté dedicada a este tipo, de atender a este tipo de delitos porque es más que claro que no son las mismas causas que los de un homicidio, que no feminicidio por supuesto. Preguntar primero eso, a usted y a la secretaria. Gracias.",0.32823650481604266,73,25,11,2020
PREGUNTA, Pero ¿usted considera que en las causas de un homicidio son las mismas que las de un feminicidio?,0.32823650481604266,18,25,11,2020
PREGUNTA, Gracias.,0.32823650481604266,1,25,11,2020
PREGUNTA,"Si me permite la secretaria de Gobernación, por favor esta pregunta. ¿Qué han encontrado ustedes, por favor, qué han encontrado ustedes como autoridades federales? Ahora que hablaban, decían que el Estado es la solución, no es el problema, pero ¿qué han encontrado, por ejemplo, con algunos estados? Cuando vemos que hay gobernadores, por ejemplo, el de Puebla, hace unas semanas, cómo olvidar cuando dijo él que las mujeres no desaparecen, sino que se van con el novio, ¿qué encuentran ustedes con ese tipo de situaciones que se mencionan desde puestos importantes?",0.32823650481604266,91,25,11,2020
PREGUNTA,"Las mujeres enfrentan… Si de entrada el gobernador dice eso, ¿qué dirán las fiscalías?",0.32823650481604266,14,25,11,2020
PREGUNTA," Presidente, nada más faltó lo de la fiscalía, lo de si estarían pensando que sí hace falta una fiscalía especializada.",0.32823650481604266,20,25,11,2020
PREGUNTA," Gracias, presidente. Nada más aprovechando, rapidísimo sobre el tema de Rosario Robles. Ayer hablaba ella de que sí estaría ella pensando en apegarse al criterio de oportunidad como testigo colaborador con la Fiscalía General de la República; anteriormente ella misma mencionaba que por presiones no colaboraría de esta manera, pero ya aceptó que sí.",0.32823650481604266,54,25,11,2020
PREGUNTA,"Usted ayer… Pero dice ella que no imputarían nada en contra del expresidente Enrique Peña Nieto, pero bueno, usted mismo ayer mencionaba nada, todo lo que se hacía pasaba por el visto bueno del presidente. ¿Qué opina al respecto? Gracias.",0.32823650481604266,40,25,11,2020
PREGUNTA," Gracias, señor presidente. Buenos días.",0.32823650481604266,5,25,11,2020
PREGUNTA,"Soy Frida Guerrera, columnista en Fernanda Tapia, Rompeviento y Cultura Colectiva.",0.32823650481604266,11,25,11,2020
PREGUNTA,"Aplaudo y qué bueno, espero que no sea solamente un evento por el día 25 de noviembre y que el compromiso de estos informes en la mañanera sean mensuales.",0.32823650481604266,29,25,11,2020
PREGUNTA,Es imposible no querer aprovechar a todos los temas o estos temas importantes que se manejaron ahorita. Y escuchando me vienen a la mente tres situaciones importantes:,0.32823650481604266,27,25,11,2020
PREGUNTA,"Uno, en efecto, el tema del feminicidio se sigue debiendo en el país, hay decenas de familias esperando también ser reunidas con la secretaria y que no son vistas. Uno.",0.32823650481604266,30,25,11,2020
PREGUNTA,"Dos, se habló del tema del asesinato de periodistas y es muy triste y lamentable que en efecto ahora ya no nos están desapareciendo o levantando o vigilando, como sucedía en otros gobiernos, ahora nos destrozan en redes sociales, hay hordas dedicadas, y en este momento si estuviéramos viendo los comentarios en el canal del gobierno, podría adivinar lo que se está escribiendo.",0.32823650481604266,63,25,11,2020
PREGUNTA,"El hecho de venir a poner temas tan importantes como las violencias de género nos ha hecho a muchas compañeras, nos ha puesto en el ojo del huracán a muchas de nosotras, donde todo tipo de cosas se nos menciona en estas redes.",0.32823650481604266,43,25,11,2020
PREGUNTA,"¿Qué es lo que realmente se puede hacer para que el gobierno haga este llamado a que no nada más necesitan asesinarnos físicamente, sino que nos aniquilan psicológicamente, emocionalmente? A nivel autoestima se generan muchas cosas, el impacto, sobre todo en las mujeres periodistas, es altísimo.",0.32823650481604266,46,25,11,2020
PREGUNTA,"Y tres, escuchando el tema del Protocolo Homologado de Desaparición hay casos, y ahorita particularmente estamos acompañando un caso en el Estado de México, dos casos, donde hay mujeres con antecedentes de violencia que están desaparecidas y que las fiscalías de desaparecidos siguen esperando órdenes de cateo cuando ya no debería de ser.",0.32823650481604266,53,25,11,2020
PREGUNTA,"Suena muy bonito el hecho de que hay que esperar 72 horas… ya no hay que esperar 72 horas para hacer una denuncia y, perdón, pero la realidad es completamente diferente, lo que la gente que nos enlaza, reporta, no es eso.",0.32823650481604266,42,25,11,2020
PREGUNTA,"¿Qué es lo que realmente se debe, debemos de hacer en conjunto? Sabemos perfectamente que esto es un tema, sí, de 36 años de impunidad, de corrupción, de infinidad de situaciones, de que descompuso también a toda esta sociedad, pero nuevamente tratemos de resaltar que el tema de las violencias en contra de las mujeres es un tema aparte.",0.32823650481604266,59,25,11,2020
PREGUNTA,"No dudo que hay homicidios de mujeres que tienen que ver con esta violencia generalizada, pero ojalá, de verdad se contemple esa fiscalía especializada a nivel federal en torno al tema del feminicidio y que ojalá de verdad esto que ustedes nos informan o nos platican acá tengan repercusiones allá afuera, donde la gente sigue diciendo: ‘No me quieren levantar la denuncia, me dijeron que mi pareja se llevó a mi hija y no pueden hacer nada porque es hija de los dos’, huérfanos que siguen esperando también a ser atendidos.",0.32823650481604266,91,25,11,2020
PREGUNTA,Hay infinidad de cosas que ojalá de verdad podamos ir platicando a lo largo de estos meses y que también a las mujeres defensoras y periodistas que nos dedicamos a esto se nos dé un énfasis especial por toda la violencia que se genera alrededor.,0.32823650481604266,45,25,11,2020
PREGUNTA,Gracias.,0.32823650481604266,1,25,11,2020
PREGUNTA," El tema de los periodistas nada más, presidente.",0.32823650481604266,8,25,11,2020
PREGUNTA," No, sí, pero el ataque, estas hordas que…",0.32823650481604266,8,25,11,2020
PREGUNTA," Yo escribo para Fernanda Tapia, Rompeviento y…",0.32823650481604266,7,25,11,2020
PREGUNTA, Fernanda Familiar.,0.32823650481604266,2,25,11,2020
PREGUNTA," Perdón, presidente, lo que pasa es que sí, usted tiene razón, ahora todos nos hemos convertido en medios, nosotros fuimos de esos medios que queríamos romper cercos con Radio Amlo, pero también ahorita hay un grupo de yutuberos que son abrazados por Presidencia y que desgraciadamente son los principales orquestadores de estos ataques, y que nuevamente sería importante también que esta gente…",0.32823650481604266,62,25,11,2020
PREGUNTA,"Todos lo queremos, todos votamos por usted la mayoría de los que estamos en este país y los que venimos a las mañaneras, los que votamos por usted y no por el hecho de que hayamos votado por usted implique que no también digamos los errores que hay. Y ese es justamente lo diferente y maravilloso de este gobierno, que no teníamos antes, esta democracia, este ejercicio de libertad.",0.32823650481604266,69,25,11,2020
PREGUNTA,"Pero desgraciadamente estos grupos de yutuberos que están ligados o son cercanos a Presidencia son los orquestadores de estas campañas. Y yo creo que sí sería importante para todas nosotras también que desde Presidencia hubiera también este arropo, este abrazo.",0.32823650481604266,40,25,11,2020
PREGUNTA,"Gracias, presidente.",0.32823650481604266,2,25,11,2020
PREGUNTA," Gracias, presidente. Buenos días. Rocío Jardinez.",0.32823650481604266,6,25,11,2020
PREGUNTA," Disculpe que la interrumpa, pero yo vengo de Sinaloa, vengo de fuera y requiero que me escuche.",0.32823650481604266,17,25,11,2020
PREGUNTA, Porque tengo…,0.32823650481604266,2,25,11,2020
PREGUNTA," Gracias. Sí, buenos días a todos y disculpe, señor presidente, pero busco este espacio para exponerle un caso de derechos humanos, de violación de derechos humanos muy grave que está sucediendo y que estoy viviendo yo en persona.",0.32823650481604266,38,25,11,2020
PREGUNTA,"Yo, buenos días a todos, soy periodista independiente de Sinaloa, trabajé 11 años en Ríodoce hasta finales del año pasado y hoy soy freelance de algunos medios informativos.",0.32823650481604266,28,25,11,2020
PREGUNTA,"Estoy aquí para exponerle un caso personal, como le digo, de violación de derechos humanos, y le explico, a mi hijo Rafael lo detuvieron de forma arbitraria hace ya 13 años cuando tenía 20 años mi hijo, lo detuvieron, lo torturaron policías del Estado de México, agentes federales y militares.",0.32823650481604266,50,25,11,2020
PREGUNTA,"Lo encarcelaron en una prisión federal por delincuencia organizada, esto sucedió en 2008 cuando la guerra contra el narcotráfico estaba en su apogeo, cuando había esa coordinación interinstitucional que le llamaban entre los tres niveles de gobierno para aprehender a los supuestos delincuentes, muchos sí, muchos no.",0.32823650481604266,47,25,11,2020
PREGUNTA,"A pesar de que él denunció la tortura en su momento en 2008, no se investigó; al contrario, se presentaron en el proceso un sinfín de trabas jurídicas, burocráticas, para alargar el juicio, así que pasaron cuatro años para que él la dictaran sentencia y pasaron ocho años para que la Suprema Corte de Justicia de la Nación revisará su caso y ordenara, después de ocho años, que investigaran la tortura que él había denunciado.",0.32823650481604266,75,25,11,2020
PREGUNTA,"Sin embargo, el expediente regresa al juzgado federal y se detiene de nuevo. Lo más grave de todo esto ahora es que Rafael, mi hijo, ya cumplió su sentencia, el 2 de marzo del 2018, es decir, que hace casi tres años que está, que lo mantienen preso sin base legal porque no hay justificación jurídica para que mantengan a una persona en prisión cuando cumplió su pena, su condena.",0.32823650481604266,70,25,11,2020
PREGUNTA,"Por toda esta situación, el Grupo de Trabajo de Detención Arbitraria del Comité de Derechos Humanos de la ONU conoció del caso de mi hijo, lo analizó y lo vieron en un tribunal en su sesión ordinaria en Suecia, eso fue hace el año pasado, a principios, y emitió una resolución. Este tribunal internacional ordena al Estado mexicano que libere inmediatamente a Rafael y que se le reponga el daño ocasionado en todos esos 13 años; sin embargo, no ha pasado nada, señor presidente.",0.32823650481604266,84,25,11,2020
PREGUNTA,"Yo he acudido, he enviado cartas, le envié una carta a usted explicándoles toda la situación hace dos años, envié carta a la Secretaría de Gobernación, al fiscal general, he tocado puertas que no se abren o he tocado puertas que se abren y dicen ‘Está bien, lo vamos a investigar’, y no pasa nada.",0.32823650481604266,55,25,11,2020
PREGUNTA,"Son ya… mi hijo debería ya de estar libre hace tres años, debería de estar libre si hubiera renunciado a practicarse los exámenes médicos y psicológicos de acuerdo al Protocolo de Estambul, como le llaman, para comprobar que fue torturado.",0.32823650481604266,40,25,11,2020
PREGUNTA,"Le han practicado ya cuatro Protocolos de Estambul, cuatro exámenes médicos y cuatro exámenes psicológicos. No pasa nada. Todos los dictámenes concluyen que él tiene secuelas físicas y psicológicas debido a las acciones de tortura a los que fue sujeto durante de detención.",0.32823650481604266,43,25,11,2020
PREGUNTA,"Hay dos carpetas de investigación abiertas, abiertas, pero guardadas, una en la Fiscalía General de la República y otra en la fiscalía del Estado de México para investigar la tortura por parte de los agentes estatales y la de aquí por parte de los agentes federales y militares; sin embargo, ahí están las carpetas abiertas.",0.32823650481604266,55,25,11,2020
PREGUNTA,"Y pues yo, señor presidente, vengo aquí como periodista, yo le digo, y yo estoy segura que en un principio la detención de mi hijo fue consigna por mi trabajo periodístico.",0.32823650481604266,31,25,11,2020
PREGUNTA,"A mí me han roto el corazón, 13 años he estado y hemos seguido todos los procedimientos de acuerdo a como se dice en la ley. Todo hemos… no hemos… hemos seguido todas las reglas y procedimientos del sistema jurídico, del sistema penal, pero el proceso no avanza, se estanca y lo más grave, como le digo, es que mi hijo ya debería de estar libre, debería estar libre hace tres años si hubiera renunciando a hacerse esos exámenes.",0.32823650481604266,79,25,11,2020
PREGUNTA,"Y la ONU, y estoy de acuerdo con ella en lo opinión que después a estas alturas, después de 13 años, no quieren darle la libertad, no quieren, el sistema judicial no quiere aceptar que se equivocó, porque se equivocó, en mi caso y en muchos otros, porque todo en este trajinar que han dado en los penales y viendo en los juzgados, he visto muchas personas como yo, muchas madres lastimadas por sus hijos en prisión.",0.32823650481604266,77,25,11,2020
PREGUNTA,"Y lo que sí le puedo decir, señor presidente, es que esa guerra contra el narcotráfico, esa política genocida dejó muchas víctimas, miles de muertes y desaparecidos, y eran jóvenes de 18, 20 a 25 años, yo lo viví, lo digo, vivo en Sinaloa, pero eso fue en todo el país.",0.32823650481604266,51,25,11,2020
PREGUNTA,"Pero aparte de las muertes y desaparecidos, hay cientos de jóvenes, igual, jóvenes de 18, 20, 25 años presos siendo inocentes, ¿por qué?, porque fueron una política de aportar números, de dar números, de decir y justificar una política para intereses, no sé. Y, bueno, estoy aquí por eso.",0.32823650481604266,49,25,11,2020
PREGUNTA,"Señor presidente, quisiera como madre, como periodista, eso le digo como madre, que estoy en el lugar de muchas personas que yo he conocido y que están en mi situación. Y, bueno, quizá usted pueda decirme que esto no le corresponde o que esto corresponde a esto de la autonomía de los poderes, al Poder Judicial, pero lo que yo le digo es que usted es responsable de la seguridad pública, de la paz, del Estado de derecho de este país y quisiera pedirle, requerirle que se solucione esta situación y que se haga justicia. Usted dígame qué más tengo yo qué hacer para que se haga justicia.",0.32823650481604266,108,25,11,2020
PREGUNTA,Gracias.,0.32823650481604266,1,25,11,2020
PREGUNTA," Gracias presidente. Buenos días, buenos días a todos.",0.32823650481604266,8,25,11,2020
PREGUNTA,"Quisiera preguntarle, presidente, si bien hay un tema de cultura en nuestro país para terminar con el machismo y demás, hay una demanda también muy puntual por parte de las feministas, yo creo que incluso de todas las mujeres, es en la cuestión legal, presidente.",0.32823650481604266,45,25,11,2020
PREGUNTA,"Hay solamente el castigo alrededor de 11 años por abuso sexual, también hay penas que al parecer no se consideran justas y que permiten este abuso contra las mujeres, esta violencia, estos feminicidios.",0.32823650481604266,33,25,11,2020
PREGUNTA,"Quisiera saber su postura, si usted consideraría que habría que echarle un ojito a las leyes de nuestro país para que fueran más severas estos castigos para evitar y ya erradicar también, los feminicidios y todos los ataques hacia las mujeres.",0.32823650481604266,41,25,11,2020
PREGUNTA,Gracias.,0.32823650481604266,1,25,11,2020
PREGUNTA," Una nada más, presidente. También preguntarle, el 20 de enero asume la presidencia Joe Biden en Estados Unidos. En China pues también el presidente ya se sumó a estas felicitaciones a Joe Biden, y se quiere saber si usted… ¿Cuándo va a mandar esa felicitación?, ¿cuándo se va a sumar?",0.32823650481604266,50,25,11,2020
PREGUNTA,Gracias.,0.32823650481604266,1,25,11,2020
