Participante,Texto,Sentimiento,Palabras,Dia,Mes,Anio
JORGE ALCOCER VARELA,"De hecho, todo este camino llamado la logística es compleja pues requiere de transporte, de almacenamiento, de distribución y de la aplicación de las vacunas como es el caso que requieren mantenerse en temperatura controlada y requieren ser aplicadas en una segunda dosis a los 21 días.",0.0,47,05,01,2021
JORGE ALCOCER VARELA,"El principal objetivo es que la población mexicana cuente con vacunas seguras y eficaces. Los beneficios potenciales son -de vacunarse- son evitar casos nuevos, disminuir las hospitalizaciones y desde luego no tener más tristes defunciones.",0.0,35,05,01,2021
JORGE ALCOCER VARELA,"Para ello logramos y realizamos la priorización de la población a vacunarse, considerando en primer lugar a los trabajadores de la salud que están al frente de la atención de pacientes infectados por el SARS-CoV-2 y que con quienes ya hemos empezado desde el 24 de diciembre; y desde luego a los adultos mayores, a nuestros padres, a nuestros abuelos, a nuestros viejos.",0.0,63,05,01,2021
JORGE ALCOCER VARELA,"Por ello, hoy recibimos con gusto, con esperanza para muchos, el cuarto arribo de vacunas. Como han de saber, se han recibido 53 mil 625 dosis de la vacuna Pfizer, de las que han sido aplicadas hasta ayer a las 4:00 de la tarde 43 mil 960, es decir, llevamos un avance del 82 por ciento; así, se han vacunado profesionistas de la salud en la Ciudad de México, en los estados de Coahuila, Nuevo León, Estado de México y Querétaro.",0.0,81,05,01,2021
JORGE ALCOCER VARELA,"Hoy recibimos 53 mil 605 dosis, ocho mil 755 ya depositadas en Coahuila y 44 mil 850 en la Ciudad de México.",0.0,22,05,01,2021
JORGE ALCOCER VARELA,"En esta primera fase de la vacunación seguiremos protegiendo al personal médico. Para ello, ya contamos con un censo de todas las entidades estatales y en esta breve ceremonia, la primera del año, nos mantiene unidos a todos y les recuerdo: a todos nos tocará.",0.0,45,05,01,2021
JORGE ALCOCER VARELA,"Muchas gracias, señor presidente y subsecretario Hugo López-Gatell. Seguimos adelante. Muchas gracias.",0.0,12,05,01,2021
JORGE ALCOCER VARELA,"A continuación, el almirante Ojeda.",0.0,5,05,01,2021
RAFAEL OJEDA DURAN," Muy buenos días, señor presidente.",0.0,5,05,01,2021
RAFAEL OJEDA DURAN,"Nos encontramos aquí en el aeropuerto. Y sin duda hoy también es una fecha muy importante para quienes formamos parte del Gobierno de México, al igual que para las y los mexicanos.",0.0,32,05,01,2021
RAFAEL OJEDA DURAN,"Como ya sabemos, recibimos un nuevo cargamento de vacuna que habrá de ser distribuido y aplicado en la población en todo el territorio nacional.",0.0,24,05,01,2021
RAFAEL OJEDA DURAN,"Las Fuerzas Armadas, nuestro glorioso Ejército, nuestra querida Guardia Nacional y desde luego también nuestra Secretaría de Marina Armada de México nos sumamos al esfuerzo del gobierno federal para la distribución, el resguardo y desde luego la aplicación de la vacuna contra el COVID-19.",0.0,44,05,01,2021
RAFAEL OJEDA DURAN,Las y los mexicanos pueden estar seguros que juntos ganaremos esta batalla. La salud y el bienestar de nuestros muy querido México será recobrado.,0.0,24,05,01,2021
RAFAEL OJEDA DURAN,Muchas gracias y le cedo la palabra al licenciado Marcelo Ebrard.,0.0,11,05,01,2021
MARCELO EBRARD CASAUBON, Muy breve. Buenos días.,0.0,4,05,01,2021
MARCELO EBRARD CASAUBON,"Se está recibiendo hoy el cargamento, ya lo explicó aquí el doctor Alcocer, como estaba programado.",0.0,16,05,01,2021
MARCELO EBRARD CASAUBON,"Yo quisiera nada más reconocer el esfuerzo que ha hecho Pfizer-BioNTech, la empresa que está produciendo estas vacunas, así como DHL que se ha encargado del transporte y lo están haciendo en tiempo y forma conforme estaba programado.",0.0,38,05,01,2021
MARCELO EBRARD CASAUBON,"Ya el próximo embarque serán cifras considerables, más allá de 436 mil vamos a recibir la próxima semana y ya el sector Salud está listo para manejar esos volúmenes de vacunas que colocan a México entre los primeros del mundo en su plan de vacunación.",0.0,45,05,01,2021
MARCELO EBRARD CASAUBON,"También tenemos noticia, como ustedes saben, de que el día de ayer se aprobó AstraZeneca, que es otra vacuna aprobada en México y ya muy próximamente iniciarán la producción en nuestro país para surtir a México con 77.4 millones de dosis y a toda América Latina con 250 millones de dosis de la vacuna AstraZeneca. Buenas noticias para México.",0.0,59,05,01,2021
MARCELO EBRARD CASAUBON,Buen día.,0.0,2,05,01,2021
PRESIDENTE ANDRES MANUEL LOPEZ OBRADOR," Pues muchas gracias a todos. Muchas gracias, doctor Alcocer. También saludamos a Juan Ferrer, del Insabi; también a Horacio Duarte, de Aduanas, que está también ayudando en todo el trámite. Muchas gracias. Un abrazo.",0.0,34,05,01,2021
PRESIDENTE ANDRES MANUEL LOPEZ OBRADOR,"Bueno, esta es la información.",0.0,5,05,01,2021
JORGE ALCOCER VARELA, Muchas gracias.,0.0,2,05,01,2021
PRESIDENTE ANDRES MANUEL LOPEZ OBRADOR, Está es la información en general.,0.0,6,05,01,2021
PRESIDENTE ANDRES MANUEL LOPEZ OBRADOR,"Si les parece, nos quedamos hasta aquí y mañana seguimos, mañana.",0.0,11,05,01,2021
PRESIDENTE ANDRES MANUEL LOPEZ OBRADOR,"Bueno, muchas gracias de todo corazón.",0.0,6,05,01,2021
