Participante,Texto,Sentimiento,Palabras,Dia,Mes,Anio
PRESIDENTE ANDRES MANUEL LOPEZ OBRADOR, Buenos días.,0.0,2,05,01,2021
PRESIDENTE ANDRES MANUEL LOPEZ OBRADOR,"Pues hoy martes, como siempre, vamos a informar sobre la situación de salud, en particular lo de la pandemia, nos va a informar el doctor Hugo López-Gatell sobre la situación que prevalece en el país; y también vamos a tener información de la llegada de un mayor número de dosis de vacunas, tanto al aeropuerto de Monterrey como al aeropuerto de la Ciudad de México; y vamos también a informar sobre este plan de vacunación, de cómo vamos y qué se está previendo hacia adelante, qué va a lograrse, con el propósito de que se vacune a todos los mexicanos y que podamos cumplir con la meta de vacunar antes de que termine marzo, a finales de ese mes, a todos los adultos mayores del país, estamos trabajando con ese propósito organizándonos.",0.0,132,05,01,2021
PRESIDENTE ANDRES MANUEL LOPEZ OBRADOR,"Ya inició el Plan Nacional de Vacunación, los preparativos, la integración de brigadas de vacunación para ir hasta las comunidades más apartadas de México, ya estamos trabajando en ese plan, pero vamos a depender de la disponibilidad de las vacunas.",0.0,40,05,01,2021
PRESIDENTE ANDRES MANUEL LOPEZ OBRADOR,Y ya también se están haciendo las gestiones para que se cumplan los acuerdos que tenemos con farmacéuticas y solicitando también el apoyo de gobiernos extranjeros con ese propósito.,0.0,29,05,01,2021
PRESIDENTE ANDRES MANUEL LOPEZ OBRADOR,"De modo que vamos a darle la palabra al doctor Hugo López-Gatell, que nos informe de cómo vamos y también acerca de la vacuna. Adelante, doctor.",0.0,26,05,01,2021
HUGO LOPEZ-GATELL RAMIREZ," Muchas gracias señor presidente, con su permiso. Muy buenos días tengan todas y todos ustedes aquí en la sala y también allá en sus casas o sitios de trabajo.",0.0,29,05,01,2021
HUGO LOPEZ-GATELL RAMIREZ,"Comentamos sobre la actualización de la epidemia y lo que ya mencionó el presidente sobre el avance de la vacunación. Recordar lo que dijimos el 24 de diciembre de 2020: con la llegada de las vacunas da un giro radical el manejo de la epidemia, no sólo en México, sino en el mundo, en los países que ya empezaron a vacunar. Es muy diferente, sustancialmente diferente el poder tener un instrumento de protección específica que nos permita controlar la epidemia de manera activa.",0.0,83,05,01,2021
HUGO LOPEZ-GATELL RAMIREZ,"Las medidas generales de salud pública conocidas ampliamente y utilizadas en todo el mundo durante 2020 seguirán teniendo su relevancia en la medida en que progresa la vacunación, pero cada día que pasa en el que podamos estar vacunando cada nuevo embarque, como el que llegará hoy o los embarques que llegarán hoy, cada nueva vacuna que pueda ser incorporada al repertorio nos servirá para tener una velocidad más grande de control epidémico.",0.0,73,05,01,2021
HUGO LOPEZ-GATELL RAMIREZ,"La priorización que estableció el Gobierno de México, también como lo relatamos el 8 de diciembre de 2020 en este mismo foro, está científicamente planeado, corresponde con las recomendaciones de mejores prácticas de la Organización Mundial de la Salud y coincide con varias de las recomendaciones que en cada uno de los países han hecho los países que ya tienen vacunas.",0.0,61,05,01,2021
HUGO LOPEZ-GATELL RAMIREZ,"Lo que interesa en esa priorización, en primer lugar, es reducir la mortalidad, eso es crucial, reducir la mortalidad y, de acuerdo con distintos análisis, incluyendo algunos análisis epidemiológicos y modelaciones matemáticas que hizo nuestro grupo técnico asesor en vacunación, si logramos tener esta vacunación priorizando las edades, vamos a lograr reducir la mortalidad en 80 por ciento cuando alcancemos 20 por ciento de cobertura. Entonces, la ganancia es muy acelerada, con 20 por ciento de cobertura reduciremos 80 por ciento de las muertes que se presentarían por la epidemia. Este es un objetivo muy claro y así ha sido trazado para nuestro plan de vacunación.",0.0,106,05,01,2021
HUGO LOPEZ-GATELL RAMIREZ,"Y otro elemento que queremos comentar es: los planes de vacunación requieren una visión de Estado, una visión organizada en todos los estados nacionales. Esto es una recomendación general de la Organización Mundial de la Salud, pero también es la perspectiva que han tenido todos los países.",0.0,47,05,01,2021
HUGO LOPEZ-GATELL RAMIREZ,"Es muy deseable la cooperación armónica de todos los órdenes de gobierno, el federal, el estatal, el municipal; es muy deseable la contribución de distintos actores sociales, pero definitivamente es imprescindible que el Estado mantenga la unidad y por eso el Gobierno de México tiene una estrategia de alcance nacional que ha sido conversada con los gobiernos estatales, próximamente será nuevamente conversada, el próximo jueves tenemos sesión de trabajo con la Conferencia Nacional de Gobernadores, que es un foro muy amigable con esta organización que representa la mayoría de los gobiernos estatales en la que tenemos este diálogo muy fluido, muy constructivo. Y el presidente de Conago, la presidente de Conago, actualmente la gobernadora de Sonora y el presidente de la Comisión de Salud de Conago, el gobernador Mauricio Vila Dosal, de Yucatán, nos han pedido que presentemos nuevamente la actualización del plan de vacunación ante las y los gobernadores, lo cual haremos con muchísimo gusto para seguir construyendo este esfuerzo conjunto.",0.0,162,05,01,2021
HUGO LOPEZ-GATELL RAMIREZ,"Si me permite, presidente, voy a presentar entonces el informe técnico que comentamos ayer y a renglón seguido las curvas epidémicas estatales para que tengan al arranque de 2021 la panorámica de cómo está la epidemia y también cómo va progresando la vacunación, y el anuncio de los embarques que llegan en las próximas horas.",0.0,55,05,01,2021
HUGO LOPEZ-GATELL RAMIREZ,"Aquí tenemos, es esencialmente información semejante a la que veníamos presentando hasta el final de 2020, le hemos puesto un formato visual un poquito más dinámico para enfatizar algunos aspectos que es importante destacar.",0.0,34,05,01,2021
HUGO LOPEZ-GATELL RAMIREZ,"Como saben, todos los informes técnicos se publican en tiempo real en el portal coronavirus.gob.mx, toda información que hayamos presentado alguna vez y que por razones de diseño visual dejemos de presentar en estas exposiciones permanecen en el informe técnico; y si hay alguna información adicional que el público quisiera conocer o que las y los comunicadores quisieran que se exponga a mayor detalle, siempre con mucho gusto lo podemos explicar nuevamente.",0.0,72,05,01,2021
HUGO LOPEZ-GATELL RAMIREZ,"Aquí tenemos la curva epidémica de los casos estimados por semana, como lo solíamos hacer, y destacamos que habíamos tenido un pico epidémico que se prolongó desde la semana 10 en marzo hasta la semana 39 del año, la última semana de julio.",0.0,43,05,01,2021
HUGO LOPEZ-GATELL RAMIREZ,"Posteriormente, durante agosto y septiembre hubo un descenso en la intensidad epidémica y llegamos a la semana 40 en donde tuvimos nuevamente un repunte, es a lo que le llamamos la segunda oleada, el rebrote, el repunte.",0.0,37,05,01,2021
HUGO LOPEZ-GATELL RAMIREZ,"Comentamos en varias ocasiones que no hay ninguna razón técnica para requerir que haya una extinción completa de la epidemia antes de hablar de un rebrote, un rebrote es simplemente el momento en donde cambia la tendencia; en este caso, volvió a ascender y superó desde luego la intensidad epidémica del verano. Y llegamos a este punto en la semana epidemiológica número 50 de 2020, que es la penúltima semana del año, y después hemos tenido dos semanas consecutivas de descenso; para el corte de información que termina en la semana 52 de 2020, en este momento estamos en la primera semana epidemiológica de 2021, tenemos este descenso de 21 por ciento.",0.0,112,05,01,2021
HUGO LOPEZ-GATELL RAMIREZ,"Y como suele ocurrir con el flujo de datos, es posible que la magnitud de este descenso sea más modesta, pero seguramente al sábado próximo terminaremos con una tendencia de descenso ya por dos semanas consecutivas, lo cual es alentador.",0.0,40,05,01,2021
HUGO LOPEZ-GATELL RAMIREZ,"Por el otro lado, quiero destacar lo que hemos señalado en otras ocasiones: la recuperación. La gran mayoría, cerca del 80 por ciento de las personas que han sido atendidas por COVID, que han sido registradas por padecer COVID-19, tienen una enfermedad leve, una enfermedad que se maneja ambulatoriamente, cerca del 20 por ciento se hospitalizan.",0.0,56,05,01,2021
HUGO LOPEZ-GATELL RAMIREZ,"En ambos casos la gran mayoría, que también es cerca del 80 por ciento, se recuperan, y esto es lo que se ve en esta otra gráfica, que para la semana final del año tuvo un aumento de seis por ciento en las recuperaciones.",0.0,44,05,01,2021
HUGO LOPEZ-GATELL RAMIREZ,"En este momento, cuatro por ciento de los casos, que son estos casi 64 mil, son la epidemia activa, el resto son la epidemia histórica, este millón y medio casi de casos que sumamos; de todos modos, por razones estadísticas, un millón 600 mil, si consideramos los estimados, ya han se recuperado, sólo cuatro por ciento permanecen activos.",0.0,58,05,01,2021
HUGO LOPEZ-GATELL RAMIREZ,"Respecto al porcentaje de positividad, un indicador importante que se usa a nivel internacional, aunque cada país tiene su propia magnitud de porcentaje de positividad de acuerdo a cómo realiza el muestreo, el uso de las pruebas, en México que tenemos un enfoque basado en los casos documentados y no en el número de pruebas por realizar, independientemente de la existencia o no de enfermedad, tenemos un porcentaje de 42 por ciento.",0.0,72,05,01,2021
HUGO LOPEZ-GATELL RAMIREZ,"Lo mismo, llegó a un punto máximo rumbo a la semana 26 de 2020, esto es en el mes de julio, después descendió y en el otoño ya se ha mantenido con un poco de tendencia al alza, pero en general alrededor de 38 o hasta 43 por ciento, en este momento 42 por ciento.",0.0,55,05,01,2021
HUGO LOPEZ-GATELL RAMIREZ,"Esta gráfica, que en ocasiones la habíamos presentado, la vamos a incorporar ya sistemáticamente porque da una información complementaria sobre el desenlace más desafortunado de la enfermedad, que es la pérdida de la vida, y es la letalidad.",0.0,38,05,01,2021
HUGO LOPEZ-GATELL RAMIREZ,"Recordar que la letalidad de caso es la proporción o el porcentaje de personas que lamentablemente pierden la vida cuando tienen COVID, en su mayoría por las consecuencias negativas del virus SARS-CoV-2 sobre el organismo, mayormente el daño pulmonar agudo y otras afecciones comunes.",0.0,44,05,01,2021
HUGO LOPEZ-GATELL RAMIREZ,"Llegamos a un punto máximo de un poco más de 18 por ciento en la semana 17 del año, esto es alrededor del final de mayo, y posteriormente ha ido descendiendo, progresivamente desciende, lo cual es muy afortunado.",0.0,38,05,01,2021
HUGO LOPEZ-GATELL RAMIREZ,"Esto tiene varias explicaciones, dos de las principales son la mejoría en la capacidad de atención, los protocolos de atención se fueron refinando en todo el mundo conforme al progreso la epidemia, también en México, y la oportunidad de atención.",0.0,40,05,01,2021
HUGO LOPEZ-GATELL RAMIREZ,"Como hemos mostrado en algunas de las conferencias técnicas de la noche, principalmente la exposición del doctor López Ridaura, hemos tenido un acortamiento del tiempo en que las personas acuden a atención.",0.0,32,05,01,2021
HUGO LOPEZ-GATELL RAMIREZ,"Y seguimos haciendo este llamado: si usted tiene síntomas de COVID y tiene 60 o más años de edad o tiene enfermedades crónicas, diabetes, hipertensión, inmunosupresión y otras, no se espere, no se espere, acuda a valoración médica, eso puede ayudar a que disminuya la probabilidad de un desenlace fatal.",0.0,50,05,01,2021
HUGO LOPEZ-GATELL RAMIREZ,"Aquí lo vemos, estamos en este momento en promedio en seis por ciento y con esta tendencia progresiva a la baja.",0.0,21,05,01,2021
HUGO LOPEZ-GATELL RAMIREZ,"Aquí sintetizamos lo que tradicionalmente presentábamos en las gráficas de columnas, que es la ocupación hospitalaria estado por estado. De manera panorámica tenemos el 51 por ciento de las camas destinadas a la atención de personas con infección respiratoria aguda grave, el síndrome clínico de COVID-19, ocupadas.",0.0,47,05,01,2021
HUGO LOPEZ-GATELL RAMIREZ,"Vemos que cinco de las 32 entidades federativas, que ahí están indicadas con sus porcentajes de ocupación, tienen ocupaciones superiores al 70 por ciento; otras cinco están entre 50 y 69 por ciento, también ahí indicadas; y el resto, 22 de las 32 tienen ocupaciones menores al 50 por ciento. El dato específico de disponibilidad de camas también aparece al final de la gráfica.",0.0,64,05,01,2021
HUGO LOPEZ-GATELL RAMIREZ,"Y para camas con ventilador, que son aquellas para personas críticamente enfermas, 45 por ciento están en este momento ocupadas en promedio; sólo dos entidades federativas, el Valle de México, la Ciudad de México, la zona conurbada del Estado de México, tienen ocupaciones superiores al 70 por ciento; dos están entre 50 y 69 por ciento, a saber, Nuevo León y Baja California; y las 28 restantes, 28 de 32, tienen ocupaciones inferiores al 50 por ciento.",0.0,77,05,01,2021
HUGO LOPEZ-GATELL RAMIREZ,"Recordamos aquí para una comprensión más exacta del manejo de la epidemia, que el objetivo de tener camas disponibles es un objetivo técnico establecido por el Gobierno de México desde la fase de preparación de esta epidemia, desde enero de 2020.",0.0,41,05,01,2021
HUGO LOPEZ-GATELL RAMIREZ,¿Por qué razón?,0.0,3,05,01,2021
HUGO LOPEZ-GATELL RAMIREZ,Porque una de las situaciones más difíciles que enfrentaron varios de los países que iniciaron con la epidemia de COVID fue la incapacidad de atender a su población. En México hemos logrado -porque este fue el objetivo técnico alcanzado- que no se saturaran los hospitales.,0.0,45,05,01,2021
HUGO LOPEZ-GATELL RAMIREZ,"No teníamos, ciertamente no teníamos, y lo hemos declarado una y otra vez, la capacidad instalada. El Sistema Nacional de Salud de México durante muchos años no desarrolló las capacidades suficientes en hospitales, en el número de camas, en el personal de salud, con una carencia de cerca de 240 mil personas de los múltiples campos laborales de la salud y no había la capacidad instalada; por lo tanto, era imprescindible emprender la más amplia reconversión posible y siempre estar por encima de la cantidad de casos, de personas que necesitaran hospitalización. Lo hemos logrado y esto requiere un trabajo arduo de todos los días con todas las instituciones del sector salud.",0.0,112,05,01,2021
HUGO LOPEZ-GATELL RAMIREZ,"La siguiente, por favor. Esto ya no, vámonos directamente en la última de las secciones, a la vacunación y enseguida presentamos las gráficas estatales. Aquí está.",0.0,26,05,01,2021
HUGO LOPEZ-GATELL RAMIREZ,"Esta es la Estrategia Nacional de Vacunación contra COVID-19. En un momento daré una indicación sobre lo que ya señalaba el presidente de cómo irá progresando, cómo está planeada que vaya progresando en esta primera fase, sobre todo en la que se está vacunando al personal de salud.",0.0,48,05,01,2021
HUGO LOPEZ-GATELL RAMIREZ,"Veamos primero los números generales. Ayer se vacunaron cuatro mil dos personas y lo estamos aquí graficando día por día. La vacunación contra COVID en México empezó el 24 de diciembre con dos mil 924 dosis; posteriormente, tuvimos un segundo embarque que empezó a utilizarse desde el domingo 27 de diciembre y todos los días se ha utilizado ese embarque, un receso simplemente el día 21.",0.0,66,05,01,2021
HUGO LOPEZ-GATELL RAMIREZ,"Había algunas inquietudes sociales de por qué…. Perdón, el día 1º de enero no se había vacunado. No es porque el personal vacunador no esté en disposición, es porque el personal médico, el personal de salud que recibe la vacunación no estaba en disposición de ser vacunado; hubiera sido infructuoso intentar vacunar a personas que necesitaban un receso, es el personal que ha estado arduamente trabajando y el propio personal pidió tener ese receso.",0.0,74,05,01,2021
HUGO LOPEZ-GATELL RAMIREZ,"Cuando hicimos las listas de candidatos a vacunar, la preferencia fue esperar el día 1º, fue la preferencia mayoritaria del personal de salud. Atendiendo y respetando esa declaración, esa manifestación de nuestros compañeros y compañeras del personal de salud, optamos por dejar el receso el día 21, lo mismo que el día 25 y retomarla el 2 de enero, 3 de enero, 4 de enero.",0.0,65,05,01,2021
HUGO LOPEZ-GATELL RAMIREZ,"Cuarenta y tres mil 960 personas han sido ya vacunadas, hasta ahorita es desde luego la primera dosis, recordar que aquí estamos usando la vacuna de Pfizer BioNTech, que requiere dos dosis con un intervalo de 21 días en promedio.",0.0,40,05,01,2021
HUGO LOPEZ-GATELL RAMIREZ,"Y vemos el progreso, lo vamos a estar graficando día con día, conforme vayamos utilizando esta y posteriormente las siguientes vacunas.",0.0,21,05,01,2021
HUGO LOPEZ-GATELL RAMIREZ,"Ochenta y dos por ciento de las 53 mil 625 dosis ya han sido utilizadas. Hoy arrancan nuevamente los puestos de vacunación desde temprano, a las 8:00 de la mañana, y lo más probable es que se termine el 100 por ciento de estas dosis.",0.0,45,05,01,2021
HUGO LOPEZ-GATELL RAMIREZ,"Pero llegan nuevas, hoy llegan, hoy 5 de enero llega este nuevo embarque de una dotación semejante de 53 mil, un poco más de 53 mil dosis que se desglosan de esta manera:",0.0,33,05,01,2021
HUGO LOPEZ-GATELL RAMIREZ,"Ocho mil 755 serán para Coahuila. Arriban poco después de las 08:15 de la mañana al aeropuerto de Monterrey, ahí está el general secretario de la Defensa, Luis Cresencio Sandoval, y también nuestro colega Zoé Robledo Aburto, director general del IMSS, para recibir ocho mil 755 dosis en el aeropuerto de Monterrey. El personal de la Secretaría de la Defensa Nacional las trasladará de una manera segura a Saltillo, Coahuila, donde serán utilizadas en los distintos puestos de vacunación en instalaciones militares de acuerdo a lo programado.",0.0,87,05,01,2021
HUGO LOPEZ-GATELL RAMIREZ,"Y en la Ciudad de México arribarán 44 mil 850 dosis. Ahí estarán para recibirlas el secretario de Salud, el canciller, el almirante secretario de la Marina y también Juan Ferrer, director del Insabi.",0.0,34,05,01,2021
HUGO LOPEZ-GATELL RAMIREZ,"Ahora comento sobre el uso de estas vacunas y el plan de vacunación. Recordar que el plan de vacunación tiene un primer grupo de priorización, que es el personal de salud, quienes cuidan a las personas enfermas. Tenemos que cuidar a quienes nos cuidan, esto se ha hecho en todo el mundo, esto tiene una razón técnica importante de priorizar al personal que está directamente en atención.",0.0,67,05,01,2021
HUGO LOPEZ-GATELL RAMIREZ,"Es claro y debe quedar muy claro, otro personal de salud, que somos quienes no estamos en el campo clínico, no somos prioridad y seguiremos esperando cuando nos toque a lo que corresponde por nuestra edad y condiciones de salud; pero el personal de salud sí, y es el personal clínico; no solamente médicas y médicos, y enfermeras y enfermeros, sino 11 categorías laborales del personal que está presente en las instalaciones clínicas, empezando por las instalaciones COVID y las instalaciones no COVID también de manera continua.",0.0,87,05,01,2021
HUGO LOPEZ-GATELL RAMIREZ,"Geográficamente, hemos establecido el arranque en donde está más activa la epidemia en este momento, que es el Valle de México; entonces 53 mil dosis se distribuyen de esa manera por esta razón. Y llegarán a la Ciudad de México, se seguirán completando la vacunación en hospitales de la Ciudad de México, se progresará en forma centrifuga, en forma del centro a la periferia hacia el Valle de México, después la zona megalopolitana, que ya expresábamos la semana pasada, es el siguiente grupo de estados que están en mayor intensidad epidémica, esto comprende Querétaro, Tlaxcala, Puebla, Morelos y el Valle de México, estarán vacunados también ahí el personal de salud.",0.0,110,05,01,2021
HUGO LOPEZ-GATELL RAMIREZ,"Y enseguida, ya con el embarque que tendremos el día 11 de enero, es decir, la próxima semana, ya simultáneamente vacunaremos en el resto de las entidades federativas. Esto también lo destaco porque ha habido algunas inquietudes, legítimas por supuesto, en los gobiernos del resto de la República, de que perciben que sólo está aquí en la Ciudad de México. No es así, todas las 32 entidades federativas tienen la prioridad.",0.0,71,05,01,2021
HUGO LOPEZ-GATELL RAMIREZ,"Entonces, con el embarque del 11 de enero ya estaremos recibiendo más de 436 mil dosis por semana de manera continua y esto nos permitirá vacunar en grandes cantidades a todo el personal de salud del resto del país.",0.0,39,05,01,2021
HUGO LOPEZ-GATELL RAMIREZ,"Estimamos que, para finales de enero, para el último embarque, que será el 25 de enero, tendremos ya un millón 400 mil dosis acumuladas que permitirán vacunar a todo el personal de salud que está justamente en las unidades clínicas, COVID y no COVID. Entonces, todos los estados tendrán esa prioridad.",0.0,51,05,01,2021
HUGO LOPEZ-GATELL RAMIREZ,"Después, comento de una vez, ya lo mencionamos, el segundo grupo de priorización son las personas adultas mayores. Hemos identificado, con base en el Censo Nacional de Población y Vivienda en su versión más actualizada… Agradecemos al Inegi, por cierto, esta colaboración de facilitarnos información con mayor detalle, gracias al Inegi.",0.0,51,05,01,2021
HUGO LOPEZ-GATELL RAMIREZ,"Y también con base en otros censos, por ejemplo, el censo de los Programas de Bienestar, en específico el programa de becas a los adultos mayores, esto nos permite un nivel de detalle muy importante sobre la distribución en el territorio de las personas adultas mayores y empezaremos vacunando a los que tienen 80 y más años, después 70-79, 60-69 y así progresivamente.",0.0,63,05,01,2021
HUGO LOPEZ-GATELL RAMIREZ,"En conjunto, personas de 60 y más años son 12 millones 450 mil personas y vamos a vacunar prioritariamente o empezando por las zonas más remotas, esto es importantísimo. Generalmente, los recursos de salud o los servicios de salud, y muchos otros servicios sociales, históricamente llegan al final a las zonas socialmente más vulnerables. No va a ser así, ahora va a ser al revés, las zonas más vulnerables, las personas más vulnerables serán vacunadas prioritariamente y a través de la infraestructura humana de los Programas de Bienestar vamos a poder priorizar el arranque en estas zonas remotas.",0.0,98,05,01,2021
HUGO LOPEZ-GATELL RAMIREZ,"Va a haber un mecanismo de brigadas constituidas por múltiples personas funcionarias que estarán activas, atendiendo distintos aspectos de la movilización social, el reclutamiento, la identificación de personas, la atención en las familias y, también desde luego, el aspecto central del proceso de vacunación a cargo de personal de salud, y vacunaremos a tres millones de personas adultas mayores de las zonas remotas; enseguida, otro bloque muy importante de las zonas urbanas de mediano tamaño y finalmente las zonas metropolitanas donde existe la mayor densidad poblacional, todas las personas adultas mayores y en adelante seguiremos con todas las demás edades.",0.0,100,05,01,2021
HUGO LOPEZ-GATELL RAMIREZ,"Recordar que en ninguna parte del mundo en este momento que arranca el año se tiene información suficiente para vacunar a menores de 16 años. Esto es por un precepto ético fundamental que establece que no se pueden hacer ensayos clínicos o no se deben hacer ensayos clínicos iniciales en personas menores de edad, pero ya las compañías farmacéuticas y los distintos centros de investigación que colaboran con ellas tienen planeados y están en programación ensayos clínicos secundarios sobre la seguridad y eficacia en personas menores de edad. Esto, posiblemente a lo largo del año, rumbo a la mitad del año, habrá información para menores de edad y se podrá continuar con el resto de las edades.",0.0,117,05,01,2021
HUGO LOPEZ-GATELL RAMIREZ,"Vamos a ver las curvas epidémicas estatales, un recorrido de la epidemia en el estado actual. El corte de información es de ayer por la tarde, de modo que está actualizada la realidad epidemiológica. Esta es la misma curva, ya destaqué, son los casos estimados, que son un poco más de un millón 636 mil y dos semanas consecutivas en el final del año de descenso, el descenso más reciente, 21 por ciento.",0.0,73,05,01,2021
HUGO LOPEZ-GATELL RAMIREZ,"La curva de mortalidad ha continuado todavía en ascenso, el ascenso más reciente es de tres por ciento entre la semana 51 y la 52, y generalmente con un periodo de 15 a 21 días después de los casos cambia la curva de defunciones en la misma dirección; entonces, esperemos que, si persiste el descenso de casos, empezará a ocurrir el descenso de defunciones.",0.0,64,05,01,2021
HUGO LOPEZ-GATELL RAMIREZ,"La siguiente es las hospitalizaciones. Lo mismo, con un periodo también de 15 a 21 días se ve un cambio en la tendencia de hospitalizaciones. Si persiste el descenso de casos, empezará el descenso de hospitalizaciones.",0.0,36,05,01,2021
HUGO LOPEZ-GATELL RAMIREZ,"Ahora sí, estado por estado. La misma lógica que hemos comentado todos los martes del Pulso de la Salud: vemos aquí los casos estimados, aquí las defunciones, en la esquina superior derecha el semáforo vigente en estos momentos, que fue actualizado el pasado viernes 1 de enero.",0.0,47,05,01,2021
