Participante,Texto,Sentimiento,Palabras,Dia,Mes,Anio
PRESIDENTE ANDRES MANUEL LOPEZ OBRADOR, Buenos días.,0.9384397760356878,2,30,05,2019
PRESIDENTE ANDRES MANUEL LOPEZ OBRADOR,"Nos da mucho gusto reunirnos, como lo hacemos cotidianamente todos los días a esta hora en Palacio Nacional, de lunes a viernes a las 7:00 de la mañana. Ahora se nos hizo un poco tarde.",0.8802543412435,35,30,05,2019
PRESIDENTE ANDRES MANUEL LOPEZ OBRADOR,"Llegamos aquí, a Palacio, de lunes a viernes un poco antes de las 6:00, porque de 6:00 a 7:00 tenemos la reunión del Gabinete de Seguridad para conocer lo que sucede en el país en materia de inseguridad, delitos, violencia, en las últimas 24 horas.",0.5756819587460654,45,30,05,2019
PRESIDENTE ANDRES MANUEL LOPEZ OBRADOR,"Tomamos decisiones desde muy temprano con el secretario de Seguridad, el secretario de la Defensa, secretario de Marina, la secretaria de Gobernación, el consejero jurídico, y a esas reuniones asisten también otros servidores públicos. Terminando esa reunión estamos aquí con ustedes.",0.5060513771306623,41,30,05,2019
PRESIDENTE ANDRES MANUEL LOPEZ OBRADOR,El día de hoy vamos a informar de algo muy importante.,0.5492485262513178,11,30,05,2019
PRESIDENTE ANDRES MANUEL LOPEZ OBRADOR,Hoy se va a enviar la información respectiva para que el Senado de la República ratifique el Tratado de Libre Comercio con Estados Unidos y Canadá.,0.386930103527399,26,30,05,2019
PRESIDENTE ANDRES MANUEL LOPEZ OBRADOR,"Es el procedimiento que falta, la ratificación del Senado, y de manera respetuosa, por tratarse de un poder independiente, autónomo, vamos a solicitar a los senadores que consideren el que se convoque a un periodo extraordinario para la aprobación del Tratado de Libre Comercio con Estados Unidos y Canadá.",0.26902375839461323,49,30,05,2019
PRESIDENTE ANDRES MANUEL LOPEZ OBRADOR,"El día de hoy el consejero jurídico, Julio Scherer; el secretario de Relaciones Exteriores, Marcelo Ebrard; la secretaria de Economía, Graciela Márquez; y el subsecretario para América del Norte, que ha actuado como nuestro principal negociador, Jesús Seade, los cuatro van a asistir al Senado por la tarde para presentar ya formalmente los documentos.",0.018600911144434476,54,30,05,2019
PRESIDENTE ANDRES MANUEL LOPEZ OBRADOR,"Queremos explicarles cuál es el procedimiento, por qué tiene que ser este acuerdo ratificado en el Senado, sólo en esa cámara alta y que conozcan cómo se lleva a cabo el procedimiento para la aprobación.",0.354044960587489,35,30,05,2019
PRESIDENTE ANDRES MANUEL LOPEZ OBRADOR,"En este caso es una aprobación con mayoría simple, de modo que estamos seguros que se va a aprobar en el Senado.",0.28640875466623306,22,30,05,2019
PRESIDENTE ANDRES MANUEL LOPEZ OBRADOR,"Desde luego, repito, se trata de un poder independiente, ellos van a decidir. Pero yo señalo que existe, si no un consenso, existe un apoyo mayoritario del pueblo de México para que se apruebe y ratifique este tratado.",0.011531298140693085,38,30,05,2019
PRESIDENTE ANDRES MANUEL LOPEZ OBRADOR,"Consideramos que nos conviene, que es benéfico para que haya más inversión extranjera, que se estimule la participación de las empresas, para la creación de empleos bien pagados en el país.",0.10673326629031218,31,30,05,2019
PRESIDENTE ANDRES MANUEL LOPEZ OBRADOR,"Por eso considero que se va a aprobar, porque los legisladores, en este caso los senadores, han actuado siempre de manera muy responsable.",0.5438453183600716,23,30,05,2019
PRESIDENTE ANDRES MANUEL LOPEZ OBRADOR,"Le vamos a dar la palabra a Julio Scherer Ibarra, que es el consejero jurídico de la Presidencia, para que él explique sobre el procedimiento; luego les va a informar Marcelo Ebrard, secretario de Relaciones Exteriores; luego la doctora Graciela Márquez, secretaria de Economía; y luego Jesús Seade, que ha sido clave en este proceso de negociación del tratado; nos ha ayudado mucho a que tanto en Estados Unidos como en Canadá, se acepten condiciones que ayuden a tener una relación de cooperación para el desarrollo, cooperación para el desarrollo y para un comercio justo, sin barreras, sin aranceles, que permita a México crecer con este acuerdo comercial, con este tratado.",0.09848279702125295,111,30,05,2019
PRESIDENTE ANDRES MANUEL LOPEZ OBRADOR,"Entonces, Julio va a informarles sobre el procedimiento.",0.03432235469170484,8,30,05,2019
JULIO SCHERER IBARRA, CONSEJERO JURÍDICO DE LA PRESIDENCIA DE LA REPÚBLICA: Muy buenos días.,0.554383285186337,11,30,05,2019
JULIO SCHERER IBARRA,"Como les comentó el señor presidente, vamos a presentar hoy en el Senado el tratado y vamos a explicar cuál es el procedimiento que vamos a llevar a cabo.",0.1169536913327138,29,30,05,2019
JULIO SCHERER IBARRA,"El tratado entre México, Estados Unidos y Canadá fue firmado por las tres partes el 30 de noviembre de 2018 en la Cumbre del G-20 en Buenos Aires, Argentina. El T-MEC, como se le denomina, se encuentra pendiente de aprobación en el Congreso de los Estados Unidos de Norteamérica.",0.46578385379228426,49,30,05,2019
JULIO SCHERER IBARRA,En el Senado de la República no se ha se recibido el T-MEC para efectos de su aprobación. En términos de los dispuesto en el segundo párrafo de la fracción primera del artículo 76 de la Constitución Política de los Estados Unidos Mexicanos.,0.11889498619118506,43,30,05,2019
JULIO SCHERER IBARRA,"La aprobación de los congresos en los países suscriptores pueden ser paralelas o en momentos distintos. Es importante destacar que la Constitución Política le reconoce la facultad exclusiva a la Cámara de Senadores del Congreso de la Unión para terminar, denunciar, suspender, modificar, enmendar, retirar reservas y formular declaraciones interpretativas sobre tratados internacionales, por lo que en el momento en el que se reciba en la cámara, se actualiza la atribución constitucional en los términos antes señalados.",0.10415709339349938,77,30,05,2019
JULIO SCHERER IBARRA,"Asimismo, la Constitución Política de los Estados Unidos Mexicanos no establece mayoría calificada para la aprobación de los tratados internacionales, motivo por lo cual, como ya se explicó aquí, opera mayoría simple.",0.11627291349838544,32,30,05,2019
JULIO SCHERER IBARRA,"Al tratarse de una facultad exclusiva del Senado de la República, en términos del artículo 76, fracción primera, segundo párrafo de la Constitución Política, la aprobación del T-MEC puede realizarse tanto en las sesiones ordinarias como en un periodo extraordinario al que será seguramente convocado próximamente en la cámara que sea convocado por el Congreso y en la Comisión Permanente del Congreso de la Unión.",0.39899658043900593,65,30,05,2019
JULIO SCHERER IBARRA,"Por disposición del artículo 237 del Senado de la República, los tratados internaciones deberán turnarse para su estudio y dictamen a las comisiones de Relaciones Exteriores que corresponda; adicionalmente, podrá turnarse a otras comisiones cuyas materias corresponden con objeto de los mismos, a fin de que coadyuven en el dictamen del mismo.",0.4158293278710596,52,30,05,2019
JULIO SCHERER IBARRA,"En consecuencia, el turno que corresponderá al T-MEC deberá hacerse a las comisiones de Relaciones Exteriores de América del Norte y a la Comisión de Economía del Senado de la República.",0.029329824600861965,31,30,05,2019
JULIO SCHERER IBARRA,"Es todo, señor presidente.",0.6057504899615687,4,30,05,2019
JULIO SCHERER IBARRA,Muchas gracias.,0.500183160728402,2,30,05,2019
MARCELO EBRARD CASAUBON," Con su permiso, señor presidente.",0.323306212195259,5,30,05,2019
MARCELO EBRARD CASAUBON,Estimada y estimados colegas.,0.3919898286763967,4,30,05,2019
MARCELO EBRARD CASAUBON,Señoras y señores de los medios de comunicación.,0.3671395626257264,8,30,05,2019
MARCELO EBRARD CASAUBON,"Se toma la decisión, como aquí ya se informó por parte del titular del Ejecutivo, de iniciar el proceso de ratificación en México ante el Senado de la República del Tratado México-Estados Unidos-Canadá.",0.03918785180186457,33,30,05,2019
MARCELO EBRARD CASAUBON,"Este proceso es de ratificación, es decir, sí o no, va a tener las modalidades que la Constitución marca en el artículo 76 constitucional y han sido ya superados, ya como es de su conocimiento, los obstáculos que impedían que esto iniciase, especialmente las disposiciones que Estados Unidos tomó respecto a la denominada 232 en cuanto al acero y al aluminio.",0.08831501999162893,61,30,05,2019
MARCELO EBRARD CASAUBON,"Una vez resuelto esto, México inicia su proceso.",0.5239119359240066,8,30,05,2019
MARCELO EBRARD CASAUBON,"Los tres países tenemos procesos distintos en curso y con esta decisión que toma el presidente de la República, nosotros estaremos el día de hoy ante el Senado de la República para entregar los textos completos, el protocolo correspondiente para que puedan iniciar, cuando así lo determinen, el proceso de discusión y, en su caso, de ratificación.",0.033768860690888615,57,30,05,2019
MARCELO EBRARD CASAUBON,Muchas gracias.,0.500183160728402,2,30,05,2019
GRACIELA MARQUEZ COLIN," Presidente, colegas.",0.3863437944010945,2,30,05,2019
GRACIELA MARQUEZ COLIN,Muy buenos días a todos y todas.,0.926123185901524,7,30,05,2019
GRACIELA MARQUEZ COLIN,"Tengo el gusto de participarles, como ya se ha anticipado acá, que el día de hoy estaremos entregando en el Senado el texto, el protocolo y el reporte del Tratado México, Estados Unidos y Canadá.",0.08544212600022721,35,30,05,2019
GRACIELA MARQUEZ COLIN,"Así se da el último paso a un proceso de modernización del tratado comercial que Estados Unidos, México y Canadá firmaron en 1994. Este proceso de modernización de ese tratado inició en 2017.",0.1709625359508733,33,30,05,2019
GRACIELA MARQUEZ COLIN,"A partir de agosto del año pasado nuestro gobierno decidió acompañar el último tramo de la negociación del tratado. El 30 de noviembre se firmó el protocolo dando por concluidas las negociaciones. De entonces a la fecha hemos actualizado algunos procesos, algunos temas importantes del cual se hablará posteriormente, pero hoy lo importante a señalar es este paso, este último paso que damos para la ratificación que hará la Cámara de Senadores.",0.1654044220108053,72,30,05,2019
GRACIELA MARQUEZ COLIN,¿Por qué es importante este tratado y por qué la ratificación nos abre una nueva perspectiva en la relación con nuestros dos socios de América Latina?,0.776708500953354,26,30,05,2019
GRACIELA MARQUEZ COLIN,"En primer lugar, porque el nuevo tratado abrirá espacios para la inversión y el comercio, beneficiando a la actividad productiva del país.",0.6326103346252391,22,30,05,2019
GRACIELA MARQUEZ COLIN,"Los flujos comerciales en América del Norte, los flujos comerciales que se desarrollan entre México, Estados Unidos y Canadá, equivalen a 1.2 billones de dólares. Esta es una de las áreas de intercambio comercial más importantes de nuestro planeta y por eso es tan importante que nosotros demos el paso de mantener un tratado comercial en América del Norte para garantizar que en México se creen más y mejores empleos, que se beneficie la actividad productiva, que los inversionistas tengan certidumbre y certeza en el momento de invertir en nuestro país, que las inversiones lleguen a nuestro país para producir bienes para el mercado y bienes para el mercado de América del Norte, en donde encontraran ventajas al no haber barreras arancelarías.",0.0586854092641602,122,30,05,2019
GRACIELA MARQUEZ COLIN,"Así, pues, tenemos que ratificar el Acuerdo de Estados Unidos, Canadá y México.  Tiene una importancia muy grande en este momento.",0.6591399192837932,21,30,05,2019
GRACIELA MARQUEZ COLIN,"Nosotros presentaremos hoy el texto al Senado de la República. Habrá las deliberaciones correspondientes, pero seguramente los senadores tomaran en cuenta todos estos datos en términos del impacto productivo, del impacto en inversiones, del impacto comercial del tratado de México, Estados Unidos y Canadá.",0.22323570561178183,44,30,05,2019
GRACIELA MARQUEZ COLIN,"La modernización de este tratado, necesaria porque cambió el mundo en más de un cuarto de siglo de vigencia del acuerdo anterior, también contribuye, y en eso México también debe de estar muy orgulloso de contribuir a construir una región en América del Norte de alta competitividad.",0.5432760009996469,47,30,05,2019
GRACIELA MARQUEZ COLIN,Nosotros en México tenemos una plataforma exportadora muy importante y nos beneficiamos también de los flujos de inversión.,0.5170792953192344,18,30,05,2019
GRACIELA MARQUEZ COLIN,Junto con nuestros socios seguramente construiremos bienestar para México y bienestar en las economías de nuestros socios comerciales.,0.3681190629007235,18,30,05,2019
GRACIELA MARQUEZ COLIN,Muchas gracias.,0.500183160728402,2,30,05,2019
GRACIELA MARQUEZ COLIN,"Es cuanto, señor presidente.",0.01045651494289542,4,30,05,2019
JESUS SEADE KURI," Muchas gracias, señor presidente.",0.42659809592117026,4,30,05,2019
JESUS SEADE KURI,"Colegas, estimados, estimadas amigas y amigos de la prensa y otros que estén presentes:",0.4935458428403805,14,30,05,2019
JESUS SEADE KURI,Yo lo que quiero agregar es nada más un par de palabras sobre la pregunta importante en este momento:,0.3067995404707008,19,30,05,2019
JESUS SEADE KURI,¿Por qué hoy? ¿Por qué ahora se da este paso?,0.3954695489511503,10,30,05,2019
JESUS SEADE KURI,"Bueno, siendo un poco frívolo, no dejo de notar, y no es que yo lo haya escuchado del presidente, pero observo que hoy se cumplen seis meses de que se firmó aquel tratado, firmado por el gobierno anterior, pero al cual el entonces presidente electo brindó todo su apoyo, corrigiendo lo que hubiera de ser corregido y se corrigió en forma totalmente satisfactoria para nosotros y ayudando en forma sustantiva a que saliera, y se firmara hace seis meses. Entonces, parecería ser buen momento.",0.09445618856729457,84,30,05,2019
JESUS SEADE KURI,"Pero más importante, más específicamente, yo pondría a su consideración tres factores, tres metas cruciales que tenían que cumplirse antes de llegar a esta de la ratificación.",0.33774432369499024,27,30,05,2019
JESUS SEADE KURI,"La primera. Ya tiene un mes exactamente de haberse cumplido, pero se las recuerdo, era la Reforma Laboral, todo el conjunto de cambios legislativos muy importantes, históricamente importantes que metimos, que reflejaban tanto un compromiso que adoptamos, y con mucho gusto, en el contexto del Tratado con Estados Unidos y con Canadá, como un compromiso político de décadas del señor presidente y de todos los que estamos con él en este gobierno.",0.5636427300581506,72,30,05,2019
JESUS SEADE KURI,"Entonces, se pasa la Reforma Laboral hace un mes, que era un requerimiento total para poder llegar a esta fase.",0.029984972518635224,20,30,05,2019
JESUS SEADE KURI,"Segundo lugar. Como ya se mencionó, el problema también muy acucioso, muy complicado del acero. Nosotros en un momento dado dijimos: No se debe firmar, allá en noviembre, el tratado, el borrador del tratado, sin resolver lo del acero. No se hizo, no se pudo, han pasado meses, pero era una condición total que México había expresado repetidas veces; y Canadá, por su lado, también.",0.4814599675904945,65,30,05,2019
JESUS SEADE KURI,"Afortunadamente, ya muy recientemente se pudo resolver eso, es otro obstáculo que se supera y que nos permite pasar a la etapa definitiva.",0.8140176500691001,23,30,05,2019
JESUS SEADE KURI,"Y tercer lugar. Hemos estado en contacto estrecho con los ejecutivos o negociadores, los ejecutivos de los dos países socios, de Canadá y de Estados Unidos. En los tres países son distintos procedimientos, pero siempre en todos los casos el elemento común es que la ratificación la realiza el Legislativo, que tiene una personalidad soberana, pero los Ejecutivos son los que negocian, son los que preparan y son los que en un momento dado lanzan a la ratificación el proceso.",0.13845339102670415,80,30,05,2019
JESUS SEADE KURI,"Y en esta comunicación cercana que tenemos con Canadá y con Estados Unidos observamos, y le hemos informado al señor presidente, que detectamos importantes avances. Ciertamente en Canadá (que acaba -y ayer también- de iniciar el lado técnico de su proceso) como en Estados Unidos, que es más complejo todo el proceso, pero están avanzando las cosas en una forma muy atractiva.",0.5196765896107355,62,30,05,2019
JESUS SEADE KURI,"En Estados Unidos el Legislativo entra en receso a fin de julio, y el objetivo de ellos y que todos esperamos que así sea, es que la ratificación se complete entre junio y julio. En Canadá el receso entra en julio, entonces la ratificación probablemente sea en el mes de junio.",0.30279162452604885,51,30,05,2019
JESUS SEADE KURI,"Y en México estamos en receso legislativo, pero tenemos perfectamente, como señaló el canciller, la capacidad de solicitar a los señores senadores consideración bajo régimen de excepción en este periodo y tenemos el sentir total de que es oportuno.",0.3907027503724617,39,30,05,2019
JESUS SEADE KURI,"Entonces, queremos buscar la ratificación en México en las próximas semanas y en los tres países en este lado de acá del verano, antes de agosto, antes de julio en el caso de Canadá.",0.32024245142581403,34,30,05,2019
JESUS SEADE KURI,"Entonces, todo marcha bien.",0.3287764918699622,4,30,05,2019
JESUS SEADE KURI,Muchas gracias.,0.500183160728402,2,30,05,2019
PRESIDENTE ANDRES MANUEL LOPEZ OBRADOR," Bueno, pues esa es la información.",0.6371438116427247,6,30,05,2019
PRESIDENTE ANDRES MANUEL LOPEZ OBRADOR,Hoy se entrega la documentación al Senado para que se inicie el proceso de ratificación del tratado.,0.05527203170182874,17,30,05,2019
PRESIDENTE ANDRES MANUEL LOPEZ OBRADOR,"Estamos seguros que vamos a contar con el apoyo de los senadores y que pronto se va a tener esta aprobación que va a ayudar mucho a mantener la confianza en México, en su pueblo, en su gobierno. Ese es el propósito de este anuncio.",0.591749510026452,45,30,05,2019
PRESIDENTE ANDRES MANUEL LOPEZ OBRADOR,"Hoy por la tarde, quienes están aquí van a asistir al Senado de la República para entregar el documento principal y los documentos accesorios.",0.4340575499189707,24,30,05,2019
PRESIDENTE ANDRES MANUEL LOPEZ OBRADOR,"Eso es básicamente lo que queríamos tratarle hoy y abrimos la sesión de preguntas y respuestas. Si les parece, tenemos pendientes de ayer a José Ley Gutiérrez y a Carlos Pozos, que quedamos pendientes, pero si hay algo que tenga que ver primero con el tema del tratado, podemos desahogarlo y luego entramos a los asuntos generales. ¿Les parece?",0.15380987728409207,59,30,05,2019
PRESIDENTE ANDRES MANUEL LOPEZ OBRADOR,Es sobre el tratado.,0.3201975711705174,4,30,05,2019
PREGUNTA," Si, buenos días. Solamente para el secretario de Relaciones.",0.4195847247232829,9,30,05,2019
PREGUNTA,¿Qué es lo que se contempla o qué se va a hacer para resolver el serio problema del tráfico de mercancías?,0.6248890403688969,21,30,05,2019
PREGUNTA,"Porque constantemente se bloquean porque no tienen, en Estados Unidos lo afirman, la capacidad para estarlo revisando y esto causó pérdidas por miles de millones de dólares en este último año.",0.0072886708186137026,31,30,05,2019
MARCELO EBRARD CASAUBON," Sí, con mucho gusto.",0.6532755473461241,4,30,05,2019
MARCELO EBRARD CASAUBON,Se refiere el compañero a los retrasos que hemos observado en los puertos de entrada a los Estados Unidos a lo largo de toda la frontera con diferentes intensidades.,0.45464168674985306,29,30,05,2019
MARCELO EBRARD CASAUBON,"Brevemente diría que se llevó a cabo la…en primer lugar, mandamos una nota diplomática a Washington, yo estuve en Washington recientemente hace unos días y fue uno de los temas de conversación más importantes.",0.7739203073405899,34,30,05,2019
MARCELO EBRARD CASAUBON,"Se hizo una evaluación del impacto económico y se realizó una reunión el 22 y 23 de mayo, acaba de ser en la Cancillería, fue la sede, porque hay muchos temas, no es el objeto de esta conferencia, pero diría brevemente que lo que acordamos fue monitorear los tiempos y ver las decisiones que van a tomar, que son varios capítulos.",0.6968734351887774,61,30,05,2019
MARCELO EBRARD CASAUBON,Un capítulo son inversiones que hay que hacer para ampliar los puertos o mejorar los ingresos.,0.636928140721309,16,30,05,2019
MARCELO EBRARD CASAUBON,"Dos. Son acuerdos con aduanas, que algunos no se han concretado, no se han materializado, que trataremos de que así se haga lo más pronto posible.",0.2542012376846777,26,30,05,2019
MARCELO EBRARD CASAUBON,"Tercero. La diferenciación de su personal porque argumentan varios problemas, uno de ellos la atención a migrantes, etcétera; entonces se acordó que aumentarían el personal.",0.1000328109028661,25,30,05,2019
MARCELO EBRARD CASAUBON,"Y estaremos presentando mensualmente cómo evoluciona este acuerdo a partir de este mes, es decir, del 22 de mayo estaré yo informando a alrededor del 22 de junio qué pasó con ese acuerdo.",0.5125157345384419,33,30,05,2019
PREGUNTA," Presidente buenos días, Marco Antonio Olvera, corresponsal de Radio Latino California.",0.1290735900991541,11,30,05,2019
PREGUNTA,Quisiera preguntarle. Yo sé que México necesita abrir sus mercados al exterior para que llegue la inversión extranjera y se generen fuentes de empleo y trabajo.,0.11935335260628001,26,30,05,2019
PREGUNTA,"Pero ¿qué pasa con las amenazas continuas de Donald Trump?, que amenaza con construir un muro y siempre está sobre esa retórica. Una.",0.0266167995609727,23,30,05,2019
PREGUNTA,"Y dos. El tema de los migrantes, si está contemplado dentro de este tratado de Libre comercio con Canadá, porque muchos migrantes se van porque no hay empleo y sé que hay temporadas en las que puede haber permisos temporales de tres o seis meses, para que obviamente ingresen y regresen a sus lugares de origen.",0.1949287185979783,56,30,05,2019
PRESIDENTE ANDRES MANUEL LOPEZ OBRADOR, Son dos temas importantes.,0.8090504027528488,4,30,05,2019
PRESIDENTE ANDRES MANUEL LOPEZ OBRADOR,"Primero, lo del tratado, que es lo que ahora estamos resolviendo y espero que sea en definitiva, porque, como tú lo señalas, es algo que nos conviene.",0.25533639124329965,27,30,05,2019
PRESIDENTE ANDRES MANUEL LOPEZ OBRADOR,"Y vamos a seguir atendiendo el otro tema, que es el fenómeno migratorio. Para eso vamos a seguir insistiendo en atender las causas, es decir, en buscar un acuerdo bilateral de cooperación para el desarrollo.",0.055835171673838176,35,30,05,2019
PRESIDENTE ANDRES MANUEL LOPEZ OBRADOR,"Lo que hemos estado planteando ya existe, incluso un plan elaborado por Cepal, y está viendo el secretario de Relaciones Exteriores todo lo vinculado al fenómeno migratorio. Pero no sólo los flujos de migrantes, sino atender las causas. Ese es el enfoque que estamos dándole a este asunto.",0.06851886287811171,48,30,05,2019
PRESIDENTE ANDRES MANUEL LOPEZ OBRADOR,"Seguramente Marcelo Ebrard va a informar sobre cómo vamos en este otro campo de la negociación, de los acuerdos.",0.090573603638828,19,30,05,2019
PRESIDENTE ANDRES MANUEL LOPEZ OBRADOR,"O sea, dividiría yo en dos: Lo del tratado, que es lo que estamos ahora resolviendo, y lo del tema migratorio, con el enfoque estructural, con un enfoque de fondo para que haya producción, haya empleos, haya bienestar en Centroamérica, en nuestro país y la migración se convierta en un asunto opcional, no obligatorio, que la gente que no se vea en la necesidad de migrar por falta de oportunidades o por violencia. Entonces, ese es el otro tema.",0.016719244102957755,79,30,05,2019
PRESIDENTE ANDRES MANUEL LOPEZ OBRADOR,"No sé si Marcelo sobre este último tema tengas algo que decir, un adelanto, porque acabas de regresar de Estados Unidos.",0.41682140809191726,21,30,05,2019
MARCELO EBRARD CASAUBON," Sí, señor presidente.",0.42593460805528316,3,30,05,2019
MARCELO EBRARD CASAUBON,"Se presentó muy brevemente en el tratado, que es tu pregunta… No hay un apartado respecto a esa materia; es decir, lo que hoy se va a presentar es lo que ya se conoce, que tiene que ver con otros capítulos y otros, vamos, inversiones.",0.07858217973867235,45,30,05,2019
MARCELO EBRARD CASAUBON,"México desde el principio que se tomó contacto con la administración Trump, que fue en el proceso entre, digamos, de transición, el presidente de la República le presentó, le envió una carta invitándolo para hacer una iniciativa de desarrollo respecto a los tres países: Guatemala, Honduras, El Salvador e informando que el sur de México iba a recibir una inversión muy relevante.",0.09159928749902638,62,30,05,2019
MARCELO EBRARD CASAUBON,"El primer acto de política exterior fue la firma con los presidentes de los países a los que hago referencia el día 1º de diciembre de una declaración política, cuyo contenido esencial es preparar esa iniciativa.",0.4332899728619934,36,30,05,2019
MARCELO EBRARD CASAUBON,"Se pidió a la Cepal que lo hiciese. El lunes de la semana pasada se presentó aquí. De inmediato fui a Washington a presentarlo, me recibieron en la Casa Blanca y de ahí, también por instrucciones del presidente de la República, fui a Berlín, Alemania, de donde llegué el día de ayer, a una conferencia que es una iniciativa de Alemania y por lo tanto esperamos también de la Unión Europea, hacia América Latina y el Caribe, cosa que celebramos porque Alemania había estado un poco, vamos a decir, concentrada en otras partes del mundo.",0.5667104667680505,95,30,05,2019
