Participante,Texto,Sentimiento,Palabras,Dia,Mes,Anio
PREGUNTA," Buenos días, presidente. Muchas gracias. Julio Omar Gómez. Buenos días a todos.",0.0,12,09,06,2023
PREGUNTA,"Presidente, nos hicieron llegar aquí, al medio, 87 ejidatarios expropiados del ejido Santiago Zacatula, del poblado del mismo nombre, municipio de la Unión Guerrero. También le solicitan el apoyo, pues le hacen un llamado de auxilio urgente para que no se consuma otro acto más de despojo de los que han venido dando a lo largo y ancho del país al amparo del Poder Judicial.",0.0,65,09,06,2023
PREGUNTA,"El predio denominado es Isla de la Palma, perteneciente al ejido Santiago Zacatula, del poblado del mismo nombre, y habían expropiado 645 hectáreas en 1982, en tiempos de los padres que ahora los denunciantes son los hijos. En la Isla de la Palma no se ha construido una sola empresa u obra o desarrollo desde el 82 y relatan que tuvieron la posesión desde el año 2008, que es cuando empieza el conflicto por la propiedad con el gobierno de Michoacán. Esa es una petición que le hacen y con mucho gusto le puedo hacer llegar los datos de las personas que solicitan acá.",0.0,104,09,06,2023
PREGUNTA,"Presidente, en otro tema, ya dándole seguimiento de empleados aduanales, una de las tareas en las que usted ha puesto especial interés y donde se ha notado la mano de Rafael Marín Mollinedo al frente de la Agencia Nacional de Aduanas, quieren comentarle y preguntarle sobre la llegada de Alex Tonatiuh Márquez Hernández a la primera línea de la ANAM, con muy mala reputación y ruido alrededor de su llegada.",0.0,70,09,06,2023
PREGUNTA,"Nos han comentado que hay otros dos personajes cercanos a la dirección: Héctor Ruiz Ángel y Alejandro Enrique Arco Romero. Lograron saltarse los requisitos y meter a Márquez en los mandos de la dirección. Empleados de la aduana insisten que del norte del país se han manifestado en ese desacuerdo con esas personas porque están llegando con una clara actitud de dominar y tener el control aduanal, precisamente contra lo que usted está luchando, que es la corrupción, donde incluso el administrador de Reynosa, Felipe Martínez Roque, se jacta que como grupo han llegado desde Reynosa para controlar el contrabando.",0.0,100,09,06,2023
PREGUNTA,"Y queda claro que Marín Mollinedo quiere cumplir con su encomienda, hay escritos en los que piden el cambio de ciertos subadministradores para tener orden en el contrabando, pero también en la agencia se preguntan por qué Tonatiuh, Héctor y Felipe tienen control, junto con el general Ramiro Gómez Contreras, quien lejos de disminuir el contrabando, lo está dejando pasar, presidente, pues son llamados que hacen los propios empleados aduanales.",0.0,70,09,06,2023
PREGUNTA,"Por otra parte, nos hicieron llegar también, señor presidente, que siguen tratando de hacer trampas a los que usualmente se acostumbraban, participando en las licitaciones del IMSS a pesar de estar inhabilitados en Impromed y estar inhabilitada, pero se coordinan con Intermed, ambas empresas están relacionadas entre sí, donde supuestamente tienen el mismo dueño, Fernando Chaín.",0.0,56,09,06,2023
PREGUNTA,"Y realizaron operaciones entre sí por 206 millones en enero-abril de este año, simulan operaciones para transferir esas ganancias entre ellas mismas, muy parecido a las operaciones que hacía Genesis HealthCare, y concursa, cobra al gobierno, pero después ya se transfieren a otra empresa que se llama Falcón, que también, igual, está inhabilitada en el 2023. Ya se han hecho transferencias por 126 millones de pesos por licitaciones que mediante estos engaños siguen participando. Pues aquí estas personas que se sienten ofendidas solicitan una revisión sobre este aparente acto de corrupción, presidente.",0.0,92,09,06,2023
PREGUNTA,"Esos son tres pequeños temas, pero le diré que hay un atraso ahí que tenemos en la edición dando seguimiento a algunas solicitudes, y les voy a decir muy rápido porque aquí tengo las solicitudes que con mucho gusto se lo puedo hacer llegar a Jesús Ramírez por manera digital, si usted gusta. Le voy a decir un poco rapidísimo todos los puntos:",0.0,63,09,06,2023
PREGUNTA,"Hubo un recurso del Conabox que se prometió a Baja California Sur, no llegó, y el presidente de la Comisión de Boxeo solicita saber qué pasó con ese recurso que nunca llegó a los deportistas. Aquí tengo la solicitud, también se la puedo hacer llegar.",0.0,45,09,06,2023
PREGUNTA,"También hay otra demanda en Baja California Sur, nos hacen llegar una carta sobre discriminación laboral, aprovechando que va a estar allá, presidente. Con gusto le paso a Jesús el documento donde le hacen el reconocimiento que los trabajadores de Reformex, su situación laboral y la discriminación total con los no sindicalizados.",0.0,52,09,06,2023
PREGUNTA,"Y una asociación de trabajadores petroleros jubilados de Poza Rica, Veracruz, fueron defraudados por una caja de ahorro y piden su intervención, presidente, ya que es un problema tan añejo y afecta a varias familias veracruzanas, cientos.",0.0,37,09,06,2023
PREGUNTA,"Y, pues, bueno, igual aquí tengo otra vez otra solicitud donde el Valle de Guadalupe pues no ha tenido el abasto del agua y en Ensenada, y los pobladores le solicitan un pozo profundo para el abasto de cientos de familias, aquí tengo también la solicitud que le hacen llegar.",0.0,50,09,06,2023
PREGUNTA,"Y sobre el conflicto de trabajadores de la Cámara de Senadores que le había planteado en la última ocasión del sindicato del Senado y contra la magistrada Bertha Orozco, fueron recibidos muy bien por la secretaria del Trabajo, pero no es la encargada, sino la Secretaría Gobernación a través del Tribunal Federal de Conciliación y Arbitraje. Ahí sí le solicitaría que nos ayudara para tener esa cita a los trabajadores del sindicato de la Cámara de Senadores para poder tener esa cita con la dependencia correspondiente.",0.0,86,09,06,2023
PREGUNTA,"Y ya, por último, el tema que le expuse sobre el faro viejo, el emblema de Cabo San Lucas, pues fueron muy bien atendidos por el director Diego Prieto, pero nos comentó que pertenece al Inbal, por lo que se mandó oficio, pero no se ha realizado algún contacto con el instituto, por lo que también se requiere dar seguimiento a este asunto de la privatización de un inmueble de la nación. Entonces, también ojalá nos pueda echar la mano. Yo sé que son muchos detalles, presidente, se los quise decir a detalle, pero aquí están todas las solicitudes.",0.0,99,09,06,2023
PREGUNTA," Señor presidente, yo vengo de la zona maya, de…",0.0,9,09,06,2023
PREGUNTA," Gracias, presidente. Rubí Bobadilla, del Informador en Jalisco.",0.0,8,09,06,2023
PREGUNTA,"Preguntarle, bueno, que el problema de las desapariciones afecta gravemente a todo el país. Jalisco se encuentra liderando este número de personas desaparecidas a nivel nacional. En Jalisco tenemos este problema en el cual además se criminaliza a las víctimas y pues, bueno, después aparecen los cuerpos en fosas clandestinas, donde también tenemos una grave crisis. En este sentido tenemos una alta impunidad también, en el estado, donde la impunidad supera el 99 por ciento, tanto en homicidios como en desapariciones.",0.0,81,09,06,2023
PREGUNTA,Me gustaría preguntarle si usted ya habló con el presidente en esta temática precisamente. ¿Cuáles serían las indicaciones para el estado de Jalisco? ¿Qué sigue de pendientes en este tema?,0.0,30,09,06,2023
PREGUNTA,"Además de que el gobernador Enrique Alfaro dice que existe un doble registro de desapariciones, porque en Jalisco tienen unos datos y el Registro Nacional de Personas Desaparecidas tiene otros datos más, debido a un desorden que tiene la Comisión Nacional de Búsqueda. ¿Qué hay en este tema, en primer lugar, presidente?",0.0,52,09,06,2023
PREGUNTA," Presidente, en este mismo sentido, ya que usted lo comenta, que ha estado en contacto ya también con el gobierno de Estados Unidos, no sé si fue a partir de que dio a conocer este documento en abril pasado o si ya estaban trabajando desde antes para identificar este tipo de sitios clandestinos que no solamente operan principalmente en Jalisco, Nayarit y Quintana Roo, sino también en otras partes de la república. Usted, con tan buena relación que tiene, por ejemplo, con Ken Salazar, ¿sí se está actuando?, ¿sí van contra estos sitios?",0.0,93,09,06,2023
PREGUNTA," Perfecto, presidente.",0.0,2,09,06,2023
PREGUNTA,"En mi siguiente pregunta, su opinión respecto de estos estados que están endeudando a sus entidades, a sus ciudadanos, como sabemos, Enrique Alfaro inició la administración con alrededor de una deuda de 17 mil millones de pesos y ahorita va superior a los 34 mil millones de pesos, esto en el sentido de que estaría buscando estas negociaciones para poder, no tanto como separarse del tema de los impuestos, pero sí quisiera un esquema el independiente para poder organizar sus recursos. ¿Esto tiene lógica cuando endeudas a un estado y quieres como separarte del sistema financiero que se tiene?",0.0,99,09,06,2023
PREGUNTA, En la reforma nos podría usted adelantar cuál sería el tope o más o menos.,0.0,15,09,06,2023
PREGUNTA," Gracias, presidente.",0.0,2,09,06,2023
PREGUNTA," Presidente, yo…",0.0,2,09,06,2023
PREGUNTA," Muy buenos días, señor presidente.",0.0,5,09,06,2023
PREGUNTA,"Janet Galindo, de Grupo Transmedia La Chispa Campeche, Tabasco, Yucatán, Quintana Roo, Petrolera, Estado de México, Ciudad de México.",0.0,19,09,06,2023
PREGUNTA,"Señor presidente, usted ha estado tocando constantemente —bueno, y hemos visto— de hecho, ayer se tocó el tema del rescate arqueológico donde ha habido grandes avances; sin embargo, no nada más ha sido a lo largo del Tren Maya donde se ha tenido, si ha habido rescate.",0.0,47,09,06,2023
PREGUNTA,"Pero hay un tema que se ha quedado pausado, nos había ya comentado algo sobre el rescate del penacho de Moctezuma. ¿Qué es lo que ha pasado? ¿Cómo va ese proceso? Porque muchos lo tomaron esto como una burla; sin embargo, hemos visto que, a través de su administración, o sea, este tema de este rescate ha sido y va en serio. ¿Cómo este tema? ¿Cómo va este proceso?",0.0,69,09,06,2023
PREGUNTA, ¿Lo aconsejaban?,0.0,2,09,06,2023
PREGUNTA," Gracias, muy amable. De hecho, bueno, no, no quita el dedo del renglón, no se quita, ¿verdad?",0.0,17,09,06,2023
PREGUNTA," Okey, gracias.",0.0,2,09,06,2023
PREGUNTA,Y ayer usted tuvo una reunión con Del Mazo. No sé si nos pudiera comentar qué trascendió. ¿Tocaron temas importantes en esta reunión?,0.0,23,09,06,2023
PREGUNTA, ¿Es fake entonces esa foto que circuló?,0.0,7,09,06,2023
PREGUNTA, Es que ayer salió esa foto.,0.0,6,09,06,2023
PREGUNTA," Con Ricardo Monreal, con el senador.",0.0,6,09,06,2023
PREGUNTA," Sí, sí, ayer.",0.0,3,09,06,2023
PREGUNTA," Sí, como que estaban preparando algo.",0.0,6,09,06,2023
PREGUNTA,"Señor presidente, y rápidamente, en mi última participación le comenté sobre una carta que le había mandado el doctor Carlos Rafael García Ortiz —él es tabasqueño— con respecto a cómo se encontraban algunos ductos en hospitales en el sureste.",0.0,39,09,06,2023
PREGUNTA,"Él le mandó un compendio de fotos que me pidieron entregárselo. Si se los hago llegar a través de Jesús, por favor. Aquí vienen todas las fotos, que él quisiera ver si usted personalmente los pudiera revisar.",0.0,37,09,06,2023
PREGUNTA,Es cuanto. Muchísimas gracias.,0.0,4,09,06,2023
PREGUNTA," Buenos días, compañeras y compañeros; buenos días, señor presidente.",0.0,9,09,06,2023
PREGUNTA,"Antes que nada, pues agradezco que por fin me haya dado nuevamente la palabra. Francamente cumplo seis meses sin poder participar, estoy aquí asistiendo una vez a la semana desde hace seis meses, pero, pues gracias que nuevamente me da la oportunidad de hablar.",0.0,44,09,06,2023
PREGUNTA,"Presidente, antes que nada, le quiero…. Son tres denuncias que le traigo:",0.0,12,09,06,2023
PREGUNTA,"Una es de una ciudadana de la Ciudad de México, que nos ha pedido hacerle saber a usted de las violaciones que ha sufrido a sus derechos humanos por parte del Instituto Mexicano del Seguro Social. En Puntos Suspensivos nos dimos a la tarea no dimos a la tarea de investigar su caso y resulta que se trata de la inadecuada aplicación de la ley, que no sólo es la ley del Seguro Social de 1973, sino la ley de 1997, la ley del Issste, la ley de Pemex, entre otras más.",0.0,92,09,06,2023
PREGUNTA,"Me explico. El artículo 155 de la Ley del Seguro Social de 1973 señala, y cito textualmente: ‘El derecho al goce de la pensión de viudez comenzará desde el día del fallecimiento del asegurado o pensionado, y cesará con la muerte del beneficiario o cuando la viuda o concubina contrajera en matrimonio o se encontraran en concubinato’.",0.0,57,09,06,2023
PREGUNTA,"El argumento que da el IMSS respecto a dicho artículo es que se busca cubrir las necesidades por la pérdida de unos de los contribuyentes al gasto familiar. Al casarse de nuevo, dicha carencia desaparece porque el aporte económico le corresponde a la nueva pareja de la viuda.",0.0,48,09,06,2023
PREGUNTA,"Señor presidente, en el tiempo en que se legislaron estas leyes no se protegían los derechos de las mujeres como se hace hoy en día. Si ponemos atención, la ley habla de viuda y/o concubina, y no de viudo o concubino, siendo el artículo discriminatorio.",0.0,45,09,06,2023
PREGUNTA,"Debo decirle que la Suprema Corte de Justicia ya se ha pronunciado al respecto sobre este tipo de casos y señala que dichos artículos transgreden las garantías de igualdad a la no discriminación y de seguridad social, por lo que no existe justificación constitucional para que una persona que tiene derecho a recibir una pensión por viudez se le restrinja el derecho a percibirla por el hecho de que contraiga nuevo matrimonio, pues ello contraviene al principio de igualdad contenido en el artículo 1º de la Constitución Política de los Estados Unidos Mexicanos, así como el de protección a la institución de la familia consagrado en el artículo 4º y la garantía de seguridad social, y el principio de la previsión social contenidos en el artículo 123, apartado B fracción 11 inciso A.",0.0,133,09,06,2023
PREGUNTA,"En el caso que nos ocupa la ciudadana contaba con una pensión por viudez desde 1995; tiempo después, se volvió a casar. A unos años, el IMSS detectó que estaba asegurada por su segundo esposo, por lo que le canceló la pensión por viudez que recibía, requiriéndole la devolución de más de 800 mil pesos por haberlos cobrado inadecuadamente; de lo contrario, darán vista al Ministerio Público, es decir, de un derecho social que recibía ahora es señalada como una delincuente.",0.0,81,09,06,2023
PREGUNTA,"Lamentablemente para la señora su segundo esposo falleció a finales del año pasado. Al tratar de tramitar su segunda pensión no sólo se la negaron, sino que el funcionario que la atendió, de la subdelegación 10 Churubusco, le preguntó si estaba coleccionando pensiones.",0.0,43,09,06,2023
PREGUNTA,En Puntos Suspensivos decidimos traer este tema con usted porque la señora es una más de muchas mujeres en el país que han sido restringidas de sus derechos y violentadas hasta verbalmente por funcionarios insensibles.,0.0,35,09,06,2023
PREGUNTA,"La pregunta en concreto, señor presidente, es: ¿qué postura tomará la Cuarta Transformación en la aplicación de dichos artículos violatorios de derechos humanos, tomando en cuenta la llegada de la ministra Norma Lucía Piña Hernández como presidenta de la Suprema Corte de Justicia, que al parecer está más interesada en proteger los intereses de delincuentes que los derechos de la propia ciudadanía?",0.0,62,09,06,2023
PREGUNTA,"Esto como primera denuncia, presidente.",0.0,5,09,06,2023
PREGUNTA, La información.,0.0,2,09,06,2023
PREGUNTA," Con Jesús, ¿verdad?, pasar la información.",0.0,6,09,06,2023
PREGUNTA," Gracias, señor presidente. Y una disculpa, no me presenté. Héctor Tlatempa, de la cooperativa Puntos Suspensivos.",0.0,16,09,06,2023
PREGUNTA,"Y, bueno, en la siguiente denuncia, señor presidente, es con respecto a una tragedia que está viviendo una familia aquí también en la Ciudad de México, ya que en diciembre del año pasado el joven Emmanuel Rubén Ruiz Martínez, de 26 años, fue atropellado por el Metrobús aproximadamente a las 2:17 horas, esto en la alcaldía Tlalpan; lamentablemente, minutos después el joven perdió la vida.",0.0,65,09,06,2023
PREGUNTA,"Cabe mencionar que Emmanuel Ruiz el día de su accidente se encontraba en horas de trabajo. De hecho, era la hora de su comida cuando el gerente de la sucursal de la tienda Elektra Tláhuac lo mandó a recoger unos celulares a unos domicilios de la zona, fue entonces que sucedió el lamentable accidente.",0.0,54,09,06,2023
PREGUNTA,"El caso es que, desde diciembre a la fecha, las autoridades como el Ministerio Público, la Fiscalía de Justicia de la Ciudad de México, las autoridades locales no han dado información concreta y precisa de qué fue lo que sucedió, tampoco han presentado videos de las cámaras de la sucursal ni tampoco del Metrobús, aunque la familia las ha solicitado desde el primer momento. Sin embargo, ya se determinó un supuesto peritaje en donde el resultado fue que el joven se suicidó.",0.0,82,09,06,2023
PREGUNTA,"Señor presidente, la señora Yazmín Karina Ruiz, hermana de Emmanuel, le pide de favor su intervención para que se haga justicia, ya que ni la empresa en este caso…. Él estaba en una empresa que se llama Xioami, una empresa china que vende celulares, y el joven trabajaba para esta empresa, pero estaba en la sucursal de Elektra, ahí el gerente es el que lo manda a hacer este trabajo. Bueno, pues ni Elektra, ni el Metrobús, ni la empresa Xioami, ni el gobierno de la ciudad, en este caso, se han responsables de la muerte del joven Emmanuel Rubén Ruiz Martínez, en este caso por lo menos para darles la información precisa de lo que es lo que sucedió, y la familia está esperando que haya justicia.",0.0,128,09,06,2023
PREGUNTA,"Desde esa fecha, es el día que hasta ahora le han cerrado las puertas, le han dicho: ‘El joven se suicidó y ya no hay nada más qué hacer’. No sé si pudiera usted intervenir para esta justicia, gracias.",0.0,39,09,06,2023
PREGUNTA," Muy bien, presidente, gracias.",0.0,4,09,06,2023
PREGUNTA,"Y, por último —perdón compañeros. Desde hace seis meses que no participaba, y estos son casos desde el año pasado— señor presidente, le traigo también el caso de un extrabajador de Pemex que fue despedido injustamente, incluso este caso ahorita que se lo mencione ya le va a traer, lo va a recordar muy bien. Es de un extrabajador despedido injustamente hace ya 25 años y que sigue hasta el día de hoy luchando para que se le escuche y se haga justicia, se trata del señor Leoncio Salinas, quien por lo menos en ya cuatro ocasiones ha podido acercarse a usted para exponerle su caso, la tercera ocasión ocurrió el sábado 1º de octubre del 2022 en una de sus giras por Salina Cruz, Oaxaca.",0.0,126,09,06,2023
PREGUNTA,Este ejemplo que le voy a dar es lo que ha sucedido durante las cuatro ocasiones que usted ha dado una instrucción al señor Leoncio para que se dirija hacia otros funcionarios y esto que le voy a describir es lo que le ha pasado en las cuatro ocasiones.,0.0,49,09,06,2023
PREGUNTA,"Ahí el señor Leoncio pudo platicar con usted y exponerle su situación, después de escucharlo con atención dio la instrucción a un asistente de nombre Jimena, posteriormente guía y acompaña hasta el ingeniero Octavio Oropeza y se compromete en atender este caso y encontrar una solución favorable para el señor Leoncio, entonces instruyó a un asistente para que le entregara los datos a un señor que se llama Marcos Herrerías.",0.0,70,09,06,2023
PREGUNTA,"El lunes 3 de octubre vía telefónica el señor Alberto Pérez se comunica con el señor Leoncio y le manifiesta que por conducto del señor Marcos Herrerías él atendería todo lo relacionado a su caso, le comentó la posibilidad de reinstalarlo y más adelante incluso, la posibilidad, si él lo deseaba, de poderse jubilar. Quedó en comunicarse en los próximos días de esa semana, que le tendrían una respuesta seguramente favorable.",0.0,71,09,06,2023
PREGUNTA,"El 7 de octubre el señor Leoncio recibe un oficio de Pemex, en donde anteriores actuaciones y en diferentes sexenios le negaban nuevamente la solución favorable a su caso.",0.0,29,09,06,2023
PREGUNTA,"El 9 de marzo del presente año le vuelve a enviar el mismo oficio negativo a resolver su caso, incluyendo en el mismo el agravante sesgo de falta de humanismo, al mencionarle y reiterarle irracionalmente hasta de manera secuencial todos los oficios que, como en serie, le han enviado antes, que son lo mismo, respecto a esa su falta negativa.",0.0,60,09,06,2023
PREGUNTA,"Apenas el pasado 28 de mayo, nuevamente el señor Leoncio tuvo la oportunidad de acercarse a usted en su visita por Salina Cruz, Oaxaca. Ahí le hizo saber que desde más de siete meses que usted le pidió al ingeniero Octavio Romero Oropeza atender este caso y hasta ahora el señor Leoncio sigue esperando una solución favorable.",0.0,57,09,06,2023
PREGUNTA,"Usted llamó al gobernador Salomón Jara y le preguntó que si podía ayudar en el caso del señor Leoncio. El gobernador respondió que sí y usted dijo que iba a estar al pendiente de este caso. Lo citaron el lunes pasado a las 5:00 de la mañana en palacio de gobierno de Oaxaca, lo atendieron y escucharon los asistentes del gobernador, pero al final le comentaron que ese asunto no le competía al gobernador.",0.0,74,09,06,2023
PREGUNTA,"Señor presidente, es claro y notorio el deterioro del señor Leoncio Salinas por exigir y luchar porque se le haga justicia, en cuanto todos los daños y perjuicios que han causado a él y a su familia. Por ejemplo, su hijo, a raíz de este descuido, ya ha sufrido, ha intentado quitarse dos veces la vida, está llevando también un tratamiento sicológico para poder salir adelante. Todo esto implica también gastos extras para el señor Leoncio. Él ha estado ya endeudado por miles de pesos en el banco tratando de salir adelante.",0.0,92,09,06,2023
PREGUNTA,"Es importante también saber que fue boletinado en Pemex para que no fuera contratado en ninguna empresa, entonces el señor ha tenido que buscar otras maneras para tener recursos desde hace 25 años, que en febrero de este año los cumplió.",0.0,41,09,06,2023
PREGUNTA,"Entonces, él ha buscado desde hace ya… Desde que inició este gobierno, él encontró, por lo menos, esta luz, este aliento de decir encontrar la posibilidad de que en su gobierno fuera, primero, escuchado, y segundo, revisado todo con detenimiento, porque hay muchas cosas, supuestas pruebas que le fincaron, que le plantaron, y que no hay manera de comprobarlas, y él tiene todo muy bien documentado.",0.0,66,09,06,2023
PREGUNTA,"Hizo dos huelgas de hambre. El obispo también ahí de la comunidad lo apoyó, hizo en su momento un comunicado llamando al gobierno de ese momento para que se atendiera.",0.0,30,09,06,2023
PREGUNTA,"Pudo hablar con el sacerdote Solalinde para que también lo apoyara, Solalinde también trató de intervenir con la secretaria de Energía, Rocío Nahle; Rocío Nahle nunca pudo. Usted, de hecho, le había pedido a un asistente que lo contactara a Leoncio con Rocío Nahle; Rocío Nahle nunca lo recibió, ni lo atendió.",0.0,52,09,06,2023
PREGUNTA,"Es decir, son por lo menos tres funcionarios que usted ha pedido que pudieran recibirlo, que lo atiendan; y si acaso lo han escuchado, pero hasta ahorita, hasta el día de hoy, no ha recibido ni siquiera la atención y que revisen los papeles para que se den cuenta que es una injusticia, es por eso que traemos esta denuncia para ver si usted puede intervenir, presidente.",0.0,67,09,06,2023
PREGUNTA, Consolidación fiscal.,0.0,2,09,06,2023
PREGUNTA, Gracias.,0.0,1,09,06,2023
PREGUNTA,"Señor presidente, ya nada más por último quería compartirle: el día de ayer en redes sociales Acción Nacional, el Partido Acción Nacional, subió un spot, un spot en donde le dan voz al presidente Vicente Fox hablando acerca de las pensiones. Esto para mí es y para el medio importante que usted lo escuche, porque nos gustaría escuchar su versión. Vicente Fox está dando aquí una versión, cuando la da como verdadera, pero también nos gustaría escuchar la réplica, su versión. Se la pongo, son unos segundos nada más.",0.0,89,09,06,2023
PREGUNTA, PAN.,0.0,1,09,06,2023
PREGUNTA," Gracias, señor presidente.",0.0,3,09,06,2023
PREGUNTA, Esto opinaba Fox en 2004.,0.0,5,09,06,2023
PREGUNTA, Y le regaló también Punta Pájaros.,0.0,6,09,06,2023
PREGUNTA," Son políticas que implementan, de supuesto bienestar a través de tarjetas o programas sociales. ¿Se contrapone a combatir el trabajo al…?",0.0,21,09,06,2023
PREGUNTA," Gracias, presidente, buenos días.",0.0,4,09,06,2023
PREGUNTA,"Ángel Molina, de ATiempo.Tv, medio digital de Coahuila.",0.0,8,09,06,2023
PREGUNTA,"Hablando precisamente sobre la situación de Coahuila y de Manolo Jiménez, quien es virtual gobernador electo, pues preguntarle principalmente si ha tenido ya alguna especie de acercamiento con Manolo Jiménez después de su victoria el pasado domingo.",0.0,37,09,06,2023
PREGUNTA,"Y también preguntarle: a partir del 2024 habrá sólo dos gobernadores del PRI, que sería Manolo Jiménez y Esteban Villegas, en Durango; entonces, preguntarle cómo sería la relación del gobierno federal para con estos gobiernos estatales del PRI.",0.0,38,09,06,2023
