Participante,Texto,Sentimiento,Palabras,Dia,Mes,Anio
MARCELO EBRARD CASAUBON," Con su permiso señor presidente. Compañeras, compañeros, señoras y señores.",0.32823650481604266,10,24,11,2020
MARCELO EBRARD CASAUBON,"Bueno, informarles de dos cuestiones: la presencia internacional de México en esta materia y el avance en materia de vacunas.",0.32823650481604266,20,24,11,2020
MARCELO EBRARD CASAUBON,"Sobre lo primero, como ustedes saben, participó el señor presidente de la República el fin de semana en dos sesiones de los líderes del G20, las 20 economías más grandes del mundo. En esa sesión, tanto el sábado como el domingo el señor presidente planteó varias de las principales preocupaciones de México que me permito resumir muy brevemente lo que compartió el presidente López Obrador.",0.32823650481604266,65,24,11,2020
MARCELO EBRARD CASAUBON,Cinco lecciones que ha dejado la pandemia:,0.32823650481604266,7,24,11,2020
MARCELO EBRARD CASAUBON,"La salud es un derecho humano -la primera- fundamental que el Estado tiene que garantizar, ese derecho humano, y sin afán de lucro.",0.32823650481604266,23,24,11,2020
MARCELO EBRARD CASAUBON,"La segunda lección: es mejor prevenir que curar, evidentemente.",0.32823650481604266,9,24,11,2020
MARCELO EBRARD CASAUBON,"La tercera, la familia es la principal institución de seguridad social.",0.32823650481604266,11,24,11,2020
MARCELO EBRARD CASAUBON,"La cuarta lección: es necesario confiar en la responsabilidad de la gente y evitar medidas autoritarias, incluso mencionó los toques de queda y medidas muy drásticas que han tomado algunos países.",0.32823650481604266,31,24,11,2020
MARCELO EBRARD CASAUBON,"Y quinto, el rescate económico debe ser de abajo hacia arriba y no como se propone en las recetas tradicionales neoliberales, de arriba hacia abajo.",0.32823650481604266,25,24,11,2020
MARCELO EBRARD CASAUBON,Lecciones de esta pandemia.,0.32823650481604266,4,24,11,2020
MARCELO EBRARD CASAUBON,Dos propuestas principales:,0.32823650481604266,3,24,11,2020
MARCELO EBRARD CASAUBON,"Reducir los pagos de deudas, sean estos intereses o principal capital de las naciones pobres del mundo. Eso no se ha hecho, se han hecho quitas parciales. Pero fue un planteamiento específico. Si realmente todos los países que participan en el G20 hacen valer lo que dicen, entonces habría que reducir los pagos de la deuda para todos los países, principalmente los pobres.",0.32823650481604266,63,24,11,2020
MARCELO EBRARD CASAUBON,"Segundo, acceso de países de ingresos medios a créditos con tasas de interés equivalentes a la de los países desarrollados; es decir, los países pobres o los países de desarrollo medio, ambos, tienen que pagar tasas de interés mucho más altas que las que están pagando los países desarrollados.",0.32823650481604266,49,24,11,2020
MARCELO EBRARD CASAUBON,"Y por supuesto, insistió el señor presidente en la importancia de promover un acceso equitativo y oportuno a las vacunas que ya, como ustedes saben, es inminente, y ahora voy a entrar a ese tema. Me refiero enseguida al portafolio de México actual, que incluye proyectos de vacunas de alta efectividad.",0.32823650481604266,51,24,11,2020
MARCELO EBRARD CASAUBON,"Como ustedes recordarán, hay dos vías que se diseñaron por parte de México para estar en tiempo y forma y tener acceso a las vacunas. Una es multiletaral, que es el Covax, que ahí estamos participando, somos uno de los promotores principales; y los acuerdos con diferentes empresas que están avanzando en materia de vacunas.",0.32823650481604266,55,24,11,2020
MARCELO EBRARD CASAUBON,"Hay tres convenios de precompra de México, siguiendo las instrucciones del presidente. La primera, CanSino; la segunda, Pfizer; la tercera, AstraZeneca, que ustedes recordarán, con apoyo de la Fundación Slim se hizo un convenio con Argentina y está en curso.",0.32823650481604266,40,24,11,2020
MARCELO EBRARD CASAUBON,Esas tres en la semana han presentado diferentes estudios.,0.32823650481604266,9,24,11,2020
MARCELO EBRARD CASAUBON,"En síntesis, tienen efectividades muy altas, como se observa, y como ya dije, con los tres tenemos acuerdo de precompra.",0.32823650481604266,20,24,11,2020
MARCELO EBRARD CASAUBON,"En el caso de CanSino también hay fase III en México en este momento y, en el caso de AstraZeneca, estamos avanzando para la producción y distribución desde México a toda América Latina.",0.32823650481604266,33,24,11,2020
MARCELO EBRARD CASAUBON,"Respecto a los avances de los estudios clínicos fase III, que es la fase última para determinar por parte de la autoridad regulatoria si una vacuna funciona o no funciona, si es segura o no es segura, en curso está CanSino; Janssen esperamos que esta semana lleguen las primeras dosis y en cuanto autorice Cofepris pues ya se pueda iniciar este estudio de fase III. Janssen es una empresa vinculada a Johnson & Johnson, más conocida en México, de origen norteamericana; Novavax, que ya presentó sus primeros documentos a Cofepris para la autorización; y CureVac, de Alemania, que ya nos dijo que tiene interés en hacer un estudio clínico en México.",0.32823650481604266,111,24,11,2020
MARCELO EBRARD CASAUBON,"De confirmarse todo esto que acabo de decir, estaríamos en las próximas semanas en México, habría cuatro estudios fase III.",0.32823650481604266,20,24,11,2020
MARCELO EBRARD CASAUBON,"Me refiero a CanSino, en primer lugar, que ya está en curso. ¿Dónde estamos al día de hoy? Se prevén 15 mil voluntarios en México, de los 40 mil que participarán a nivel global en este proyecto de vacuna. Se lleva a cabo conforme a lo programado.",0.32823650481604266,47,24,11,2020
MARCELO EBRARD CASAUBON,"Tengo el gusto de compartirles, el doctor Guillermo Ruiz Palacios del Instituto Nacional de Nutrición ‘Salvador Zubirán’, es el investigador principal de este estudio.",0.32823650481604266,24,24,11,2020
MARCELO EBRARD CASAUBON,"El día de ayer, por fortuna la Cofepris autorizó ocho centros adicionales para realizar el ensayo clínico en México, con esto suman ya 19 los centros autorizados. Recordarán que les había yo informado que serían 20, tenemos ya 19 autorizados y que han pasado por minucioso proceso de inspección.",0.32823650481604266,49,24,11,2020
MARCELO EBRARD CASAUBON,"Me detengo en esto. Cofepris ha sido más estricta en México que en varios de los países del mundo, que tienen incluso estándares por lo regular más altos, ¿por qué?, por la preocupación y la seguridad de la vacuna. Entonces, se han hecho visitas, se han hecho análisis, mucho muy minuciosos, de cada centro de investigación que está participando.",0.32823650481604266,59,24,11,2020
MARCELO EBRARD CASAUBON,"Son 16 entidades federativas en este momento. Aguascalientes, Chihuahua, Ciudad de México, Coahuila, Durango, Guerrero, Hidalgo, Jalisco, Michoacán, Morelos, Nuevo León, Oaxaca, Puebla, Quintana Roo, Veracruz y Yucatán son los que están participando.",0.32823650481604266,33,24,11,2020
MARCELO EBRARD CASAUBON,¿Cómo se seleccionaron?,0.32823650481604266,3,24,11,2020
MARCELO EBRARD CASAUBON,Pues por parte de la empresa con sus propios análisis y dependiendo qué centro hay en cada entidad federativa y así lo resolvieron.,0.32823650481604266,23,24,11,2020
MARCELO EBRARD CASAUBON,"La vacuna, una vez que cuente con autorización de emergencia, sería enviada a México para hacer el llenado final y el envasado tipo lo que estamos haciendo con AstraZéneca.",0.32823650481604266,29,24,11,2020
MARCELO EBRARD CASAUBON,"Ya CanSino está por decidir con qué empresa mexicana va a hacer esto y les puedo informar que los ensayos en Arabia Saudita, Rusia, Paquistán, están en curso también. Eso es CanSino.",0.32823650481604266,32,24,11,2020
MARCELO EBRARD CASAUBON,"Luego, Pfizer, esto es una vacuna de origen norteamericano, es una empresa asociada entre Pfizer, norteamericana, y BionTech, alemana. El 20 de noviembre, Pfizer ingresó su solicitud de aprobación de uso de emergencia a la FDA de los Estados Unidos, el equivalente a Cofepris en Estados Unidos.",0.32823650481604266,47,24,11,2020
MARCELO EBRARD CASAUBON,"Se espera que aproximadamente, el 10 de diciembre, reciban su autorización, esa es la expectativa. Claro que puede variar, depende de lo que decida la FDA; y después de cuatro días de que reciban la autorización inicie el programa de vacunación en Estados Unidos. Es decir, estaríamos entre el 14, 15 y 16 de diciembre.",0.32823650481604266,55,24,11,2020
MARCELO EBRARD CASAUBON,"En México, el día de hoy la Cofepris va a recibir información de Pfizer sobre las indicaciones o instrucciones para el proceso de vacunación, método de entrenamiento para quienes participen del personal de salud y la definición de características del expediente requerido para México, que son documentos o manuales que les pide Cofepris.",0.32823650481604266,53,24,11,2020
MARCELO EBRARD CASAUBON,"Mañana, 25 de noviembre, Pfizer va a ingresar el expediente técnico a la Cofepris para el inicio de su análisis, como lo hizo en Estados Unidos.",0.32823650481604266,26,24,11,2020
MARCELO EBRARD CASAUBON,¿Qué va a pasar después?,0.32823650481604266,5,24,11,2020
MARCELO EBRARD CASAUBON,"Bueno, aquí hicimos una gráfica del proceso logístico que ilustra cómo funciona desde la planta de Pfizer hasta México. Entonces, estimamos en cinco días hábiles el que pueda llegar esta vacuna a México.",0.32823650481604266,33,24,11,2020
MARCELO EBRARD CASAUBON,"Tienen ustedes en esta gráfica en primer lugar marcado con número 1 la planta en Estados Unidos, en Europa, a definir por Pfizer qué planta va a utilizar.",0.32823650481604266,28,24,11,2020
MARCELO EBRARD CASAUBON,El día 1 se va a mandar vía aérea hacia México para que llegue el día 3 aproximadamente a México.,0.32823650481604266,20,24,11,2020
MARCELO EBRARD CASAUBON,"Día 4 es el proceso de desaduanización. Lo estoy simplificando mucho porque son trámites a veces complejos y es por razones de seguridad, se tienen que hacer.",0.32823650481604266,27,24,11,2020
MARCELO EBRARD CASAUBON,"Se manda entre el día 4 y 5 a los centros de distribución para llegar finalmente al punto de vacunación, que es el compromiso con Pfizer; es decir, vamos a hacer todo este proceso hasta llegar a los puntos de vacunación que señale la Secretaría de Salud.",0.32823650481604266,47,24,11,2020
MARCELO EBRARD CASAUBON,"Me dice el doctor Alcocer que esto ya lo tienen muy avanzado y se presentará muy pronto lo que se denomina, no el plan general de vacunación, sino el más específico porque mucho depende del tipo de vacuna que se vaya a aplicar, por ejemplo, esta tiene dos dosis, necesita una cierta temperatura, en fin, tiene una serie de características.",0.32823650481604266,60,24,11,2020
MARCELO EBRARD CASAUBON,"Ya con esta confirmación de fechas, el doctor Alcocer tiene listo su plan de vacunación, cosa que celebramos, es una muy buena noticia para México; es decir, vamos a empezar con una distancia muy breve respecto de Estados Unidos y Alemania, que fue la instrucción que nos dio el presidente.",0.32823650481604266,50,24,11,2020
MARCELO EBRARD CASAUBON,La siguiente es ¿qué avances hay en el proyecto de AstraZeneca-Oxford?,0.32823650481604266,11,24,11,2020
MARCELO EBRARD CASAUBON,"Bueno, como ustedes saben, se dio a conocer ya la efectividad, que es muy alta, no se han detectado efectos secundarios graves en la información que nos han compartido, están entregando todo el tiempo reportes.",0.32823650481604266,35,24,11,2020
MARCELO EBRARD CASAUBON,"La distribución logística es más sencilla relativa, si lo comparan con otras vacunas, porque es menos dos y menos ocho grados la temperatura que se requiere.",0.32823650481604266,26,24,11,2020
MARCELO EBRARD CASAUBON,"Como recordaremos, esta vacuna no tiene fines de lucro.",0.32823650481604266,9,24,11,2020
MARCELO EBRARD CASAUBON,"Las pruebas clínicas se han realizado en Japón, Rusia, Estados Unidos y la Gran Bretaña.",0.32823650481604266,15,24,11,2020
MARCELO EBRARD CASAUBON,"El antígeno de esta vacuna está haciendo producido en Argentina y ya está listo el equipo mexicano para recibir y hacer posible que tengamos esta vacuna en tiempo y forma, y la transferencia de tecnologías se ha llevado a cabo gracias al apoyo de la Fundación Carlos Slim, a quien le agradecemos su respaldo en este proceso, pero vamos en tiempo.",0.32823650481604266,61,24,11,2020
MARCELO EBRARD CASAUBON,"Entonces, en síntesis, pues es inminente que, si todo esto sale como hemos dicho y la autoridad regulatoria considera que se puede aprobar, como esperemos que se apruebe en Estados Unidos y en Europa, México estará en diciembre también iniciando su proceso.",0.32823650481604266,42,24,11,2020
MARCELO EBRARD CASAUBON,"Muchas gracias. Es cuanto, señor presidente.",0.32823650481604266,6,24,11,2020
MARCELO EBRARD CASAUBON," Se va a continuar con las restricciones a viajes no esenciales. Como decía yo la otra ocasión que me hiciste favor de preguntar algo similar hace unas semanas, dependiendo el semáforo de salud que determina la Secretaría de Salud, pues se restringen o no los intercambios, los viajes no esenciales.",0.32823650481604266,50,24,11,2020
MARCELO EBRARD CASAUBON,"Entonces, eso se va a mantener por lo que veo hasta ahora, lo que se prevé en ese semáforo; además, tenemos que tomar en cuenta la situación en los Estados Unidos, en donde ha habido un aumento, no en todos los puntos fronterizos, pero sí en varias zonas de Estados Unidos. Entonces, el pronóstico es que se va a mantener.",0.32823650481604266,60,24,11,2020
MARCELO EBRARD CASAUBON,"Y para las personas que vienen, nos instruyó el presidente que hiciéramos un programa con el Instituto Nacional de Migración y otras autoridades que tienen a su cargo esa competencia para tomar todas las precauciones respecto a las y los mexicanos que van a visitar a sus familiares en este fin de año, igual que lo estamos haciendo con todos los demás ciudadanos, eso es lo que se tiene previsto.",0.32823650481604266,70,24,11,2020
MARCELO EBRARD CASAUBON," La precaución, el seguir las indicaciones que nos está dando la Secretaría de Salud, uso del cubrebocas, la sana distancia, pues todas las medidas de protección que nos han recomendado las autoridades de salud.",0.32823650481604266,34,24,11,2020
