Participante,Texto,Sentimiento,Palabras,Dia,Mes,Anio
ZOE ROBLEDO ABURTO," Con su permiso, señor presidente. Muy buenos días a todas y a todos. Señores secretarios, subsecretario López-Gatell.",0.32823650481604266,17,11,08,2020
ZOE ROBLEDO ABURTO,"Hace ya varios días el presidente nos dio una instrucción a todos quienes integramos el Sector Salud del gobierno federal sobre el reconocimiento permanente que se les hace a los médicos, las médicas, enfermeras, enfermeros y en general a todo el personal de salud que ha estado en esa primera línea de batalla para atender esta pandemia por SARS-CoV-2, por el COVID-19.",0.32823650481604266,62,11,08,2020
ZOE ROBLEDO ABURTO,"En ese sentido, el secretario Alcocer nos dio esta tarea de buscar cuál era la mejor forma para hacerlo y la mejor forma para hacerlo dentro de nuestro propio marco jurídico. Fue así como el 19 de mayo se envió una solicitud por parte de la Secretaría de Salud y varias otras instituciones, el IMSS, el Issste, Pemex, Issfam para que se retomara la Condecoración ‘Miguel Hidalgo’ que está establecida en la Ley de Premios, Estímulos y Recompensas en su capítulo 5, en su artículo 34.",0.32823650481604266,86,11,08,2020
ZOE ROBLEDO ABURTO,"Se establece que esta condecoración, desafortunadamente, poco conocida es la más alta presea que puede recibir un nacional por parte del Estado mexicano por su conducta, por sus obras y por sus acciones.",0.32823650481604266,33,11,08,2020
ZOE ROBLEDO ABURTO,"En ese sentido es que el 29 de mayo se instaló el Consejo para la Condecoración ‘Miguel Hidalgo’, que también está establecida en la ley. Este Consejo lo integran la Secretaría de Gobernación, lo preside la Secretaría de Gobernación, la Secretaría de Educación Pública, la Secretaría de Cultura y las mesas directivas de la Cámara de Senadores y Cámara de Diputados. Sus titulares se reunieron y establecieron que el personal de salud recibiría esta condecoración y nombraron a un jurado calificador de la misma.",0.32823650481604266,84,11,08,2020
ZOE ROBLEDO ABURTO,"Este jurado está integrado por los titulares de todas las dependencias que tienen atención médica: otra vez de la Secretaría de Salud, la Secretaría de la Defensa Nacional, la Secretaría de Marina, el IMSS, el Issste y Petróleos Mexicanos.",0.32823650481604266,39,11,08,2020
ZOE ROBLEDO ABURTO,El 26 de mayo se informó que sería a través del Instituto para Devolver al Pueblo lo Robado que se otorgarían 250 millones de pesos para estas condecoraciones.,0.32823650481604266,28,11,08,2020
ZOE ROBLEDO ABURTO,"Este premio está a la altura de lo que hace justamente la cancillería con la Orden Mexicana del Águila Azteca, que reconoce a los extranjeros, pero esto es para los connacionales y, en particular, para este personal de salud.",0.32823650481604266,39,11,08,2020
ZOE ROBLEDO ABURTO,"Así fue como se ha estado trabajando, tanto por parte del consejo como del jurado. En ese sentido -si pueden pasar a la siguiente- se estableció que, como lo dice la propia ley, hay cuatro grados:",0.32823650481604266,36,11,08,2020
ZOE ROBLEDO ABURTO,"El grado Collar, la más alta distinción por actos heroicos de difícil repetición. En ese sentido estableció el consejo que serían 58 condecoraciones, un diploma y 100 mil pesos en numerario como reconocimiento.",0.32823650481604266,33,11,08,2020
ZOE ROBLEDO ABURTO,"Esto, dirigido a médicas, médicos y personal de enfermería que está directamente en lo que conocemos como los equipos COVID, lo que decía ahora el doctor López-Gatell, equipos que están directamente vinculados a una cama de terapia intensiva, de cuidados intensivos y están en contacto directo con los pacientes graves hospitalizados.",0.32823650481604266,51,11,08,2020
ZOE ROBLEDO ABURTO,"En Grado Cruz, también para médicos y médicas de equipos COVID y también para los hospitales que están atendiendo la pandemia. Se trata de 500 condecoraciones, un diploma y un estímulo en efectivo de 50 mil pesos, esto es por méritos eminentes, por conducta destacadamente ejemplar.",0.32823650481604266,46,11,08,2020
ZOE ROBLEDO ABURTO,"Y para Grado Banda, para el resto también de personal de salud que integra hospitales, camilleros, personal de seguridad muchas veces, personal que está vinculado a la operación de un hospital, aunque no necesariamente estén directamente con los pacientes, lo mismo conductores de ambulancias que quienes están en un laboratorio o en las tomas de muestra y que han demostrado estas conductas ejemplares.",0.32823650481604266,63,11,08,2020
ZOE ROBLEDO ABURTO,"Y, finalmente, el Grado Placa, que es para todo el personal de salud que ha combatido la pandemia directamente en los hospitales en donde lo han hecho.",0.32823650481604266,27,11,08,2020
ZOE ROBLEDO ABURTO,"En ese sentido, el trabajo que se ha hecho es un desarrollo de una plataforma para que a partir de hoy, se estableció que fuera hoy a las 11:00, se haga pública esta convocatoria. Se puede ingresar a una página de internet en donde tanto el personal de salud como todo aquel que haya cursado y se haya recuperado de esta enfermedad pueda ingresar y ser quienes postulen; es decir, la postulación es abierta para las personas que han estado en los hospitales o para quienes están trabajando en los hospitales.",0.32823650481604266,91,11,08,2020
ZOE ROBLEDO ABURTO,"Ellos tienen un pulso y han tenido la experiencia de quiénes de sus compañeros o quiénes del personal que los atendió tuvo este nivel heroico en su conducta; desde luego que todo el personal, ha sido una pandemia larga y ha demostrado un gran compromiso, pero estamos buscando justo esos actos de heroísmo, de patriotismo, de enorme entrega y vocación de servicios.",0.32823650481604266,62,11,08,2020
ZOE ROBLEDO ABURTO,"En ese sentido, se estableció esta convocatoria y estará en esta página que es condecoraciónmiguelhidalgo.gob.mx.",0.32823650481604266,15,11,08,2020
ZOE ROBLEDO ABURTO,"Asimismo, de la mano con la Coordinación de Comunicación Social de Presidencia se produjo un promocional para dar a conocer la convocatoria e invitar a todas y todos a que ingresen y que se reconozca a esas personas que estuvieron ahí cerca, que salvaron la vida de muchos mexicanas y mexicanos. Entonces, no sé si estuviera el video o la página, el video.",0.32823650481604266,63,11,08,2020
ZOE ROBLEDO ABURTO," Un dato adicional que omití decir que es creo que es importante -está en la presentación, si nos la pueden poner esa la última lámina- es que el Consejo de la premiación votó, hizo una convocatoria entre artistas mexicanos, porque el reglamento de esta ley está derogado desde hace muchos años, entonces se estableció un nuevo diseño para esta condecoración.",0.32823650481604266,60,11,08,2020
ZOE ROBLEDO ABURTO,"El artista que obtuvo más votos por el consejo de premiación fue Carmen Tapia, ella es originaria de Taxco, con una gran tradición orfebre y de manejo de platería. Hizo este diseño que pueden ver aquí, este es el boceto, está inspirada en el escudo de la Junta de Zitácuaro, propulsora del Congreso de Chilpancingo de 1813, donde se determinó la abolición de la esclavitud, esto fue impulsado desde luego por el Padre de la Patria, por Miguel Hidalgo, el 6 de diciembre de 1810. Ella estará encargada y es a partir de ahora el diseño de esta Condecoración ‘Miguel Hidalgo’, que tiene todos los elementos, la heráldica, la cruz, la estrella y demás, hizo un gran trabajo.",0.32823650481604266,118,11,08,2020
ZOE ROBLEDO ABURTO,"Entonces, si pudiéramos ingresar nada más a la página que vamos a liberar en las próximas horas para ver cómo es el proceso en donde alguien ingresa y puede postular a algún personal de salud.",0.32823650481604266,35,11,08,2020
ZOE ROBLEDO ABURTO,"Bueno, habíamos platicado con Hugo si por la tarde podemos hacer una prueba en vivo para que cada quien conozca cómo puede postular y la intención sería que estas 58 primeras condecoraciones pudieran ser entregadas en el mes de septiembre.",0.32823650481604266,40,11,08,2020
ZOE ROBLEDO ABURTO,Es todo. Muchas gracias.,0.32823650481604266,4,11,08,2020
