Participante,Texto,Sentimiento,Palabras,Dia,Mes,Anio
ZOE ROBLEDO ABURTO,"Y además también en el primer nivel, que es instrumental más sencillo, pero igual de importante para la atención médica de primer nivel, 552 estuches de diagnóstico, 66 refrigeradores para vacunas, 261 esterilizadores de vapor, en fin, 261 estetoscopios de cápsula sencilla, fonodetector de latidos fetales, que hacen falta, 261, y camas clínicas adultas, 251.",0.0,55,15,03,2022
ZOE ROBLEDO ABURTO,Esto nos lleva tener un cálculo de las primeras inversiones que hacen falta en Nayarit.,0.0,15,15,03,2022
ZOE ROBLEDO ABURTO,"Ahora, aquí hay que aclarar que en este caso también se está calculando el Hospital de la Mujer de Tepic, que es una obra que lleva mucho tiempo, tuvo problemas con la empresa constructora y ya hoy se está concluyendo la obra física y también el equipamiento. También va a hacer falta ampliar; no ampliar, sino equipar 30 camas de hospitalización de ese hospital, además de la unidad de cuidados intensivos neonatales.",0.0,72,15,03,2022
ZOE ROBLEDO ABURTO,"Si vemos, estas son las inversiones para el caso de Nayarit en términos de la nómina adicional a la que ya se cuenta. Insisto, esta es la nómina adicional para poder mejorar los servicios de salud.",0.0,36,15,03,2022
ZOE ROBLEDO ABURTO,"La nómina de médicos generales tiene un costo por los meses de abril a diciembre de 215 millones de pesos, la de médicos especialistas de 42 millones de pesos y lo que hace falta, el déficit de enfermeras, de 300 millones de pesos, además de los mil 903 equipos de primer nivel por un monto de 58 millones de pesos, los 716 equipos de segundo nivel por un monto de 277 millones de pesos, ya contando el Hospital de la Mujer de Tepic, y el equipo de segundo nivel, 277, además de otro equipamiento que hace falta de 113 millones de pesos para este hospital que ya se ha mencionado, además de 71 acciones de infraestructura para mejorar lo que ya se tiene.",0.0,123,15,03,2022
ZOE ROBLEDO ABURTO,"Muchas veces se pensaba que ya construyendo nuevos hospitales se mejoraba el sistema de salud, cuando se tenían hospitales que no estaban operando plenamente. Se trata de una inversión de mil 438 millones de pesos para Nayarit en esta primera etapa para poner los hospitales y las unidades de primer nivel al cien en estos aspectos.",0.0,56,15,03,2022
ZOE ROBLEDO ABURTO,"También hay que señalar el abasto de medicamentos. El cierre del 2021 se cerró con 78 por ciento de abasto, pero ya para el primer trimestre se tiene garantizado arriba del 96 por ciento y así se piensa mantener en el resto de los meses.",0.0,45,15,03,2022
ZOE ROBLEDO ABURTO,"Solamente para finalizar tenemos algunos… ¿Por qué se necesitaba intervenir en Nayarit? Estos son algunos ejemplos de lo que se encontró en levantamiento. Este Hospital de la Mujer, que inició su construcción en 2005, en 2005 y no ha podido atenderse un parto en ese lugar; había que intervenirlo en todos los aspectos, desde lo jurídico y ahora la obra física y el equipamiento.",0.0,64,15,03,2022
ZOE ROBLEDO ABURTO,El Hospital Integral de Tuxpan es una obra que está detenida desde el año 2021 y que también se incorporó a este diagnóstico.,0.0,23,15,03,2022
ZOE ROBLEDO ABURTO,"O el quirófano del Hospital Mixto ‘Jesús María’. Además, un hospital extraordinario, de los primeros que empezaron a incorporar temas de medicina tradicional, partería, pero que tiene hoy un quirófano inhabilitado por daños en el hospital que no han sido atendidos; también hay zonas de atención en este mismo hospital que están en un deterioro importante.",0.0,56,15,03,2022
ZOE ROBLEDO ABURTO,"O el Hospital Básico Comunitario de Las Varas, que esto era muy común, hospitales básicos comunitarios de 12 camas que se instalaban, pero nunca llegó el equipo, entonces la población ahí tenía un quirófano sin el equipo que hace falta.",0.0,40,15,03,2022
ZOE ROBLEDO ABURTO,"O este de Hospital de Puente de Camotlán, que también el quirófano pues ahora está siendo utilizado para almacenar equipo y no para realizar cirugías.",0.0,25,15,03,2022
ZOE ROBLEDO ABURTO,"Entonces, esa es la intención, ese es el trabajo que nos ha encomendado el presidente López Obrador y que se ha hecho con todo el equipo de salud, con todo el sector Salud, desde el diseño y la actualización de este modelo de atención integral a la salud, el enfoque preventivo, que es clave, y desde luego la incorporación de trabajadoras y trabajadores con mucha vocación que van a hacernos falta para levantar el sistema de salud estado por estado.",0.0,80,15,03,2022
ZOE ROBLEDO ABURTO,"Es cuando, por mi parte, señor presidente.",0.0,7,15,03,2022
ZOE ROBLEDO ABURTO,Gracias.,0.0,1,15,03,2022
LUIS CRESENCIO SANDOVAL GONZALEZ," Con su permiso, señor presidente. Muy buenos días.",0.0,8,15,03,2022
LUIS CRESENCIO SANDOVAL GONZALEZ,"Bien, vamos a presentar lo del paseo dominical del domingo ahí, en Santa Lucía. Mencionar que estos paseos dominicales es un proyecto de la Secretaría de la Defensa Nacional donde se pueden realizar diversas actividades como son caminatas, rutas ciclistas, carreras, una convivencia con la sociedad. Se llevan a cabo en todas las instalaciones del Ejército y de la Fuerza Aérea mexicanos, ubicados en todo nuestro país.",0.0,67,15,03,2022
LUIS CRESENCIO SANDOVAL GONZALEZ,"El objetivo que se busca es tener la oportunidad de mostrarle a la sociedad, a la sociedad mexicana, lo que es su Ejército, lo que es su Fuerza Aérea. Este acercamiento con la sociedad ha sido sumamente importante para nosotros, es una prioridad para la Secretaría de la Defensa Nacional este tipo de actividades, y bajo este gran objetivo de acercamiento se realizó el domingo pasado este paseo dominical en Santa Lucía, Estado de México, para dar la oportunidad a todo ciudadano de conocer muy de cerca lo que en ese campo militar construyó el Cuerpo de Ingenieros del Ejército.",0.0,100,15,03,2022
LUIS CRESENCIO SANDOVAL GONZALEZ,"Oportunidad única, ya se consideró poder visitar tanto el Aeropuerto Internacional ‘Felipe Ángeles’, las instalaciones de la Base Aérea Militar número 1, las instalaciones sociales y culturales incluidas en este gran proyecto.",0.0,32,15,03,2022
LUIS CRESENCIO SANDOVAL GONZALEZ,"Más de 25 mil personas caminaron, pasearon con sus mascotas, hicieron su ruta ciclista, conocieron el interior y el exterior del Aeropuerto Internacional ‘Felipe Ángeles’, así como las instalaciones de la Base Aérea Militar número 1. Interactuaron con su Ejército y con su Fuerza Aérea; constataron un compromiso institucional cumplido por la Secretaría de la Defensa Nacional que, con entusiasmo, profesionalismo y deseos de servir a México, a sus instituciones, pero principalmente al pueblo de México, ahí se ve todo lo que hicieron nuestros ingenieros en estas construcciones.",0.0,88,15,03,2022
LUIS CRESENCIO SANDOVAL GONZALEZ,"Les mostraremos el video abarcando esta parte tan importante que desarrolló la sociedad mexicana en, repito, en el Aeropuerto Internacional ‘Felipe Ángeles’ y en las instalaciones militares ubicadas en este campo militar.",0.0,32,15,03,2022
LUIS CRESENCIO SANDOVAL GONZALEZ,Muchas gracias.,0.0,2,15,03,2022
VOZ DE MUJER," Como parte de las actividades de acercamiento social, el 13 de marzo de 2022 la Secretaría de la Defensa Nacional llevó a cabo una ruta ciclista y un paseo dominical en las instalaciones de la Base Aérea Militar número 1, Santa Lucía, Estado de México.",0.0,45,15,03,2022
VOZ DE MUJER,Referidas actividades fueron gratuitas y abiertas el público en general de 9:00 de la mañana a 6:00 de la tarde.,0.0,20,15,03,2022
VOZ DE MUJER,"Se contó con la asistencia de 25 mil 258 participantes, de los cuales 16 mil 553 realizaron el recorrido en bicicleta y ocho mil 705, a pie.",0.0,27,15,03,2022
VOZ DE MUJER,"Se instalaron módulos con las siguientes actividades interactivas: pista de adiestramiento canino, minipista del soldado, exhibición de vehículos blindados, simulación con paracaídas.",0.0,22,15,03,2022
VOZ DE MUJER,"Durante el recorrido de 24 kilómetros, los visitantes pudieron observar la Plaza Mexicana, la Glorieta Monumental, la pista central, plataforma militar de la base aérea y el Tren Olivo, el Tren Histórico Cultural, el Museo Quinametzin, el Museo Militar de Aviación, la torre de control, la plataforma de servicios del aeropuerto y el centro comercial.",0.0,55,15,03,2022
INTERVENCION HOMBRE," Es muy moderno, las instalaciones. Se siente mucha seguridad, yo me siento bien tranquilo dando la vuelta.",0.0,17,15,03,2022
INTERVENCION HOMBRE," Que sigan adelante, aquí se ve mucho progreso, mucha tecnología y hay que seguir, yo creo, en ese sentido.",0.0,19,15,03,2022
INTERVENCION MUJER," La verdad es que están impresionantes. Se escuchan muchas cosas en las noticias, pero ya hasta que estás aquí te das cuenta de la inmensidad. La verdad es que vale mucho la pena este recorrido. Gracias al gobierno, que nos dio la oportunidad de venir a conocer las instalaciones.",0.0,49,15,03,2022
INTERVENCION HOMBRE," Está de primera, de verdad, primer mundo, un lugar muy bonito. Ya estuvimos también en el museo paleontológico, el Museo del Mamut.",0.0,22,15,03,2022
PREGUNTA," Los visitantes manifestaron su asombro por el esfuerzo realizado para materializar el proyecto, que permitirá a México disponer de un aeropuerto de clase mundial y con espacios modernos, mencionando además que tuvieron la oportunidad de disfrutar en familia las actividades programadas.",0.0,41,15,03,2022
PREGUNTA,Los visitantes a la Base Aérea Militar número 1 disfrutaron de la convivencia y sano esparcimiento.,0.0,16,15,03,2022
PREGUNTA,Gracias por su asistencia.,0.0,4,15,03,2022
PRESIDENTE ANDRES MANUEL LOPEZ OBRADOR," Muy bien. Bueno, hay una lista de ayer, a ver si terminamos, son seis compañeras y compañeros. Empezamos con Nancy Flores.",0.0,21,15,03,2022
PREGUNTA," Buenos días, presidente. Nancy Flores, de la revista Contralínea. Buenos días también a todos sus invitados.",0.0,16,15,03,2022
PREGUNTA,"Presidente, en la revista Contralínea un equipo de reporteros empezamos a publicar una investigación acerca de la triangulación de recursos públicos para el fondeo de esta plataforma Latinus. Esto se hace a través de nueve empresas dedicadas al sector Salud precisamente, son nueve farmacéuticas ligadas también al político priista, a familiares del político priista Roberto Madrazo Pintado, específicamente a su hijo y a su yerno.",0.0,65,15,03,2022
PREGUNTA,En esta investigación logramos varios hallazgos:,0.0,6,15,03,2022
PREGUNTA,"Primero, que estas nueve farmacéuticas habrían obtenido contratos con 11 entidades federativas, con 11 gobiernos estatales por más de cinco mil millones de pesos. Llama la atención que el 90 por ciento de estos recursos, es decir, alrededor de cuatro mil 500 millones de pesos salieron del gobierno de Michoacán, cuando Silvano Aureoles Conejo estaba al frente de esta entidad federativa. En ese sentido, bueno, ya sabemos que este perredista salió del país por todas las investigaciones que se están llevando a cabo por presuntas defraudaciones durante su administración.",0.0,89,15,03,2022
PREGUNTA,"Y, bueno, lo que encontramos es que este recurso se obtuvo, estos contratos se obtuvieron, la mayoría, por adjudicación directa y además corresponden a este periodo de 2018 a 2022.",0.0,30,15,03,2022
PREGUNTA,"Entre otras cosas, hay algunos incumplimientos de contratos. Por ejemplo, en el caso de los servicios de mastografías, tanto en Michoacán como en Oaxaca, pues encontramos que estos servicios no se habían brindado a las mujeres a tiempo; en algunos casos, ni siquiera se habían dado los servicios contratados. Y esto significa un daño para estas mujeres, porque cuando ya hay presencia de cáncer un día, un mes, meses de retraso pueden significar la vida, el cáncer de mama es una de las principales causas de muerte en las mujeres.",0.0,90,15,03,2022
PREGUNTA,"En otro hallazgo también que hicimos, bueno, encontramos que parte de estos cuatro mil 500 millones de pesos que se contrataron con estas nueve farmacéuticas provinieron del Instituto de Salud para el Bienestar, del Insabi y de dos fideicomisos federales.",0.0,40,15,03,2022
PREGUNTA,"Entonces, presidente, preguntarle, primero, si este plan que tienen, que están implementando para federalizar la salud ya de alguna manera sería un blindaje para que no ocurran estos casos de presunta corrupción o de presunta negligencia por parte de estas farmacéuticas y de estas empresas que se dedican al sector Salud y que estaban acostumbradas a otros esquemas.",0.0,58,15,03,2022
PREGUNTA,¿Qué pasaría con los estados que no se adhieran a este plan de salud?,0.0,14,15,03,2022
PREGUNTA,"Y también preguntarle si ustedes estaban enterados de que parte de los recursos federales del Insabi habían terminado en estas contrataciones; recursos que, además, se movieron a través de dos fideicomisos en FASSA y un fideicomiso de infraestructura, y pues que son miles de millones de pesos que terminan en esta triangulación para fondear, pues en este caso la plataforma Latinus.",0.0,61,15,03,2022
PRESIDENTE ANDRES MANUEL LOPEZ OBRADOR," Bueno, lo que estás exponiendo es cierto, es lo que sucedía y todavía pasa en menor escala, porque esto era lo que imperaba, el negocio en las medicinas, en la compra de los equipos médicos.",0.0,35,15,03,2022
PRESIDENTE ANDRES MANUEL LOPEZ OBRADOR,"Siempre lo hemos dicho, había tres, cuatro empresas que le vendían al gobierno medicamentos y equipos, el gobierno compraba alrededor de 100 mil millones de pesos en medicamentos y en equipos, y tres empresas vendían como el 60 por ciento, 70 por ciento, es decir, 60, 70 mil millones, y esas empresas estaban vinculadas al gobierno, eran empresas de políticos o de traficantes de influencia.",0.0,65,15,03,2022
PRESIDENTE ANDRES MANUEL LOPEZ OBRADOR,"Por eso la campaña tan fuerte en contra nuestra; incluso, utilizando a los niños con cáncer. Estas empresas promovían esa campaña porque se les cayó un negocio jugoso, lucrativo, inhumano y a partir de que ya no pudieron seguir haciendo ese negocio, porque se abrió la compra de medicamentos a países extranjeros, tenían todo controlado en México, no se podían comprar medicamentos en otros países, sólo se le tenían que comprar los medicamentos a ellos, a este grupo de intermediarios, de distribuidores de medicinas y de equipos.",0.0,87,15,03,2022
PRESIDENTE ANDRES MANUEL LOPEZ OBRADOR,"Entonces, nos costó muchísimo acabar con este monopolio porque estaba muy enraizado, como un cáncer, y tenía protección de medios de información. Entonces los protegían los medios, los apoya, desde luego, el gobierno, desde mero arriba, había indicaciones para apoyarlos.",0.0,40,15,03,2022
PRESIDENTE ANDRES MANUEL LOPEZ OBRADOR,"Y una vez que tomamos las decisiones de enfrentarlos empezó la reacción, la ofensiva. Recuerdo que desde antes de llegar a la Presidencia nos reunimos para ver cómo estaba el marco legal y encontramos de que no se podía comprar medicamentos. Por eso hicimos un convenio con la ONU, para que nos ayudaran en la compra y en la transparencia de las adquisiciones de medicamentos, y ahora estamos comprando medicamentos en todos los países del mundo, estamos ahorrando mucho.",0.0,79,15,03,2022
PRESIDENTE ANDRES MANUEL LOPEZ OBRADOR,"Sin embargo, la campaña, no sólo de los niños que no tenían sus medicamentos, sino del desabasto de medicamentos; todo esto apoyado, repito, por los medios. Una vez que empezamos, se intensificó la campaña, y ya no sólo para cuestionar lo que estábamos haciendo en materia de salud, sino ya para cuestionar al gobierno. Y ahí viene lo de Loret de Mola, porque Loret recibe financiamiento, cuando menos de una de estas empresas.",0.0,73,15,03,2022
PREGUNTA," Nueve, nosotros localizamos nueve compañías que están ligadas al servicio de salud y que además distribuían medicamentos y material quirúrgico y todo esto.",0.0,23,15,03,2022
PRESIDENTE ANDRES MANUEL LOPEZ OBRADOR," Pues yo estoy siendo muy fresa, hablo de una y tú dices nueve. Pues sí, y así empiezan todas esas campañas de desprestigio en contra del gobierno. Por eso queremos que Loret dé a conocer cuánto gana, cuáles son sus bienes; pero no sólo Loret, sino todos estos periodistas que actúan como mercenarios, que se dedican a golpear para defender a grupos de intereses creados, para defender la corrupción, son defensores de la corrupción.",0.0,74,15,03,2022
PRESIDENTE ANDRES MANUEL LOPEZ OBRADOR,"Por eso cuando hablan de Claudio X. González y su equipo, yo no digo que son mexicanos en defensa de la… para combatir la corrupción, son mexicanos en favor de la corrupción, de eso no tengo duda, y manejan muchísimo dinero, porque están muy molestos, enojados, porque se les acabaron los negocios jugosos que hacían al amparo del poder público; saqueaban, robaban con la complicidad de la mayoría de los medios de información, con honrosas excepciones, para no generalizar.",0.0,79,15,03,2022
PRESIDENTE ANDRES MANUEL LOPEZ OBRADOR,"Por eso los periodistas honestos, con ética, se deben de sentir muy orgullosos, cruzaron el pantano y no se mancharon; y no era fácil, porque durante todo el periodo neoliberal era entregar subvención para silenciar a los medios, con la máxima de obedecer y callar, aplaudir y callar, y hubo los que resistieron, que no cayeron en la tentación; esos merecen todo nuestro respeto, pero otros se volvieron inmensamente ricos: mansiones, departamentos en el extranjero, hasta yates; periodistas que recibían y siguen recibiendo para defender al régimen de corrupción, de injusticias, de privilegios.",0.0,93,15,03,2022
PRESIDENTE ANDRES MANUEL LOPEZ OBRADOR,"Por eso sigo convocando a que todos demos a conocer nuestros bienes. Yo tengo menos bienes que esos periodistas. Si comparo lo que tengo con la gente más humilde, soy un potentado; pero si comparo lo que tengo con los que poseen algunos periodistas, pues soy pobre, porque es increíble lo que tienen. Y no estoy hablando de las empresas, ahí sí soy del grupo que más quiero, el de los de pobreza extrema, en comparación con los machuchones.",0.0,79,15,03,2022
PRESIDENTE ANDRES MANUEL LOPEZ OBRADOR,"Aunque no todo el que tiene es malvado, hay gente que ha hecho su patrimonio con esfuerzo, trabajo y de conformidad con la ley, y merece respeto, y el empresario que invierte y corre riesgos y genera empleos merece respeto. Nosotros estamos en contra de la riqueza mal habida, del influyentismo, de la corrupción, de este tipo de cosas.",0.0,59,15,03,2022
PRESIDENTE ANDRES MANUEL LOPEZ OBRADOR,"Antes, no sólo estos periodistas famosos, los corruptos en general no perdían ni siquiera su respetabilidad, hasta se les ponía de ejemplo, en algunos casos se les decía a los hijos: ‘Estudia, para que cuando seas grandes seas como don fulano, un reverendo ladrón’.",0.0,44,15,03,2022
PRESIDENTE ANDRES MANUEL LOPEZ OBRADOR,"El cambio ahora es no permitir eso, estigmatizar la corrupción, nada de que es delincuente sólo el que se roba una bolsa, una cartera, el que se roba un cilindro de gas, el que se roba la ropa que quedó tendida en el patio, el que se roba un pavo, una gallina, así era antes, ratero, y los delincuentes de cuello blanco, los grandes ladrones, repito, ni siquiera perdían su respetabilidad, y cuánto daño le han hecho al país.",0.0,79,15,03,2022
PRESIDENTE ANDRES MANUEL LOPEZ OBRADOR,"Entonces, por eso hay que seguir insistiendo.",0.0,7,15,03,2022
PRESIDENTE ANDRES MANUEL LOPEZ OBRADOR,"Y no me enoja de que nos ataquen. Tengo un escudo protector, mi autoridad moral, y eso me da autoridad política, y por eso los puedo enfrentar, si no, ya me hubiesen hecho papilla o minilla de peje.",0.0,38,15,03,2022
PREGUNTA," Presidente, en este caso también el tema es que, bueno, dos contratos se incumplieron, uno de ellos precisamente en Michoacán que tiene que ver con esta empresa Movimedical S.A. de C.V., en ese caso se había contratado un convoy de mastografías y no dieron el servicio; y en el caso de Oaxaca, pues incluso la Auditoría Superior de la Federación reportó ya un daño patrimonial por 16 millones de pesos, porque tampoco se dieron los servicios de mastografías a las personas que debían de obtener este estudio médico; y en el caso de Michoacán, ese contrato era por 400 millones de pesos.",0.0,102,15,03,2022
PREGUNTA,"Entonces, preguntarle si basta con esta federalización del sistema sanitario para que se evite que en el futuro los gobiernos caigan en este mismo, digamos, contubernio o posibles hechos de corrupción.",0.0,31,15,03,2022
PREGUNTA,¿Y qué va a pasar con los estados que no se adhieran a este sistema de federalización?,0.0,17,15,03,2022
PRESIDENTE ANDRES MANUEL LOPEZ OBRADOR," Es muy importante tu pregunta. Yo desde hace tiempo sostengo que si acabamos con la corrupción, terminamos de desterrar la corrupción y en especial la corrupción en el sector Salud, con el mismo presupuesto nos alcanza para mejorar la infraestructura de salud, tener los centros de salud, los hospitales bien equipados, los tres turnos de médicos, de especialistas, que ahí es donde vamos a tener más problemas porque estos tecnócratas irresponsables y corruptos abandonaron la educación pública y no tenemos los médicos que requiere el país, y el déficit mayor está en los especialistas, pero estamos buscando la forma de que no falten los médicos, los especialistas, y vamos a tener todas las medicinas.",0.0,114,15,03,2022
PRESIDENTE ANDRES MANUEL LOPEZ OBRADOR,"Y me preguntaban que si va a ser gratuito sólo el cuadro básico. No, gratuidad completa en medicinas, en estudio, en todo lo que tiene que ver con la salud, garantizar el derecho a la salud.",0.0,36,15,03,2022
PRESIDENTE ANDRES MANUEL LOPEZ OBRADOR,"Entonces, si no hay corrupción, alcanza el presupuesto.",0.0,8,15,03,2022
PRESIDENTE ANDRES MANUEL LOPEZ OBRADOR,"Ya tenemos, además, los recursos para este plan. Claro, estamos hablando con los gobiernos estatales y ya la mayoría ha aceptado la federalización, porque esto significa que estos dos fideicomisos a los que haces mención se mantengan, pero el recurso se traslade para el financiamiento del plan de salud. O sea, tendríamos que llevar a cabo una modificación a la Ley de Coordinación Fiscal y como vemos que eso no se va a hacer pronto y puede obstaculizarse su trámite por nuestros adversarios que están en el no, en el no, en el no a todo, entonces, sin necesidad de esa reforma a la Ley de Coordinación Fiscal, sólo con un convenio que firmen los gobiernos estatales en donde esos recursos los van a transferir al fondo para el financiamiento del Plan Nacional de Salud, con eso basta.",0.0,138,15,03,2022
PRESIDENTE ANDRES MANUEL LOPEZ OBRADOR,"Lo que ya aceptó el gobernador de Nayarit y otros gobernadores, pero me dio mucho gusto que el doctor Miguel Ángel Navarro fue el primero en decir: ‘Yo participo en la federalización de la salud’, porque esto va a significar un mejor servicio de salud para el pueblo de Nayarit, y así va a ser en todos los casos.",0.0,59,15,03,2022
PRESIDENTE ANDRES MANUEL LOPEZ OBRADOR,"Y si hacen faltan recursos, los tenemos, no va a haber ningún problema.",0.0,13,15,03,2022
PRESIDENTE ANDRES MANUEL LOPEZ OBRADOR,"Ahora, nada por la fuerza, todo por la razón y el derecho, es voluntario. Lo mencionó en su exposición Zoé, si hay estados que no quieren participar, pueden continuar con el mismo sistema, que se les entreguen los recursos de las participaciones federales para salud.",0.0,45,15,03,2022
PRESIDENTE ANDRES MANUEL LOPEZ OBRADOR,"Cuando hablas de que en estas empresas el Insabi utilizó recursos, es que…",0.0,13,15,03,2022
PREGUNTA, Se los entregó al estado de Michoacán.,0.0,7,15,03,2022
PRESIDENTE ANDRES MANUEL LOPEZ OBRADOR," Claro, claro.",0.0,2,15,03,2022
PREGUNTA," Sí, son las participaciones y se entregaron directamente por el Insabi y por estos dos fideicomisos.",0.0,16,15,03,2022
PRESIDENTE ANDRES MANUEL LOPEZ OBRADOR," Sí, sí, y porque tenemos la obligación de entregarles los fondos para que ellos atiendan la demanda de salud y ellos ya contratan a las empresas.",0.0,26,15,03,2022
PRESIDENTE ANDRES MANUEL LOPEZ OBRADOR,"Hay casos en donde no quieren porque tienen estos compromisos políticos con las antiguas empresas o las empresas que predominaban en el periodo neoliberal, entonces quieren seguir comprándoles a las mismas empresas y tienen acuerdos, hay componendas, pero en la medida de que va a ir federalizándose el sistema de salud nos vamos a ir dando cuenta quiénes no van a participar.",0.0,62,15,03,2022
PRESIDENTE ANDRES MANUEL LOPEZ OBRADOR,"Y ya los ciudadanos de esos estados, estoy seguro que van a pedir cuentas, que informen quién está vendiendo los medicamentos, a quién le compran los equipos. La transparencia es una regla de oro de la democracia.",0.0,37,15,03,2022
PRESIDENTE ANDRES MANUEL LOPEZ OBRADOR,"Entonces, imagínense que el presupuesto de salud o una parte del presupuesto de salud se utiliza para publicidad y para pagarle a Loret de Mola y otros. Claro que está mal eso, y ojalá Loret aclare de dónde obtiene los fondos.",0.0,41,15,03,2022
