Participante,Texto,Sentimiento,Palabras,Dia,Mes,Anio
PRESIDENTE ANDRES MANUEL LOPEZ OBRADOR, Buenos días.,0.0,2,15,03,2022
PRESIDENTE ANDRES MANUEL LOPEZ OBRADOR,"Vamos a informar, como todos los martes, sobre la situación de la salud y, como acordamos, el día de hoy se va a dar a conocer el plan de salud que se está impulsando para garantizar a todos los mexicanos el derecho a la salud, la forma en que estamos trabajando. Ahora con más tiempo, porque la primera mitad del tiempo la dedicamos a atender la pandemia; como ya afortunadamente la pandemia está teniendo menos efectos, hay menos contagios, menos hospitalizaciones y, lo más importante, menos fallecidos, sentimos que vamos de salida, ahora el mismo equipo que trabajamos para enfrentar la pandemia, todas las dependencias del gobierno, el sector Salud más la Secretaría de la Defensa, la Secretaría de Marina, los institutos de salud, todos juntos estamos fortaleciendo el sistema de salud para población abierta, para los que no tienen seguridad social, que son alrededor de la mitad de los mexicanos y la gente también más pobre, más necesitada.",0.0,159,15,03,2022
PRESIDENTE ANDRES MANUEL LOPEZ OBRADOR,"Entonces, es rehabilitar hospitales, centros de salud, equiparlos, que no falten los médicos, los especialistas, las enfermeras, los trabajadores de la salud; que haya médico todo el tiempo en los centros de salud, en los hospitales, que no sea sólo de lunes a viernes, ni que se pueda uno enfermar el fin de semana, que no falten los medicamentos y que toda esta atención sea gratuita.",0.0,66,15,03,2022
PRESIDENTE ANDRES MANUEL LOPEZ OBRADOR,"Ese es el plan que se va a exponer el día de hoy, para que se conozca cómo vamos, en el compromiso de dejar en este gobierno un sistema de salud de primer orden para garantizar este derecho a todos los mexicanos.",0.0,42,15,03,2022
PRESIDENTE ANDRES MANUEL LOPEZ OBRADOR,"Entonces, primero vamos con lo de pandemia y luego la presentación de este plan, y después, posteriormente, el general Luis Cresencio Sandoval les va a informar sobre lo del paseo dominical en el aeropuerto ‘Felipe Ángeles’, que fue algo muy importante, y ya se difundió, pero no mucho, y que pues todos los mexicanos sepan que ya se está por terminar esta importante obra, y al final abrimos para preguntas y respuestas.",0.0,72,15,03,2022
PRESIDENTE ANDRES MANUEL LOPEZ OBRADOR,"Entonces, comenzamos con el doctor Alcocer.",0.0,6,15,03,2022
JORGE ALCOCER VARELA," Con su permiso, señor presidente. Muy buenos días a todas y todos ustedes.",0.0,13,15,03,2022
JORGE ALCOCER VARELA,"Como todos los martes, hoy les presentamos en el Pulso de la Salud tres temas ya mencionados por el señor presidente de interés para la población mexicana.",0.0,27,15,03,2022
JORGE ALCOCER VARELA,"En primer lugar, el informe de los medicamentos adquiridos por el sector Salud, para el sector Salud, y enseguida el doctor Hugo López-Gatell les presentará el estado que guarda la pandemia y el seguimiento de la política de vacunación.",0.0,39,15,03,2022
JORGE ALCOCER VARELA,"Hoy cumplimos un deber para nuestra población, en especial para quienes no cuentan con seguridad social, pues el deber de un hombre es estar allí, donde es más útil, donde es más necesario. Les recuerdo que en 2019, antes de la pandemia, recorrimos a ras de tierra con el presidente de la República más de siete mil 400 kilómetros, visitando los 80 hospitales rurales del IMSS-Bienestar y platicando con las comunidades para estudiar, conocer, entender, mejorar los servicios de atención médica y qué rutas para abastecer a todas las personas en todos los lugares con atención médica y medicamentos gratuitos. En ese sentido se gestó el Instituto de Salud para el Bienestar.",0.0,112,15,03,2022
JORGE ALCOCER VARELA,"Ese camino aún no termina, estamos en un proceso de transformación hacia la construcción de un Sistema Nacional de Salud que sea universal, gratuito, equitativo y de calidad, con énfasis en los sectores más vulnerables y marginados de nuestra población. El camino hacia ello está construido con certeza; prueba de ello es la atención médica durante la pandemia del COVID-19, que demostró una integración histórica del Sistema Nacional de Salud.",0.0,70,15,03,2022
JORGE ALCOCER VARELA,"Para reafirmar el modelo, tomando como tal IMSS-Bienestar y seguir en el cumplimiento de nuestro de deber, en tercer lugar, el maestro Zoé Robledo nos hablará del primer paso táctico ya tomado en la construcción de este servicio federal de atención médica y medicamentos gratuitos, nos dirá en dónde estamos y qué sigue.",0.0,53,15,03,2022
JORGE ALCOCER VARELA,Continuamos el informe de los medicamentos adquiridos por el sector Salud para la población de nuestro país. En esta primera lámina se nota que se han distribuido 693 millones de medicamentos y material de curación.,0.0,35,15,03,2022
JORGE ALCOCER VARELA,En la siguiente se muestra que de enero a abril se distribuirán 114 millones 553 mil piezas de medicamentos y material de curación en las 32 entidades federativas derivadas de la compra consolidada Insabi 2022. La compra de Insabi de la Unops garantizará un abasto mayor de 95 por ciento de las claves solicitadas para el primer semestre.,0.0,58,15,03,2022
JORGE ALCOCER VARELA,"En la siguiente vemos que en los últimos siete días se entregaron 12 millones 587 mil 408 piezas de medicamentos y de material de curación, y están en tránsito nueve millones 932 mil 379 piezas.",0.0,35,15,03,2022
JORGE ALCOCER VARELA,"Pueden ustedes ver en la siguiente que el Insabi, con la suma de 31 entidades federativas al plan de distribución de la última milla y con ayuda de la Sedena y Birmex, han distribuido en 14 estados en lo que va del año 14 millones 494 mil 72 piezas para abastecer mil 254 unidades estatales de salud.",0.0,57,15,03,2022
JORGE ALCOCER VARELA,"Y, finalmente, les informamos que del 5 al 11 de marzo se prepararon tres mil 36 mezclas oncológicas para el cáncer para pacientes del Instituto Nacional de Cancerología, del Hospital Infantil de México, del Instituto de Enfermedades Respiratorias, del Hospital General y el Hospital Regional de Ixtapaluca.",0.0,47,15,03,2022
JORGE ALCOCER VARELA,Muchas gracias.,0.0,2,15,03,2022
JORGE ALCOCER VARELA,Hugo.,0.0,1,15,03,2022
HUGO LOPEZ-GATELL RAMIREZ," Con su permiso presidente, secretarios, compañeros directores y comisionado. Muy buenos días tengan todas y todos ustedes.",0.0,17,15,03,2022
HUGO LOPEZ-GATELL RAMIREZ,"Vamos a comentar sobre la situación de la epidemia de COVID-19 y sobre todo de la continuidad del programa de vacunación. Vamos a ver la primera imagen, es la curva epidémica de agregación semanal, ya muy conocida.",0.0,37,15,03,2022
HUGO LOPEZ-GATELL RAMIREZ,"Siete semanas consecutivas de reducción de la epidemia. Como hemos platicado varias veces, ya es una tendencia muy sostenida y seguramente llegaremos a niveles mínimos de esta epidemia.",0.0,28,15,03,2022
HUGO LOPEZ-GATELL RAMIREZ,"También, como hemos comentado siempre, la aclaración de que en cada país la epidemia depende también de lo que ocurre en otros países y en la medida en que ciertas regiones del mundo, en este momento particularmente en Europa Occidental y en Asia, pudiera mantenerse activa la epidemia o incluso aumentar, cualquier región del mundo pudiera quedar afectada, pero por el momento en América y en México tenemos una reducción sostenida que probablemente se va a mantener en la medida en que tengamos altas coberturas de vacunación, como sí lo tenemos en México.",0.0,93,15,03,2022
HUGO LOPEZ-GATELL RAMIREZ,"Los otros indicadores, la hospitalización también muestra claramente que se han ido desocupando las unidades COVID en la medida en que hay menos personas que necesitan la atención, menos de 10 por ciento de las camas tanto de ventilador como camas generales están ocupadas, y la reducción representa 95 por ciento respecto al punto máximo de la epidemia en la segunda ola.",0.0,62,15,03,2022
HUGO LOPEZ-GATELL RAMIREZ,"Y la mortalidad, el indicador más relevante del impacto que pudiera tener la epidemia de COVID, también a la baja, 94 por ciento con respecto al punto máximo que alcanzamos en la segunda ola.",0.0,34,15,03,2022
HUGO LOPEZ-GATELL RAMIREZ,"Y en la vacunación continuamos, ya existe muy poca demanda para el esquema primario, prácticamente hemos llegado al punto final en donde la población ya toda está cubierta en el esquema primario, y quienes restan por ponerse la vacuna les seguimos invitando a que se la pongan, pero ya es muy pocas personas que quedan pendientes o que desean todavía todavía vacunarse.",0.0,62,15,03,2022
HUGO LOPEZ-GATELL RAMIREZ,"Es posible que algunas de las personas que ya no se estén vacunando hayan tenido, o bien la decisión de no vacunarse, lo cual consideramos que no es conveniente, insistimos en que se vacunen, o bien fueron vacunadas en otro contexto, quizá fuera de México.",0.0,45,15,03,2022
HUGO LOPEZ-GATELL RAMIREZ,"Hemos utilizado 186.7, casi punto 8 millones de dosis de vacunas en 85.4 millones de personas. Este es el esquema primario al que me refería.",0.0,25,15,03,2022
HUGO LOPEZ-GATELL RAMIREZ,Y en la siguiente lo que vemos es que la cobertura está en 90 por ciento.,0.0,16,15,03,2022
HUGO LOPEZ-GATELL RAMIREZ,"Seguimos trabajando para que en las áreas rurales de muy difícil acceso lograr que todo mundo se vacune. No es ya ningún problema de acceso, es un asunto de voluntad, pero seguimos intentando que se persuada a todas las personas para que sean vacunadas.",0.0,44,15,03,2022
HUGO LOPEZ-GATELL RAMIREZ,"La cobertura general es 90 por ciento de la población adulta y 54 por ciento en pequeñas de 14 a 17 años, quienes sí están todavía activamente vacunándose. Esto nos da un promedio general de 87 por ciento.",0.0,38,15,03,2022
HUGO LOPEZ-GATELL RAMIREZ,"Ahora, con los refuerzos avanzamos a una velocidad todavía importante, 71 por ciento de cobertura en personas de 60 años y más, 48 en personas de 40 a 59 años y 62 por ciento en personas de 30 y 39, próximamente incorporaremos ya la estadística de personas de 18 hasta 29 años de edad para el refuerzo que están recibiendo.",0.0,60,15,03,2022
HUGO LOPEZ-GATELL RAMIREZ,"Y, como sabemos, hemos recibido la última, 224.3 millones de dosis de vacunas. Tenemos suficiente vacuna ahorita para cubrir todas las necesidades de lo que está programado.",0.0,27,15,03,2022
HUGO LOPEZ-GATELL RAMIREZ,"Y estamos en un periodo bueno de baja en la epidemia y alta cobertura de vacunación, y eso es lo que deseamos.",0.0,22,15,03,2022
HUGO LOPEZ-GATELL RAMIREZ,Muchas gracias.,0.0,2,15,03,2022
ZOE ROBLEDO ABURTO," (IMSS): Muchas gracias. Muy buenos días. Con su permiso, señor presidente. Muy buenos días a todos y a todas quienes nos ven.",0.0,22,15,03,2022
ZOE ROBLEDO ABURTO,"Dentro del sector hicimos un video que creemos que es importante darlo a conocer a toda la población, al pueblo de México, sobre cuál era el origen de la provisión de servicios de atención médica en nuestro país y cómo es el modelo de IMSS-Bienestar para pasar a este proceso de transición. Entonces, si nos lo permiten, pudiéramos verlo.",0.0,59,15,03,2022
VOZ," MUJER: Desde 1943, con la creación de la Secretaría de Salubridad y Asistencia y del Instituto Mexicano del Seguro Social, en México esas dos instituciones se hacían cargo de brindar servicios médicos a toda la población.",0.0,36,15,03,2022
VOZ,"En 1979 nació IMSS-Coplamar para atender a población sin seguridad social que vivía en zonas marginadas y de difícil acceso. Poco tiempo después, en 1984, inició un proceso de descentralización de los servicios de salud y atención médica para que fueran los gobiernos de los estados los que se encargaran de esas tareas. Sin embargo, sólo en 19 entidades continúa la operación del programa que cambió de nombre a IMSS-Solidaridad, IMSS-Oportunidades, IMSS-Prospera y finalmente IMSS-Bienestar, mismos que mantuvieron vigente el modelo de atención integral a la salud.",0.0,87,15,03,2022
VOZ,"Hoy, el propósito es que en el año 2024 los hospitales de salud a cargo de los gobiernos de los estados se conviertan en hospitales del IMSS-Bienestar, operados y administrados con los lineamientos de ese modelo de Atención Integral a la Salud del IMSS-Bienestar.",0.0,44,15,03,2022
VOZ,¿En qué consiste ese modelo?,0.0,5,15,03,2022
VOZ,"Primero, la atención primaria a la salud como eje rector. Significa que las acciones del programa se centran en la prevención de enfermedades, priorizando la promoción de la salud y el diagnóstico oportuno para evitar el deterioro de la salud de las personas y sus familias.",0.0,46,15,03,2022
VOZ,"Segundo, acción comunitaria y participación social. El IMSS-Bienestar suma e involucra a través de diversas acciones a las familias, a las comunidades y al personal para trabajar juntos en el cuidado de la salud de todas y todos.",0.0,38,15,03,2022
VOZ,"Tercero, atención hospitalaria todos los días del año en todos los turnos. Los hospitales IMSS-Bienestar cuentan con médicos, enfermeras y paramédicos las 24 horas los 365 días del año.",0.0,29,15,03,2022
VOZ,"A la fecha, los hospitales del IMSS-Bienestar cuentan con las siguientes especialidades: ginecología y obstetricia, pediatría, medicina interna, cirugía, medicina familiar, anestesiología, urgencias médicas y epidemiología. Adicionalmente, cuentan con los servicios de laboratorio, rayos X, dental, sicología, nutrición y trabajo social.",0.0,41,15,03,2022
VOZ,"Cuarto, programas de mantenimiento y conservación. El IMSS-Bienestar realiza acciones para mantener instalaciones dignas, limpias y ordenadas y equipos funcionales, y con personal preparado y capacitado.",0.0,26,15,03,2022
VOZ,Desde hace meses se ha trabajado de la mano de los gobiernos estatales para que la transferencia se realice bajo tres principios:,0.0,22,15,03,2022
VOZ,"Uno, continuidad de los servicios de atención médica.",0.0,8,15,03,2022
VOZ,"Dos, libre asociación de los gobiernos de los estados con los que se han firmado acuerdos y convenios.",0.0,18,15,03,2022
VOZ,"Tres, libre adscripción de los trabajadores y transparencia total en la información.",0.0,12,15,03,2022
VOZ,"No se afectarán los derechos laborales ni se despedirá a ningún trabajador de salud. Cada quien conocerá sus condiciones individuales de acuerdo a su antigüedad, tipo de contratación y categoría. Para hacerlo, se implementará una calculadora digital para que cada trabajadora y trabajador tenga la información necesaria, pero sobre todo conozca de manera particular las condiciones de la transferencia al programa IMSS-Bienestar.",0.0,62,15,03,2022
VOZ,"Esta transformación está centrada en el derecho a la salud, centrada a las personas y en sus familias, para que reciban atención médica con la calidad que merecen; para que siempre encuentres médicos, enfermeras y especialistas en las unidades de salud; para que tengas acceso a medicamentos gratuitos; para que recibas atención médica en instalaciones dignas y con el equipo necesario, para que nadie se quede atrás y nadie se quede fuera.",0.0,72,15,03,2022
ZOE ROBLEDO ABURTO, Muchas gracias. Si nos permiten poner la presentación.,0.0,8,15,03,2022
ZOE ROBLEDO ABURTO,"¿De dónde viene el impulso de este proceso de transformación para la atención médica de las personas que no cuentan con seguridad social? Y aquí es importante aclararlo, este esquema es para las personas que no cuentan con seguridad social; el resto de las instituciones de seguridad social que existen en nuestro país, el IMSS, el Issste, el Issfam, Pemex y sus servicios de salud, además de los institutos de seguridad social de trabajadores de los gobiernos estatales, permanecen exactamente igual, aquí nos estamos enfocando en la población más vulnerable, quienes menos tienen y que no tienen seguridad social.",0.0,99,15,03,2022
ZOE ROBLEDO ABURTO,"Como lo saben, hubo reformas en 2019 al artículo 4º de la Constitución que sientan las bases del Estado de bienestar que propone la Cuarta Transformación: el componente de las pensiones para adultos mayores, las becas para los estudiantes de familias de escasos recursos y este que es el componente de salud; en la Constitución se estableció el sistema de salud para el bienestar, para la atención médica y los medicamentos gratuitos, que después derivó en reformas a la Ley General de Salud.",0.0,83,15,03,2022
ZOE ROBLEDO ABURTO,"Como se ha señalado, estuvimos en este recorrido todo el sector Salud por los hospitales de IMSS-Bienestar y trabajando, pensando y diseñando en este nuevo modelo que establece también las bases de coordinación entre los estados y la federación para la población sin seguridad social en la atención médica.",0.0,49,15,03,2022
ZOE ROBLEDO ABURTO,"En septiembre del año pasado se tuvo una reunión con todo el gabinete del sector Salud y las instrucciones del presidente López Obrador tienen que ver en el proceso, como se ha llevado a cabo esta etapa, concentrando los recursos que se entrega a los estados mediante un proceso estructurado.",0.0,50,15,03,2022
ZOE ROBLEDO ABURTO,"En segundo lugar, dimensionando cuál es el número real de beneficiarios que reciben atención y servicios de salud para que éstos sean de calidad, sean gratuitos y con un diagnóstico que se realizara en el territorio, directamente en cada una de las unidades y hospitales del segundo nivel.",0.0,48,15,03,2022
ZOE ROBLEDO ABURTO,"Además, con ese levantamiento poder conocer y calcular las inversiones tanto en personal, en infraestructura y en equipamiento que hacían falta, a partir de este fortalecimiento del modelo de atención primaria a la salud, del modelo de atención integral a la salud de IMSS-Bienestar que se acaba de ver, que existe en el país desde 1979.",0.0,56,15,03,2022
ZOE ROBLEDO ABURTO,"Como lo hemos señalado, las premisas son:",0.0,7,15,03,2022
ZOE ROBLEDO ABURTO,La libre asociación de los estados que están en esta disposición de transformar sus sistemas de salud en la atención médica.,0.0,21,15,03,2022
ZOE ROBLEDO ABURTO,"En segundo lugar, la participación voluntaria también de los trabajadores para que cada uno de ellos y de manera directa conozca cuáles son las condiciones que se les están ofreciendo y puedan tomar la mejor decisión sin despedir a nadie, sin liquidar a nadie.",0.0,44,15,03,2022
ZOE ROBLEDO ABURTO,"Hay mucha información en redes sociales, anónima toda, que establece algunos principios que no son correctos. El planteamiento se está haciendo para que cada uno de los trabajadores y trabajadoras conozca cuál es la situación y obviamente que este proceso de transferencia ocurra sin interrumpir la atención médica.",0.0,48,15,03,2022
ZOE ROBLEDO ABURTO,"La siguiente, el abordaje que se ha hecho es a partir, primero, de este ejercicio de levantamiento, diagnóstico de campo. Después de que se realiza esto, se hacen mesas de trabajo de todo el sector Salud con los gobiernos estatales para ver otros aspectos que tienen que ver con los temas financieros, laborales, jurídicos, de la propiedad de los inmuebles, etcétera, también conocer cuáles son los servicios que se tienen contratados en cada estado.",0.0,74,15,03,2022
ZOE ROBLEDO ABURTO,"Y, en tercer lugar, las firmas de los acuerdos, que ustedes han sido testigos. Se ha firmado ya en el estado de Nayarit, que es nuestro estado emblema, la punta de lanza de todo este sistema. Agradecemos mucho al gobernador Miguel Ángel Navarro porque ha sido con una disposición plena para que esto se logre, además de las firmas que se han llevado a cabo en los estados de Colima y de Tlaxcala.",0.0,73,15,03,2022
ZOE ROBLEDO ABURTO,"En la siguiente, estos levantamientos que se han realizado desde el año pasado ya han alcanzado 13 estados del país. Se trata de equipos, más de mil personas que han trabajado de todo el sector que acuden a las unidades, han visitado cuatro mil 747 unidades con una cédula que tiene que ver con estos componentes: los temas médicos, de enfermería, la participación comunitaria, los esquemas de contratación en recursos humanos, recursos materiales, servicios generales, conservación y la situación jurídica de los inmuebles.",0.0,83,15,03,2022
ZOE ROBLEDO ABURTO,"Y los estados que ya han sido visitados hasta este momento son Baja California Sur, Campeche, Colima, Ciudad de México, Durango, Michoacán, Nayarit, Oaxaca, Sonora, Sinaloa, Tlaxcala, Veracruz y Zacatecas. En ellos se hace este levantamiento para poder conocer el estado que guardan las instalaciones y todo el servicio de atención médica.",0.0,52,15,03,2022
ZOE ROBLEDO ABURTO,"En este caso traemos el caso de Nayarit, porque la pretensión es que empecemos el 1º de abril ya con la operación plena en el estado de Nayarit. Ahí se firmó el acuerdo desde el año pasado, en diciembre del 2021, y la intención es que 261 centros de salud de primer nivel y 16 hospitales, más uno nuevo que está por concluirse, el Hospital de la Mujer de Tepic, sean ya operados por el IMSS-Bienestar. Se trata de cuatro mil 627 trabajadoras y trabajadores que están en esta atención con quienes se está iniciando este proceso, este diálogo, para que conozcan cuáles son las propuestas para su incorporación al programa.",0.0,111,15,03,2022
ZOE ROBLEDO ABURTO,"Los siguientes pasos en este sentido es que el 17 de marzo instalamos en Nayarit, con el gobernador Navarro, ya la mesa de transición junto con todo el sector Salud. Una vez que esto ocurra, el miércoles 23 se estará lanzando tanto esta herramienta digital para que cada trabajador pueda conocer de manera individual cuál es la propuesta para su caso, dependiendo la antigüedad, la categoría, los años de servicio, para que no se le afecten nunca sus derechos labores, ni sus condiciones generales de trabajo.",0.0,86,15,03,2022
ZOE ROBLEDO ABURTO,"Y también vamos a habilitar ese mismo día un número telefónico, es el 800 953 2210 para que también en esa central puedan hacer llamadas los trabajadores, las trabajadoras y aclarar cualquier tipo de duda. Queremos que la información sin intermediarios esté a la mano de los trabajadores porque ellos son clave en este proceso de transición.",0.0,57,15,03,2022
ZOE ROBLEDO ABURTO,"Y de la misma manera se está planteando celebrar encuentros, asambleas informativas directamente con los trabajadores donde puedan aclararse absolutamente todas las dudas que puedan tener.",0.0,26,15,03,2022
ZOE ROBLEDO ABURTO,"Para darnos una idea de cómo está funcionando esto en el caso de Nayarit, como ejemplo, ¿qué es lo que nos encontramos en Nayarit después de este levantamiento? Estas brechas, este análisis establece cuáles son las brechas del sistema estatal de salud en Nayarit para que pudiera tener lo mínimo indispensable para estar igual que el programa con el número de especialistas que tiene el programa IMSS-Bienestar en todos los turnos, en el trabajo de enfermería, equipamiento, infraestructura y desde luego el tema de abasto de medicamentos.",0.0,87,15,03,2022
ZOE ROBLEDO ABURTO,"Como pueden ver ahí, en el caso de Nayarit encontramos un déficit de mil 629 trabajadores y trabajadoras, es decir, hacen falta contratar a mil 629 trabajadoras y trabajadores, ya contando incluso a los que están contratados de manera temporal. Es decir, son plazas que no existen y que son necesarias para que los hospitales puedan operar en todos los turnos: matutino, vespertino, los dos turnos que hay por la noche y también los fines de semana. De estos mil 629 trabajadores, 453 son la necesidad de médicos generales.",0.0,89,15,03,2022
ZOE ROBLEDO ABURTO,"También se están lanzando ya las convocatorias para identificar a estos trabajadores. Muchos de ellos pueden ser también trabajadores que estuvieron durante la pandemia, médicos generales que se contrataron para la atención de COVID y que son candidatos a estas contrataciones; 68 médicos especialistas, mil 108 enfermeras.",0.0,47,15,03,2022
ZOE ROBLEDO ABURTO,"Además, en términos de infraestructura —insisto, es sólo lo que hace falta para que las unidades que ya existen puedan operar de manera plena y eficiente— 12 unidades de cuidados especiales para neonatos, es decir, hay 12 hospitales que no cuentan con estas unidades que son claves para evitar muertes maternas y muerte infantil.",0.0,54,15,03,2022
ZOE ROBLEDO ABURTO,"Hace falta un quirófano, aunque en el caso de Nayarit de 25 quirófanos que tiene el Sistema Estatal de Salud, 15 están funcionando. Esos que no están funcionando tienen que ver con falta de equipamiento.",0.0,35,15,03,2022
ZOE ROBLEDO ABURTO,"También una sala de expulsión, servicios de urgencia, que no se cuentan en un hospital, tres salas de choque, hace faltan 24 consultas de especialidad en la consulta externa, 15 peines de laboratorio, tres residencias médicas y 66 ampliaciones de camas censables.",0.0,42,15,03,2022
ZOE ROBLEDO ABURTO,"Además, en la parte de equipamiento se identificó la necesidad de cinco ultrasonógrafos, 16 unidades oftalmológicas, 16 unidades de anestesia intermedia, cinco ultrasonógrafos básicos, 16 campímetros computarizados, 16 unidades de anestesia básica, 32 ventiladores adulto pediátrico, 32 ventiladores para neonatos, además de 16 refractores automáticos, 80 carros rojos, que son para las salas de choque en los servicios de urgencia también en el primer nivel, 16 esterilizadores de vapor para poder hacer los procesos de limpieza del instrumental, 48 cunas de calor radiante, 16 lámparas quirúrgicas que hacen falta sustituir, 16 equipos de rayos X y 386 camas clínicas hospitalarias, muchas de estas camas ya cumplieron su vida útil o están en camillas en la hospitalización, se necesita hacer esta inversión.",0.0,121,15,03,2022
