Participante,Texto,Sentimiento,Palabras,Dia,Mes,Anio
PRESIDENTE ANDRES MANUEL LOPEZ OBRADOR,"Y en efecto, el costo del transporte hay que cuidarlo, el costo del transporte público, porque es un costo que se tiene que sufragar porque, si no, no se puede ir al trabajo, no se puede ir a la escuela, no se puede ir a ninguna parte.",0.0,47,15,03,2022
PRESIDENTE ANDRES MANUEL LOPEZ OBRADOR,"Fíjense que cuando está mal la economía familiar, cuando no alcanzan los ingresos, lo que se sacrifica primero, y por eso tenemos que garantizar que mejoren los ingresos, porque lo que primero que se sacrifica cuando hay crisis en la familia es el gasto de alimentación, en alimentación, o sea, se consumen menos alimentos, menos tortillas, sí, pero el transporte no, ese es fijo.",0.0,64,15,03,2022
PRESIDENTE ANDRES MANUEL LOPEZ OBRADOR,"Y, en efecto, aquí en la Ciudad de México es una de las ciudades en donde cuesta menos el transporte público, y ojalá y se siga el ejemplo de la Ciudad de México en el resto del país, porque hay lugares en donde cuesta mucho el transporte público. No vamos a ir tan lejos, en el Estado de México, los que vienen a trabajar a la ciudad destinan una cantidad considerable en transporte para llegar a sus centros de trabajo.",0.0,80,15,03,2022
PRESIDENTE ANDRES MANUEL LOPEZ OBRADOR,"Entonces, vamos a ver lo de los carros, es un asunto de seguridad y también es para ayudar a la gente que no tiene para comprar un carro nuevo, pero lo queremos hacer bien, por eso se ha ido perfeccionando este acuerdo y vamos a tomar en cuenta lo que tú estás planteando.",0.0,53,15,03,2022
PREGUNTA," Solamente, presidente, una apelación muy breve. Sí es un tema de seguridad, pero la gente que tiene un carro ‘chocolate’ precisamente se lo roban a ellos y ninguna autoridad les admite la denuncia porque no tienen documentos válidos, apostillados, salvo un título de propiedad, otro tipo de documentos, por eso que brincan al tema de la inseguridad, no porque el ‘vehículo chocolate’, el vehículo irregular lo haya comprado el ladrón, se los roban con más facilidad porque saben que va a ser muy difícil rastrearlos.",0.0,85,15,03,2022
PREGUNTA,"Es todo, presidente.",0.0,3,15,03,2022
PRESIDENTE ANDRES MANUEL LOPEZ OBRADOR, Muy bien.,0.0,2,15,03,2022
PRESIDENTE ANDRES MANUEL LOPEZ OBRADOR,"Adelante, Valentina.",0.0,2,15,03,2022
PREGUNTA, Muchas gracias. Buen día a todas las personas que escuchan este diálogo.,0.0,12,15,03,2022
PREGUNTA,"Presidente, soy Valentina Peralta Puga, periodista independiente, principalmente lo que hacemos es investigar temas de seguridad, de violencia, de justicia y colaboramos con distintos medios.",0.0,25,15,03,2022
PREGUNTA,"Nos parece muy importante que ahorita que están presentes las autoridades de salud presentando este plan se considere un espacio fundamental a la salud mental sicoemocional de la población dentro de las instituciones, toda vez que la circunstancia de estos últimos sexenios de tanta violencia ha generado enfermedades graves que después derivan en otras enfermedades a partir de hechos violentos y de delitos.",0.0,63,15,03,2022
PREGUNTA,"Los grupos de delincuentes son también muy creativos y organizados, hay prácticas delictivas que se van replicando y tardan en ser identificadas y combatidas cada vez más en todo el espacio.",0.0,31,15,03,2022
PREGUNTA,"Y en todo el país se secuestran a personas que están de viaje, fuera de su lugar de residencia, que están hospedadas en hoteles y ahí son victimadas, como tres jóvenes de familias humildes del Estado de México, Aníbal Cerón Hernández, Cesar Augusto Vázquez Cureño y Juan Carlos Pérez, empleados que fueron enviados por su empresa por unos días a trabajar a Tabasco y fueron secuestrados por delincuentes en complicidad con autoridades locales, quienes les montaron una trampa y fueron encarcelados como responsables, mediante un montaje de intento de secuestro, en la carpeta de Balancán 298/2020. Desde hace año y medio están privados de la libertad en el Cereso Tenosique siendo inocentes.",0.0,112,15,03,2022
PREGUNTA,"En la Ciudad de México y en el Estado de México hay carpetas de investigación iniciadas previamente a su detención: en la Ciudad de México, la 555/09-2020; en el Estado de México, la 222267/20/09, donde se demuestra que los tres jóvenes son víctimas de secuestro y que los mecanismos de corrupción e impunidad en Tabasco tienen en la calle a los verdaderos culpables, que en Balankán-Tabasco se confabularon empleados del hotel Moncho donde estaban hospedados, la policía de Balancán, el titular de la UECS, Guadalupe González González, y al menos otras tres personas que hicieron las negociaciones para cobrar los rescates que pagaron la empresa y las familias, y que los verdaderos secuestradores son protegidos por el mismo titular de la UECS en Tabasco.",0.0,124,15,03,2022
PREGUNTA,"A la vez que exponemos esta práctica, a la vez que exponemos este caso en particular, exponemos esta práctica para que la Secretaría de Seguridad Ciudadana lo tome encuesta y también generen una estrategia de identificación de que esto está sucediendo en todo el país, presidente, y no se le está tomando mucho en cuenta, porque dicen: ‘Es un secuestro virtual, no es un secuestro real’ y, sin embargo, todas las lesiones sicoemocionales y de salud mental están ahí en las familias y más en este caso que estos jóvenes, siendo inocentes, están en ese lugar.",0.0,96,15,03,2022
PREGUNTA,"A le vez que exponemos esta problemática generalizada preguntamos si el gobierno federal puede intervenir para lograr la justicia. Esta intervención es urgente, porque el próximo viernes 18 de marzo será la última audiencia en la causa penal 151/2020. El juez presidente es Gabriel Martínez Cornelio del juzgado de la Región IV de Emiliano Zapata Tabasco y se determinará una sentencia que las familias, que son familias muy vulnerables del Estado de México, temen que pueda ser… consumarse esta injusticia.",0.0,80,15,03,2022
PREGUNTA,Son dos puntos principales en los que tienen que ver con esta intervención:,0.0,13,15,03,2022
PREGUNTA,"Uno, lograr la libertad de estos tres jóvenes inocentes a partir de la verdad, y que se investigue por parte del gobierno federal lo que realmente sucedió, porque así se identificarán a los responsables y se determinará cómo están haciendo esta mecánica, sobre todo el Tabasco, no es el único caso, de hecho ya está ahorita una serie que ejemplifica que esto tiene mucho tiempo haciéndose de la misma manera, y necesitamos que esa sanción sea ejemplar para que otros grupos delincuenciales no sigan replicando esta conducta. Es mi primera pregunta, presidente.",0.0,92,15,03,2022
PRESIDENTE ANDRES MANUEL LOPEZ OBRADOR," Bueno, Valentina, yo te propongo que hables hoy con Rosa Icela Rodríguez, secretaria de Seguridad Pública y Protección Ciudadana, que te atienda, transmítele toda la información y que ella nos ayude para que nos informe qué está sucediendo, si te parece.",0.0,41,15,03,2022
PREGUNTA," Perfecto, presidente. Le informaremos el resultado de esta reunión.",0.0,9,15,03,2022
PRESIDENTE ANDRES MANUEL LOPEZ OBRADOR, Sí.,0.0,1,15,03,2022
PREGUNTA," Mi segunda pregunta, para formularle mi segunda pregunta es indispensable que le refiera el siguiente contexto. Los periodistas, cuando estudiamos en las escuelas de periodismo, siempre nos dicen que tenemos que consignar hechos, datos duros, nada de interpretaciones ni subjetividades, y los hechos son que su gobierno realiza muchas acciones que son inéditas en México y en el mundo. Por ejemplo, usted y su gabinete inician juntos diariamente antes de amanecer sus actividades, no hay ningún referente en el mundo de un gobierno que haga lo mismo.",0.0,87,15,03,2022
PREGUNTA,"Por otro lado, la libertad de expresión que depende del gobierno federal es total, muestra de esa práctica diaria es esta reunión, es este diálogo donde podemos realizar preguntas libres que nadie verifica antes sobre temas de interés general, que son respondidas por usted sin un apuntador ni asesores que le estén preparando las respuestas, como ha sido siempre en los sexenios anteriores. Esos son hechos, no son conjeturas.",0.0,69,15,03,2022
PREGUNTA,"En estos tres años su gobierno ha enfrentado la pandemia con vacunas gratuitas para toda la población, ha hecho rifas y ventas de bienes para beneficiar a las comunidades más pobres, ha construido escuelas, hospitales, bancos, caminos, otorgado becas y apoyos.",0.0,41,15,03,2022
PREGUNTA,"Entre muchas acciones más, ha recuperado miles de millones de pesos que antes evadían grandes empresas, por lo que hoy su gobierno, sin endeudarse con el extranjero cuenta con recursos adicionales para destinarlos a los asuntos más importantes y urgentes, como el que hoy le preguntamos y que tiene que ver también con esta salud mental y sicoemocional de la población en general y de las víctimas en particular.",0.0,69,15,03,2022
PREGUNTA,"Presidente, con hechos, como lo decimos, se constatan los múltiples esfuerzos realizados hasta ahora por su gobierno. Sabemos que un sexenio es insuficiente para resolver todo lo acumulado en casi 40 años, por eso se atiende lo más importante y usted durante sus cientos de conferencias matutinas ha repito muchas veces que lo más importante siempre son las personas, lo humano, la felicidad de los gobernados.",0.0,66,15,03,2022
PREGUNTA,"En México hay al menos 100 mil seres humanos que están dados por desaparecidos y más de 53 mil personas encontradas sin vida de las que se desconoce su identidad y han sido abandonas en fosas comunes. Muchas personas dadas por desaparecidas están en esos espacios forenses atrapadas y nuevamente desaparecidas en una crisis de incapacidad, ineficiencia e ineficacia de los gobiernos locales.",0.0,63,15,03,2022
PREGUNTA,"Sabemos que desde el inicio de su gestión la atención a la búsqueda de personas desaparecidas es una de sus prioridades. Es evidente que el subsecretario Encinas y la titular de la Comisión Nacional de Búsqueda, Karla Quintana Osuna, han impulsado con total entrega y compromiso incontables acciones de búsqueda e identificación, que incluye el otorgamiento de más de mil millones de pesos en subsidios federales a las entidades federativas para fortalecer las acciones de búsqueda locales, la construcción de algunos centros regionales de identificación humana, pero, presidente, hacen falta más esfuerzos, sobre todo en materia forense.",0.0,97,15,03,2022
PREGUNTA,"Ahora que usted es el presidente y la mayoría de las entidades federativas son gobernadas por la 4T, están dadas las condiciones para buscar realmente, sin simulaciones. En otras condiciones nadie nunca más lo va a hacer. Hoy es el momento de las familias de personas desaparecidas.",0.0,47,15,03,2022
PREGUNTA,"En los tres años que quedan de su mandato es tiempo suficiente para lograr avances concretos en esta tragedia que los anteriores presidentes provocaron y por ello se negaron a reconocer. Hoy esos grupos que en su momento protegió, armó y empoderó García Luna siguen desapareciendo a seres humanos en México.",0.0,51,15,03,2022
PREGUNTA,"En este mismo salón, presidente, usted recibió a las familias que buscan a sus seres amados y se comprometió con ellas en repetidas ocasiones a que no habría límite de recursos, que su gobierno destinaría todo lo necesario para atender y enfrentar este fenómeno atroz, y buscarlos con todos los medios a su alcance.",0.0,54,15,03,2022
PREGUNTA,"Por eso, presidente es indispensable hoy atender de forma inmediata la crisis forense con el enfoque de búsqueda masiva con fines de identificación. Los gobiernos locales tienen acumulado el rezago de al menos 53 mil seres humanos sin vida y sin identidad en fosas comunes y servicios forenses que no se perician por falta de recursos y de voluntad política, ya que hasta ahora la facultad de identificación corresponde a las fiscalías, la federación no se puede meter legalmente si las fiscalías no generan esta voluntad de poder identificarlos.",0.0,89,15,03,2022
PREGUNTA,"Y los servicios forenses están rebasados, no pueden hacerlo con sus capacidades instaladas no siquiera logran atender la demanda ordinaria, menos el rezago acumulado por años. Ahí es donde sólo puede resolver el gobierno federal, porque este es un fenómeno nacional, y no hay manera de que lo hagan de manera individual, se está obligado a la coordinación de instituciones y de gobiernos, sobre todo para el cruce de información y de bases de datos, se necesita un repositorio nacional que no existe.",0.0,83,15,03,2022
PREGUNTA,"Se puede empezar con las entidades federativas, donde se cuenta con toda la voluntad política y humanitaria como, por ejemplo en la Ciudad de México, donde la jefa y el secretario de gobierno han mostrado compromiso incondicional con el tema y además se necesita con urgencia, porque en la Ciudad de México hay más de 14 mil personas en las fosas comunes del Panteón de Dolores y en el Instituto de Ciencias Forenses hay miles de muestras biológicas archivadas sin procesar, no se les ha obtenido el perfil genético, siguen pendientes por falta de recursos, por lo que no se puede realizar una confronta y saber si las personas que están dadas por desaparecidas y están siendo buscadas por sus familias las tienen sepultadas en su fosa común.",0.0,128,15,03,2022
PREGUNTA,En el Estado de México hay un promedio de ocho mil y los demás estados también están en situaciones similares.,0.0,20,15,03,2022
PREGUNTA,La única forma de resolver es actuar con la intervención decidida del gobierno federal ahora que usted es el presidente.,0.0,20,15,03,2022
PREGUNTA,"La pregunta es si usted destinará los recursos suficientes para realizar las propuestas que el subsecretario Alejandro Encinas ha hecho públicamente desde el año pasado y consisten en construir un Centro Nacional de Identificación Humana, porque hay regionales, pero si no tenemos una base de datos nacional no podemos confrontar, un Centro Nacional de Identificación Humana para que desde la Segob se articule la coordinación pericial y cotejo de datos que debe ser nacional.",0.0,74,15,03,2022
PREGUNTA,"Y el resguardo de estas personas también debe de estar bajo este enfoque federal, así como impulsar y fortalecer la intervención del Mecanismo Extraordinario de Identificación Forense, conocido como MEIF, que ya inició su operación hace pocos meses mediante el grupo coordinador integrado por siete personas expertas.",0.0,47,15,03,2022
PREGUNTA,"Son dos iniciativas, presidente, que de iniciarse este año con la fuerza federal permitirán a miles de personas desaparecidas regresar a sus casas en pocos meses. Lo único que necesitan para realizarse es la instrucción presidencial para destinar los recursos y la gestión política en las entidades federativas, al menos en las gobernadas por Morena.",0.0,55,15,03,2022
PREGUNTA,"Si hay un tema, presidente, que une a toda la población en México, más allá de filias y fobias, es este, donde todas las personas desean que las familias encuentren a sus seres amados desaparecidos. A lo mejor no vamos a encontrar a todos, porque algunos estarán fuera del alcance, pero estos 52 mil seres humanos están ahí en las fosas, sabemos dónde están, solamente están esperando que la cerrazón de las fiscalías se haga a un lado y se privilegie lo humano.",0.0,83,15,03,2022
PREGUNTA,"Le preguntamos, presidente, si además la impulsar la especialización de las fiscalías y las comisiones de búsqueda locales, usted apoyará estas iniciativas que propone el subsecretario Encinas.",0.0,27,15,03,2022
PREGUNTA,"Y, también, aunado a esta pregunta ¿puede convocar a este espacio al subsecretario Encinas, a la comisionada Quintana, y al grupo coordinador del MEIF para que expongan a toda la población a detalle la importancia y alcances de las propuestas y sus planes?",0.0,43,15,03,2022
PRESIDENTE ANDRES MANUEL LOPEZ OBRADOR," Bueno, te propongo algo, Valentina. Mira, el jueves es el informe de seguridad, van a estar aquí todos los miembros del gabinete, va a estar Rosa Icela. Que para el jueves informe sobre lo de Balancán, lo de los jóvenes, que van a ser sancionados, sancionados o no, el viernes, hay tiempo, de ahora al jueves para que ella investigue, se ponga de acuerdo contigo y nos informe aquí sobre ese asunto.",0.0,72,15,03,2022
PRESIDENTE ANDRES MANUEL LOPEZ OBRADOR,"Y lo mismo, te propongo que el jueves, después de tu amplia exposición, venga Alejandro Encinas, el jueves, con Karla, y que nos digan qué están haciendo y qué más se puede hacer para identificar cuerpos de desaparecidos.",0.0,38,15,03,2022
PRESIDENTE ANDRES MANUEL LOPEZ OBRADOR,"Te adelanto que no hay ninguna limitación económica, ellos lo saben, que para estas necesidades, estas demandas tan justas y humanas no hay límite en cuanto a presupuesto, tenemos sus recursos para atender estas demandas.",0.0,35,15,03,2022
PRESIDENTE ANDRES MANUEL LOPEZ OBRADOR,"Pero ya, según tengo información, se está trabajando; sin embargo, si hace falta más, de acuerdo a lo que tú estás planteando, que el jueves nos planteen qué necesitamos hacer para aprovechar este tiempo que nos falta, que no son tres años, son dos años y medio, porque estoy contando los días.",0.0,52,15,03,2022
PRESIDENTE ANDRES MANUEL LOPEZ OBRADOR,"Ahora resulta que tenemos que avanzar, como decía, Juárez, que avancemos aprisa, para que hasta donde lleguemos quede la raya y, que si —toco madera— regresan los conservadores, triunfan los reaccionarios, que les cueste trabajo retrogradar, hacer retroceder lo que se avanzó.",0.0,42,15,03,2022
PRESIDENTE ANDRES MANUEL LOPEZ OBRADOR,"Entonces, vamos a pedirle a Alejandro y Karla que vengan el jueves y te invitamos a ti para las dos cosas que planteaste.",0.0,23,15,03,2022
PREGUNTA," Muchas gracias, presidente. Sí, de acuerdo.",0.0,6,15,03,2022
PREGUNTA,"Y tiene usted razón, sí se está avanzando, hemos seguido puntualmente todas sus acciones, se está avanzando más de lo que se avanzó en los sexenios pasados, que fue prácticamente nada. Sn embargo, ustedes tienen tantos temas importantes qué atender que no se puede ver a detalle. Por ejemplo, la institución que rige todo el tema de búsqueda según la ley general en la materia es la Comisión Nacional de Búsqueda y nosotros tenemos entendido, tenemos el documento donde ya desde el año pasado solicitaron 300 plazas y no se les autorizó una, donde las plazas que tienen no son de estructura, donde 15 personas son las que tienen que atender prácticamente todos los espacios de todo el país, es insuficiente.",0.0,121,15,03,2022
PREGUNTA,"Entonces qué bueno que nos reitera que no hay límite en esto, porque deberíamos reenfocar las necesidades específicas de esta institución que, si se construye y se solidifica como lo exige la circunstancia y lo exige su encomienda, seguramente en estos dos años y medio que todos también estamos contando día a día vamos a tener resultados sólidos.",0.0,58,15,03,2022
PREGUNTA,Muchas gracias. Nos vemos aquí el jueves.,0.0,7,15,03,2022
PRESIDENTE ANDRES MANUEL LOPEZ OBRADOR, Muy bien.,0.0,2,15,03,2022
PRESIDENTE ANDRES MANUEL LOPEZ OBRADOR,"Raúl, te vas a quedar, o sea, te quedaste en la rayita. No, no, no, mañana tú eres el primero, sí, porque ya. Es que tengo una reunión.",0.0,28,15,03,2022
PREGUNTA, ¿Con quién?,0.0,2,15,03,2022
PRESIDENTE ANDRES MANUEL LOPEZ OBRADOR," Con todos los gerentes de las refinerías que están desde anoche reunidos, porque estamos definiendo sobre una estrategia a partir de que está aumentando el precio del crudo y estamos rehabilitando las refinerías para avanzar más en el propósito de la autosuficiencia y de no aumentar los precios de los combustibles.",0.0,51,15,03,2022
PRESIDENTE ANDRES MANUEL LOPEZ OBRADOR,"Lo vuelvo a decir, no van a aumentar los precios de las gasolinas, del diésel, del gas, de la luz; no van a aumentar en México a pesar de la nueva crisis provocada por la invasión y la guerra en Ucrania. Entonces, vamos a seguir manteniendo esos precios, y por eso la reunión con los gerentes de las seis refinerías, con el director de Pemex, Octavio Romero Oropeza, y con Rocío Nahle, la secretaria de Energía.",0.0,76,15,03,2022
PREGUNTA, (inaudible),0.0,1,15,03,2022
PRESIDENTE ANDRES MANUEL LOPEZ OBRADOR," Seguir avanzando. Miren, cuando llegamos al gobierno sólo estaban operando dos refinerías de las seis, y tenemos operando ahora las seis, y estamos ahora operando al 76 por ciento de su capacidad y lo que queremos es mejorar su capacidad productiva, producir más gasolinas, más diésel y también menos combustóleo, por eso se están modernizando las plantas y se están construyendo dos coquizadoras, que son las que se utilizan para sacarle al combustóleo gasolina, y esto no sólo es más rentable, sino menos contaminación. Entonces, estamos trabajando en eso.",0.0,89,15,03,2022
PRESIDENTE ANDRES MANUEL LOPEZ OBRADOR,"Cada gerente de las refinerías tiene su programa, se les está apoyando para que no les falten los recursos para la rehabilitación de plantas y que no padezcan de burocracia, se actúe rápido también que se cuide la seguridad de los trabajadores. Estamos en eso, es como un taller y me toca ahora reunirme con ellos porque me van a entregar sus conclusiones de todo el plan de refinación hasta el 2024. Entonces, eso es lo que voy a ver.",0.0,80,15,03,2022
PRESIDENTE ANDRES MANUEL LOPEZ OBRADOR,"Y luego vamos a tener otra reunión. Va a estar la jefa de Gobierno, va a estar el gobernador del Estado de México, desde luego el secretario de la Defensa, los ingenieros miliares, el secretario de Comunicaciones, porque estamos viendo todo lo que significa la construcción de las obras para llegar sin demora al aeropuerto desde el tren, que se va a terminar, desde el aeropuerto ‘Felipe Ángeles’ hasta Buenavista, aquí al centro, la ampliación de la autopista México-Pachuca a ocho carriles, que va a estar terminada para el 21, y otras vías, bueno, los distribuidores muy grandes que se están construyendo, vamos a revisar eso.",0.0,106,15,03,2022
PRESIDENTE ANDRES MANUEL LOPEZ OBRADOR,"Es que vi en el Face, hay unos memes de veras que ingeniosos, me hacen reír. Ahora con lo de la respuesta a los diputados de Europa, salieron unos meses buenísimos. Me gustó más uno donde estoy con Jesús, que le digo que eso no es diplomático, pero en fin. Pero unos muy buenos.",0.0,54,15,03,2022
PRESIDENTE ANDRES MANUEL LOPEZ OBRADOR,"Pero también los voceros del… No, no voceros, sino los conservadores, que también tienen ingenio y pasión. Estaba yo viendo uno de ellos que, por cierto, se le denomina así, vocero, y dice que el domingo fue al aeropuerto, dice: ‘Y era domingo e hice dos horas y media del centro al Felipe Ángeles’. Pues yo creo que se perdió el vocero.",0.0,62,15,03,2022
PRESIDENTE ANDRES MANUEL LOPEZ OBRADOR,"Pero estamos procurando acortar el tiempo, la distancia. Acuérdense ustedes que se quería hacer el aeropuerto en Tizayuca, hubo un debate si era Texcoco o Tizayuca y muchos… yo era jefe de Gobierno y pensaba que era mejor Tizayuca y no el lago, después es que me di cuenta de que existía la base aérea de Santa Lucía con más de dos mil hectáreas.",0.0,64,15,03,2022
PRESIDENTE ANDRES MANUEL LOPEZ OBRADOR,"Entonces, está más cerca que Tizayuca y entonces no les parecía lejos, porque están molestos por el nuevo aeropuerto, que está muy bien, pero de primera, es de los mejores aeropuertos del mundo. Yo no he viajado mucho, porque no acostumbro a viajar mucho, pero los aeropuertos que conozco son buenos aeropuertos y este nuevo aeropuerto está al nivel de los mejores del mundo.",0.0,64,15,03,2022
PRESIDENTE ANDRES MANUEL LOPEZ OBRADOR,"Y qué bueno que se abrió para que lo visitaran, porque ya una vez que se entregue el 21 pues ya no se va a poder caminar por las pistas.",0.0,30,15,03,2022
PREGUNTA," ¿Cómo va a ser la inauguración, presidente? ¿Cómo va a ser la inauguración en la semana?",0.0,16,15,03,2022
PRESIDENTE ANDRES MANUEL LOPEZ OBRADOR," Todo lo va a coordinar la Secretaría de la Defensa, porque ellos son los que lo hicieron. Por eso no voy a hablar porque, si no, me van a querer cepillar los del INE.",0.0,34,15,03,2022
PRESIDENTE ANDRES MANUEL LOPEZ OBRADOR,"Vamos a estar el día jueves, digo, el viernes; nos vamos el jueves en la tarde a Minatitlán, sí, va a haber reunión de seguridad, mañanera y conmemoración de la expropiación petrolera, porque es 18 de marzo.",0.0,37,15,03,2022
PRESIDENTE ANDRES MANUEL LOPEZ OBRADOR,"Entonces, de Mina vamos a hacer una gira por el istmo para supervisar las obras del tren, los parques industriales.",0.0,20,15,03,2022
PREGUNTA, ¿Con prensa?,0.0,2,15,03,2022
PRESIDENTE ANDRES MANUEL LOPEZ OBRADOR," La de la ceremonia del 18, sí, con medios, lo demás es supervisión. Y vamos a estar en Salina Cruz y luego vamos a supervisar en helicóptero la carretera de Salina Cruz a Oaxaca.",0.0,34,15,03,2022
PRESIDENTE ANDRES MANUEL LOPEZ OBRADOR,"Vamos a llegar a Oaxaca el 19 en la tarde. Se está haciendo ya un acuerdo en dos comunidades, Sola de Vega y Coatlán, para resolver un problema de mucho tiempo que ha costado incluso vidas por límites de tierra, son 10 mil hectáreas en disputa, y ya parece que hay un acuerdo. Vamos nosotros a ayudar a las dos comunidades, a los dos pueblos para que se consiga la paz.",0.0,71,15,03,2022
