Participante,Texto,Sentimiento,Palabras,Dia,Mes,Anio
MARCELO EBRARD CASAUBON, Buenos días.,0.0,2,06,07,2021
MARCELO EBRARD CASAUBON," Ah, sí, tiene razón. Bueno, con su permiso, señor presidente, buenos días.",0.0,12,06,07,2021
MARCELO EBRARD CASAUBON,"¿Dónde estamos en el abastecimiento de vacunas, que es la tarea que nos ha encomendado el señor presidente?",0.0,18,06,07,2021
MARCELO EBRARD CASAUBON,"Estamos aquí y la siguiente meta es llegar a 70 millones. Como lo acaba de decir el doctor López-Gatell, ya rebasamos 60 millones, pues ahora seguimos a 70 y vamos a alcanzarlo pronto, a mediados de julio, porque es el ritmo que está marcado; y, finalmente, de ahí pasaremos a rebasar los 80 millones a finales de este mes, principios, primeros días del mes de agosto.",0.0,66,06,07,2021
MARCELO EBRARD CASAUBON,"La siguiente, por favor. El presidente de la República desde que empezó la pandemia se hicieron dos cosas:",0.0,18,06,07,2021
MARCELO EBRARD CASAUBON,"Una -bueno, varias- una hablar con muchas instancias en el exterior, suscribir tempranamente la opción multilateral, que es Covax, promover la resolución de la ONU que dio lugar a ello y también aumentar las capacidades nacionales.",0.0,36,06,07,2021
MARCELO EBRARD CASAUBON,"Entonces, hemos tenido envíos desde siete países hasta el día de hoy y cada vez más lo que vamos a tener es que el abasto en México va a ser fruto de acuerdos para envasar nacionalmente, hacer el llenado y envasado final en México, aunque la sustancia activa proviene de otros países.",0.0,52,06,07,2021
MARCELO EBRARD CASAUBON,"Lo último que tenemos que informar ahí es el trabajo de Birmex, que ya inició el envasado, su primera prueba de la vacuna Sputnik de origen ruso.",0.0,27,06,07,2021
MARCELO EBRARD CASAUBON,"En esta gráfica, aquí se iniciaron las entregas de Drugmex Querétaro y aquí se iniciaron las entregas de Liomont Ocoyoacac, Estado de México. Es la misma gráfica que les acabo de presentar.",0.0,32,06,07,2021
MARCELO EBRARD CASAUBON,"Todo esto pues un circuito internacional complejo, pero, en fin, lo que me interesa comentarles es que en México ya se habrán envasado en julio, para fines de julio, nueve millones de AstraZeneca. Estas dos las traemos del exterior, dos millones de Pfizer, 11 millones de Sinovac, y este millón de CanSino también se envasa aquí en México.",0.0,58,06,07,2021
MARCELO EBRARD CASAUBON,"La siguiente, por favor. Informar de lo que nos encargó el presidente, la reunión del Grupo de los 20 en Italia, que la posición mexicana fue acelerar la cooperación internacional y ayudar a los países más vulnerables, de ahí se derivan dos acuerdos específicos con Italia.",0.0,46,06,07,2021
MARCELO EBRARD CASAUBON,"Vamos a hacer todo lo posible por traer la fase 3 de ReiThera, que es la vacuna italiana, que ya está bastante avanzada.",0.0,23,06,07,2021
MARCELO EBRARD CASAUBON,"Y en México hoy, si no hay algún cambio, se va a evaluar el proyecto fase 3 de Sanofi, que es francesa, con lo cual tendríamos más opciones de las que ya acabo de aclarar en este momento.",0.0,38,06,07,2021
MARCELO EBRARD CASAUBON,"La siguiente, por favor. México está en un circuito internacional, ya sea que estemos trayendo sustancia activa de otros países o que estemos importando las vacunas terminadas, que también nos obliga a no interrumpir el circuito; es decir, nosotros también tenemos que aportarles a otros países para que ese circuito virtuoso funcione. Si en algún lugar se para, pues entonces ya no funciona, no llegaría a todos los países el acceso a la vacuna.",0.0,74,06,07,2021
MARCELO EBRARD CASAUBON,"Entonces, son los países con los que el presidente nos ha pedido que se hagan diversas donaciones ¿de qué vacuna?, son dosis de AstraZeneca, producidas con sustancia activa hecha en Argentina y envasadas y finalizadas en nuestro país.",0.0,38,06,07,2021
MARCELO EBRARD CASAUBON,"Entonces, son Paraguay, hasta este día hemos mandado a Paraguay, Belice, Bolivia, El Salvador, Honduras, Guatemala y Jamaica, en el Caribe.",0.0,21,06,07,2021
MARCELO EBRARD CASAUBON,Y esto sería el estado al día de hoy. Gracias.,0.0,10,06,07,2021
MARCELO EBRARD CASAUBON," Bueno, rápido paso revista al tema de fases 3, muy breve.",0.0,11,06,07,2021
MARCELO EBRARD CASAUBON,"Desde un principio México ha tenido el interés, por instrucciones del presidente de la República y también del sector salud, de traer a México fases 3. Se han llevado a cabo varias: claramente Johnson & Johnson, CanSino, Curevac, en fin, ha habido varias.",0.0,43,06,07,2021
MARCELO EBRARD CASAUBON,"Ahora tenemos presentación de solicitudes, como ya dije, de Sanofi; Walvax, que es un ARN mensajero que va a valorar el sector salud si se lleva a cabo esa fase 3; hay otra de la India.",0.0,36,06,07,2021
MARCELO EBRARD CASAUBON,En el caso de América Latina hicimos una reunión de la Comunidad de Estados Latinoamericanos y Caribeños para presentar el portafolio de América Latina de las vacunas propias después de la experiencia que hemos tenido.,0.0,35,06,07,2021
MARCELO EBRARD CASAUBON,¿Cuál ha sido esa experiencia?,0.0,5,06,07,2021
MARCELO EBRARD CASAUBON,"Que al día de hoy América Latina sigue siendo como región, junto con el Caribe, de las que tiene menos vacunas, si lo comparas con otras regiones del mundo que sí producen. Dicho de otro modo, es estratégico producir tus propias vacunas.",0.0,42,06,07,2021
MARCELO EBRARD CASAUBON,"Bueno, en la reunión de la comunidad se presentaron los diversos proyectos. México presentó el suyo, el Patria; Cuba nos presentó los suyos, que son dos, que ya están en fase 3; presentó Brasil otra, Chile otra, Argentina otra. Entonces, es ese el portafolio de América Latina.",0.0,47,06,07,2021
MARCELO EBRARD CASAUBON,"El compromiso es: los que logren pasar fase 3 y tener las autorizaciones regulatorias, los demás países de América Latina respaldaríamos.",0.0,21,06,07,2021
MARCELO EBRARD CASAUBON,¿Cómo?,0.0,1,06,07,2021
MARCELO EBRARD CASAUBON,"Pues comprando alguna parte de nuestras vacunas que vamos a necesitar en el futuro, es decir, estamos hablando ya claramente del año 2022.",0.0,23,06,07,2021
MARCELO EBRARD CASAUBON,"Entonces, respuesta específica: sí, sí nos interesa y sí es muy importante que América Latina tenga en la región la posibilidad de producir su propia vacuna porque este no va a ser el último virus que vamos a enfrentar, va a haber otros y la gran lección es: tenemos que desarrollarlo nosotros; caso contrario, nos puede costar miles de vidas, quizá millones. Entonces, sí, sí nos interesa.",0.0,67,06,07,2021
MARCELO EBRARD CASAUBON," Con mucho gusto. Lo que ayer les comentamos a los senadores, ya lo informó aquí el señor presidente, es cuál es el avance de México, porque la razón para las restricciones ha sido sanitaria, el origen de esas restricciones.",0.0,39,06,07,2021
MARCELO EBRARD CASAUBON,"Entonces, nosotros estamos trabajando con DHS y ayer le pedimos su apoyo a los senadores. Teníamos un senador muy importante, por ejemplo, de Nuevo México, que es el senador Luján.",0.0,30,06,07,2021
MARCELO EBRARD CASAUBON,"Respecto a que si no van a levantar las restricciones en toda la frontera porque consideren que por razones sanitarias no se pueden hacer al mismo tiempo, que sí nos ayuden para que se revise qué se entiende por actividad no esencial y qué se entiende por actividad esencial. Entonces, en eso estamos ahorita.",0.0,54,06,07,2021
MARCELO EBRARD CASAUBON,"Se formó un grupo de trabajo y esperamos que los senadores apoyen esta iniciativa de México porque el impacto, como el presidente ya se los hizo notar, ha sido muy grande y ya no habría una razón: es decir, por ejemplo, Tijuana y San Diego tienen el mismo nivel de vacunación al día de hoy, ¿cuál sería la razón entonces de mantener o prolongar innecesariamente esa restricción a las actividades?",0.0,70,06,07,2021
MARCELO EBRARD CASAUBON,"Entonces, estamos en eso y esperamos…",0.0,6,06,07,2021
MARCELO EBRARD CASAUBON,"Otra cosa que hemos propuesto es que, bueno, que no tiene que ser toda la frontera, puede hacerse por ciudad dependiendo el avance que se tenga en cada ciudad.",0.0,29,06,07,2021
MARCELO EBRARD CASAUBON,"Entonces estamos esperando la respuesta, espero que sea muy pronto.",0.0,10,06,07,2021
