Participante,Texto,Sentimiento,Palabras,Dia,Mes,Anio
RICARDO MEJIA BERDEJA," Con su permiso, señor presidente. Buenos días a todas y a todos.",0.0,12,16,06,2022
RICARDO MEJIA BERDEJA,"Vamos a dar cuenta del informe Cero Impunidad, no hay crimen sin castigo, que es un trabajo coordinado del Gobierno de México, Secretaría de la Defensa, Secretaría de Marina, Secretaría de Seguridad Pública, Centro Nacional de Inteligencia, Guardia Nacional, en coordinación con las secretarías de Seguridad los estados, las fiscalías locales y desde luego la Fiscalía General de la República. Empezamos.",0.0,61,16,06,2022
RICARDO MEJIA BERDEJA,"Se informa de la detención de 22 personas vinculadas a actividades criminales en Colima. Esta fue una operación interinstitucional que se desarrolló entre el 10 y el 12 de junio, en cumplimiento a diversos cateos que autorizaron los jueces en los municipios de Villa de Álvarez y Colima, en una operación coordinada por la Secretaría de Marina, la fiscalía de Colima, la Secretaría de Seguridad Pública del estado y la Fiscalía General de la República, donde se lograron rescatar a dos personas del sexo femenino privadas de la libertad, pero también se pudo lograr la detención en flagrancia de 22 personas, asegurar seis inmuebles, armas cortas, armas largas y diferente material localizado en un domicilio en Villa de Álvarez. Aquí se ve el material bélico y los detenidos.",0.0,128,16,06,2022
RICARDO MEJIA BERDEJA,"Siguiente. También se informa de la detención en una operación coordinada por la fiscalía de Oaxaca, en coordinación con la Secretaría de Seguridad y Protección Ciudadana a través de la Coordinación Antisecuestros, que se logró la detención de Jesús ‘N’ y Nicandro ‘N’ en Juchitán de Zaragoza, Oaxaca, a quienes se les imputa la autoría del homicidio calificado cometido en agravio de Carlos Eduardo ‘N’, que fue ocurrido el pasado 3 de junio. La vinculación a proceso ya se solicitó y está pendiente de la resolución del juez de control.",0.0,90,16,06,2022
RICARDO MEJIA BERDEJA,"Siguiente. También se informa de la detención de los presuntos homicidas del alcalde de Teopisca, en Chiapas, que fue un evento acontecido el pasado 8 de junio donde se le asesinó al alcalde y ya se generó orden de aprehensión en contra de estas personas del sexo masculino, las cuales ya fueron detenidas por la Fiscalía General de Justicia del estado de Chiapas y las mismas ya están vinculados a proceso penal.",0.0,72,16,06,2022
RICARDO MEJIA BERDEJA,"Siguiente. También se informa de la detención de presuntos responsables de un linchamiento, de un homicidio tumultuario cometido en el municipio de Huauchinango, en la comunidad de Papatlazolco, en agravio de Daniel ‘N’. Ya se obtuvo la detención de cinco masculinos autores presuntos de este evento criminal, los cuales fueron ya vinculados a proceso penal y también la detención de dos individuos también presuntamente involucrados en este evento.",0.0,68,16,06,2022
RICARDO MEJIA BERDEJA,"El linchamiento, como ustedes lo saben, se provoca partir de la desinformación, del rumor alentado y de la exacerbación, de los ánimos de la comunidad. Y este caso es importante porque tampoco debe haber impunidad cuando se conocen este tipo de eventos de alto impacto en agravio de un joven, como era Daniel.",0.0,53,16,06,2022
RICARDO MEJIA BERDEJA,"Siguiente. También informamos de la detención de una célula del grupo criminal Los Escorpiones, vinculado al cártel del Golfo. Esto fue una operación en Cadereyta, Nuevo León, coordinada por elementos de la policía estatal fuerza civil y también con el apoyo de la Mesa Estatal de Construcción de Paz y Seguridad.",0.0,51,16,06,2022
RICARDO MEJIA BERDEJA,"Se logró de cuatro sujetos con armas y también chalecos balísticos y diferente material bélico, entre ellos cinco armas largas y una corta, los cuales ya están en proceso de vinculación penal.",0.0,32,16,06,2022
RICARDO MEJIA BERDEJA,"Siguiente. Continuando con las detenciones, el pasado 3 de junio personal de la Secretaría de la Defensa Nacional, en coordinación con la Fiscalía General de Veracruz, lograron la detención de cuatro personas, el aseguramiento de siete armas de fuego, dos de ellas largas, diferentes dosis de droga en el municipio de Emiliano Zapata, también al ejecutar un mandamiento judicial de cateo y ya están vinculados a proceso penal.",0.0,68,16,06,2022
RICARDO MEJIA BERDEJA,"Siguiente. También informamos de la detención de una célula criminal vinculada al cártel de Sinaloa, en el municipio de Benito Juárez, Cancún, Quintana Roo. Esta fue una operación coordinada por la Fiscalía General de Justicia de Quintana Roo, la Secretaría de Seguridad Pública de Cancún.",0.0,45,16,06,2022
RICARDO MEJIA BERDEJA,"Se logró la detención, en un primer momento, de cuatro sujetos por un robo con violencia que dejó lesionados. No obstante, al analizar el perfil de estos infractores de la ley, la Mesa de Inteligencia, integrada por Sedena, Semar, Guardia Nacional, Conase, CNI, entre otros, pudo establecer la vinculación de esta célula criminal con cuando menos siete homicidios; después hubo una quinta detención. Y se ha logrado establecer también que este grupo se dedicada, además de la venta de drogas, homicidios también, a la extorsión bajo el esquema conocido como ‘gota a gota’. Cuatro de ellos ya están vinculados a proceso y uno más está pendiente a su vinculación.",0.0,109,16,06,2022
RICARDO MEJIA BERDEJA,"Siguiente. Informamos de la detención aquí en la alcaldía de Cuajimalpa de Edgar René ‘N’, alias ‘Latín’, presunto encargado del trasiego de droga del Estado de México, entre el Estado de México y Culiacán para la organización delictiva del cártel del Pacífico. Fue una operación en la cual se les pudo detener con 88 kilogramos de cocaína, cuyo valor aproximado es de 20.7 millones de pesos.",0.0,66,16,06,2022
RICARDO MEJIA BERDEJA,"Siguiente. También, aquí en la Ciudad de México, en una operación coordinada por la Fiscalía General de Justicia de la Ciudad de México, el Centro Nacional de Inteligencia y la Secretaría de la Defensa Nacional se logró la detención de seis personas por delitos contra la salud, después de ejecutar 10 cateos en domicilios de Coyoacán, Xochimilco, Tlalpan y Gustavo A. Madero, aquí en la Ciudad de México.",0.0,68,16,06,2022
RICARDO MEJIA BERDEJA,"Ya se les detuvo, son seis personas. Informar que está pendiente su vinculación a proceso penal, la cual ya se solicitó por el Ministerio Público. Y aquí lo relevante, además de asegurárseles armas largas, dólares americanos, vehículos, es que se les aseguraron 331 kilogramos de cocaína, lo cual es una cantidad sumamente relevante.",0.0,53,16,06,2022
RICARDO MEJIA BERDEJA,"Siguiente. También aquí informamos en estos temas que, por lo complicado, por lo doloroso que son, evidentemente no puede haber impunidad. Es la detención del presunto homicida de un menor de cinco años en el Estado de México. Esta fue una operación coordinada por la Fiscalía General de Justicia del Estado de México, con elementos de Conase y un grupo de trabajo antihomicidios, que por instrucciones de la secretaria Rosa Icela Rodríguez, ya se encuentra trabajando.",0.0,76,16,06,2022
RICARDO MEJIA BERDEJA,"Ellos estuvieron apoyando tanto en la revisión e integración de la carpeta de investigación, así como en la ejecución de la orden de aprehensión. Y se logró detener a Alexis Ulises ‘N’, quien además como agravante era padrastro del menor que fue asesinado; ya se encuentra detenido y pendiente su vinculación a proceso penal.",0.0,54,16,06,2022
RICARDO MEJIA BERDEJA,"Siguiente. Damos cuenta de este caso relevante de Texcaltitlán, Estado de México. El pasado 14 de junio, en cumplimiento de una orden de aprehensión por homicidio y otra más por extorsión en contra de un objetivo prioritario generador de alta violencia en la región, perteneciente al grupo criminal de La Familia Michoacán.",0.0,52,16,06,2022
RICARDO MEJIA BERDEJA,"Personal de la Fiscalía General de Justicia el Estado de México, con acompañamiento de la Secretaría de Seguridad del estado, fue agredido cuando pretendía ejecutar este mandamiento judicial, fue agredido por sujetos armados que se encontraban resguardados en un domicilio y atrás de varios vehículos; y tras repeler la agresión los elementos de la Policía Ministerial y de la policía estatal, resultaron tres policías de Investigación lesionados, 11 agresores abatidos, 10 individuos detenidos, así como el aseguramiento de 29 armas largas, cinco armas cortas y cinco vehículos.",0.0,87,16,06,2022
RICARDO MEJIA BERDEJA,"Aquí es importante subrayar que este objetivo prioritario está vinculado al homicidio de 13 elementos de Seguridad Pública del Estado de México en un evento que tuvo amplísima difusión en Coatepec de Harinas, donde fueron abatidos ocho elementos de la Secretaría de Seguridad y cinco policías de Investigación en una emboscada, cometido por el grupo criminal de La Familia Michoacana.",0.0,60,16,06,2022
RICARDO MEJIA BERDEJA,"Dentro de las armas que fueron aseguradas, se encontró un arma corta 9 milímetros que pertenecía a uno de los 13 elementos de seguridad pública fallecidos. Dicha arma fue robada precisamente en ese evento de marzo de 2021. También este grupo criminal atacó instalaciones de Seguridad Pública en Sultepec, Estado de México, y este mismo grupo criminal está vinculado al atentado en contra de la alcaldesa de Pilcaya, Guerrero.",0.0,69,16,06,2022
RICARDO MEJIA BERDEJA,"Nada más subrayar también que el grupo de La Familia Michoacana se dedica fundamentalmente a la extorsión, al cobro de piso, a la extorsión a autoridades, a la gente que vende, huevo, carne, en Taxco plata y es un grupo que afecta la economía y la vida de las familias de esa región.",0.0,53,16,06,2022
RICARDO MEJIA BERDEJA,"Siguiente. También informamos de la detención de generadores de violencia con armamento, droga y vehículos en diferentes operaciones coordinadas por la Secretaría de la Defensa Nacional. Es el caso en Tijuana, Baja California, el pasado 11 de junio, donde, con el apoyo de la fiscalía del estado y la policía estatal, fueron detenidos cinco personas; en Culiacán, el pasado 10 de junio, también la propia Sedena, Guardia Nacional y policía estatal detienen a ocho generadores de violencia; en Tepatitlán, Morelos, cinco más, también por parte de la Sedena, Guardia Nacional y la fiscalía de Jalisco.",0.0,95,16,06,2022
RICARDO MEJIA BERDEJA,"Siguiente. También se aseguran en estas acciones coordinadas por la Secretaría de la Defensa diferente armamento, armas largas, vehículos, droga, entre otras, cartuchos, chalecos, entre otras, aditamentos para las actividades criminales.",0.0,31,16,06,2022
RICARDO MEJIA BERDEJA,"Siguiente. También informar de un operativo de desarme en San Juan Parangaricutiro, Michoacán, de un grupo que se autodenominaba ‘Autodefensas y/o Lumbreros’. En esta operación coordina por Sedena interviene Guardia Nacional, la policía de Michoacán, la fiscalía local y también con la presencia de observadores de derechos humanos, porque fue una acción de desarme a este grupo armado que se ostentaba como autodefensas. Se logró detener a 11 personas, se cumplimentaron tres de órdenes de cateo, además de asegurar 22 armas largas, cuatro armas cortas, 31 cargadores y tres vehículos, entre otros objetos.",0.0,93,16,06,2022
RICARDO MEJIA BERDEJA,"Siguiente. También informamos de un aseguramiento de cocaína en una operación naval realizada por la Secretaría de Marina, esto fue en Huatulco, en Oaxaca, el pasado 9 de junio, donde se identificaron dos embarcaciones de contrabandistas a 135 millas náuticas al oeste de Huatulco.",0.0,44,16,06,2022
RICARDO MEJIA BERDEJA,"Un helicóptero de Marina les hace la señalización de que se detuvieran, no lo hacen. Llegan al poblado de El Azufre, abandonan los vehículos. Y la Secretaría de Marina en esta operación pudo asegurar 36 bultos de cocaína con un peso de mil 347 kilogramos, lo que representa una afectación de 309 millones de pesos a la delincuencia organizada.",0.0,59,16,06,2022
RICARDO MEJIA BERDEJA,"Nos parece relevante subrayar —siguiente— las operaciones que la Secretaría de Marina ha desarrollado entre febrero y junio de este año de aseguramiento de embarcaciones. Ha logrado la detención de 107 infractores de la ley o presuntos delincuentes, ha asegurado más de 14 toneladas, es decir, 14 mil 46 kilogramos de cocaína, ha detenido 33 embarcaciones, lo que implica una afectación a la delincuencia organizada de más de cuatro mil 300 millones de pesos.",0.0,74,16,06,2022
RICARDO MEJIA BERDEJA,"También, como parte del combate a la impunidad, como hemos explicado, es la investigación, la detención, la vinculación a proceso, el seguimiento al proceso penal y las sentencias condenatorias.",0.0,29,16,06,2022
RICARDO MEJIA BERDEJA,"Aquí damos cuenta de sentencias relevantes que ha hecho el Tribunal Superior de Justicia de la Ciudad de México. Así como a veces se señala algunas resoluciones de los jueces con las cuales hay desacuerdo, aquí también subrayamos este tipo de sentencias que son importantes para que no haya impunidad, son en la Ciudad de México.",0.0,56,16,06,2022
RICARDO MEJIA BERDEJA,"Aquí por homicidio calificado a Juan Carlos ‘N’, 72 años de prisión, por desaparición cometida por particulares, que es importante, las desapariciones hoy en México fundamentalmente son cometidas por particulares, ya no por el Estado.",0.0,35,16,06,2022
RICARDO MEJIA BERDEJA,Aquí se obtuvo la pena de 62 años y seis meses de prisión.,0.0,13,16,06,2022
RICARDO MEJIA BERDEJA,Y otra más por secuestro agravado de 47 años de prisión en contra de Ismael ‘N’ y Juan Carlos ‘N’.,0.0,20,16,06,2022
RICARDO MEJIA BERDEJA,"También informamos de una sentencia relevante en el fuero federal, esta fue una operación en el municipio de Guadalupe, Zacatecas, en Cieneguitas, el pasado mes de agosto de 2020, fue una operación a partir de una orden de cateo en un domicilio. Se le apoyó a la Fiscalía General de Justicia del estado de Zacatecas, la Secretaría de la Defensa Nacional, la Coordinación Antisecuestros y la Guardia Nacional, se ejecuta la orden de cateo y se puede detener en flagrancia a 21 personas que pertenecen al cártel Jalisco Nueva Generación.",0.0,90,16,06,2022
RICARDO MEJIA BERDEJA,"Se les detiene con un acopio de armas de fuego de uso exclusivo del Ejército, Armada Fuerza Aérea, droga. Y a partir de la imputación penal que hace la Fiscalía General de la República, en primer término a partir del trabajo de la delegación de Zacatecas y de la Fiscalía de Coordinación Regional y después por la Fiscalía Especializada en Materia de Delincuencia Organizada, finalmente ya se logra una sentencia condenatoria por 26 años y 11 meses contra esta célula criminal del cártel Jalisco Nueva Generación.",0.0,86,16,06,2022
RICARDO MEJIA BERDEJA,"Siguiente. También, dando cuenta de los reportes de desaparición de personas del sexo femenino fundamentalmente, se informa que la Fiscalía General de Justicia de Nuevo León reportó la localización de 14 personas del sexo femenino con reporte de búsqueda entre los días 10 y 14 de junio del presente año.",0.0,50,16,06,2022
RICARDO MEJIA BERDEJA,"Siguiente. En la actualización del doloroso caso de Debanhi Susana Escobar Bazaldúa, acontecido en Escobedo, Nuevo León, informamos que el día de ayer tuvimos una reunión, por instrucciones del presidente de la República, con el fiscal general de Justicia del estado, el gobierno de Nuevo León, la Comisión Ejecutiva Nacional de Atención a Víctimas, y los padres de Debanhi, don Mario Escobar y doña Dolores Bazaldúa, donde se acordó que la solicitud judicial para la exhumación del cuerpo de Debanhi se realice el día 30 de junio, lo cual permitirá el análisis del cuerpo a través del grupo de expertos y expertas médicas para la homologación de dictámenes forenses antes practicados.",0.0,111,16,06,2022
RICARDO MEJIA BERDEJA,"También precisar que este día se acordó porque el perito forense internacional que tiene el reconocimiento de todo este grupo y fundamentalmente de los padres de Debanhi está convaleciente de COVID, y él ya ha estado estudiando el caso, él ya estuvo en México y entonces él va a regresar para la exhumación y el análisis correspondiente.",0.0,57,16,06,2022
RICARDO MEJIA BERDEJA,"También informar que todas las diligencias, entrevistas, actuaciones, peritajes que se han venido realizando, se pudo constatar por este grupo que ya obran dentro de la carpeta de investigación, a la cual han tenido acceso desde luego los padres de la víctima y también la Comisión de Atención a Víctimas.",0.0,50,16,06,2022
RICARDO MEJIA BERDEJA,"Siguiente. Como vinculaciones a proceso relevante, informar que en el caso de la activista abogada Cecilia Monzón Pérez, evento ocurrido el pasado 8 de mayo en el estado de Puebla, ya los presuntos feminicidas, Javier ‘N’, Santiago ‘N’ y Javier ‘N’ ya fueron vinculados a proceso penal por este delito.",0.0,50,16,06,2022
RICARDO MEJIA BERDEJA,"También, en el caso de Monserrat en Veracruz, el presunto feminicida, Marlon ‘N’, también ya fue vinculado a proceso penal.",0.0,20,16,06,2022
RICARDO MEJIA BERDEJA,"Y en el caso de las periodistas Yessenia y Sheila, en el evento de Cosoleacaque, dos de los presuntos autores de este feminicidio cometido en contra de estas compañeras periodistas ya fueron vinculados a proceso penal Armando ‘N’, alias ‘el Trascabo’, y Víctor Manuel ‘N’, alias ‘el Calaco’.",0.0,48,16,06,2022
RICARDO MEJIA BERDEJA,"Como cada reporte de Cero Impunidad, se informa también de la actualización del caso de las nueve personas periodistas que fueron asesinadas durante este año. Informar que hay, entre detenidos y buscados con orden de aprehensión, hay 26 presuntos y hay ya 19 de los cuales están vinculados a proceso penal. La actualización tiene que ver con los presuntos autores del homicidio de Yessenia y Sheila, que ya pasan a la columna de vinculados a proceso, la cual sube de 17 a 19.",0.0,83,16,06,2022
RICARDO MEJIA BERDEJA,"Informar, como lo ha precisado también el señor presidente, que en todos estos casos, en todos los casos, es decir, en los nueve casos, hay detenidos o hay personas con órdenes de aprehensión, quedan pendientes de ejecutar algunas de ellas. Es el caso de Armando Linares, en Zitácuaro, que ya están plenamente identificados los autores de este hecho criminal y hay orden de aprehensión y hay un grupo interdisciplinario en la búsqueda para poderlos detener. Es el caso también de Luis Enrique Ramírez Ramos, en Culiacán, Sinaloa. Y en el caso de Cosoleacaque hay tres órdenes pendientes de ejecutar más, pero en coordinación con la Fiscalía General de Justicia de Veracruz se está muy al pendiente para poder detenerlos lo antes posible.",0.0,122,16,06,2022
RICARDO MEJIA BERDEJA,"Sería cuanto, señor presidente.",0.0,4,16,06,2022
RICARDO MEJIA BERDEJA," Gracias, presidente.",0.0,2,16,06,2022
RICARDO MEJIA BERDEJA,"Bueno, primero que nada, subrayar la pronta respuesta del gobernador Miguel Barbosa y del fiscal Gilberto Higuera porque inmediatamente se comunicaron, hicieron diligencias y ya hay siete detenidos.",0.0,28,16,06,2022
RICARDO MEJIA BERDEJA,"Evidentemente la carpeta sigue abierta, se siguen extendiendo las investigaciones y seguramente la propia fiscalía va a… Además de la imputación directa por el hecho criminal, pues también si hubiera probables omisiones en el auxilio.",0.0,35,16,06,2022
RICARDO MEJIA BERDEJA,"Pero creo que esto sienta un precedente importante porque ya de entrada hay siete detenidos y seguramente habrá más. Nosotros estamos en colaboración permanente con la fiscalía y con el gobernador, y se estará informando de las nuevas detenciones, de las nuevas acciones que redunden precisamente en que no haya impunidad.",0.0,51,16,06,2022
RICARDO MEJIA BERDEJA," Bueno, eso tendría que deslindarlo la propia investigación. Y si efectivamente hubo una omisión, seguramente se abrirá una carpeta al respecto y se podrá imputar. Hay que recordar que en Puebla también recientemente se detuvo elementos de la corporación estatal también por un exceso de fuerza. Creemos que están actuando. También en el penal de San Miguel se detuvo incluso a varios servidores públicos.",0.0,64,16,06,2022
RICARDO MEJIA BERDEJA,"Nosotros vamos a estar muy cerca porque nos parece muy pertinente su observación, pero sí señalar que esto sienta un precedente y que también esto no exime de su responsabilidad a la autoridad municipal, porque tiene que actuar como primer respondiente.",0.0,41,16,06,2022
RICARDO MEJIA BERDEJA,"Y también hacer un llamado a las redes sociales y a otro tipo de incitaciones que luego hay que generan este tipo de situaciones en las propias comunidades, que son caldo de cultivo para que algunos sujetos sin información pues criminalicen o señalen a personas que, como en el caso de Daniel, no tenían nada que ver en ningún hecho de esta naturaleza y que, además, aunque lo hubiera habido, no es la manera, nadie puede hacerse justicia por su propia mano y menos privar de la vida a nadie.",0.0,90,16,06,2022
RICARDO MEJIA BERDEJA,Gracias.,0.0,1,16,06,2022
