Participante,Texto,Sentimiento,Palabras,Dia,Mes,Anio
PRESIDENTE ANDRES MANUEL LOPEZ OBRADOR, Buenos días.,0.0,2,13,12,2021
PRESIDENTE ANDRES MANUEL LOPEZ OBRADOR,"Pues iniciamos esta semana y, como todos los lunes, nos va a informar Ricardo Sheffield sobre quién es quién en los precios de combustibles.",0.0,24,13,12,2021
PRESIDENTE ANDRES MANUEL LOPEZ OBRADOR,"Desde ayer expresamos, manifestamos nuestras condolencias a familiares, a amigos, a los simpatizantes, seguidores de Vicente Fernández, un símbolo de la canción ranchera, un cantante popular, conocido en México y en el extranjero. Y vamos a terminar la conferencia escuchándolo. Vean, póngase de acuerdo qué canción mientras estamos desahogando todos estos temas.",0.0,52,13,12,2021
PRESIDENTE ANDRES MANUEL LOPEZ OBRADOR,"También, el Atlas fue campeón —felicidades— después de 70 años en penaltis. Y felicidades al Atlas y a todos los aficionados.",0.0,21,13,12,2021
PRESIDENTE ANDRES MANUEL LOPEZ OBRADOR,Muy bien. Vamos con Ricardo.,0.0,5,13,12,2021
RICARDO SHEFFIELD PADILLA," Muy buenos días, señor presidente; muy buenos días a todas y a todos ustedes.",0.0,14,13,12,2021
RICARDO SHEFFIELD PADILLA,"Quién es quién en el precio de los combustibles. En esta semana el incentivo fiscal es del 45.3 por ciento en el caso de la gasolina regular. El precio promedio de la gasolina regular por litro, 20.37; para la Premium 22.445 por litro y 21.65 por litro para el diésel.",0.0,50,13,12,2021
RICARDO SHEFFIELD PADILLA,"Con corte al día 9 de diciembre, la mezcla mexicana de petróleo, el barril a 66 dólares con 97 centavos.",0.0,20,13,12,2021
RICARDO SHEFFIELD PADILLA,"Tenemos las tres marcas que tienen en promedio el margen más alto y los precios más alto: Corpogas, Chevron y Red Co; mientras que las tres más económicas: Exxon Mobil, Orsan y Rendichicas.",0.0,33,13,12,2021
RICARDO SHEFFIELD PADILLA,"Y nos vamos a ver el tema de las regiones y viendo las distintas regiones tenemos la más alta, con el margen más alto, de G-500 en Tlalpan aquí en la Ciudad de México con un precio al público de 22 pesos con 42 centavos y un margen ——si se pasaron los angelitos— de cuatro pesos con 25 centavos por litro, muy alto el margen, es muy pasados de rosca en esta gasolinera; mientras que el más económico, G-500, en Medellín de Bravo, Veracruz, con un precio al público de 18.50 por litro y pueden ver ustedes la gran diferencia en el margen, 24 centavos de margen por litro, un margen muy razonable.",0.0,113,13,12,2021
RICARDO SHEFFIELD PADILLA,"En el caso de la Premium, la más alta, con el margen más alto lo encontramos en una gasolinera de la marca Shell en Iztapalapa, también aquí en la Ciudad de México, 24 pesos con 90 centavos por litro, un margen de cuatro pesos con 27 centavos, y otra vez lo comparamos con el margen de 15 centavos, bastante bajo, de franquicia Pemex en Tuxtla Gutiérrez, Chiapas, con un precio al público de 20 pesos con 70 centavos.",0.0,78,13,12,2021
RICARDO SHEFFIELD PADILLA,"Y en el diésel el ejemplo de la más cara con el margen más alto es de Valero, el Zapopan, Jalisco, con un precio al público de 23 pesos con 58 centavos por litro, un margen de tres pesos 32 centavos, comparados con los 17 centavos de franquicia Pemex en Veracruz, Veracruz, que tiene un precio al público de 20 pesos con 19 centavos.",0.0,64,13,12,2021
RICARDO SHEFFIELD PADILLA,"Vamos a ver el tema de verificaciones a gasolineras. Atendimos 374, fueron bastantes denuncias esta semana que se presentaron, como saben, a través de la app de Litro por litro que se descarga de manera gratuita en Android e iOS, 154 visitas y/o verificaciones realizamos, afortunadamente una buena semana en verificación todos se dejaron verificar.",0.0,55,13,12,2021
RICARDO SHEFFIELD PADILLA,"Y si vemos los precios sin tomar en cuenta el margen, de acuerdo a como se manifiestan en la app, la gasolina regular más barata la encontramos en franquicia Pemex de Puebla, Puebla, con un precio al público de 17.95 por litro y a 18 pesos con nueve centavos también de franquicia Pemex, pero esto en Lázaro Cárdenas, Michoacán; comparado con las más caras de 22 pesos 99 centavos de Shell en Moloacán, Veracruz, y 22 pesos con 85 centavos de franquicia Bahía de Banderas, Nayarit.",0.0,86,13,12,2021
RICARDO SHEFFIELD PADILLA,"En el caso de la gasolina Premium, la más barata, 19.50 por litro de franquicia Pemex, en Veracruz, Veracruz, y 19.99 de G500 en Medellín de Bravo, Veracruz; comparado con las más caras, 24.99 de Chevron, en Santa Ana, Sonora, y 24 pesos 87 centavos de franquicia Pemex en Talpa de Allende, Jalisco. Esta de Talpa ya se había calmado, otra vez andan con precios muy altos, hubo un tiempo en que cada mes estaban apareciendo y otra vez estos señores se nos vuelven a volar.",0.0,86,13,12,2021
RICARDO SHEFFIELD PADILLA,"El diésel, la más barata, 19 pesos con nueve centavos de Mobil, en Cadereyta Jiménez, Nuevo León, y 19 pesos con nueve centavos de BP en Cadereyta Jiménez, Nuevo León, también.",0.0,31,13,12,2021
RICARDO SHEFFIELD PADILLA,"La más cara, 24 pesos, de franquicia Pemex, en Chontla, Veracruz, y 23 pesos con 85 centavos de G500 en San Pedro Mixtepec, Oaxaca.",0.0,24,13,12,2021
RICARDO SHEFFIELD PADILLA,"Seguimos también monitoreando el tema de los servicios sanitarios, que le da mucha importancia el consumidor a que no cobren y los mantengan limpios.",0.0,24,13,12,2021
RICARDO SHEFFIELD PADILLA,"El Gas LP, pueden ver ustedes en la raya azul, que es el comparativo que hemos venido haciendo en pesos mexicanos del precio promedio del gas a nivel internacional, que ahora está igualado porque ha venido bajando significativamente este precio en una disminución contracíclica que no se había visto hace tiempo. Esto es con corte el día 8 de diciembre en que el precio internacional es de 23 pesos con 19 centavos para cilindros y 12 pesos con 38 centavos para tanques estacionarios.",0.0,83,13,12,2021
RICARDO SHEFFIELD PADILLA,Y estos son los precios promedio de las 145 regiones: 22 pesos 89 centavos por litro para cilindro de gas y 12 pesos con 31 centavos por litro para tanque estacionario.,0.0,31,13,12,2021
RICARDO SHEFFIELD PADILLA,"Seguimos teniendo ejemplos en todo el país de expendedores de gas LP que dan por abajo del precio máximo establecido, cosa que les agradecemos su solidaridad y su apoyo a los consumidores, que son aliados de los consumidores en México, en el estado de Hidalgo, de Puebla, de Tlaxcala, de Guerrero, de Jalisco. Y como ejemplo, Flama Gas, en Mineral de la Reforma, Hidalgo. Tiene un precio al público de 11 pesos 23 centavos por litro, cuando el precio de la región es 12 pesos con 55 centavos.",0.0,88,13,12,2021
RICARDO SHEFFIELD PADILLA,"Y también hay ejemplos en el caso de cilindros de gas en Hidalgo, en Puebla, en Tlaxcala, en Guerrero y en San Luis Potosí. Y de ejemplo de ello Flama Gas en Mineral de la Reforma, Hidalgo, con un precio al público de 20 pesos 79 centavos por kilo cuando el precio máximo en la región es de 23 pesos con 23 centavos, casi tres pesos de diferencia en favor del consumidor en esa región.",0.0,75,13,12,2021
RICARDO SHEFFIELD PADILLA,"En verificaciones de gas realizamos 811 verificaciones y solamente 12 tuvieron infracciones menores, 4.3 por ciento de cilindros en mal estado que se sacaron del mercado; y de las 811, todas estaban cumpliendo el precio máximo, cosa que agradecemos y se evitan con ello fuertes sanciones, pero aparte también todas se dejaron verificar, una semana en la cual en ambos temas, gas LP y gasolina, se permitieron verificar todas.",0.0,69,13,12,2021
RICARDO SHEFFIELD PADILLA,"Vamos a remesas, que toca ahora el tema de las remesas. Este es el histórico de las remesas. En el mes de octubre fueron cuatro mil 819 millones de dólares que enviaron los héroes y heroínas desde de los Estados Unidos a nuestro país, a mamá o esposa; en promedio, 350 dólares por la remesa de cada una de ellas.",0.0,60,13,12,2021
RICARDO SHEFFIELD PADILLA,"Si lo comparamos con el 2018, aumentó 59.7 por ciento comparado con el 2019, 52.73 por ciento; y comparado con el año pasado también un aumento significativo, 33.79 por ciento, y decimos significativo porque ha venido aumentando mucho las remesas que hacen las heroínas y héroes de los Estados Unidos y fortalecen con ello nuestra economía.",0.0,56,13,12,2021
RICARDO SHEFFIELD PADILLA,"La mejor opción para el envío de efectivo fue uLink con una comisión de cero dólares y además un tipo cambiario bastante bueno de 21 pesos 323 centavos por dólar y por esa remesa promedio de 350 dólares uLink nos dio en pesos siete mil 430 pesos con 50 centavos, comparado con la peor opción de Western Union, que fueron siete mil 72 pesos con 56.",0.0,66,13,12,2021
RICARDO SHEFFIELD PADILLA,"Paisanos, paisanos, es una diferencia grande, por eso hay que escoger bien la remesadora allá en Estados Unidos, 8.5 por ciento de diferencia. Si escogen bien, les va a rendir más sus dólares acá en México ya convertidos en pesos.",0.0,40,13,12,2021
RICARDO SHEFFIELD PADILLA,"Y una muy buena opción es Banco del Bienestar abriendo cuenta con su tarjeta consular, lo pueden hacer en cualquier consulado de nuestro país allá en Estados Unidos.",0.0,28,13,12,2021
RICARDO SHEFFIELD PADILLA,"Y si es a depósito a cuenta, que es donde precisamente se obtiene el beneficio de abrir cuenta en Banco del Bienestar, uLink te da siete mil 430 pesos con 50 centavos, lo mismo que en efectivo y el mismo tipo cambiario, y sin comisión.",0.0,45,13,12,2021
RICARDO SHEFFIELD PADILLA,"Y, por el otro lado, el peor es Golden Money Transfer, que en depósito a cuenta te está dando siete mil 179 pesos con 66 centavos, porque está cobrando una comisión de cuatro dólares 99 centavos y el tipo cambiario es de 20.81.",0.0,43,13,12,2021
RICARDO SHEFFIELD PADILLA,"Y aquí está donde se recibe, que no hubo variación, lo único que podemos comentarles es que tanto allá, como acá, abran una cuenta de bienestar y, sin lugar a dudas, con esa cuenta en Banco del Bienestar y adicional, fijándose cuál es la mejor remesadora en los Estados Unidos, van a hacer que sus dólares rindan mucho.",0.0,58,13,12,2021
RICARDO SHEFFIELD PADILLA,"Viene un mes importante en las remesas, porque muchos hacen el envío más fuerte en este mes de diciembre.",0.0,19,13,12,2021
RICARDO SHEFFIELD PADILLA,Muchas gracias.,0.0,2,13,12,2021
PRESIDENTE ANDRES MANUEL LOPEZ OBRADOR, Vamos…,0.0,1,13,12,2021
PREGUNTA, Los videos.,0.0,2,13,12,2021
PRESIDENTE ANDRES MANUEL LOPEZ OBRADOR," Ah, bueno. Tú, luego tú, tercero, cuarto.",0.0,7,13,12,2021
PREGUNTA, La Secretaría de la Defensa Nacional informa los avances en la construcción del Aeropuerto Internacional ‘Felipe Ángeles’ al 13 de diciembre de 2021.,0.0,23,13,12,2021
PREGUNTA,"En la torre de control y servicios de extinción de incendios se continúa con la instalación de equipamiento de mobiliario en la cabina; asimismo, se termina con la instalación de antenas VHF para comunicación de aire-tierra.",0.0,36,13,12,2021
PREGUNTA,En el estacionamiento y terminal intermodal de transporte terrestre se lleva a cabo la construcción de muros de cemento para la estructura de elevadores en la terminal de autobuses y las preparaciones para el desplante de columnas metálicas de cubierta de eje troncal.,0.0,43,13,12,2021
PREGUNTA,"En las redes hidráulicas y sanitarias generales se inicia con los trabajos de instalación de tubería en tanques de agua en la planta de almacenamiento de agua potable primaria, mientras que en la barda perimetral del edificio se continúa con el habilitado de acero de refuerzo.",0.0,46,13,12,2021
PREGUNTA,"En la terminal de combustibles y red de distribución se efectúa el montaje de tubería de la red interna, la compactación de zanja de la red de distribución y el habilitado de acero en la caja de aislamiento de punto bajo.",0.0,41,13,12,2021
PREGUNTA,"En las redes eléctricas, voz y datos se realizan trabajos de monitoreo de red eléctrica, el cuarto de control y la supervisión de circuitos eléctricos.",0.0,25,13,12,2021
PREGUNTA,"A la fecha se han generado 136 mil 983 empleos civiles bajo el control, dirección y supervisión de 195 militares.",0.0,20,13,12,2021
PREGUNTA,Faltan 98 días de construcción.,0.0,5,13,12,2021
ROCIO NAHLE GARCIA, Hoy es 10 de diciembre y ya se colocó el tren de intercambiadores de calor en la planta hidrotratadora de naftas.,0.0,21,13,12,2021
ROCIO NAHLE GARCIA,"Me acompañan gerentes de la refinería de Madero, de Cadereyta, el gerente que va a estar aquí en Dos Bocas, porque esta refinería va a entrar al Sistema Nacional de Refinación y entre todas estarán integradas.",0.0,36,13,12,2021
ROCIO NAHLE GARCIA,Va el reporte de esta semana.,0.0,6,13,12,2021
PREGUNTA, La etapa de la construcción de la refinería Olmeca ha iniciado la recepción y colocación de equipos.,0.0,17,13,12,2021
PREGUNTA,Esta semana arribó al puerto de Dos Bocas la embarcación Happy River con dos reactores provenientes de Italia que se instalarán en los trenes de la tratadora de naftas. Se llevó a cabo la descarga de estos equipos de 278 mil 800 kilogramos de pesos y se posicionaron en el área de recepción para su posterior ingreso a la refinería Olmeca.,0.0,61,13,12,2021
PREGUNTA,En la planta hidrotratadora de naftas ya se montaron los equipos intercambiadores de calor correspondientes al tren 1 y se recibió la sección de radiación del calentador para su maniobra de instalación.,0.0,32,13,12,2021
PREGUNTA,"Continúa la construcción de subestaciones eléctricas en los diferentes paquetes, el armado de las cuatro torres de enfriamiento y se avanza en el desarrollo de las bases estructurales del área de efluentes.",0.0,32,13,12,2021
PREGUNTA,"El 10 de diciembre inició el traslado desde el exterior de cinco módulos que formarán parte de la planta reformadora, se trata del segundo embarque de este tipo y se lleva a cabo desde el muelle en Corea hacia el puerto de Dos Bocas.",0.0,44,13,12,2021
PREGUNTA,"En el área de almacenamiento se realizan pruebas hidrostáticas en los recipientes esféricos y se trabaja en la pintura y rotulado final de los tanques, así como también se prepara el sitio para las mochetas de integración de tuberías.",0.0,39,13,12,2021
PREGUNTA,"Continúan los trabajos de acabado y detalle de los edificios administrativos. En el cuarto de control continúa el trabajo de obra civil en el interior y se realiza el pegado de loseta en el área de espejos de agua, así como también en la presentación y diseño de la maqueta de exhibición.",0.0,52,13,12,2021
PREGUNTA,Se inició el montaje de los 780 kilómetros de tuberías en los racks de integración que conectarán las plantas de proceso a los tanques de almacenamiento y en el acueducto continúa el tendido e instalación de tubería para su integración.,0.0,40,13,12,2021
PREGUNTA,"Derivado del avance y la demanda de plantas en la instalación, se ha incrementado el trasplante de plantas de ornato cultivadas en el vivero.",0.0,24,13,12,2021
PREGUNTA," Tren Maya, reporte de avances, semana 57 de 157.",0.0,9,13,12,2021
PREGUNTA,"En el tramo 1, en El Triunfo-Balancán, continuamos con trabajos de terracería, hemos progresado con 112 kilómetros en todo el tramo.",0.0,21,13,12,2021
PREGUNTA,"En Palenque, Chiapas, inició la construcción del centro de atención a turistas y visitantes que son zonas de servicio colindantes a zonas arqueológicas, cuyo propósito es ofrecer atención y servicios de calidad.",0.0,32,13,12,2021
PREGUNTA,"En el tramo 2 avanzamos con la conformación de capa de subrasante y tendido de terraplén, tenemos en ejecución 45 kilómetros.",0.0,21,13,12,2021
PREGUNTA,"En el tramo 3, en Chochoh, Yucatán, en la fábrica de prefabricados realizamos 120 trabes para la construcción de 10 pasos vehiculares y progresamos en el acopio de 15 mil 500 metros cúbicos de balasto para comenzar la colocación sobre el terraplén finalizado.",0.0,43,13,12,2021
PREGUNTA,"En el tramo 4, en Kankabchén, Yucatán, estamos avanzando con la construcción de pasos vehiculares con actividades y habilitado de acero, tenemos en ejecución 14 pasos vehiculares.",0.0,27,13,12,2021
PREGUNTA,Continuamos con la construcción de muros de contención para la carretera Kantunil-Cancún.,0.0,12,13,12,2021
PREGUNTA,Hemos avanzado con 11 mil 485 metros lineales de muros.,0.0,10,13,12,2021
PREGUNTA,"De la mano del INA, hemos efectuado labores de prospección arqueológica con el objetivo de salvaguardar el patrimonio cultural subacuático. Dentro de estas actividades destaca la identificación de una cano del periodo clásico tardío encontrada al interior de una cueva inundada dentro de un cenote, ubicado en el asentamiento prehispánico de San Andrés, cercano a Chichén Itzá, Yucatán. Este hallazgo se suma a los más de 18 mil 325 monumentos arqueológicos encontrados gracias a los esfuerzos del INAH y del Tren Maya.",0.0,82,13,12,2021
PREGUNTA,Los empleos generados por el Tren Maya en el sureste ya ascienden a 92 mil 540.,0.0,16,13,12,2021
PREGUNTA,El Tren Maya avanza.,0.0,4,13,12,2021
PREGUNTA," Construcción del Tren Interurbano México-Toluca, reporte semanal.",0.0,7,13,12,2021
PREGUNTA,Vía catenaria y obra electromecánica. Avance: 45.7 por ciento.,0.0,9,13,12,2021
PREGUNTA,"Talleres y cocheras. Se realizaron las pruebas de iluminación en los edificios, naves y patios de las instalaciones ubicadas en Zinacantepec.",0.0,21,13,12,2021
PREGUNTA,Todas las luminarias son de bajo consumo y de alta eficiencia. Esta tecnología representa un ahorro energético de hasta el 90 por ciento respecto a una bombilla incandescente convencional con la misma capacidad de iluminación.,0.0,35,13,12,2021
PREGUNTA,Terracerías 3. Se distribuye el material de fijación para la vía izquierda en el kilómetro 32.,0.0,16,13,12,2021
PREGUNTA,"Sistema de catenaria. Se instalan las ménsulas y aisladores previo a la colocación de los postes para el sistema de catenaria a lo largo de la vía 1, llegando hasta el kilómetro 33 sobre el viaducto 4. Los postes se fijan mediante anclas de acero de alta resistencia a la tracción ahogadas dentro del concreto de las baquetas a los costados del viaducto.",0.0,63,13,12,2021
PREGUNTA,"Instalación de vía. En la vía izquierda, en el kilómetro 32, sobre el viaducto 4, los tramos de riel son colocados y nivelados mediante marcos de acero, simultáneamente se prepara la cimbra para el colado de los plintos de concreto que fijarán la vía.",0.0,44,13,12,2021
PREGUNTA,Portal Toluca. Continúa la construcción de la losa de concreto para la transición entre la vía del túnel y la vía del viaducto 5 en el portal Toluca del bitúnel.,0.0,30,13,12,2021
PREGUNTA,"Tramo 3, 17 kilómetros. Avance de obras: 53.7 por ciento.",0.0,10,13,12,2021
PREGUNTA,"Estación Vasco de Quiroga. Una vez liberada la interferencia de los cables de energía eléctrica de media tensión, se procedió al trazo de las filas faltantes en los apoyos 6 y 7. Simultáneamente, avanza el armado de las pilas, así como de la viga de atado de los micropilotes que protegen el talud sur del proyecto.",0.0,56,13,12,2021
PREGUNTA,"Secretaría de Infraestructura, Comunicaciones y Transportes.",0.0,6,13,12,2021
PRESIDENTE ANDRES MANUEL LOPEZ OBRADOR," Ah, bueno. Tú, luego tú, tercero, cuarto.",0.0,7,13,12,2021
PREGUNTA, La Secretaría de la Defensa Nacional informa los avances en la construcción del Aeropuerto Internacional ‘Felipe Ángeles’ al 13 de diciembre de 2021.,0.0,23,13,12,2021
PREGUNTA,"En la torre de control y servicios de extinción de incendios se continúa con la instalación de equipamiento de mobiliario en la cabina; asimismo, se termina con la instalación de antenas VHF para comunicación de aire-tierra.",0.0,36,13,12,2021
PREGUNTA,En el estacionamiento y terminal intermodal de transporte terrestre se lleva a cabo la construcción de muros de cemento para la estructura de elevadores en la terminal de autobuses y las preparaciones para el desplante de columnas metálicas de cubierta de eje troncal.,0.0,43,13,12,2021
PREGUNTA,"En las redes hidráulicas y sanitarias generales se inicia con los trabajos de instalación de tubería en tanques de agua en la planta de almacenamiento de agua potable primaria, mientras que en la barda perimetral del edificio se continúa con el habilitado de acero de refuerzo.",0.0,46,13,12,2021
PREGUNTA,"En la terminal de combustibles y red de distribución se efectúa el montaje de tubería de la red interna, la compactación de zanja de la red de distribución y el habilitado de acero en la caja de aislamiento de punto bajo.",0.0,41,13,12,2021
PREGUNTA,"En las redes eléctricas, voz y datos se realizan trabajos de monitoreo de red eléctrica, el cuarto de control y la supervisión de circuitos eléctricos.",0.0,25,13,12,2021
PREGUNTA,"A la fecha se han generado 136 mil 983 empleos civiles bajo el control, dirección y supervisión de 195 militares.",0.0,20,13,12,2021
PREGUNTA,Faltan 98 días de construcción.,0.0,5,13,12,2021
ROCIO NAHLE GARCIA, Hoy es 10 de diciembre y ya se colocó el tren de intercambiadores de calor en la planta hidrotratadora de naftas.,0.0,21,13,12,2021
ROCIO NAHLE GARCIA,"Me acompañan gerentes de la refinería de Madero, de Cadereyta, el gerente que va a estar aquí en Dos Bocas, porque esta refinería va a entrar al Sistema Nacional de Refinación y entre todas estarán integradas.",0.0,36,13,12,2021
ROCIO NAHLE GARCIA,Va el reporte de esta semana.,0.0,6,13,12,2021
PREGUNTA, La etapa de la construcción de la refinería Olmeca ha iniciado la recepción y colocación de equipos.,0.0,17,13,12,2021
PREGUNTA,Esta semana arribó al puerto de Dos Bocas la embarcación Happy River con dos reactores provenientes de Italia que se instalarán en los trenes de la tratadora de naftas. Se llevó a cabo la descarga de estos equipos de 278 mil 800 kilogramos de pesos y se posicionaron en el área de recepción para su posterior ingreso a la refinería Olmeca.,0.0,61,13,12,2021
PREGUNTA,En la planta hidrotratadora de naftas ya se montaron los equipos intercambiadores de calor correspondientes al tren 1 y se recibió la sección de radiación del calentador para su maniobra de instalación.,0.0,32,13,12,2021
PREGUNTA,"Continúa la construcción de subestaciones eléctricas en los diferentes paquetes, el armado de las cuatro torres de enfriamiento y se avanza en el desarrollo de las bases estructurales del área de efluentes.",0.0,32,13,12,2021
PREGUNTA,"El 10 de diciembre inició el traslado desde el exterior de cinco módulos que formarán parte de la planta reformadora, se trata del segundo embarque de este tipo y se lleva a cabo desde el muelle en Corea hacia el puerto de Dos Bocas.",0.0,44,13,12,2021
PREGUNTA,"En el área de almacenamiento se realizan pruebas hidrostáticas en los recipientes esféricos y se trabaja en la pintura y rotulado final de los tanques, así como también se prepara el sitio para las mochetas de integración de tuberías.",0.0,39,13,12,2021
PREGUNTA,"Continúan los trabajos de acabado y detalle de los edificios administrativos. En el cuarto de control continúa el trabajo de obra civil en el interior y se realiza el pegado de loseta en el área de espejos de agua, así como también en la presentación y diseño de la maqueta de exhibición.",0.0,52,13,12,2021
PREGUNTA,Se inició el montaje de los 780 kilómetros de tuberías en los racks de integración que conectarán las plantas de proceso a los tanques de almacenamiento y en el acueducto continúa el tendido e instalación de tubería para su integración.,0.0,40,13,12,2021
PREGUNTA,"Derivado del avance y la demanda de plantas en la instalación, se ha incrementado el trasplante de plantas de ornato cultivadas en el vivero.",0.0,24,13,12,2021
PREGUNTA," Tren Maya, reporte de avances, semana 57 de 157.",0.0,9,13,12,2021
PREGUNTA,"En el tramo 1, en El Triunfo-Balancán, continuamos con trabajos de terracería, hemos progresado con 112 kilómetros en todo el tramo.",0.0,21,13,12,2021
PREGUNTA,"En Palenque, Chiapas, inició la construcción del centro de atención a turistas y visitantes que son zonas de servicio colindantes a zonas arqueológicas, cuyo propósito es ofrecer atención y servicios de calidad.",0.0,32,13,12,2021
PREGUNTA,"En el tramo 2 avanzamos con la conformación de capa de subrasante y tendido de terraplén, tenemos en ejecución 45 kilómetros.",0.0,21,13,12,2021
PREGUNTA,"En el tramo 3, en Chochoh, Yucatán, en la fábrica de prefabricados realizamos 120 trabes para la construcción de 10 pasos vehiculares y progresamos en el acopio de 15 mil 500 metros cúbicos de balasto para comenzar la colocación sobre el terraplén finalizado.",0.0,43,13,12,2021
PREGUNTA,"En el tramo 4, en Kankabchén, Yucatán, estamos avanzando con la construcción de pasos vehiculares con actividades y habilitado de acero, tenemos en ejecución 14 pasos vehiculares.",0.0,27,13,12,2021
PREGUNTA,Continuamos con la construcción de muros de contención para la carretera Kantunil-Cancún.,0.0,12,13,12,2021
PREGUNTA,Hemos avanzado con 11 mil 485 metros lineales de muros.,0.0,10,13,12,2021
PREGUNTA,"De la mano del INA, hemos efectuado labores de prospección arqueológica con el objetivo de salvaguardar el patrimonio cultural subacuático. Dentro de estas actividades destaca la identificación de una cano del periodo clásico tardío encontrada al interior de una cueva inundada dentro de un cenote, ubicado en el asentamiento prehispánico de San Andrés, cercano a Chichén Itzá, Yucatán. Este hallazgo se suma a los más de 18 mil 325 monumentos arqueológicos encontrados gracias a los esfuerzos del INAH y del Tren Maya.",0.0,82,13,12,2021
PREGUNTA,Los empleos generados por el Tren Maya en el sureste ya ascienden a 92 mil 540.,0.0,16,13,12,2021
