Participante,Texto,Sentimiento,Palabras,Dia,Mes,Anio
PRESIDENTE ANDRES MANUEL LOPEZ OBRADOR, Buenos días.,0.9384397760356878,2,30,09,2019
PRESIDENTE ANDRES MANUEL LOPEZ OBRADOR,"Bueno, estamos iniciando esta semana. Nos da mucho gusto estar de nuevo con ustedes, el compartir este tiempo para informar a los ciudadanos a través de ustedes; les agradecemos mucho por asistir a esta conferencia diaria, que es muy importante.",0.8489122272972706,40,30,09,2019
PRESIDENTE ANDRES MANUEL LOPEZ OBRADOR,Vamos a tratar dos temas:,0.6576678426297966,5,30,09,2019
PRESIDENTE ANDRES MANUEL LOPEZ OBRADOR,"Vamos a dar una buena noticia para los productores del campo, lo que tiene que ver con la fijación de Precios de Garantía. Este es un programa nuevo, no se aplicaban Precios de Garantía, llevaba mucho tiempo, años, y se acordó apoyar a los productores garantizando precios justos y comprando cosechas de alimentos básicos para que los productores, comuneros, ejidatarios, pequeños propietarios, vean compensado su esfuerzo con precios justos; y al mismo tiempo que avancemos en el objetivo de la autosuficiencia alimentaria.",0.20741717032758109,82,30,09,2019
PRESIDENTE ANDRES MANUEL LOPEZ OBRADOR,"Entonces, vamos a informar sobre este programa, lo va a hacer el doctor Víctor Manuel Villalobos, secretario de Agricultura; y el licenciado Ovalle, titular de Seguridad Alimentaria Mexicana, Segalmex.",0.019573605275716964,29,30,09,2019
PRESIDENTE ANDRES MANUEL LOPEZ OBRADOR,"Y también hoy, como todos los lunes, vamos a dar a conocer el Quién es quién en los precios de los combustibles. Esos son los dos temas que vamos a abordar.",0.16531384697930715,31,30,09,2019
PRESIDENTE ANDRES MANUEL LOPEZ OBRADOR,"Si les parece, vamos con el doctor Víctor Manuel Villalobos, secretario de Agricultura.",0.3757736202156258,13,30,09,2019
VICTOR MANUEL VILLALOBOS ARAMBULA," Muchas gracias, señor presidente.",0.42659809592117026,4,30,09,2019
VICTOR MANUEL VILLALOBOS ARAMBULA,Muy buenos días tengan todos ustedes.,0.9062130058864615,6,30,09,2019
VICTOR MANUEL VILLALOBOS ARAMBULA,"Como ustedes saben, Precios de Garantía es uno de los cuatro programas estratégicos que ha asignado el señor presidente a la Secretaría de Agricultura y tiene como orientación fundamental la de favorecer la producción de los campesinos y pequeños productores por medio de los precios justos y pago inmediato de sus cosechas para cuatro granos y para la leche fluida.",0.018216079496283774,60,30,09,2019
VICTOR MANUEL VILLALOBOS ARAMBULA,"Los otros tres programas son: Crédito Ganadero a la Palabra, Fertilizantes y Producción para el Bienestar.",0.6511780809310138,16,30,09,2019
VICTOR MANUEL VILLALOBOS ARAMBULA,"Precios de Garantía favorece gradualmente a la autosuficiencia de maíz, de frijol, de trigo panificable y de arroz, así como de la leche fluida. Esto se logra al garantizarles precios competitivos a todos nuestros pequeños y medianos productores.",0.8286841094941423,38,30,09,2019
VICTOR MANUEL VILLALOBOS ARAMBULA,"El precio está orientado a apoyar a los campesinos, a los comuneros, a los pequeños productores de autosuficiencia, sin intermediarios y sin coyotes y, como ya se ha señalado, con el pago inmediato tan pronto como entregan sus cosechas.",0.021063575922951643,39,30,09,2019
VICTOR MANUEL VILLALOBOS ARAMBULA,¿Cómo se logra esto? ¿Cómo vamos a poder llevar a cabo toda esta logística?,0.8479423491050303,14,30,09,2019
VICTOR MANUEL VILLALOBOS ARAMBULA,"Es importante reiterar a ustedes que Segalmex cuenta con 553 centros de acopio que están distribuidos en todo el territorio nacional, lo que facilita la compra directa de los granos, así como de la leche fluida sin altos costos para el transporte para los productores y también disminuyendo la logística.",0.8959090085871797,50,30,09,2019
VICTOR MANUEL VILLALOBOS ARAMBULA,"Hoy nos da mucho gusto, como ya lo señaló el presidente y ha indicado, anunciar el inicio de la compra de maíz y de frijol que será la cosecha de primavera-verano, y para mayor detalle yo le voy a pedir al licenciado Ignacio Ovalle, que es el director general de Segalmex, que explique un poco más de cómo vamos a proceder al respecto.",0.1417042731409737,63,30,09,2019
VICTOR MANUEL VILLALOBOS ARAMBULA,Licenciado.,0.022691947683872005,1,30,09,2019
IGNACIO OVALLE FERNANDEZ," Con su autorización, señor presidente.",0.42593460805528316,5,30,09,2019
IGNACIO OVALLE FERNANDEZ,Explico con un poco más de detalle en qué consiste el sistema de Precios de Garantía. Tiene dos objetivos básicos:,0.6597449121661967,20,30,09,2019
IGNACIO OVALLE FERNANDEZ,"Uno, atender a los productores más pobres del campo, y para esos efectos funciona el precio del maíz, del frijol y de la leche fluida. En el caso de maíz, como se ve, se compra la cosecha a los productores, a los campesinos que tienen hasta cinco hectáreas de temporal, y con un límite de compra de 20 toneladas. Con esto podemos decir realmente con seguridad que podemos llegar con ese precio al 100 por ciento de los campesinos más olvidados del país, al 100 por ciento.",0.42322859842855276,87,30,09,2019
IGNACIO OVALLE FERNANDEZ,"En el caso del frijol estaba planteado poder comprar a productores que tenían hasta 20 hectáreas de temporal o cinco de riego y comprando con un límite de 15 toneladas; sin embargo, hubo reiteradas peticiones de los productores, tanto planteadas a Segalmex, como fundamentalmente al jefe del Ejecutivo, de que pudiera aumentarse el hectareaje, la cantidad de hectáreas que podían ser favorecidas porque los principales estados productores de frijol en el país tienen extensiones grandes, pero no siempre muy productivas, por lo cual rogaría la siguiente lámina.",0.06561318123441456,87,30,09,2019
IGNACIO OVALLE FERNANDEZ,"El señor presidente de la República ha dispuesto que se pase la compra de límite de 20 hectáreas a 30 hectáreas, manteniéndose la de cinco de riego.",0.9221989239978572,27,30,09,2019
IGNACIO OVALLE FERNANDEZ,"Otra vez volvemos a la lámina anterior, por favor, para terminar de describir cómo está lo de Precios de Garantía.",0.43574329881759605,20,30,09,2019
IGNACIO OVALLE FERNANDEZ,"En el trigo panificable y en el arroz el objetivo fundamental es caminar hacia a la autosuficiencia alimentaria, es decir, reducir importaciones; por lo tanto, aquí se está comprando a cinco mil 790 y el arroz a seis mil 120.",0.28240788718947973,40,30,09,2019
IGNACIO OVALLE FERNANDEZ,"La leche fresca se está adquiriendo desde el día 1º de enero de este año, ya estaba fijada, porque la leche se colecta diariamente; en cambio estos cultivos se están anunciando hasta el día de ahora, fundamentalmente el maíz porque es cuando se van a presentar las cosechas, con excepción, debo decirlo, del frijol, que tuvimos que salir a comprar la que se presentó a principios… era desde fines del año anterior, pero se presentó la demanda de los productores a principios de este año y salimos a comprar, por indicaciones del presidente y de nuestro secretario de Agricultura, salió Segalmex a comprar y pudimos adquirir 100 mil toneladas en promedio.",0.1420206044791054,111,30,09,2019
IGNACIO OVALLE FERNANDEZ,"Ahora, hay unos elementos complementarios que nos ha indicado el presidente destacar ante ustedes.",0.8707515641189681,14,30,09,2019
IGNACIO OVALLE FERNANDEZ,¿En promedio cuánto más se está pagando al productor?,0.00838178422359406,9,30,09,2019
IGNACIO OVALLE FERNANDEZ,"Más o menos 30 por ciento más de lo que se compraría a pie de parcela al campesino. En algunos casos más, en el caso del maíz, señor presidente, el precio que se está pagando es 40 por ciento superior a como le compraban al campesino en el medio rural.",0.3562092451267468,50,30,09,2019
IGNACIO OVALLE FERNANDEZ,"Ahora, hay un dato complementario que nos ayuda a mostrar que no va a haber un alto autoconsumo en las comunidades donde se produce, ¿por qué?, porque como en Segalmex existen, coexisten Diconsa y Liconsa, que son empresas -ya alguna vez lo dije- que siguen existiendo, en el caso de Diconsa, fíjense ustedes, se sale a comprar a cinco mil 610, pero además se da un apoyo para el flete, para que el campesino pueda llevar la mercancía a la bodega o los granos a la bodega de 150 pesos adicionales por tonelada, para que no lo amarren ahí en la parcela.",0.527140845932808,102,30,09,2019
IGNACIO OVALLE FERNANDEZ,"Esto quiere decir que nos vende el productor el maíz más o menos a 5.75 pesos el kilo y en nuestras tiendas de Diconsa se vende a cinco pesos, ¿qué quiere decir?, que el campesino va a vender su cosecha a un precio más caro y puede comprar su propia cosecha a un precio más barato en nuestras tiendas.",0.25969438991224825,59,30,09,2019
IGNACIO OVALLE FERNANDEZ,¿Qué significa esto?,0.541333260777616,3,30,09,2019
IGNACIO OVALLE FERNANDEZ,"Un apoyo, tanto en la fase productiva como en la fase de comercialización.",0.3984781580545075,13,30,09,2019
IGNACIO OVALLE FERNANDEZ,"En el caso del frijol ocurre, señor presidente, algo semejante. Salimos a comprar a 14 mil 500, equivale decir a 14.50 el kilo de frijol, y lo vendemos en nuestras tiendas a 14. Vale decir que, como ya dijo nuestro señor secretario de Agricultura, don Víctor Villalobos, que tenemos ahorita 553 bodegas, nuestra aspiración es llegar a 600 o más.",0.42381681614640687,60,30,09,2019
IGNACIO OVALLE FERNANDEZ,¿Qué quiero decir?,0.3356616582736641,3,30,09,2019
IGNACIO OVALLE FERNANDEZ,"No habrá una sola zona de productores y particularmente, hay que enfatizarlo, una sola zona indígena -donde tenemos aproximadamente 200 bodegas- que quede sin ser atendida.",0.5974585840826073,26,30,09,2019
IGNACIO OVALLE FERNANDEZ,"Y complementaría decir, por lo que acabo de mencionar y que recomendó el señor presidente que dijéramos, también el 1º de octubre se bajan todos los precios de la canasta básica en las tiendas Diconsa, no habrá una sola tienda en el país que venda la canasta básica a precios más bajos; y si en algún caso lo hubiera, bajamos el precio.",0.3311462635189146,62,30,09,2019
IGNACIO OVALLE FERNANDEZ,"Señor presidente, es cuanto tengo que informar.",0.012612425574119408,7,30,09,2019
VICTOR MANUEL VILLALOBOS ARAMBULA," Al concluir, señalamos que la buena noticia que ha indicado el señor presidente es para nuestros productores, porque al aumentar la oferta en la superficie de 20 a 30 hectáreas estamos incorporando un importante número de productores que también se verán beneficiados con el Precio de Garantía. Sería la buena noticia.",0.2541424214364321,51,30,09,2019
VICTOR MANUEL VILLALOBOS ARAMBULA,"Muchas gracias, presidente.",0.42659809592117026,3,30,09,2019
PRESIDENTE ANDRES MANUEL LOPEZ OBRADOR, Muy bien.,0.8068985108677682,2,30,09,2019
PRESIDENTE ANDRES MANUEL LOPEZ OBRADOR,"Este es un anuncio, una noticia importante, buena, para los productores. Lo podría yo sintetizar, resumir en una frase: ‘Que coman los que nos dan de comer’, eso es lo que podríamos decir, no abandonar a los campesinos.",0.31718503895069,38,30,09,2019
PRESIDENTE ANDRES MANUEL LOPEZ OBRADOR,Y ahora vamos al Quién es quién en los precios.,0.6063629245332034,10,30,09,2019
RICARDO SHEFFIELD PADILLA," Buenos días, señor presidente; buenos días a todas y a todos ustedes.",0.8469471086767334,12,30,09,2019
RICARDO SHEFFIELD PADILLA,"Iniciamos con el Quién es quién de las gasolinas. La gasolina regular la encontramos con el margen y el precio más alto en Emerald Gas, de Los Cabos, Baja California Sur, y que sí son una auténtica joyita, porque tienen un margen de tres pesos 23 centavos por litro y dan la gasolina regular a 21.77 por litro al público; la más económica, en contraste, la encontramos en Grupo Divala, en Centro, Tabasco, con un margen de 20 centavos -ahí sí se ve que son una joyita lo de los de Emerald- y está al público a 17 pesos con 82 centavos por litro.",0.09007581212537799,104,30,09,2019
RICARDO SHEFFIELD PADILLA,"En la gasolina Premium el precio al público, 22 pesos con 89 centavos por litro con el margen más alto a tres pesos 40 centavos en Benito Juárez, BP Estaciones y Servicios Energéticos; mientras que el margen más bajo y más económica la gasolina lo encontramos en Súper Servicio Agua Dulce, en Agua Dulce, Veracruz, con un margen de 43 centavos y un precio al público de 19 pesos con cinco centavos.",0.15640840645942977,72,30,09,2019
RICARDO SHEFFIELD PADILLA,"Y el combustible diésel, con un margen de 2.67 y un precio al público de 22 pesos con 58 centavos por litro, el más caro en Hermosillo, Sonora, Reforma Gasolinera; y el más económico, Inmobiliaria El Carmelo, en Nacajuca, Tabasco, con un margen de 37 centavos y un precio al público de 19.59 por litro.",0.04767267778357222,55,30,09,2019
RICARDO SHEFFIELD PADILLA,"Si lo vemos por marcas, en los promedios siguen estando como por muchos meses las más económicas LaGas, Orsan y Total; y en lo general han estado peleándose y con mucho movimiento cada semana los cuatro más altos: Chevron, Redco, Arco y Shell.",0.13489404192670015,43,30,09,2019
RICARDO SHEFFIELD PADILLA,"Pasamos al tema de verificación de combustibles. En verificación de combustibles en esta semana bajó un poco el número de denuncias, qué bueno, habla… porque ahora tenemos muchos denunciantes, muchos quejosos, más de 100 mil en potencia con todos los que tiene la app de litro por litro.",0.022366302279530702,48,30,09,2019
RICARDO SHEFFIELD PADILLA,"Y se atendieron 157 denuncias, con 112 verificaciones y visitas, una sola gasolinera no se dejó verificar inmovilizamos 19 bombas manguera de 11 gasolineras que presentaron problemas de no tener litros por litro.",0.0017725043038690628,33,30,09,2019
RICARDO SHEFFIELD PADILLA,"Y la que no se dejó verificar, que algo está escondiendo, que aparte que la vamos a verificar con fuerza pública en fecha próxima, a los consumidores pues que tomen nota y no vayan a esa gasolinera, que es Autoservicio Pino Pallas, en La Paz, Baja California Sur, porque algo obviamente están escondiendo, y somos nosotros como consumidores quienes tenemos el poder con nuestra compra de no beneficiar a estas personas que no cumplen con la ley y que algo están escondiendo.",0.017590234666367697,82,30,09,2019
RICARDO SHEFFIELD PADILLA,"Tuvimos una verificación especial con un apoyo muy significativo de la Guardia Nacional en puntos en los que sospechamos que se está vendiendo huachicol, del poco que todavía están ordeñando a los ductos, muy poco por cierto, pero que estamos atentos a dónde puede ese poco distribuirse.",0.41889420706571423,47,30,09,2019
RICARDO SHEFFIELD PADILLA,"Verificamos junto con la ASEA, la Agencia de Seguridad y Energía Ambiental, y también con la CRE. Fueron ocho estaciones de servicio que inmovilizamos por normas que nos toca a la Profeco, cinco estaciones fueron clausuradas por la ASEA, porque son temas de seguridad y ahí procede la clausura total de la gasolinera.",0.07245103179576144,53,30,09,2019
RICARDO SHEFFIELD PADILLA,"Fuimos a visitar Dos Minas, donde se sospechaba que consumen huachicol y no nos dejaron entrar ni con Guardia Nacional. Por esto se levantaron áreas circunstanciadas de estos hechos y se dará continuidad conforme a derecho a estos casos.",0.15324596150736247,39,30,09,2019
RICARDO SHEFFIELD PADILLA,Tres distribuidoras clausuradas por la ASEA y una distribuidora con acta de negativa de verificación.,0.05208786740797453,15,30,09,2019
RICARDO SHEFFIELD PADILLA,"Al día de hoy 104 mil 379 descargas en los dos sistemas, IOS y Android, con buenas reseñas y retroalimentación de los usuarios en la app de Litro por Litro; y en esta app la gasolina más económica, que no toma en cuenta el margen, solamente el precio final al público, la gasolina regular más económica está en Coatzacoalcos, Veracruz, a 17 pesos 61 centavos por litro; y la más cara a 21 pesos 81 centavos por litro en Los Cabos, Baja California.",0.040055212378670005,83,30,09,2019
RICARDO SHEFFIELD PADILLA,"En Premium la más económica a 18.99 por litro en Centro, Tabasco; y la más cara, 23 pesos con 10 centavos en Bahía de Banderas, Nayarit.",0.40056620715191976,26,30,09,2019
RICARDO SHEFFIELD PADILLA,"En el diésel el más económico en todo el país lo encontramos en Medellín de Bravo, Veracruz, a 19.39 por litro; mientras que el más caro a 23 pesos con 14 centavos en Churumuco, Michoacán. Y pueden ver ustedes de todo esto una estabilidad muy importante en el tema de las gasolinas.",0.5910579011608184,52,30,09,2019
RICARDO SHEFFIELD PADILLA,"En el gas LP en tanques estacionarios Gas del Caribe, en Cozumel, Quintana Roo, ofrece el precio más alto, con el margen más alto, 11 pesos con 12 centavos por litro y cinco pesos con 15 centavos el margen que tiene esta empresa; mientras que el más económico ya por varios meses lo encontramos en la Central de Abastos de Tehuacán, en Santiago Miahuatlan, Puebla, con un precio al público de seis pesos con 99 centavos por litro y un margen de un peso 95 centavos por litro.",0.046095465898853154,88,30,09,2019
RICARDO SHEFFIELD PADILLA,"Mientras que en los cilindros, en Gas del Caribe, S.A., en Cozumel, Quintana Roo, tenemos el precio más alto por kilo, a 20 pesos con 41 centavos con el margen más alto de nueve pesos con cinco centavos; mientras que los cilindros más económicos los encontramos en Servigas, Tarímbaro. Michoacán, a 14 pesos con 21 centavos por kilo y un margen de tres pesos con 36 centavos por kilo y un margen de tres pesos con 36 centavos por kilo.",0.010142905532635438,80,30,09,2019
RICARDO SHEFFIELD PADILLA,"Por último, en el tema de verificación de gas tenemos que en esta semana verificamos 58 expendedores, 17 resultaron infraccionados, 498 básculas verificadas, 33 inmovilizadas porque no estaban bien calibradas, 38 vehículos verificados, 12 inmovilizados, 46 lotes de cilindros, 17 cilindros fueron inmovilizados, es el siete por ciento, pero solamente 21 por problemas de seguridad a los consumidores, que el dos por ciento, sigue manteniéndose bajo el porcentaje.",0.0034756306122001967,68,30,09,2019
RICARDO SHEFFIELD PADILLA,Muchas gracias.,0.500183160728402,2,30,09,2019
PRESIDENTE ANDRES MANUEL LOPEZ OBRADOR," Gracias, Ricardo.",0.11075527130115738,2,30,09,2019
PRESIDENTE ANDRES MANUEL LOPEZ OBRADOR,"Estos son los dos temas. Si hay preguntas sobre los temas, empezamos. Sobre el tema.",0.5292153136087403,15,30,09,2019
PREGUNTA," Señor presidente, en Zambia -y para el señor Ignacio Ovalle, quien fue director de Conasupo- en Zambia y Perú, el control de precios que se interpreta como de garantía propició, licenciado Ignacio Ovalle, al final escases y afectó gravemente a los presupuestos de esas naciones en los gobiernos de Fujimori, ¿qué nos dice sobre el particular?",0.1800255518477679,56,30,09,2019
PREGUNTA,"Y para el procurador del consumidor. En Hidalgo, particularmente, y Puebla, señor procurador, empresas como Regio aún se continúan negando al control y la verificación.",0.010677776984954424,25,30,09,2019
PREGUNTA,¿Existe alguna sospecha de que estas empresas en Hidalgo y Puebla estén vinculadas con el huachicol?,0.04024546447274418,16,30,09,2019
PREGUNTA,"Y, finalmente, señor presidente, leía que usted tuvo un encuentro don Joe Biden, en marzo del 2012, cuando él visitó la República Mexicana y se reunió con candidatos a la Presidencia en ese momento.",0.23643403055741366,34,30,09,2019
PREGUNTA,¿Cuál sería su impresión de ese encuentro con Biden?,0.8320387032021183,9,30,09,2019
PREGUNTA,Y empezando con el director de Conasupo.,0.3933815917857814,7,30,09,2019
IGNACIO OVALLE FERNANDEZ," Gracias, señor presidente.",0.393030772130476,3,30,09,2019
IGNACIO OVALLE FERNANDEZ,"Segalmex, no Conasupo, pero recuerdo -por lo que menciona cuando dijo que había sido director de Conasupo- una diferencia fundamental entre lo que fueron Precios de Garantía de aquella entidad paraestatal y lo que son los Precios de Garantía actuales, y que da un poco explicación sobre esos precios controlados y por qué aquí no tenemos ese riesgo.",0.414877628193498,58,30,09,2019
IGNACIO OVALLE FERNANDEZ,"En el caso que aquí mencionamos, por ser el más importante de maíz y frijol, que es lo que vamos a empezar a comprar el 1º de octubre, no se abren todas las bodegas al mismo tiempo, sino como conforme se va presentando la cosecha.",0.5316673540941694,45,30,09,2019
IGNACIO OVALLE FERNANDEZ,"Vamos a empezar en nueve estados, -aprovecho para decirlo, a mediados de noviembre continúan 21 estados, y nos queda uno pendiente Nayarit para diciembre. Bien.",0.08686085791390595,25,30,09,2019
IGNACIO OVALLE FERNANDEZ,¿Cuál es la principal diferencia entre aquellos precios y estos?,0.9182337797597169,10,30,09,2019
IGNACIO OVALLE FERNANDEZ,"Aquellos, como ocurrió también con el Sistema Alimentario Mexicano, el Precio de Garantía era para todos los productores y la totalidad de las cosechas.",0.0715949739989305,24,30,09,2019
IGNACIO OVALLE FERNANDEZ,"Y por otro lado había también una… aquí están los estados y el tiempo en que se van a abrir, según se trate, de frijol o de maíz las bodegas de recepción, y por otro lado había el problema de que se quería controlar el precio de venta. En nuestro caso el precio de maíz y de frijol, por ejemplo, está consagrado a los productores más pobres, aquellos productores que tienen más de cinco hectáreas de temporal o que producen grandes cantidades, agricultores de los que puede estar orgulloso el país no reciben este beneficio, es exclusivamente para los productores más necesitados del país.",0.11741479370224917,104,30,09,2019
IGNACIO OVALLE FERNANDEZ,Y llama la atención de que se establece un límite de compra.,0.334430359080232,12,30,09,2019
IGNACIO OVALLE FERNANDEZ,¿Por qué?,0.541333260777616,2,30,09,2019
IGNACIO OVALLE FERNANDEZ,Para que no se utilice a cualquiera de esos productores para colar las grandes cosechas.,0.02140385159250363,15,30,09,2019
IGNACIO OVALLE FERNANDEZ,"Pero por lo que hace al consumo no establecemos precios controlados, al mercado abierto le vendemos a precio de mercado; y el precio máximo, el que sería controlado, es exclusivamente en las tiendas de Diconsa, que significan un margen del consumo nacional, un margen minoritario, la gran mayoría del consumo sigue manejándose conforme al mercado.",0.28689170053689644,55,30,09,2019
IGNACIO OVALLE FERNANDEZ,"Pero, ¿dónde están las tiendas Diconsa?",0.5251370365243422,6,30,09,2019
IGNACIO OVALLE FERNANDEZ,"Están en las zonas del país. Perdonen que tenga que repetir la frase que constituye un elemento central de la filosofía del gobierno actual, que es primero los pobres. A eso es a lo que estamos consagrados.",0.36201941081832556,37,30,09,2019
RICARDO SHEFFIELD PADILLA," Complementando desde el punto de vista de la Profeco, que es otro brazo del gobierno federal que trabaja en equipo",0.04140240494661888,20,30,09,2019
RICARDO SHEFFIELD PADILLA,"Nosotros monitoreamos el precio de 10 mil productos y servicios, y todos como consumidores somos los reguladores finales del precio, una institución de gobierno; de manera tal que al apoyar al productor pequeño se vuelve competitivo el precio en el mercado con los grandes productores de volumen, pero al final como consumidores se coadyuva a regular al mercado para que no se especule.",0.030199299799823498,63,30,09,2019
RICARDO SHEFFIELD PADILLA,Y semana con semana se monitorea en Profeco -y todos ustedes pueden constatarlo- como se hace aquí públicamente en el tema de combustibles.,0.0006494302793410137,23,30,09,2019
RICARDO SHEFFIELD PADILLA,"Tomamos nota de esta denuncia que usted realiza, tenemos varias denuncias formales ya presentadas ante Fiscalía General de la República que esperemos que en fecha próxima, yo me imagino, habrá un avance por parte de la fiscalía, ellos trabajan de manera independiente, como lo marca la ley y como debe ser, ojalá podamos tener noticias de la Fiscalía General de la República de lo ya presentado y realizaremos las investigaciones como lo que usted señalando; de hecho, el operativo especial que realizamos con la Guardia Nacional salió de este tipo de denuncias.",0.005142512673036694,92,30,09,2019
PRESIDENTE ANDRES MANUEL LOPEZ OBRADOR," Bueno, dejamos para lo general la otra.",0.5999923094852904,7,30,09,2019
PRESIDENTE ANDRES MANUEL LOPEZ OBRADOR,"Vamos a equilibrar, una compañera mujer.",0.2290581303135151,6,30,09,2019
PREGUNTA," Gracias, presidente. Nancy Rodríguez, de Oro Sólido.",0.6764508788155584,7,30,09,2019
PREGUNTA,"Para el secretario. En 2007 -precisamente que ayer que estuvo el presidente en la comunidad tarahumara- en 2007 se les autorizó el llamado pinole nutritivo, y supuestamente se les prometió a esta comunidad tarahumara que se les iba a autorizar el distribuirla en las dependencias como en el IMSS, allá local.",0.041922293956736335,51,30,09,2019
PREGUNTA,"Entonces, obviamente ellos estaban muy entusiasmados con este programa, pero hasta la fecha no ha habido nada.",0.38871772892091605,17,30,09,2019
PREGUNTA,¿Qué posibilidades habría de que se retomara eso?,0.7500393038682672,8,30,09,2019
PREGUNTA,"Incluso, la Universidad de Chihuahua fue el que les hizo el estudio, que por cierto aquí lo traigo, donde se define específicamente las propiedades nutritivas de proteína, sodio, todo lo que implica el pinole nutritivo, y es precisamente para la comunidad tarahumara.",0.0103020405259777,42,30,09,2019
