Participante,Texto,Sentimiento,Palabras,Dia,Mes,Anio
JORGE ALCOCER VARELA," Con su permiso, señor presidente. Buenos días, con gusto saludo a todos ustedes.",0.0,13,02,07,2024
JORGE ALCOCER VARELA,"Hoy, 2 de julio, en el ‘Pulso de la salud’ pues hemos ya escuchado un marco de referencia muy completo de lo que ha sucedido en los últimos años, prácticamente desde el inicio de este sexenio, en la salud. Y para continuar con ello, el maestro Zoé, como ya fue mencionado, informará los logros que tiene el IMSS-Bienestar para atender a la población sin seguridad social en los 23 estados que han sido federalizados, y va a tratar cuatro temas centrales importantes:",0.0,82,02,07,2024
JORGE ALCOCER VARELA,"Lo primero, cómo vamos en la credencialización de los usuarios de los pacientes del IMSS-Bienestar.",0.0,15,02,07,2024
JORGE ALCOCER VARELA,"En segundo lugar, conoceremos los avances de La Clínica es Nuestra, este operativo, así le puedo poner, que da un sustento y una realidad a lo que es la base del manejo del diagnóstico de la prevención de la salud, que es muy, muy importante, y que se está desarrollando rápidamente, como lo vamos a oír.",0.0,56,02,07,2024
JORGE ALCOCER VARELA,"Y, en tercer lugar, tenemos la basificación en el Estado de México que tiene una magnitud importante y que requiere, desde luego, un trato diferente.",0.0,25,02,07,2024
JORGE ALCOCER VARELA,"Terminará esta presentación con las nuevas convocatorias que se requieren el IMSS-Bienestar en el personal de enfermería. Estas convocatorias cubren tanto la enfermería clínica y como a la auxiliar, y para eso vamos a comunicarles el día de hoy.",0.0,39,02,07,2024
