Participante,Texto,Sentimiento,Palabras,Dia,Mes,Anio
JAVIER POTES GONZALEZ," Señor presidente, señor secretario, subsecretario, Mario Héctor.",0.32823650481604266,7,17,11,2020
JAVIER POTES GONZALEZ,"Hoy como nunca, en la historia del sector Salud en México se requiere de voluntad y esfuerzos de colaboración.",0.32823650481604266,19,17,11,2020
JAVIER POTES GONZALEZ,"En ese sentido, las asociaciones hospitalarias del sector privado están convencidas de que la colaboración público-privada en salud es necesaria y posible cuando se tiene como prioridad la salud de los mexicanos.",0.32823650481604266,32,17,11,2020
JAVIER POTES GONZALEZ,"La Asociación Nacional de Hospitales Privados y el Consorcio Mexicano de Hospitales ratificamos con gusto nuestro compromiso con este acuerdo histórico, convencidos de que nuestra aportación está alineada con instituciones de gobierno enfocadas a mantener y recuperar la salud de los mexicanos.",0.32823650481604266,42,17,11,2020
JAVIER POTES GONZALEZ,"Reconocemos y agradecemos la apertura para este diálogo que se ha mantenido ininterrumpido desde el inicio con la Secretaría de Salud, el Consejo de Salubridad General, las instituciones de salud del gobierno, así como con la Secretaría de Relaciones Exteriores y Funsalud.",0.32823650481604266,42,17,11,2020
JAVIER POTES GONZALEZ,Muchas gracias.,0.32823650481604266,2,17,11,2020
