Participante,Texto,Sentimiento,Palabras,Dia,Mes,Anio
PRESIDENTE ANDRES MANUEL LOPEZ OBRADOR, Buenos días.,0.0,2,13,09,2021
PRESIDENTE ANDRES MANUEL LOPEZ OBRADOR,"Pues estamos iniciando esta semana de septiembre, esta semana patria y vamos a participar en la ceremonia de conmemoración de la hazaña, de la defensa del Castillo de Chapultepec, de los niños héroes, vamos a estar en esa ceremonia el día de hoy.",0.0,43,13,09,2021
PRESIDENTE ANDRES MANUEL LOPEZ OBRADOR,"En la semana vamos a participar en las festividades, el Grito el día 15, el día 16 vamos a participar en la ceremonia y el desfile militar que se va a llevar a cabo; el día 17 asisten invitados, presidentes de países de América Latina y el Caribe, primeros ministros, porque el día 18 tenemos un encuentro de la Celac, de todos los miembros de este organismo, presidentes y primeros ministros de América Latina y el Caribe, que nos vamos a reunir; el día 19 muy temprano tenemos que izar la bandera a media asta para recordar a quienes perdieron la vida con los temblores de 1985. Todo esto es la semana que estamos iniciando.",0.0,115,13,09,2021
PRESIDENTE ANDRES MANUEL LOPEZ OBRADOR,"La semana anterior enfrentamos muchos problemas por las inundaciones, por el temblor, derrumbes, pero estamos saliendo adelante, con la participación conjunta, coordinada de los gobiernos, de los gobiernos municipales, de los gobiernos de los estados, del gobierno federal, estamos ayudando a la gente damnificada en distintos estados de la República y lo vamos a seguir haciendo.",0.0,56,13,09,2021
PRESIDENTE ANDRES MANUEL LOPEZ OBRADOR,"Vamos a comenzar entonces la semana con el informe de Quién es quién en los precios, de Ricardo Sheffield.",0.0,19,13,09,2021
RICARDO SHEFFIELD PADILLA," Muy buenos días, señor presidente; buenos días a todas y a todos ustedes.",0.0,13,13,09,2021
RICARDO SHEFFIELD PADILLA,"Quién es quién en el precio de los combustibles. En el precio de la gasolina, el precio promedio de la regular 20 pesos 55 centavos por litro, de la Premium 22 pesos con 44 centavos por litro y 21 pesos con 73 centavos es el promedio por litro del diésel.",0.0,50,13,09,2021
RICARDO SHEFFIELD PADILLA,"Ustedes pueden ver que en esta semana que está transcurriendo, el apoyo, el incentivo fiscal al combustible en el caso de la regular es de 53.55 por ciento, bastante alto, más de la mitad del IEPS que se está condonando, porque el precio del petróleo está en 64 dólares con 38 centavos. Pueden ver ustedes ahí en la gráfica que se ha mantenido bastante alto el precio del petróleo a nivel internacional.",0.0,72,13,09,2021
RICARDO SHEFFIELD PADILLA,"Las tres marcas más económicas en el país en los promedios de la semana pasada fue Exxon Mobil, G500 y Orsan, mientras que las tres que dieron en promedio los precios más caros como marca fue RedCo, Chevron y Arco.",0.0,40,13,09,2021
RICARDO SHEFFIELD PADILLA,"Vamos ahora por la gasolina regular, G500 tiene en Miguel Hidalgo, aquí en la Ciudad de México, el precio más alto, 21 pesos 80 centavos por litro, con el promedio de margen más alto, tres pesos con 50 centavos; mientras que franquicia Pemex en Tuxtla Gutiérrez, Chiapas, con un precio al público de 20 pesos con un centavo por litro, tiene un margen de 15 centavos.",0.0,66,13,09,2021
RICARDO SHEFFIELD PADILLA,"Arco, para la gasolina Premium, en Hermosillo, Sonora, 23 pesos 99 centavos por litro, con un margen de tres pesos 42 centavos la opción más cara, con el mayor margen; mientras que franquicia Pemex en Veracruz, Veracruz con un precio al público de 20 pesos 74 centavos por litro y un margen de 16 centavos es la opción más económica.",0.0,60,13,09,2021
RICARDO SHEFFIELD PADILLA,"Para el diésel, G500, un precio al público de 23 pesos 96 centavos por litro en San Pedro Mixtepec, Oaxaca, con un margen de cuatro pesos 42 centavos es la opción más cara; mientras que Eustoil en Durango, Durango, con 21 pesos 14 centavos por litro y 19 centavos de margen es la opción más económica.",0.0,56,13,09,2021
RICARDO SHEFFIELD PADILLA,"También estuvimos muy activos en el tema de verificaciones a gasolinas, tuvimos 177 denuncias presentadas a través de la app de Litro por Litro, atendimos a través de 165 visitas y/o verificaciones.",0.0,32,13,09,2021
RICARDO SHEFFIELD PADILLA,"Dos no se dejaron verificar: fue una gasolinera en Zapopan, Jalisco, en la carretera a Nextipac, y también en Nazas, Durango, en el kilómetro 35.5, en la carretera de Pedriceña a Nazas. Estas dos gasolineras las estamos ya apuntando para poderlas visitar con la Guardia Nacional, la ASEA y la CRE para hacer una verificación integral, porque obviamente algo no correcto es lo que están escondiendo al no permitirnos revisar las bombas.",0.0,72,13,09,2021
RICARDO SHEFFIELD PADILLA,"La más barata, sin tomar en cuenta el margen, de G500, en Querétaro, Querétaro, precio al público 18.39 por litro de la regular, y 18.92, también de G500, en León, Guanajuato.",0.0,31,13,09,2021
RICARDO SHEFFIELD PADILLA,"Las más caras, 22 pesos 27 centavos de franquicia Pemex, en Chilpancingo, Guerrero, y 21.99 de Mobil, en Río Grande, Zacatecas.",0.0,21,13,09,2021
RICARDO SHEFFIELD PADILLA,"Para la Premium, la más económica, sin tomar en cuenta el margen, 20 pesos 72 centavos de franquicia Pemex, en Veracruz, Veracruz, y también de franquicia Pemex con un precio al público de 21.10 por litro en Ciudad Madero, Tamaulipas.",0.0,40,13,09,2021
RICARDO SHEFFIELD PADILLA,"Mientras que las más caras para la gasolina Premium, 23 pesos 99 centavos, franquicia Pemex, en Tasco de Alarcón, Guerrero, y de Arco, 23 pesos con 99 centavos en Hermosillo, Sonora.",0.0,31,13,09,2021
RICARDO SHEFFIELD PADILLA,"Las más económicas del diésel, G500, 19.69 por litro en Querétaro, Querétaro, otra vez, y 20 pesos con nueve centavos de G500 en Morelia, Michoacán, bien por los de G500 con ese precio al público.",0.0,35,13,09,2021
RICARDO SHEFFIELD PADILLA,"Y las más caras, 23.59, de franquicia Pemex, en Amatlán de Cañas, Nayarit, y 23.29 de BP, en Campeche, Campeche.",0.0,20,13,09,2021
RICARDO SHEFFIELD PADILLA,También seguimos monitoreando los servicios sanitarios en estas gasolineras.,0.0,9,13,09,2021
RICARDO SHEFFIELD PADILLA,"Quién es quién en el gas LP. El precio promedio de la semana que concluyó, esto es tomando en cuenta ya el promedio de los 145 precios máximos establecidos en el país, 12 pesos 58 centavos por litro para tanque estacionario y 23 pesos con 30 centavos por kilo en el caso de los cilindros de gas.",0.0,57,13,09,2021
RICARDO SHEFFIELD PADILLA,"Y podemos ver ahora en la gráfica, en base al promedio de precios máximos establecido, que se han mantenido por abajo de estos promedios, ya los promedios nacionales, que es muy buen indicador.",0.0,33,13,09,2021
RICARDO SHEFFIELD PADILLA,"En el caso de tanques estacionarios tenemos algunos ejemplos, por ejemplo, Gas de Hidalgo, en Zacualtipán, Hidalgo, 11 pesos 79 centavos por kilógramo, cuando el precio máximo está en 13 pesos 32 centavos, estamos hablando de casi dos pesos de diferencia por debajo del precio máximo.",0.0,46,13,09,2021
RICARDO SHEFFIELD PADILLA,"Y lo mismo sucede en el caso de cilindros de gas, Gas de Hidalgo, en Zimapán, Hidalgo, 21 pesos 84 centavos por kilo, cuando el precio máximo es de 24.68, y hay varios ejemplos en el estado de Hidalgo, en el estado de Nuevo León y en el estado de Oaxaca.",0.0,51,13,09,2021
RICARDO SHEFFIELD PADILLA,"En verificaciones de gas LP, que hemos estado redoblando el esfuerzo en este tema, 850 visitas y/o verificaciones, 840 salieron sin infracción, 10 salieron con infracciones por algunos aparatos descalibrados, peor sobre todo varios cilindros, un 10 por ciento de los cilindros en mal estado, concentrado en ciertos proveedores, dos no estaban respetando el precio máximo, ambas eran de Gas Imperial, dos camiones, el precio máximo de 22 pesos 32 centavos y no exhibían el precio.",0.0,76,13,09,2021
RICARDO SHEFFIELD PADILLA,"Cuando no exhiben el precio, según el mono es la pedrada, es el gran riesgo que tenemos. Y por eso estos dos camiones fueron suspendidos, obviamente estaban vendiendo por abajo del precio máximo, si no, sería lo primero que presumirían a la hora de vender el gas.",0.0,47,13,09,2021
RICARDO SHEFFIELD PADILLA,"Y una estación de carburación que fue cerrada por la ASEA, no cumplía con nada, y nosotros tomamos control de los cilindros de gas, lo cual nos aumentó el promedio de los cilindros de gas porque estaban en pésimo estado todos los cilindros de gas de esta estación de carburación que se encontraba en Cuautlacingo, estado de Puebla. Seguiremos estos trabajos en coordinación con la CRE, con la ASEA y con el respaldo de la Guardia Nacional, como también en algunos operativos agradecemos el apoyo de la Secretaría de Marina.",0.0,90,13,09,2021
RICARDO SHEFFIELD PADILLA,"Toca remesas, Quién es quién es las remesas. Otra vez nuestros paisanos, héroes y heroínas que desde los Estados Unidos siguen rompiendo récord en el envío de remesas. La remesa promedio, como ustedes saben, es de 350 dólares al mes y en el mes de julio salimos 58.9 por ciento por arriba del 2018, 35.8 por ciento por arriba del 2019 y 28.6 por ciento por arriba del año pasado del 2020.",0.0,72,13,09,2021
RICARDO SHEFFIELD PADILLA,"Si nosotros viéramos la gráfica hacia años atrás, es todavía más bajo, o sea, realmente este año se han roto todos los récords y es de dar ese gran reconocimiento a las heroínas y héroes que trabajan en los Estados Unidos, que están trabajando dobles turnos y haciendo el trabajo que luego en ese país muchos otros no quieren realizar y con esto fortaleciendo a mamá o a esposa acá en México.",0.0,72,13,09,2021
RICARDO SHEFFIELD PADILLA,"La mejor opción para enviar sus remesas en efectivo fue uLink, que no cobra comisión, cero dólares y cero centavos de dólar, y el tipo de cambio fue de 19.90 el promedio de uLink, mientras que la peor opción, porque cobra comisión y tiene un tipo de cambio más bajo, te da menos pesos por tus dólares, fue Western Union, que al final daba seis mil 589 pesos con 96 centavos por los 350 dólares en ese mes de julio.",0.0,80,13,09,2021
RICARDO SHEFFIELD PADILLA,"A depósito en cuenta uLink sigue siendo la mejor opción, mismo tipo de cambio y sin comisión, mientras que en el caso de depósito a cuenta fue Pangea Money Transfer, con seis mil 676 pesos con 72 centavos.",0.0,38,13,09,2021
RICARDO SHEFFIELD PADILLA,"Telecomm sigue siendo quien tiene cubiertos más municipios en todo el país, Oxxo el que tiene más sucursales, 19 mil 146, y que abre de 6:00 de la mañana a 10:00 de la noche.",0.0,34,13,09,2021
RICARDO SHEFFIELD PADILLA,No ha habido mucha variación en el tema de las ventanillas de pago por el lado mexicano.,0.0,17,13,09,2021
RICARDO SHEFFIELD PADILLA,"Y siguiendo la instrucción del señor presidente, hemos elaborado un Quién es quién en los precios para apoyar a todas las mexicanas y mexicanos que están recibiendo el apoyo del gobierno federal para recuperar su casa, reconstruir su habitación o también para comprar enseres, esto por lo que mencionó el señor presidente para contrarrestar los desastres naturales a los que se ha visto sometido nuestro país.",0.0,66,13,09,2021
RICARDO SHEFFIELD PADILLA,"Lo estamos haciendo estado por estado, cada mes seguimos publicando el quién es quién en los materiales de construcción, pero esto lo estamos haciendo con un enfoque especial a los estados que están recibiendo este apoyo que ha instruido el presidente de México, Andrés Manuel López Obrador.",0.0,47,13,09,2021
RICARDO SHEFFIELD PADILLA,"En el estado de Hidalgo tenemos el ejemplo, pueden ver los principales materiales de construcción y cuál es el precio unitario, no son precios de mayoreo, son precios de menudeo, por lo tanto, no deben en el estado de Hidalgo de pagarse más de este monto por una varilla, por un costal de cemento, un costal de cal.",0.0,58,13,09,2021
RICARDO SHEFFIELD PADILLA,"Pero también estamos haciéndolo con los principales enseres domésticos: cafetera, colchón individual, estufa, lavadora, licuadora, olla de presión, refrigerador, que son los artículos que están comprando quienes han tenido que padecer estas circunstancias de embates de la naturaleza.",0.0,38,13,09,2021
RICARDO SHEFFIELD PADILLA,"Lo estamos haciendo en el estado de Hidalgo, lo estamos haciendo en el Estado de México, en el estado de Guerrero, en el estado de Puebla, en Veracruz, como también lo estamos llevando a cabo en el estado de Nayarit, en el estado de Jalisco, en Baja California, Baja California Sur, en Oaxaca, en Sinaloa y por último también… Ah, hasta ahí llega, esos son los estados en los que tenemos este operativo especial.",0.0,74,13,09,2021
RICARDO SHEFFIELD PADILLA,"Aparte de dar a conocer el quién es quién en los precios de materiales para la construcción y de enseres domésticos básicos, también estamos realizando visitas a los proveedores en estos estados que acabo de mencionar, son 237 visitas que realizamos la semana pasada y ahí tenemos algunas fotografías para constatarlo.",0.0,51,13,09,2021
RICARDO SHEFFIELD PADILLA,"Afortunadamente no encontramos proveedores que estuvieran hasta este momento abusando y pues para que ninguno se pase de rosca, por eso darles a conocer estado por estado cuál es el precio unitario de estos productos y que aprovechen bien el apoyo que se está dando por parte del gobierno federal para que efectivamente se invierta en material para construcción o reponer enseres domésticos básicos que se hayan perdido por estos desastres naturales.",0.0,72,13,09,2021
RICARDO SHEFFIELD PADILLA,Muchas gracias.,0.0,2,13,09,2021
PRESIDENTE ANDRES MANUEL LOPEZ OBRADOR," Gracias, Ricardo.",0.0,2,13,09,2021
PRESIDENTE ANDRES MANUEL LOPEZ OBRADOR,Vamos con los videos.,0.0,4,13,09,2021
PREGUNTA, La Secretaría de la Defensa Nacional informa los avances en la construcción del Aeropuerto Internacional ‘Felipe Ángeles’ al 13 de septiembre de 2021.,0.0,23,13,09,2021
PREGUNTA,"En la pista norte y central, plataformas y rodajes se realiza la aplicación de riego en pista y tendido de concreto en márgenes de calles de rodaje como parte de la estructura de los pasos a desnivel.",0.0,37,13,09,2021
PREGUNTA,"En la terminal de pasajeros se lleva a cabo la colocación de iluminación e instalación de equipo eléctrico, hidrosanitario, aire acondicionado, contra incendio y sistema de inspección de equipaje documentado; asimismo, la colocación de plafones de doble nivel en pasillos del centro de datos general.",0.0,45,13,09,2021
PREGUNTA,En el eje troncal de circulación y obras complementarias se ejecutan trabajos de habilitado y armado de acero de la base para la escultura del general Felipe Ángeles en la glorieta de acceso y en el área de transferencia de seguridad del AIFA se realizan trabajos de aplanado fino en muros exteriores.,0.0,52,13,09,2021
PREGUNTA,"En la vialidad y barda perimetral se trabaja la excavación en caja para paso a desnivel en la conexión del eje 20 y 40, así como el relleno de terraplén en el eje 10 del entronque Nextlalpan.",0.0,37,13,09,2021
PREGUNTA,"En la interconexión vial, tramo caseta Tultepec-Santa Lucía, se continúa con las actividades de sembrado de pasto y árboles, detallado de las bases y colocación de las letras para los monumentos.",0.0,31,13,09,2021
PREGUNTA,A la fecha se han generado 116 mil 15 empleos civiles. Faltan 189 días de construcción.,0.0,16,13,09,2021
ROCIO NAHLE GARCIA," Es viernes 10 de septiembre. Hoy me acompaña el gobernador de Tabasco, a quien le agradecemos todo el apoyo que nos ha dado el gobierno del estado.",0.0,27,13,09,2021
ROCIO NAHLE GARCIA,Seguimos con el montaje de estructura metálica ya en los racks y en las plantas de proceso.,0.0,17,13,09,2021
ROCIO NAHLE GARCIA,Va el reporte de esta semana.,0.0,6,13,09,2021
PREGUNTA," Esta semana arribó al puerto de Dos Bocas el buque M.V. Midland Trader, procedente del puerto de Lázaro Cárdenas, Michoacán, con 20 mil toneladas de acero de refuerzo para la obra civil de la nueva refinería.",0.0,36,13,09,2021
PREGUNTA,Se llevó a cabo la descarga de varillas que serán utilizadas en la construcción.,0.0,14,13,09,2021
PREGUNTA,"En el área de proceso se lleva a cabo el montaje de estructura de soporte en los racks de tuberías, así como la instalación de charolas para alojamiento de cableado.",0.0,30,13,09,2021
PREGUNTA,"Las subestaciones eléctricas del paquete 1 se encuentra en etapa final de obra civil y en los paquetes 2 y 3 continúa el montaje de estructuras metálicas, instalaciones de enterrados para la línea híbrida, incendio y drenaje químico por parte de Samsung.",0.0,42,13,09,2021
PREGUNTA,"Esta semana se llevaron a cabo reuniones de supervisión con empresas nacionales especializadas en fabricación de equipos y estructuras metálicas en Monterrey, Nuevo León, y Guadalajara, Jalisco.",0.0,27,13,09,2021
ROCIO NAHLE GARCIA," Es 4 de septiembre. Estamos en Monterrey, Nuevo León, en la empresa Menter, esta empresa nos está haciendo 56 equipos para Dos Bocas. También aquí en México estamos construyendo.",0.0,29,13,09,2021
ROCIO NAHLE GARCIA,También aquí en Monterrey están haciendo las placas soldadas que van hacia las esferas de los tanques de almacenamiento.,0.0,19,13,09,2021
ROCIO NAHLE GARCIA,"Estamos en Guadalajara, Jalisco, 6 de septiembre, y venimos a revisar lo que está haciendo este taller, 503 equipos para Dos Bocas, se construyen aquí en México.",0.0,27,13,09,2021
ROCIO NAHLE GARCIA,"En Guadalajara se está utilizando en esta fábrica, de nombre Recal, 40 mil toneladas de acero estructural para Dos Bocas.",0.0,20,13,09,2021
ROCIO NAHLE GARCIA,Todo esto ha generado empleo aquí en México.,0.0,8,13,09,2021
VOZ DE HOMBRE," De cuatro mil 347 equipos de proceso, 511 se fabrican en Jalisco y 98 en Nuevo León, otros más se fabrican en Altamira, Tamaulipas; Pueblo Viejo y Tuxpan, Veracruz, donde se supervisará próximamente. Con ello se cumple también que se utilice toda la mano de obra, materiales y talleres mexicanos que tengan la capacidad para ello y contribuir a la generación y manutención del empleo del país.",0.0,67,13,09,2021
VOZ DE HOMBRE,Se desarrollan los trabajos de obra civil en el laboratorio y se trabaja en la fachada del cuarto de control central.,0.0,21,13,09,2021
VOZ DE HOMBRE,"En el edificio de mantenimiento satelital ya concluido actualmente se utiliza para la residencia de obra donde se encuentran trabajando mujeres y hombres en funciones de supervisión, ingeniería e integración.",0.0,30,13,09,2021
VOZ DE HOMBRE,"La construcción civil de las 39 subestaciones eléctricas que darán servicio a la refinería registran un avance del 54 por ciento en su conjunto; asimismo, ya están en sitio los equipos de las cuatro torres de enfriamiento e inicia su colocación toda vez que las cimentaciones ya fueron concluidas.",0.0,49,13,09,2021
VOZ DE HOMBRE,En el área de almacenamiento se continúa con los trabajos de obra mecánica e instalación de tubería de interconexión y transporte de las 34 esferas y los 56 tanques verticales que darán servicio de almacenamiento y proceso.,0.0,37,13,09,2021
VOZ DE HOMBRE,"En el gasoducto y acueducto continúan los trabajos de tendido y soldadura de tubería, mientras que en los racks de integración de estructura metálica continúa el montaje de marcos en sus distintos frentes, que concluirá el 30 de octubre, de acuerdo al programa establecido.",0.0,44,13,09,2021
VOZ DE HOMBRE,En el vivero se lleva a cabo el trasplante de plantas de ornato hacia distintas áreas verdes de la refinería.,0.0,20,13,09,2021
PREGUNTA, Semana 45 de 157.,0.0,4,13,09,2021
PREGUNTA,"En el tramo 1 realizamos trabajos de excavación, afine y colado de plantilla para las obras de drenaje transversal y proseguimos el suministro, conformación y compactación de terraplén.",0.0,28,13,09,2021
PREGUNTA,"En el tramo 2 seguimos con las actividades de limpieza del terreno como de despalme y desmonte, y avanzamos con la llegada de rieles nuevos. La cifra ya asciende a seis mil 144 toneladas en el almacén de Pomuch.",0.0,39,13,09,2021
PREGUNTA,"En el tramo 3 ejecutamos actividades para la construcción de pasos vehiculares, como el armado y cimbrado en el muro de estribo, y el armado de acero en los muros de aleros.",0.0,32,13,09,2021
PREGUNTA,"En el tramo 4 continuamos con los trabajos de adecuación de carretera, que incluyen actividades de colocación de su base hidráulica, construcción de muros de contención y pasos ganaderos.",0.0,29,13,09,2021
PREGUNTA,Finaliza la reubicación de árboles en tramo 5.,0.0,8,13,09,2021
PREGUNTA,"Al día de hoy, como parte de la estrategia de mitigación ambiental, hemos reubicado 20 mil 515 árboles y palmeras en el tramo Tulum-Cancún, lo que significa un 93 por ciento de la meta. El rescate de árboles son labores realizadas con el mayor cuidado posible.",0.0,46,13,09,2021
PREGUNTA,"Gracias a las técnicas de expertos, tenemos un porcentaje de sobrevivencia de 80 por ciento. Para garantizar este porcentaje, seleccionamos árboles fuertes y sanos, sin síntomas de marchitamiento; una vez seleccionados, elegimos la técnica de trasplante más adecuada, al extraerlos se coloca una malla de sombra que los protege de la deshidratación.",0.0,52,13,09,2021
PREGUNTA,Lo más importante a la hora de reubicar un árbol es definir el propósito que tendrá en su nueva ubicación. Muchos de los árboles reubicados tendrán su nuevo hogar en parques y escuelas donde su sombra será mejor aprovechada.,0.0,39,13,09,2021
PREGUNTA,"Al llegar a su destino, el árbol se introduce en una poceta previamente hecha. Una vez reubicado, iniciamos las actividades de monitoreo y cuidado constante para garantizar la mayor calidad de vida posible de los árboles.",0.0,36,13,09,2021
PREGUNTA,Al día de hoy la cifra de empleos generados por el Tren Maya asciende a 83 mil 605.,0.0,18,13,09,2021
PREGUNTA,El Tren Maya avanza.,0.0,4,13,09,2021
VOZ DE HOMBRE," Construcción del Tren Interurbano México-Toluca, reporte semanal.",0.0,7,13,09,2021
VOZ DE HOMBRE,"Tramo 1, 36 kilómetros. Avance de obra: 100 por ciento.",0.0,10,13,09,2021
VOZ DE HOMBRE,"Talleres y cocheras en Zinacantepec. Las vías de lavado y sopleteado están terminadas y listas para operar, se usarán en el mantenimiento diario de las unidades del Tren Interurbano.",0.0,29,13,09,2021
VOZ DE HOMBRE,"Viaducto 2. Continúa la colocación de canalizaciones, instalación de vía y colado de plintos de concreto en este frente.",0.0,19,13,09,2021
VOZ DE HOMBRE,"Tramo 3, 17 kilómetros. Avance de obra: 53 por ciento.",0.0,10,13,09,2021
VOZ DE HOMBRE,"PIV La Venta. Inició el seccionamiento del puente para su retiro, se realizan cortes en sentido longitudinal con hilo de diamante y discos especiales para posteriormente desmontar por partes la estructura.",0.0,31,13,09,2021
VOZ DE HOMBRE,"Viaducto mixto 2. Se unen por medio de soldadura de campo las secciones de acero que fueron fabricadas en el taller de Guadalajara, estos elementos serán transportados a la zona de casetas donde se instalarán sobre las columnas para formar el viaducto.",0.0,42,13,09,2021
VOZ DE HOMBRE,Estación Santa Fe. Se montan los cabezales de acero fabricados en el taller para recibir los siguientes elementos que soportarán la estructura de la estación. La estación se construye sobre el vaso regulador Totolapan que seguirá operando en convivencia con esta estación.,0.0,42,13,09,2021
VOZ DE HOMBRE,"Hondonada Sagarpa. Se construye la segunda columna para el viaducto en doble voladizo. A partir de cada una de estas crecerán las trabes en módulos equilibrados hacia ambos lados hasta unirse en el centro de claro, llegando al mismo tiempo a los apoyos extremos del doble voladizo.",0.0,47,13,09,2021
VOZ DE HOMBRE,Presa Tacubaya. Continúan los preparativos para el armado de la lanzadora de dovelas prefabricadas de concreto para la construcción del viaducto sobre la zona boscosa.,0.0,25,13,09,2021
VOZ DE HOMBRE,Se continúa con el desazolve del vaso de la presa Tacubaya para el control de avenidas durante la época de lluvias.,0.0,21,13,09,2021
VOZ DE HOMBRE,Secretaría de Comunicaciones y Transportes.,0.0,5,13,09,2021
VOZ DE HOMBRE, El Istmo de Tehuantepec es la franja más estrecha del país. El programa Istmo aprovecha esta posición para dinamizar la economía y generar bienestar en la población.,0.0,27,13,09,2021
VOZ DE HOMBRE,"A continuación, se informa el avance de obras a 13 de septiembre de 2021.",0.0,14,13,09,2021
VOZ DE HOMBRE,"En el puerto de Coatzacoalcos estamos a punto de terminar los trabajos de dragado. Con un avance del 99 por ciento se retiran 650 metros cúbicos de material, lo que aumentará la capacidad de desembarque y agilizará el traslado de mercancías.",0.0,41,13,09,2021
VOZ DE HOMBRE,"En el puerto de Salina Cruz, como parte de las acciones para el cuidado del medio ambiente, trabajamos en la preservación de las tortugas golfinas. Llevamos a cabo recorridos de verificación por la zona de construcción del Rompeolas Oeste.",0.0,39,13,09,2021
VOZ DE HOMBRE,"Revisamos el estado de salud de los ejemplares a través de los caparazones. Ubicamos y protegemos sus nidos. De ser necesario, brindamos atención médica; además, damos continuidad a los resolutivos de la Manifestación de Impacto Ambiental con acciones de rescate y reubicación del caracol púrpura.",0.0,45,13,09,2021
VOZ DE HOMBRE,"En el Ferrocarril del Istmo de Tehuantepec continúa la remodelación de la vía en los cinco tramos de Medias Aguas, Veracruz a Salina Cruz, Oaxaca, se tiene un avance general de 63 por ciento.",0.0,34,13,09,2021
