Participante,Texto,Sentimiento,Palabras,Dia,Mes,Anio
MARCELO EBRARD CASAUBON," Con permiso, señor presidente.",0.0,4,27,09,2021
MARCELO EBRARD CASAUBON,"Brevemente. Presento la condecoración más alta que otorga el Estado mexicano a un extranjero: la Orden Mexicana del Águila Azteca, que está prevista en la Ley de Estímulos y Recompensas, artículo 40, se publica en el Diario Oficial.",0.0,38,27,09,2021
MARCELO EBRARD CASAUBON,"¿Por qué se otorga esta condecoración, que es la más alta al general de Brigada, Roberto Riccardi, comandante de los carabineros para la Protección del Patrimonio Cultural de Italia?",0.0,29,27,09,2021
MARCELO EBRARD CASAUBON,"Se otorga porque el general de Brigada, Roberto Riccardi ha ejercido un liderazgo muy activo en apoyo para la salvaguarda y devolución del patrimonio sustraído ilícitamente de nuestra nación. Ejemplo de ello es la reciente recuperación de 17 piezas arqueológicas que se pretendían subastar en Italia el pasado 16 de septiembre de este año.",0.0,54,27,09,2021
MARCELO EBRARD CASAUBON,"Y también por la muy destacada colaboración del general de Brigada, Roberto Riccardi, con distintas autoridades mexicanas que han traído como resultado la restitución de 74 piezas arqueológicas y 584 exvotos desde 2013, siempre en favor de la defensa del patrimonio cultural e histórico de nuestro país.",0.0,47,27,09,2021
MARCELO EBRARD CASAUBON,"Por esa razón, el día de hoy México le reconoce, general, su gran labor, su compromiso con la causa mexicana de impedir la sustracción ilícita y el tráfico de nuestro patrimonio histórico y cultural.",0.0,34,27,09,2021
MARCELO EBRARD CASAUBON,Muchas gracias.,0.0,2,27,09,2021
