Participante,Texto,Sentimiento,Palabras,Dia,Mes,Anio
PRESIDENTE ANDRES MANUEL LOPEZ OBRADOR," Buenos días. Ánimo, ánimo.",0.0,4,10,10,2022
PRESIDENTE ANDRES MANUEL LOPEZ OBRADOR,"Bueno, pues estamos iniciando esta semana. Como lo hacemos siempre los lunes, vamos al informe sobre quién es quién en los precios, vamos con Ricardo Sheffield, procurador federal del Consumidor, y después preguntas y respuestas. Adelante.",0.0,36,10,10,2022
RICARDO SHEFFIELD PADILLA," Muchas gracias, señor presidente. Muy buenos días. Buenos días a todas y a todos ustedes.",0.0,15,10,10,2022
RICARDO SHEFFIELD PADILLA,"Quién es quién en el precio de los combustibles. La gasolina regular la semana pasada tuvo un promedio de 22 pesos con seis centavos el litro, mientras que la Premium tuvo un promedio de 24 pesos con 16 centavos y el diésel de 23 pesos con 54 centavos.",0.0,48,10,10,2022
RICARDO SHEFFIELD PADILLA,"Con corte el 6 de octubre, la mezcla mexicana de petróleo tuvo un ligero aumento, quedó en 82 dólares con 34 centavos de dólares el barril; por tanto, se aumentó el incentivo fiscal para esta semana, ese incentivo al IEPS será del 92.4 por ciento en el caso de la gasolina regular, 76.9 por ciento para la Premium y del 100 por ciento en el diésel.",0.0,66,10,10,2022
RICARDO SHEFFIELD PADILLA,"Las tres marcas que dieron más caro la semana pasada, estas marcas careras fueron Redco, Chevron y Arco, mientras que las tres aliadas de los consumidores fue G500, Exxon Mobil y Orsan.",0.0,32,10,10,2022
RICARDO SHEFFIELD PADILLA,"Si nos vamos por regiones, tenemos que el precio más alto, con el margen más alto, lo encontramos en Escárcega, Campeche, en la zona sureste, es de la marca BP con un precio al público de 23 pesos 89 centavos por litro y un margen de tres pesos con 66 centavos. Bastante alto ese margen, sobre todo si lo comparamos con los 16 centavos de margen de franquicia Pemex en la misma región, por cierto, en Tuxtla Gutiérrez, Chiapas, con un precio al público más bajo en consecuencia, 21 pesos con ocho centavos por litro.",0.0,95,10,10,2022
RICARDO SHEFFIELD PADILLA,"En el caso de la gasolina Premium, el precio más alto, con el margen más alto, lo encontramos en Benito Juárez, Quintana Roo, allá en Cancún, un precio al público de 25 pesos con 26 centavos, es de franquicia BP, con un margen de dos pesos 95 centavos; mientras que franquicia Pemex en Veracruz, Veracruz, con un precio al público de 22 pesos con 59 centavos y un margen de 17 centavos es el más económico, con el menor margen.",0.0,80,10,10,2022
RICARDO SHEFFIELD PADILLA,"Ahora, en el diésel el más alto es de Valero, en Tonalá, Jalisco, un precio al público de 24 pesos con 87 centavos, un margen, estos angelitos, de tres pesos con 31 centavos por litro, comparado con 15 centavos de margen de franquicia Pemex en Puebla, Puebla, con un precio al público de 23 pesos 36 centavos es la opción más económica.",0.0,62,10,10,2022
RICARDO SHEFFIELD PADILLA,"Y recibimos 281 denuncias o quejas a través de la app de Litro por Litro, que pueden descargar de manera gratuita en Android y en ISO, y realizamos 307 verificaciones o visitas de constatación por estas denuncias. Logramos la colocación de sellos de inmovilización en tres gasolineras que tenían el pendiente con nosotros, y ya los visitamos con CRE y con Asea este fin de semana. Fue una gasolinera en León, Guanajuato, Servicios Hermanos Aldama; también otra en Silao, en la carretera México-Ciudad Juárez; y otra más también sobre la misma carretera, en el mismo municipio de Silao, Servicios Ríos Salinas. En estos operativos participó, como habíamos mencionado, no sólo Profeco, también la Asea y la CRE, y tuvimos el respaldo de la Guardia Nacional, que nos ayuda muchísimo a realizar nuestro trabajo, cosa que se agradece.",0.0,137,10,10,2022
RICARDO SHEFFIELD PADILLA,"Vamos a ver cuál es el precio más barato y el más caro sin tomar en cuenta el margen que tiene esa gasolinera. De acuerdo a como aparece en la app de Litro por Litro, esto nos da el referente de cuál es el precio bajo y el precio alto y podemos ver quién nos conviene como proveedor en donde nosotros vivimos, donde nosotros cargamos el combustible. La más barata para la gasolina regular es de Mobil en Puebla, Puebla, 20 pesos con 39 centavos el litro; también 20 pesos con 39 centavos de Bristol en Guadalajara, Jalisco.",0.0,98,10,10,2022
RICARDO SHEFFIELD PADILLA,"Las más caras, 24 pesos con 43 centavos, franquicia Pemex en Arramberri, Nuevo León; y 24 pesos con 40 centavos de franquicia Pemex en Pueblo Nuevo, Durango.",0.0,27,10,10,2022
RICARDO SHEFFIELD PADILLA,"Para la Premium, la más barata, 22 pesos 69 centavos de ServiFácil en Agua Dulce, Veracruz; y 22 pesos con 70 centavos de franquicia Pemex en Veracruz, Veracruz.",0.0,28,10,10,2022
RICARDO SHEFFIELD PADILLA,"Las más caras, 26 pesos 89 centavos, Naucalpan, Estado de México, Shell, que le encanta pasarse de rosca con los precios altos, y 26 pesos con 56 centavos de franquicia Pemex, en Hermosillo, Sonora.",0.0,34,10,10,2022
RICARDO SHEFFIELD PADILLA,"El diésel, el más barato, 22 pesos 79 centavos de Pemex, en Tampico, Tamaulipas, y también de franquicia Pemex, el más económico en Veracruz, Veracruz, 22 pesos 80 centavos para el diésel.",0.0,32,10,10,2022
RICARDO SHEFFIELD PADILLA,"Las más caras, 26.99 de Windstar, en Cuauhtémoc, Chihuahua, y 25 pesos con 99 centavos de franquicia Pemex, en 14, San Luis Potosí.",0.0,23,10,10,2022
RICARDO SHEFFIELD PADILLA,"También seguimos monitoreando el tema de los servicios sanitarios en todas las estaciones de servicio, en las gasolineras.",0.0,18,10,10,2022
RICARDO SHEFFIELD PADILLA,"Vamos ahora al gas LP, en el cual, si convertimos a pesos y a kilos el precio internacional, con corte el 5 de octubre el precio fue de 23 pesos con 85 centavos, mientras que el promedio de las 220 regiones en el país fue de 21 pesos con 94 centavos.",0.0,51,10,10,2022
RICARDO SHEFFIELD PADILLA,"Ese mismo día el precio internacional convertido a pesos y litros fue de 12 pesos con 89 centavos, mientras que el promedio de las 220 regiones en México fue de 11 pesos con 85 centavos. También, igual que el petróleo, un ligero aumento en los precios internacionales y entonces la diferencia más hacia abajo aquí en las 220 regiones en el país.",0.0,62,10,10,2022
RICARDO SHEFFIELD PADILLA,"Seguimos encontrando quién vende por abajo del precio máximo, que son aliados de los consumidores para tanques estacionarios, tenemos casos en Coahuila, en Aguas Calientes, en el Estado de México, en Jalisco, en Veracruz y en Tamaulipas. Gas Real, en Coahuila, Arteaga, tiene un precio al público de 12 pesos 31 centavos por litro, cuando el precio máximo es de 13 pesos 45 centavos, más de un peso por litro por abajo del precio máximo.",0.0,75,10,10,2022
RICARDO SHEFFIELD PADILLA,"También para cilindros de gas encontramos ejemplos de aliados de los consumidores en Zacatecas, en Veracruz, y en Oaxaca, y en Guanajuato. Un ejemplo, Gas Lux, en Zacatecas, Zacatecas, tiene un precio de 23 pesos 53 centavos por kilo, cuando el precio máximo en su zona es de 25 pesos con 13 centavos, casi dos pesos de diferencia por abajo.",0.0,60,10,10,2022
RICARDO SHEFFIELD PADILLA,"Realizamos 862 visitas o verificaciones a expendedores de gas, siete resultaron con infracciones, por lo cual inmovilizamos una báscula, inmovilizamos tres vehículos y tres instrumentos de medición, tres por ciento de los cilindros en mal estado que se sacaron del mercado.",0.0,41,10,10,2022
RICARDO SHEFFIELD PADILLA,"Y las 862 estaciones visitadas estaban respetando los precios máximos para su zona y, como mencionamos, incluso seguimos encontrando algunas por abajo del precio máximo establecido en su zona.",0.0,29,10,10,2022
RICARDO SHEFFIELD PADILLA,"Y vamos a ver los 24 productos de esta canasta básica que monitoreamos en todo el país. Tenemos que el Índice Nacional de Precios al Consumidor para bebidas y alimentos tiene un ligero aumento, ha venido en constante aumento, al igual que los precios en todo el mundo lamentablemente, pero el precio de estos 24 productos en su versión más cara y en la versión más barata ya se nota claramente que están muy debajo del aumento del Índice Nacional de Precios.",0.0,82,10,10,2022
RICARDO SHEFFIELD PADILLA,"Y vamos viendo por zonas, en la zona centro, Walmart Express en la Cuauhtémoc, aquí en la Ciudad de México, encontramos los 24 productos a su precio más alto, este paquete está en mil 161 pesos con 30 centavos, comparado con Sumesa en Atizapán, Estado de México, donde el mismo paquete está en 973 pesos con 75 centavos, más de 200 pesos por abajo.",0.0,64,10,10,2022
RICARDO SHEFFIELD PADILLA,"En la zona centro norte, Chedraui en Morelia, Michoacán, es la opción más cara para comprar este paquete, está en mil 153 pesos con un centavo; mientras que Bodega Aurrera en Aguascalientes, Aguascalientes, lo tiene en mil 28 pesos con 90 centavos. Pero también en los precios bajos está la Central de Abastos de Durango y tenemos también a Walmart en Morelia, Michoacán, con los promedios bajos para esta canasta.",0.0,70,10,10,2022
PRESIDENTE ANDRES MANUEL LOPEZ OBRADOR, Vamos a los videos.,0.0,4,10,10,2022
PREGUNTA," Tren Maya, reporte de avances, 10 de octubre de 2022.",0.0,10,10,10,2022
PREGUNTA,"En el tramo 1 avanzan los trabajos para la estación de Villa El Triunfo, Balancán, Tabasco, con la cimentación de lo que será el edificio principal y los cuartos de máquinas.",0.0,31,10,10,2022
PREGUNTA,"También, en Villa El Triunfo se intensifican los trabajos en la fábrica de durmientes donde ya se labora en tres turnos de ocho horas para producir mil 500 piezas por día con una fuerza laboral de 300 personas, en su mayoría de las localidades cercanas.",0.0,45,10,10,2022
PREGUNTA,"En el tramo 2, a la altura de Champotón, Campeche, continúa la construcción del paradero ‘Felipe Carrillo Puerto’, con el armado de estructuras metálicas, así como el colado de techo y piso, también se prepara el área donde se colocará la cisterna y la planta tratadora de aguas residuales.",0.0,49,10,10,2022
PREGUNTA,"En el tramo 3, cerca del municipio Tixpéhual, Yucatán, sigue sobre el trazado de la vía la canalización para electricidad y fibra óptica, fundamentales para la energía y conectividad en la operación de los trenes. La fibra óptica que se instala para el Tren Maya también permitirá extender el servicio de internet a los 14 municipios del tramo 3 por donde cruza la vía.",0.0,64,10,10,2022
PREGUNTA,"En el municipio Chocholá, también en Yucatán, continúa la edificación de un paso inferior vehicular que mantendrá la conectividad de las comunidades y dará seguridad en el cruce de vehículos y tren. En el tramo 3 se encuentran en proceso de construcción 26 pasos vehiculares y otros siete ya fueron concluidos.",0.0,51,10,10,2022
PREGUNTA,"En el tramo 4, cerca de la localidad de San Román, municipio de Chemax, en Yucatán, avanza el tendido de subbalasto para la conformación de una tercera vía que servirá para dar mantenimiento al Tren Maya. Esta tercera vía, también conocida como ladero de vía auxiliar, será de casi dos kilómetros y, entre otros usos, evitará el encuentro el encuentro de trenes y permitirá almacenar equipo ferroviario.",0.0,67,10,10,2022
PREGUNTA,El Tren Maya avanza.,0.0,4,10,10,2022
PREGUNTA, La Comisión Nacional del Agua informa los avances en la construcción del Parque Ecológico Lago de Texcoco.,0.0,17,10,10,2022
PREGUNTA,"En el vivero se tienen más de 900 mil piezas de vegetación halófila nativa para su propagación. Asimismo, se mantienen las tareas de colecta de germoplasma y semillas para su reproducción.",0.0,31,10,10,2022
PREGUNTA,"Se realizó la aplicación de más de 22.6 toneladas de yeso agrícola para estabilizar la alcalinidad de los suelos y, con ello, mejorar las condiciones para el establecimiento de vegetación.",0.0,30,10,10,2022
PREGUNTA,Inició la plantación de vegetación floral y frutal de tipo enredadera en los biombos de la zona demostrativa del vivero.,0.0,20,10,10,2022
PREGUNTA,Continúan los trabajos de cobertura de suelos salinos expuestos. A la fecha se han plantado más de 500 mil piezas de plantas herbáceas y se realiza el retiro de vegetación invasora.,0.0,31,10,10,2022
PREGUNTA,"En el jardín central continúan los trabajos para la habilitación de registros de concreto que forman parte de los laberintos. Asimismo, se mantienen los trabajos preliminares de trazo y nivelación en los nueve kilómetros de la ciclovía.",0.0,37,10,10,2022
PREGUNTA,Inició la instalación de confinamientos verticales tipo bolardo en estacionamientos y a la fecha se han colocado 124 piezas.,0.0,19,10,10,2022
PREGUNTA,"Se avanza en el colado de firmes para las canchas deportivas, así como para plazueletas y senderos.",0.0,17,10,10,2022
PREGUNTA,También se realiza el colado de muros para gradas y perímetros de canchas de futbol de salón.,0.0,17,10,10,2022
PREGUNTA,"Se mantienen los trabajos de conformación de montículos en áreas de prados y juegos infantiles, así como la excavación y tendido de tuberías de redes generales del parque y particulares en plataformas.",0.0,32,10,10,2022
PREGUNTA,"Avanza la construcción de cimentaciones semiprofundas para el desplante de frontones, torres y cubiertas en distintas plataformas. El colado de guarniciones en los senderos lleva un acumulado de más de cuatro kilómetros y se realiza la colocación de precolados de pavimentos con un avance de más de dos mil metros cuadrados.",0.0,51,10,10,2022
PREGUNTA,A la fecha se han generado más de cuatro mil 250 empleos en la construcción del parque.,0.0,17,10,10,2022
PRESIDENTE ANDRES MANUEL LOPEZ OBRADOR," Ya, la compañera, compañero, tres, cuatro, cinco, falta compañeras, seis, siete.",0.0,11,10,10,2022
PREGUNTA," Buenos días, señor presidente; buenos días, procurador.",0.0,7,10,10,2022
PREGUNTA,"Stephanie Palacios, de la agencia internacional Sputnik.",0.0,7,10,10,2022
PREGUNTA,"Se habló sobre el sistema de información, sobre el acuerdo entre México y Rusia en materia espacial. Aunque el Gobierno de México aseguró en este comunicado que el 8 de octubre este acuerdo todavía no entra en vigor por la parte de México, es necesario el visto bueno del Consejo de la Federación de Rusia, pero la cámara alta ya había firmado, aprobó este acuerdo el 6 de octubre y el presidente de Rusia, Vladimir Putin, el 8 de octubre firmó este documento.",0.0,83,10,10,2022
PREGUNTA,"En estas áreas de cooperación que hay este sistema satelital, el Glonass, acuerda estos espacios para la seguridad espacial, pero dice que México no va a… No tiene pensado hacer como estos tratados.",0.0,33,10,10,2022
PREGUNTA,"Pero entonces, ¿a qué se refiere en el punto sobre la cooperación de navegación por satélite? Si hay alguna información más, si el Gobierno de México estaba enterado de que sí se firmó este acuerdo. ¿Y qué es lo que está pasando?, porque hay como una desinformación.",0.0,47,10,10,2022
PRESIDENTE ANDRES MANUEL LOPEZ OBRADOR," Sí, es un acuerdo que se firmó el año pasado, en septiembre, antes de la guerra de Rusia y Ucrania, y ahora se está haciendo un escándalo porque se habla de que México está permitiendo que satélites rusos puedan ser utilizados para espiar espacio aéreo mexicano y de América del Norte. Lo cierto es que estos acuerdos se firman con todos los países y no tienen el propósito de espiar a nadie ni de afectar la soberanía de ninguna nación.",0.0,80,10,10,2022
PRESIDENTE ANDRES MANUEL LOPEZ OBRADOR,¿Qué es lo que está pasando realmente?,0.0,7,10,10,2022
PRESIDENTE ANDRES MANUEL LOPEZ OBRADOR,"Pues que está la guerra, esto lo hemos dicho, produce mucho sufrimiento, porque hay pérdida de vidas humanas, desplazados; también repercute en la economía de los países del mundo, la inflación que se está padeciendo actualmente es producto, en buena medida, de esa guerra y por eso estamos planteando que se busque el diálogo y pacificar. Sin embargo, hay quienes no quieren detener la guerra, que es lo más irracional que puede haber, y hay una propaganda en el mundo, maniquea, como suele suceder con todas las guerras, queriéndonos convencer de que hay buenos y malos; entonces todo se hace escándalo.",0.0,101,10,10,2022
PRESIDENTE ANDRES MANUEL LOPEZ OBRADOR,"Agréguenle de que van a haber elecciones en Estados Unidos dentro de tres semanas, y siempre que hay elecciones en cualquier parte del mundo, pues estas cosas se magnifican, se utilizan con propósitos electorales.",0.0,34,10,10,2022
PRESIDENTE ANDRES MANUEL LOPEZ OBRADOR,"Por eso, yo llamo, primero, a que se busque un diálogo y se logre la paz.",0.0,16,10,10,2022
PRESIDENTE ANDRES MANUEL LOPEZ OBRADOR,"Segundo, que no dejen, mejor dicho, que no echen en saco roto el que pueda crearse un grupo de intermediación para hablar con los presidentes de Rusia, de Ucrania y llegar a acuerdos.",0.0,33,10,10,2022
PRESIDENTE ANDRES MANUEL LOPEZ OBRADOR,"Estoy proponiendo, y voy a seguirlo haciendo, que se llame a participar al papa Francisco, al primer ministro Modi, de la India, al secretario general de Naciones Unidas, que se pueda aprobar que ellos ayuden para que se consiga la paz.",0.0,41,10,10,2022
PRESIDENTE ANDRES MANUEL LOPEZ OBRADOR,"Yo creo que las cosas van a mejorar mucho una vez que pasen las elecciones en Estados Unidos, o sea, tengo esa confianza: que va a haber más propaganda de buenos y malos — ojalá no escalen las agresiones—, y luego se serenen las cosas y se llegue a la paz.",0.0,51,10,10,2022
PRESIDENTE ANDRES MANUEL LOPEZ OBRADOR,"Porque, también, hay movimientos en Europa de la población que se está viendo afectada por la guerra, sobre todo por la escasez de energía, viene el invierno. Entonces, se tiene que pensar en la gente, no en los poderes hegemónicos, en los intereses de las potencias, sino en los pueblos.",0.0,50,10,10,2022
PRESIDENTE ANDRES MANUEL LOPEZ OBRADOR,"Entonces, en conclusión, a nosotros que no nos metan en sus asuntos, México tiene una política de neutralidad y lo que queremos es una solución pacífica a esa controversia, como lo establece nuestra Constitución.",0.0,34,10,10,2022
PREGUNTA," El canciller Marcelo pidió a la Agencia Espacial Mexicana información sobre este tema, aunque ellos dijeron que tenía que aprobarse y que las autoridades de Rusia lo firmaran, que esto ya está confirmado que sí lo firmaron. Entonces, ¿cuál es la situación de que sí o no?",0.0,47,10,10,2022
PRESIDENTE ANDRES MANUEL LOPEZ OBRADOR," Pues esa que le estoy explicando. Pues imagínese, para que intervenga un expresidente de México a decir que estamos tomando partido y que se está comprometiendo la soberanía de México.",0.0,30,10,10,2022
PREGUNTA, Cuando son acuerdos que se han firmado también con Estados Unidos y con otros países.,0.0,15,10,10,2022
PRESIDENTE ANDRES MANUEL LOPEZ OBRADOR," Sí, pero es parte de lo mismo, o sea, es politiquería, oportunismo, elecciones.",0.0,13,10,10,2022
PRESIDENTE ANDRES MANUEL LOPEZ OBRADOR,"Decirle a la gente, pero el mexicano está muy despierto, muy consciente, es de los pueblos más politizados del mundo, con menos analfabetismo político, siempre lo digo, entonces saben que aquí la gente está muy despierta, el mexicano no se deja manipular, es un pueblo muy avispado y en los últimos tiempos ha cambiado mucho la mentalidad del pueblo de México, hay mucha consciencia en el pueblo.",0.0,67,10,10,2022
PRESIDENTE ANDRES MANUEL LOPEZ OBRADOR,"Si por eso los medios de información no han podido, me refiero a los medios convencionales vinculados a grupos de intereses creados, ya sea en lo económico, en lo político; no pueden, porque este es un pueblo mucho, mucho muy inteligente, muy despierto, muy consciente, no susceptible a la manipulación.",0.0,50,10,10,2022
PRESIDENTE ANDRES MANUEL LOPEZ OBRADOR,"Con todas estas campañas que están echando andar en el mundo, ya estuve viendo que están promoviendo, imagínense, píldoras para resistir radiaciones nucleares, hablando incluso de la posibilidad de una tercera guerra mundial. No, no. Además, toco madera, pero son circunstancias muy especiales.",0.0,43,10,10,2022
PRESIDENTE ANDRES MANUEL LOPEZ OBRADOR,"Eso en nuestro país no transita, eso no tiene ningún impacto propagandístico, pero realmente, si ve uno la televisión en el mundo, los periódicos en el mundo, es un bombardeo de ese tipo de información que aturde.",0.0,37,10,10,2022
PRESIDENTE ANDRES MANUEL LOPEZ OBRADOR,"Entonces, decirles a los mexicanos: No nos preocupemos por eso, no estemos preocupados por algo que tiene que ver con intereses políticos hegemónicos, algo que no ayuda a los pueblos.",0.0,30,10,10,2022
PRESIDENTE ANDRES MANUEL LOPEZ OBRADOR,"Nosotros lo que estamos planteando es: ¿Qué, no podemos lograr un acuerdo entre las naciones para que en la práctica podamos establecer una tregua, en donde ya no estén probando mísiles? Porque hay algunos que están tirando y tirando misiles al mar. Imagínense cuánto cuesta tirar un mísil al mar.",0.0,50,10,10,2022
PRESIDENTE ANDRES MANUEL LOPEZ OBRADOR,"Y otros que tiran también para probar su fuerza bélica, su fuerza bruta.",0.0,13,10,10,2022
PRESIDENTE ANDRES MANUEL LOPEZ OBRADOR,"Y algunos que ni puntería tienen, que eso es lo que preocupa más, declaraciones y confrontación, y promover la guerra, y mandar armas a los países donde hay conflictos, y meterse en asuntos internos de los países.",0.0,37,10,10,2022
PRESIDENTE ANDRES MANUEL LOPEZ OBRADOR,"¿Qué, no podemos decir: Basta, vamos a darnos un tiempo, cinco años, y que los gobiernos se dediquen a atender los problemas de la gente, los grandes y graves problemas que padecen los pueblos del mundo: la pobreza, la violencia, la migración, los problemas de salud?",0.0,46,10,10,2022
PRESIDENTE ANDRES MANUEL LOPEZ OBRADOR,"Si por eso es mi reproche fraterno a Naciones Unidas. No se escucha nada de Naciones Unidas, todo está en silencio, están inmovilizados, están como adorno, cuando deberían de tener una actitud muy protagónica en estos momentos, todos los días demandando diálogo y paz, pero no. ¿Escuchan ustedes algo de la ONU? ¿Se escucha algo en la radio? ¿Se escucha algo, se ve algo en la televisión? ¿Se lee algo en los periódicos? Nada.",0.0,74,10,10,2022
PRESIDENTE ANDRES MANUEL LOPEZ OBRADOR,"Es la agencia no sé qué, que ya tomó la declaración de uno de los presidentes o ya bombardearon un puente, o ya sabotearon un gasoducto o ya hubo una declaración de que estamos a punto de apretar o de que alguien apriete el botón.",0.0,45,10,10,2022
PRESIDENTE ANDRES MANUEL LOPEZ OBRADOR,"Estaba yo viendo que hasta el expresidente Trump ya está planteando de que se necesita la paz. Ayer vi algo, no sé si es una declaración nueva.",0.0,27,10,10,2022
PRESIDENTE ANDRES MANUEL LOPEZ OBRADOR,"Y el presidente Biden, pues es una gente muy responsable, sensata, entonces, no creo yo que pasen las cosas a mayores.",0.0,21,10,10,2022
PRESIDENTE ANDRES MANUEL LOPEZ OBRADOR,"Y mientras tanto, que no nos metan a nosotros en sus argüendes, dirían.",0.0,13,10,10,2022
PREGUNTA, ¿Se va a dar a conocer la información que habló el canciller Marcelo con el ministro?,0.0,16,10,10,2022
PRESIDENTE ANDRES MANUEL LOPEZ OBRADOR," Sí, sí, toda la información, pero nosotros no somos bélicos, nosotros tenemos relaciones con todos los pueblos del mundo.",0.0,19,10,10,2022
PREGUNTA," La cuestión es que cuando se solicita información, presidente, pues no hay información.",0.0,13,10,10,2022
PRESIDENTE ANDRES MANUEL LOPEZ OBRADOR, ¿Cuándo qué?,0.0,2,10,10,2022
PREGUNTA," Cuando se solicita la información a las dependencias no hay información, por eso uno tiene que preguntar aquí con usted.",0.0,20,10,10,2022
PRESIDENTE ANDRES MANUEL LOPEZ OBRADOR," Sí, se entrega toda la información, pero yo estoy ahora informándole, soy el representante del Estado mexicano, le estoy diciendo que la política nuestra es no a la guerra, sí a la paz. La política nuestra es de neutralidad, no estamos con ninguna potencia hegemónica en el mundo, somos respetuosos de la no intervención, de la autodeterminación de los pueblos, de la solución pacífica de las controversias; además, es un mandato constitucional.",0.0,72,10,10,2022
PRESIDENTE ANDRES MANUEL LOPEZ OBRADOR,"Por eso digo que no nos metan a nosotros, nosotros defendemos nuestra soberanía y, por lo mismo, no podemos intervenir en la vida política de otra nación.",0.0,27,10,10,2022
PRESIDENTE ANDRES MANUEL LOPEZ OBRADOR,"Y en este caso en particular hemos actuado, y lo seguiremos haciendo, de manera neutral, y lo que estamos impulsando es que haya paz, ya presentamos una propuesta formalmente a la ONU en ese sentido y no nos vamos a mover de ahí.",0.0,43,10,10,2022
PREGUNTA," Pero, por ejemplo, el canciller se reunió con las dos naciones, la gente de Ucrania y la gente de Rusia. Saber qué se trató, qué se habló con el canciller Serguéi, de Rusia, porque esa información pues no, no… Si en algún momento se va a dar a conocer.",0.0,49,10,10,2022
PRESIDENTE ANDRES MANUEL LOPEZ OBRADOR, Pues a los países involucrados y a otros más se les entregó nuestra propuesta. ¿En el caso de la reunión de la ONU es a lo que te refieres?,0.0,29,10,10,2022
PREGUNTA," De Rusia, se reunió con el canciller Serguéi y si esas…",0.0,11,10,10,2022
PRESIDENTE ANDRES MANUEL LOPEZ OBRADOR," Sí, con los dos.",0.0,4,10,10,2022
PREGUNTA," Sí, con los dos, pero en el caso de Rusia, la información. Yo lo comento porque el bloqueo de información continúa, señor presidente, entonces es muy importante también conocer por qué no se pública en todos lados, continúa el bloqueo de información en canales de televisión.",0.0,46,10,10,2022
