Participante,Texto,Sentimiento,Palabras,Dia,Mes,Anio
ARACELI CORTES TERAN, El día de hoy acudí por unos resultados porque el día lunes vine a consulta y me mandaron a hacer unos estudios y el día de hoy vengo a consulta.,0.0,30,21,06,2022
ARACELI CORTES TERAN," Antes yo no podía hacer esto porque daban la cita de los estudios para más días, lo alargaban más, a veces daban 15 días o a veces un mes, hoy me los hicieron el martes y para el día jueves ya estaban los resultados.",0.0,44,21,06,2022
ARACELI CORTES TERAN," Pues, yo desde el lunes que vine mucha amabilidad por parte de los trabajadores.",0.0,14,21,06,2022
ARACELI CORTES TERAN," Pues que está mejorando porque se ve que limpiaron las bancas, limpiaron todo el hospital, lo pintaron.",0.0,17,21,06,2022
ARACELI CORTES TERAN, Pues que le damos gracias al gobierno federal y a las instituciones que competen porque pues todo esto es beneficio para la comunidad. Nos sentimos muy orgullosos de contar con ello.,0.0,31,21,06,2022
