Participante,Texto,Sentimiento,Palabras,Dia,Mes,Anio
RUTILIO ESCANDON CADENAS," Bienvenido, señor presidente, a su casa. Y también saludo con mucho gusto al doctor Alfonso Durazo Montaño, al general Luis Cresencio Sandoval González, al almirante, José Rafael Ojeda Durán, al licenciado Carlos Morelos Rodríguez, presidente municipal; al general de brigada diplomado de estado mayor, Luis Rodríguez Bucio; al licenciado David León Romero.",0.32823650481604266,52,4,6,2020
RUTILIO ESCANDON CADENAS,"Con su permiso, señor presidente.",0.32823650481604266,5,4,6,2020
RUTILIO ESCANDON CADENAS,"En Chiapas estamos trabajando, como ya lo comentó el ciudadano presidente de la República, todos los días puntualmente en las mesas de seguridad y esto nos ha permitido aprovechar todos esos valiosísimos recursos humanos en materia de seguridad; también, gracias a este trabajo permanente, estamos dando una respuesta favorable a la sociedad, al pueblo de Chiapas.",0.32823650481604266,56,4,6,2020
RUTILIO ESCANDON CADENAS,"Y, por ejemplo, en delitos de alto impacto la incidencia delictiva ha ganado al 42 por ciento.",0.32823650481604266,17,4,6,2020
RUTILIO ESCANDON CADENAS,"Esto, en algunos delitos que voy mencionar, como el robo de vehículos un nueve por ciento menos, el homicidio doloso un 24 por ciento menos, el robo a negocio 66 por ciento menos, el robo a transeúnte 69 por ciento menos, el robo a casa habitación el 70 por ciento menos, la extorsión menos 52 por ciento, el secuestro menos un 60 por ciento -estoy hablando de estos primeros cuatro meses del año- el robo a transportista menos un 91 por ciento y el robo a bancos, que no se nos ha dado, tenemos un 100 por ciento menos, porque el año pasado sí tuvimos algunos asaltos, a algunas sucursales bancarias.",0.32823650481604266,111,4,6,2020
RUTILIO ESCANDON CADENAS,"De tal forma que en delitos de alto impacto ha descendido en un 42 por ciento y en la incidencia general delictiva en un 25 por ciento, pero esto obedece también que de acuerdo al plan extraordinario que hizo el presidente, de justicia social, nos ha ayudado muchísimo.",0.32823650481604266,48,4,6,2020
RUTILIO ESCANDON CADENAS,"Por ejemplo, el robo a casa habitación, el robo a negocios era un clamor en Chiapas cuando llegamos al gobierno; sin embargo, ahora ha bajado de manera contundente, pero tiene que ver mucho también con los apoyos de justicia social, porque se está ayudando con programas muy importantes a la población chiapaneca y esto ha dado como resultado la instauración de una nueva cultura de paz en Chiapas.",0.32823650481604266,68,4,6,2020
RUTILIO ESCANDON CADENAS,"Y quiero comentarles, por ejemplo, en materia de trabajo social también nosotros nos hemos sumado en Chiapas, todos los días estaos pendientes.",0.32823650481604266,22,4,6,2020
RUTILIO ESCANDON CADENAS,"Por ejemplo, en materia de alimentación para niñas, niños y jóvenes estamos distribuyendo en Chiapas diariamente casi dos millones de raciones, tomando en cuenta también a la población vulnerable, a los que menos tienen y ahora que se presentó esta pandemia del COVID-19 seguimos apoyando de manera extraordinaria.",0.32823650481604266,48,4,6,2020
RUTILIO ESCANDON CADENAS,"Quiero decirles que ya se distribuyeron 145 mil paquetes alimentarios de 25 kilos cada uno de ellos con una alimentación balanceada. Y ya eso fue la primera fase, ya empezamos la segunda fase con otras, aproximadamente 160 mil; lo vamos a superar, de tal forma que van a ser más de 300 mil paquetes alimentarios para la población más vulnerable de Chiapas. Y esto se puede hacer gracias a las economías que tenemos, porque estamos trabajando, siguiendo el ejemplo del presidente.",0.32823650481604266,81,4,6,2020
RUTILIO ESCANDON CADENAS,"Y quiero decirles también que este gobierno es honesto y por eso la ciudadanía se ha sumado al apoyo para complementar estos alimentos, se han sumado empresarios, los trabajadores de Chiapas, todos, del gobierno estatal, están donando parte de su salario para complementar estos alimentos.",0.32823650481604266,45,4,6,2020
RUTILIO ESCANDON CADENAS,"Y no solamente eso, sino que lo estamos repartiendo casa por casa, vamos domicilio por domicilio, desde las comunidades más cercanas hasta las más lejanas de Chiapas para que el pueblo y sobre todo las personas más vulnerables no salgan de su casa, tengan ahí sus alimentos, por lo que yo agradezco a todas y a todos los trabajadores del gobierno de Chiapas y a los empresarios de buen corazón que se han sumado para complementar estas raciones alimenticias.",0.32823650481604266,79,4,6,2020
RUTILIO ESCANDON CADENAS,"También aquí en Chiapas creamos un programa nuevo que se llama Barriguita Llena, Corazón Contento de Regreso a Casa. En ese programa no solamente les damos desayunos escolares a los niños, sino les damos también comida para que regresen a su casa ya comiditos, sobre todo los niños más pobres, en las comunidades más pobres de Chiapas, porque luego pueden regresar a su casa y ya no comen; entonces, les estamos nosotros dando esas raciones de alimentación.",0.32823650481604266,77,4,6,2020
RUTILIO ESCANDON CADENAS,"Pero además quiero comentarles que ahora que los niños están llevando clases virtuales en sus casas, igual que los jóvenes, les enviamos su alimentación a su casa para seguirlos atendiendo.",0.32823650481604266,30,4,6,2020
RUTILIO ESCANDON CADENAS,"Quiero comentarle, señor presidente, que ahora con esta pandemia tan fuerte aquí en Chiapas inmediatamente adaptamos 13 clínicas COVID especializadas en enfermedades respiratorias.",0.32823650481604266,23,4,6,2020
RUTILIO ESCANDON CADENAS,"Y quiero hacer un reconocimiento a todas las doctoras, doctores, enfermeras, enfermeros, camilleros, los que manejan las ambulancias, los que hacen el aseo, porque hasta doblan turno. No solamente son profesionales en su trabajo, también son muy humanos, y gracias a eso estos centros hospitalarios adaptados para el COVID-19 en automático se han convertido en centros de aislamiento.",0.32823650481604266,58,4,6,2020
RUTILIO ESCANDON CADENAS,"Hoy por hoy tenemos en las últimas 24 horas dos mil 155 infectados históricamente, de los cuales 873 han superado esta enfermedad. Gente que estaba intubada, que estaba muy grave ha salido.",0.32823650481604266,32,4,6,2020
RUTILIO ESCANDON CADENAS,"Aquí en Palenque tenemos, por ejemplo, un hospital COVID de enfermedades respiratorias, tenemos 13 en todo el estado y ya tenemos también un centro estatal de rehabilitación para que los enfermos que van saliendo se les siga su tratamiento.",0.32823650481604266,39,4,6,2020
RUTILIO ESCANDON CADENAS,"Pero además, los enfermos de escasos recursos económicos que salen de los hospitales los estamos atendiendo también con alimentación para que puedan en su casa recuperarse bien.",0.32823650481604266,27,4,6,2020
RUTILIO ESCANDON CADENAS,"Estamos trabajando también, señor presidente, con nuestros propios recursos haciendo un esfuerzo y en un año quedará listo el C5 aquí en Chiapas. Estamos ya avanzados en algunos municipios importantes como Tapachula, Tuxtla Gutiérrez y también ya estamos empezando aquí en Palenque.",0.32823650481604266,42,4,6,2020
RUTILIO ESCANDON CADENAS,"Por eso, la conclusión es que en Chiapas estamos aprovechando lo que usted planeó desde hace mucho tiempo, que es que todas las autoridades estemos como un solo frente, sumados en la defensa de los intereses del pueblo, sobre todo en materia de seguridad. Eso nos ha dado muy buen resultado, ahí estamos todos, tanto de mi gobierno como del gobierno federal.",0.32823650481604266,62,4,6,2020
RUTILIO ESCANDON CADENAS,"Y quiero comentarle, señor presidente, que es muy grato y muy satisfactorio ver que el esfuerzo de todos ahí en la mesa de seguridad, del Ejército Mexicano, de la Marina, de la Guardia Nacional, del secretario federal de Seguridad Pública, de Protección Civil, porque también el secretario estatal de Protección Civil está conmigo todos los días en la mesa.",0.32823650481604266,59,4,6,2020
RUTILIO ESCANDON CADENAS,"Por ejemplo, hoy les puedo decir que no tenemos preocupación por las presas, porque teníamos un déficit de lluvias, porque por ahí escuché que se iban, las presas, a soltar el agua. No.",0.32823650481604266,33,4,6,2020
RUTILIO ESCANDON CADENAS,"Por ejemplo, la presa La Angostura la tenemos en un 61.7, todavía hay mucho margen y ojalá tengamos en las presas agua suficiente; y la presa de Malpaso está al 61 por ciento. Chicoasén y todas las demás son vasos reguladores, pero las que controlan son La Angostura y Malpaso.",0.32823650481604266,50,4,6,2020
RUTILIO ESCANDON CADENAS,"Estamos también muy atentos, tenemos albergues para atender a la gente en protección civil y nos hemos sumado al gobierno federal, al trabajo diario para rescatar humanitariamente a los migrantes en Chiapas, que también nos dio un buen resultado.",0.32823650481604266,39,4,6,2020
RUTILIO ESCANDON CADENAS,"Esto es lo que podría informar, señor presidente.",0.32823650481604266,8,4,6,2020
