Participante,Texto,Sentimiento,Palabras,Dia,Mes,Anio
JESUS RAMIREZ CUEVAS, Ahorita lo mandan.,0.0,3,17,10,2022
JESUS RAMIREZ CUEVAS," No, todavía no las envían.",0.0,5,17,10,2022
JESUS RAMIREZ CUEVAS, Son de pasajeros…,0.0,3,17,10,2022
JESUS RAMIREZ CUEVAS, Son de pasajeros.,0.0,3,17,10,2022
JESUS RAMIREZ CUEVAS, Fotos.,0.0,1,17,10,2022
JESUS RAMIREZ CUEVAS," No, pero ahorita vemos.",0.0,4,17,10,2022
JESUS RAMIREZ CUEVAS," En Colima sí hay, en Manzanillo…",0.0,6,17,10,2022
JESUS RAMIREZ CUEVAS," Xalapa, Veracruz.",0.0,2,17,10,2022
