Participante,Texto,Sentimiento,Palabras,Dia,Mes,Anio
PREGUNTA," Tren Maya, reporte de avances. Semana 15 de 157.",0.32823650481604266,9,30,11,2020
PREGUNTA,"En el tramo 1 avanzamos en las actividades de subrasante, corte y terraplén, y obras hidráulicas.",0.32823650481604266,16,30,11,2020
PREGUNTA,En el tramo 2 la producción de durmientes ascendió a 126 mil 686. También avance el desmontaje y el acopio de vía.,0.32823650481604266,22,30,11,2020
PREGUNTA,En el tramo 3 continuamos con las actividades y obras de drenaje transversal para construir alcantarillas tubulares y de marco.,0.32823650481604266,20,30,11,2020
PREGUNTA,En el tramo 4 destacan las actividades de terracería y los estudios preliminares.,0.32823650481604266,13,30,11,2020
PREGUNTA,"La voz de los pueblos y comunidades indígenas es imprescindible para la toma de decisiones en la vida pública de nuestro país. Por eso, este 28 y 29 de noviembre se realizó la segunda ronda de reuniones de seguimiento del proceso de consulta indígena. Se realizaron 14 nuevas reuniones regionales con estricto apego a las recomendaciones sanitarias.",0.32823650481604266,57,30,11,2020
PREGUNTA,Mantenemos un diálogo permanente con los pueblos y comunidades indígenas para dar seguimiento a los acuerdos y dar a conocer los avances en el diseño e implementación del proyecto de desarrollo integral.,0.32823650481604266,32,30,11,2020
PREGUNTA,"Este proceso se da de manera circular y de buena fe entre las comisiones de seguimiento y verificación, integradas por autoridades líderes comunitarios y un comité técnico interinstitucional integrado por más de 30 instituciones federales.",0.32823650481604266,35,30,11,2020
PREGUNTA,"El proceso de diálogo y planeación participativa está encabezado por la Secretaría de Gobernación, el Instituto Nacional de los Pueblos Indígenas y Fonatur.",0.32823650481604266,23,30,11,2020
PREGUNTA,El Gobierno de México reitera su compromiso con garantizar el respeto pleno a los derechos de los pueblos indígenas.,0.32823650481604266,19,30,11,2020
PREGUNTA,El Tren Maya Avanza.,0.32823650481604266,4,30,11,2020
PREGUNTA, Gobierno de México.,0.32823650481604266,3,30,11,2020
PREGUNTA," Gracias, presidente. Buenos días. Sara Pablo, de Grupo Fórmula.",0.32823650481604266,9,30,11,2020
PREGUNTA,"Aprovechando la presencia de Carlos Salazar, le quiero preguntar cómo van las negociaciones por el tema del outsourcing.",0.32823650481604266,18,30,11,2020
PREGUNTA,Decían en cuanto al gobierno federal que hay 500 mil trabajadores subcontratados. Si esta cifra es correcta. Decía Joel Ayala que son 500 mil. ¿Qué se haría con estos empleados?,0.32823650481604266,30,30,11,2020
PREGUNTA,"Y para Carlos Salazar, preguntarle, ¿cómo van las conversaciones?, si nos puede dar un corte. Y si lo que les preocupa está centrado en el tema de las sanciones.",0.32823650481604266,29,30,11,2020
PREGUNTA,Gracias.,0.32823650481604266,1,30,11,2020
PREGUNTA, ¿Sí son estos 500 mil trabajadores del gobierno?,0.32823650481604266,8,30,11,2020
PREGUNTA, Gracias. No sé si Carlos Salazar nos pudiera decir cómo van las conversaciones. Y en el tema de las sanciones ¿qué es lo que les preocupa?,0.32823650481604266,26,30,11,2020
PREGUNTA," Me refería al tema de las sanciones, de las sanciones que vienen contempladas en la iniciativa de subcontratación, si le parecen excesivas",0.32823650481604266,22,30,11,2020
PREGUNTA, Gracias.,0.32823650481604266,1,30,11,2020
PREGUNTA,"Presidente, sólo un segundo tema. Se decía que ya la fiscalía está solicitando arresto en contra de Genaro García Luna por el delito de enriquecimiento ilícito. Si le ha pedido la fiscalía a la cancillería de su gobierno que se pida la extradición a Estados Unidos o esto no ha ocurrido.",0.32823650481604266,51,30,11,2020
PREGUNTA," Buenos días, presidente. Diana Benítez, del periódico 24 Horas.",0.32823650481604266,9,30,11,2020
PREGUNTA,"Preguntarle, pues a dos años de su gobierno el líder del PAN dice que usted ha llevado al país a un retroceso en la salud, en la seguridad y en materia económica.",0.32823650481604266,32,30,11,2020
PREGUNTA,"Y, por otro lado, el expresidente Felipe Calderón también dice que se ha hecho un manejo torpe de la epidemia contra el coronavirus, él dice que hay hasta 300 mil fallecidos. Preguntarle si usted le exigiría pruebas a Calderón de sus comentarios.",0.32823650481604266,42,30,11,2020
PREGUNTA," Y precisamente, presidente, ayer decía en el acto de Tijuana que no han sido fáciles estos dos años de gobierno y parte por la acción de los conservadores.",0.32823650481604266,28,30,11,2020
PREGUNTA,¿Cuál sería la acción de la oposición que cree que más atoró a su gobierno en estos dos años?,0.32823650481604266,19,30,11,2020
PREGUNTA," Finalmente, presidente, hoy en el periódico publicamos que el Instituto para Devolver al Pueblo lo Robado tiene un acumulado de 12 mil inmuebles que le generan un gasto casi anual de 200 millones de pesos.",0.32823650481604266,35,30,11,2020
PREGUNTA,"¿A qué se debe que exista este acumulado de tantos bienes inmuebles?, ¿por qué no se han subastado?, ¿es burocracia o a qué lo atribuye?",0.32823650481604266,25,30,11,2020
PREGUNTA, ¿Y esperarían a sacarlos todos en subastas o habría donaciones?,0.32823650481604266,10,30,11,2020
PREGUNTA," Buenos días, señor presidente; buenos días funcionarios que lo acompañan, medios de comunicación. Iber Alejandro, de Contrapeso Digital.",0.32823650481604266,18,30,11,2020
PREGUNTA,"Señor presidente, en un acto de demagogia, el gobernador de Jalisco, Enrique Alfaro, resulta que dice que el gobierno federal le ha recortado nueve mil millones de pesos a dicha entidad federativa. Lo entendemos, esa parte de que tienen miedo de que ya vienen las elecciones, están apresurados.",0.32823650481604266,48,30,11,2020
PREGUNTA,"Pero en días recientes en plena pandemia, el gobierno de Jalisco adquirió 277 unidades con valor superior al millón de pesos, camionetas blindadas, machuchonas, como dice usted, que no tiene ni Obama, en plena pandemia, cuando la gente en Jalisco está buscando un taco, cuando están esquivando las balas de la violencia, en la cual no ha puesto orden el gobernador de Jalisco. Y no ha dicho cómo es que se adquirieron dichas unidades. ¿De qué privilegio goza Enrique Alfaro?",0.32823650481604266,80,30,11,2020
PREGUNTA,"Quien lucha por la justicia, señor presidente, no tiene nada que temer, lo ha dicho usted de manera muy atinada y yo creo que este es el caso. ¿Por qué no hubo para otorgarle un cubrebocas con ínfimo valor a Giovanni? Lo mataron por no portar un cubrebocas.",0.32823650481604266,48,30,11,2020
PREGUNTA,"Yo no tengo nada que decirle, presidente, que usted no sepa, usted ha estado en esa tierra. Entonces, la pregunta sería, presidente, ¿habría manera de que se inicie una investigación por medio de la Auditoría Superior de la Federación, por medio de la Unidad de Inteligencia Financiera, para se revise el gasto? porque el pueblo bueno y sabio quiere saber por qué un gobernador tiene 277 unidades blindadas, cuando el pueblo de México, muchos en la zona del norte, me ha tocado vivirlo, yo lo viví, la violencia en Tamaulipas, sé de lo que estoy hablando, en Jalisco es la misma situación, no puede ser que un gobernador tenga este privilegio.",0.32823650481604266,111,30,11,2020
PREGUNTA,"Y usted lo ha dicho, lo revisamos el día jueves, usted lo comentaba, señor presidente, de manera muy acertada, que el pueblo tiene derecho a checar en qué se está gastando el dinero el gobernador, señor presidente. Esa es mi primera pregunta.",0.32823650481604266,42,30,11,2020
PREGUNTA," Con respecto a las camionetas, mi estimado presidente.",0.32823650481604266,8,30,11,2020
PREGUNTA," Entiendo, entiendo la parte en la que usted no puede opinar, no puede meterse, pero sí se podría iniciar aunque sea una investigación, digo, porque es con dinero público.",0.32823650481604266,29,30,11,2020
PREGUNTA," Siguiente pregunta, señor presidente. Entiendo que su imagen es pública, entiendo que las conferencias matutinas están a disposición del pueblo bueno y sabio, quien decide informarse con quien más le apetezca, lamentablemente se ha reportado una situación y creo que no se le ha dado la debida importancia porque no se ha explicado como tal, el tema Univisión.",0.32823650481604266,58,30,11,2020
PREGUNTA,"Univisión, resulta que en internet, específicamente YouTube, se apropió de su imagen. ¿Sí sabe usted que los derechos de autor en YouTube le pertenecen a usted?",0.32823650481604266,26,30,11,2020
PREGUNTA,"Y ahí no acaba la cosa, lo que pasa es que nosotros pues transmitimos en redes sociales nuestra opinión con respecto a los temas que acontecen a nivel nacional, mundial, etcétera, pero resulta que cuando yo quiero opinar sobre algo de la mañanera, pues resulta que en ese pedacito me dice Univisión: ‘No puedes transmitirlo, te voy a bajar el video’.",0.32823650481604266,61,30,11,2020
PREGUNTA,"Entonces, esto es un acto total de censura de quienes, durante años, señor presidente, lo censuraron a usted y le decían de cosas, y ahora resulta que el pueblo bueno y sabio no se puede informar porque los medios de comunicación tradicionales, en este caso específico Univisión, se apropió de su imagen en internet.",0.32823650481604266,54,30,11,2020
PREGUNTA,"Si estamos actuando en conformidad con la ley, pues debería haber una sanción; pero sabemos no va a proceder porque usted no intervendría en esa situación, porque luego si lo hace van a decir que usted es un dictador, como lo dicen constantemente.",0.32823650481604266,43,30,11,2020
PREGUNTA,"Lo que sí me gustaría, señor presidente, es que se le diera un seguimiento. Traigo las pruebas; si me lo permite, al culminar la conferencia matutina se lo podría entregar al vocero, que es Jesús Ramírez Cuevas, y hacerle la petición a Jesús Ramírez Cuevas que hable con el equipo de YouTube México y le diga: ‘Oiga, ¿por qué Univisión se apropió de la imagen del presidente?’",0.32823650481604266,67,30,11,2020
PREGUNTA,"¿De qué privilegios gozan los que siempre callaron como momias, los que hoy son sepulcros blanqueados y que le dan cobertura a infinidad de mentiras?",0.32823650481604266,25,30,11,2020
PREGUNTA,"Que hay una campaña en contra de nosotros, los medios alternativos, pues lo entendemos porque están desesperados, han perdido rating. Aunque digan algunos en redes sociales: ‘No, no hay que darle, ya no le voy a dar cobertura el presidente’, por favor, si el pueblo no es tonto, tonto es aquél que piensa el pueblo es tonto, señor presidente.",0.32823650481604266,59,30,11,2020
PREGUNTA," Presidente, buenos días.",0.32823650481604266,3,30,11,2020
PREGUNTA,Primero preguntarle si durante la reunión del Gabinete de Seguridad la jefa de Gobierno de la Ciudad de México le informó sobre el homicidio de los empresarios francomexicanos y si en algún momento el gobierno federal podría apoyar en este caso.,0.32823650481604266,41,30,11,2020
PREGUNTA,"Y se lo comento porque, a raíz de este caso, se están realizando investigaciones, pero muchos empresarios ya están, digamos, hartos de que están siendo extorsionados, cobro de piso, en fin.",0.32823650481604266,31,30,11,2020
PREGUNTA,¿Qué es lo que se la ha informado sobre este tema? Esta sería mi primera pregunta.,0.32823650481604266,16,30,11,2020
PREGUNTA,Gracias.,0.32823650481604266,1,30,11,2020
PREGUNTA," En el caso aquí de la Ciudad de México el crimen organizado todavía sigue operando de una manera importante. ¿Aquí por parte de las autoridades ya está controlado?, ¿qué es lo que está pasando?",0.32823650481604266,34,30,11,2020
PREGUNTA," Presidente y también hablando en el caso de Ciudad de México, el Valle de México y en el tema del COVID, en los últimos días se ha informado de un incremento de casos, incluso ya algunos hospitales reportan saturación. ¿Qué informe le dio al respecto?",0.32823650481604266,45,30,11,2020
PREGUNTA,"Y se habla de que se puede pasar a semáforo rojo. ¿Se habló durante esta reunión?, ¿se hizo un apartado para hablar sobre esta posibilidad?, ¿se sugirió?",0.32823650481604266,27,30,11,2020
PREGUNTA, Entonces ¿queda descartado el semáforo rojo?,0.32823650481604266,6,30,11,2020
PREGUNTA," Presidente, aprovechando que está el procurador, si nada más nos puede comentar en qué terminaron estas negociaciones para un eventual precio en el incremento del kilo de tortillas, si nos puede comentar.",0.32823650481604266,32,30,11,2020
PREGUNTA, Gracias.,0.32823650481604266,1,30,11,2020
PREGUNTA, ¿Cuántos invitados vendrán?,0.32823650481604266,3,30,11,2020
PREGUNTA, ¿Empresarios?,0.32823650481604266,1,30,11,2020
