Participante,Texto,Sentimiento,Palabras,Dia,Mes,Anio
PREGUNTA," Por segunda ocasión, el Tianguis del Bienestar inició su recorrido por el estado de Guerrero, donde visitará seis municipios de la zona de La Montaña a fin de llevar artículos nuevos de primera necesidad a la población más vulnerable.",0.0,39,27,06,2023
PREGUNTA,"Arrancó en Alpoyeca y Xochihuehuetlán para continuar en Iliatenco, Huamuxtitlán, Tlapa de Comonfort y Chilapa de Álvarez para entregar a más 66 mil habitantes bienes que fueron incautados o decomisados en las aduanas; entre ellos, ropa, calzado, telas, utensilios, herramientas y juguetes que se encontraban almacenados en bodegas. Tan sólo este lunes distribuyó 57 mil 768 bienes de forma totalmente gratuita a tres mil 941 familias.",0.0,66,27,06,2023
PREGUNTA,"Desde que se puso en marcha en agosto de 2021, el Tianguis del Bienestar ha entregado más de ocho millones 586 mil artículos a 335 mil 411 familias de Oaxaca, Guerrero, Chiapas y Veracruz para cumplir con la encomienda presidencial de devolver al pueblo lo que por derecho le corresponde.",0.0,50,27,06,2023
PREGUNTA,"En este esfuerzo participan la Secretaría de Seguridad y Protección Ciudadana, la Secretaría de la Defensa Nacional, la Guardia Nacional, la Secretaría de la Función Pública, además de la Secretaría de Hacienda y Crédito Público, a través del Instituto para Devolverle al Pueblo lo Robado, el Servicio de Administración Tributaria y la Agencia Nacional de Aduanas de México, así como autoridades estatales y municipales.",0.0,64,27,06,2023
PREGUNTA,"Por el bien de todos, primero los pobres.",0.0,8,27,06,2023
PREGUNTA," Buenos días, presidente.",0.0,3,27,06,2023
PREGUNTA,"José Manuel Fuente, de Capital 21.",0.0,6,27,06,2023
PREGUNTA,"Me gustaría preguntarle sobre el tema de tala de árboles, ya que ha causado mucha polémica en varias partes del país. Existen varias denuncias por tala ilegal en la zona del Ajusco, en San Miguel Topilejo, en Tlalpan, que han derivado en recientes bloqueos en la carretera de México-Cuernavaca.",0.0,49,27,06,2023
PREGUNTA,"Autoridades federales y locales han detenido apenas a tres personas y han abierto cuatro carpetas de investigación al respecto, pero a veces nada más queda aquí en el papel de que los van a detener o que van a actuar, pero los talamontes siguen ahí, están muy empoderados en las zonas. Aunque se les clausure un aserradero, tienen muchos más. Ese ese un gran problema. Además, empresas inmobiliarias asedian esos territorios para construir residencias.",0.0,74,27,06,2023
PREGUNTA,"La pregunta sería, presidente: ¿usted considera necesario decretar toda esa zona como federal de seguridad nacional para cuidar el ecosistema?, porque muchas veces ahí tenemos zonas ya protegidas, pero nada más quedan en el papel.",0.0,35,27,06,2023
PREGUNTA," Y, también, bueno, esto incluye las reservas de agua, ¿no?, que también hemos visto que varias empresas abusan de grandes cantidades de agua, presidente.",0.0,24,27,06,2023
PREGUNTA," Muchas gracias, presidente.",0.0,3,27,06,2023
PREGUNTA,"En otra pregunta, hemos visto que la oposición ha criticado el método de Morena para escoger a un coordinador en defensa de la Cuarta Transformación, pero es chistoso, porque ahora van a utilizar un método similar para también elegir a un coordinador para defender a México y también un bloque opositor en contra de su gobierno. ¿Qué opinión le merece, presidente?",0.0,61,27,06,2023
PREGUNTA, Gustavo de Hoyos.,0.0,3,27,06,2023
PREGUNTA, ¿Y ya va a decir (Inaudible)?,0.0,6,27,06,2023
PREGUNTA," Incluso, presidente, llama la atención que van a dar a conocer el resultado el 3 de septiembre, días antes de…",0.0,20,27,06,2023
PREGUNTA, ¿Quién? Díganos.,0.0,2,27,06,2023
PREGUNTA, ¿Hombre o mujer?,0.0,3,27,06,2023
PREGUNTA," Incluso, presidente, incluso, bueno, dentro de la oposición hay críticas. Por ejemplo, el senador Damián Zepeda ya criticó el método, pues dice prácticamente lo mismo, que va a escoger la oligarquía dentro del partido y que no se le está tomando en cuenta a la ciudadanía, presidente.",0.0,47,27,06,2023
PREGUNTA," Por último, presidente, aprovechando, me gustaría preguntarle sobre la decisión de la Comisión Reguladora de Energía de nombrar al gas natural como energía limpia. Creo que es fundamental preguntarle su opinión, porque varios portales de geoestrategia, de energía a nivel internacional dicen que el gas natural forma parte de transición energética. Entonces, me gustaría saber su opinión al respecto, presidente.",0.0,60,27,06,2023
PREGUNTA, Está en transición.,0.0,3,27,06,2023
PREGUNTA, Alemania.,0.0,1,27,06,2023
PREGUNTA, ¿Las 60 no producen?,0.0,4,27,06,2023
PREGUNTA, ¿Esas 20?,0.0,2,27,06,2023
PREGUNTA," ¿(inaudible) van a llegar a producir, presidente?",0.0,7,27,06,2023
PREGUNTA," Buenos días, presidente. No me levanto para no estorbar allá atrás. Soy Verónica Villalvazo, Frida Guerrera, columnista de diversos medios de comunicación desde hace 17 años. Y, bueno, gracias por la voz.",0.0,32,27,06,2023
PREGUNTA,"Y no había tenido oportunidad de agradecerle en frente de usted al almirante Ojeda por el apoyo que nos dio en aquel momento con las dos estudiantes, ahora ya graduadas, que venimos a presentarle aquí y no habíamos tenido la oportunidad de coincidir o de que me tocara poder hacerlo. Gracias, almirante; y gracias por su intervención, presidente.",0.0,58,27,06,2023
PREGUNTA,"Y, bueno, el 8 de marzo estuvimos por acá recordando el tema de Pedro Carrizales, ‘el Mijis’, y seguimos, presidente. Hasta ahorita no le han dado acceso, ni a los abogados de Miriam, ni a Miriam, a la carpeta de investigación.",0.0,41,27,06,2023
PREGUNTA,"En esa ocasión que nosotros acudimos el 8 de marzo a la mañanera el fiscal de Tamaulipas lanzó un comunicado desacreditando todo lo que venimos a comentar aquí, advirtiéndome que me va a denunciar porque hablé mal de él y dije mentiras sobre el señor; sin embargo, aquí seguimos y no vamos a parar hasta encontrar la verdad, hasta saber quién asesino a ‘Mijis’.",0.0,64,27,06,2023
PREGUNTA,"Y preguntar, presidente, si de alguna manera podemos o nos pueden apoyar para ver la renuencia que tiene la Fiscalía de Tamaulipas de poderle entregar las copias de la carpeta tanto a los abogados como a la esposa de ‘el Mijis’, si nos podrían decir con quién.",0.0,47,27,06,2023
PREGUNTA, ¿Que la solicitara la FGR?,0.0,5,27,06,2023
PREGUNTA," Gracias, secretaria.",0.0,2,27,06,2023
PREGUNTA,"Aprovechando que se paró —y perdón, presidente— en enero de este año una pequeña de 14 años fue asesinada en Jalisco. No voy a dar muchos detalles para no poner en riesgo lo que le voy a plantear, secretaria.",0.0,39,27,06,2023
PREGUNTA,"Hace tres meses, en marzo, llegó con nosotros su mamá de esta pequeñita y, bueno, afortunadamente se generó una orden de aprehensión prácticamente a las semanas; sin embargo, el sujeto se amparó contra esta orden de aprehensión.",0.0,37,27,06,2023
PREGUNTA,"Nosotros lo tenemos ubicado desde el 27 de marzo. Hemos solicitado el apoyo de las personas con las que usted nos hizo favor de enlazarlos, secretaria, y hasta el momento no hemos podido concretar esa detención. Sabemos dónde está, tenemos ubicado perfectamente al sujeto, pero nos decía… Hace unos días platiqué con Manuel y me decía: ‘Frida, es que es la fiscalía de Jalisco’.",0.0,64,27,06,2023
PREGUNTA,"Supuestamente la fiscalía comentaba o se amparaba en el amparo, valga la redundancia, que tenía este sujeto; sin embargo, ese amparo ya lo tiraron y ya se puede proceder sin ningún problema a la orden de aprehensión.",0.0,37,27,06,2023
PREGUNTA,"Nos preocupan los dichos que el sujeto ha publicado en sus redes sociales, donde argumenta y asegura que le pagó a la fiscalía 300 mil pesos para no ser detenido por este feminicidio.",0.0,33,27,06,2023
PREGUNTA," Gracias, secretaria.",0.0,2,27,06,2023
PREGUNTA,"Y, bueno, nada más para comentar, presidente, ojalá hubieran estado aquí también estos jueces del Segundo Tribunal de Alzada. También en marzo le presentamos el tema de la liberación de un feminicida en el Estado de México.",0.0,37,27,06,2023
PREGUNTA,"Y bueno, nosotros, o se procedió, por parte de las instituciones a poner, obviamente, un amparo. Se apeló esta situación y lamentablemente se confirma por parte de este Tribunal Segundo de Alzada en el Estado de México, en Tlalnepantla, la magistrada Elizabeth Rodríguez Cañedo, Felipe Landeros Herrera y Guillermo Peralta Ramírez, ratifican la liberación absoluta de este feminicida.",0.0,58,27,06,2023
PREGUNTA,"Y también nos parecen situaciones graves, porque al final con seguridad este sujeto, ojalá y nos equivoquemos, va a volver a lastimar a alguna otra mujer. Ojalá pudiéramos revisar. Estamos ahorita… Nuevamente se interpuso un amparo, pero, bueno, esperando que haya respuesta.",0.0,42,27,06,2023
PREGUNTA,"Y también Raúl Ayala Casillas, de la séptima sala, que fue quien liberó a Alejandro del Valle de la Vega. Afortunadamente también la fiscal Ernestina Godoy nos ha ayudado mucho con este tema. Se solicitó, se hizo una apelación a esta resolución de no vinculación a proceso y ya salió favorable para la víctima; sin embargo, ahorita está en revisión, obviamente lo solicitó la defensa. Pero, pues, también ojalá pudiéramos tener una plática para ver cómo podemos ayudar.",0.0,78,27,06,2023
PREGUNTA,"Cabe mencionar que hemos también hecho la solicitud a Estados Unidos para que la víctima de este sujeto, la madre de sus dos niños y los dos niños puedan ingresar a Estados Unidos para justamente evitar también la situación de guerra que se está viviendo. Y lamentablemente ella me acaba de avisar que le negaron ingresar a Estados Unidos.",0.0,59,27,06,2023
PREGUNTA,"Sabemos que la guerra continúa y pues ellos están en riesgo, ya tuvieron que vender, ella ya tuvo que vender varias de sus cosas para poder sacar adelante a sus pequeños hijos. Ojalá también nos puedan ayudar ahí. Finalmente, es una víctima de violencia intrafamiliar, una víctima de abuso sexual que fue cometido en México.",0.0,55,27,06,2023
PREGUNTA,"Y, presidente, ya terminar, quisiera aprovechar esta tribuna, que, como bien usted dice, se ve en todo el mundo. Fue localizado el 25 de enero de 2023 sepultado en un montón de basura, tierra, cascajo, muy cerca de las vías del tren, en un camino de terracería, en la colonia El Dorado, en Huehuetoca, Estado de México. El hallazgo causó conmoción aquel día. Ahí estaba prácticamente momificado, un pantaloncito color beige, con ribetes a cuadros color negro y rojo, sudadera blanca; sin embargo, no hubo seguimiento de medios más que el del hallazgo.",0.0,93,27,06,2023
PREGUNTA,"Nosotros encontramos la noticia en la documentación diaria que realizamos. De inmediato, solicité apoyo a la Fiscalía del Estado de México para conocer más datos sobre el pequeño y evitar que terminara en una fosa común, como hemos hecho junto a la fiscalía y la Comisión de Atención a Víctimas del estado.",0.0,52,27,06,2023
PREGUNTA,"La maestra Alicia Samanta García de inmediato habló con la persona indicada para hacerle saber que ese bebé iba a ser acompañado por nosotros, por lo que pedía hablara con servicios periciales porque realizaríamos el rostro. Nosotros tenemos una persona que nos ayuda a realizar los rostros de estos bebés, para no exponerlos, cómo fueron localizados.",0.0,56,27,06,2023
PREGUNTA,"Y que mantuvieran al pequeño sin inhumar porque nosotros lo íbamos a inhumar. Ignoramos qué pasó, fue hasta una reunión de seguimiento que llevamos a cabo con las autoridades cada dos meses que el Ministerio Público encargado de la carpeta nos comunicó que yo lo había inhumado, y sin perfil genético.",0.0,51,27,06,2023
PREGUNTA,La maestra de inmediato le hizo saber al servidor público que debía solicitar ante el juez la exhumación porque llevaríamos a inhumar al panteón donde tenemos a todos nuestros pequeños y que era gravísimo que se inhumara sin perfil genético.,0.0,40,27,06,2023
PREGUNTA,"El pasado 12 de junio de 2023 se llevó a cabo la exhumación en el panteón municipal de Huehuetoca a las 11:00 de la mañana, justo por eso no pude venir, que era el informe de hace 15 días.",0.0,39,27,06,2023
PREGUNTA,"Lo que vimos en esa diligencia nos hirió el corazón. En la zona de fosas comunes ahí estaba el encargado del panteón, parecía ser el único al que le dolía aquel ser. Marcó el pedazo de cemento que tenía encima lo siguiente ‘Nivel II, fosa 41, 15 de marzo, 2023. Bebé.",0.0,51,27,06,2023
PREGUNTA,"Un florero que fue colocado por el encargado con tres flores rosas. ‘Era un inocente, aquí hay muchos adultos que únicamente ellos saben qué pasó, pero el bebé, él no debió morir así’, me comentó el encargado del panteón.",0.0,39,27,06,2023
PREGUNTA,"Levantaron aquel pedazo de cemento y 40 centímetros de tierra cubrían el cuerpecito. De pronto apareció una bolsa rosa de un tamaño muy pequeño para los datos que teníamos del bebé. Alarmada, le dije el ministerio público que estaba muy pequeño; él todavía dudó, comentándole a los peritos que revisaran que fuera su caso. Sí, era el número de carpeta.",0.0,60,27,06,2023
PREGUNTA,"Cuando abrieron la bolsa para que la perita fotografiara el cuerpo, horrorizados observamos por qué se veía tan pequeño, literalmente el bebé estaba doblado como si fuera un pedazo de papel; por eso estaba compacto y eso nos mostró que aquella persona que tuvo a cargo en servicios periciales a ese pequeñito, lo que menos le importó fue darle dignidad en su muerte.",0.0,63,27,06,2023
PREGUNTA,"Cerré los ojos imaginando ese momento en que decidió alguien doblar el cuerpo del pequeño como si no valiera nada, decidir inhumarlo sin perfil genético como si jamás esperara que alguien lo reclamase.",0.0,33,27,06,2023
PREGUNTA,"Me llené de impotencia, de dolor.",0.0,6,27,06,2023
PREGUNTA,"Un pequeño que fue desechado en aquel montículo de tierra y cascajo, suponemos por quienes debían cuidarlo. La causa de muerte: traumatismo craneoencefálico.",0.0,23,27,06,2023
PREGUNTA,"Un pequeño que fue revictimizado por servicios periciales al que nuevamente desecharon como si fuera basura dentro de una bolsa, sin una cajita que lo protegiera y sin lo único que podría ayudar a identificarlo en caso de que alguien lo extrañe: su perfil genético.",0.0,45,27,06,2023
PREGUNTA,"Como si quisieran borrarlo, arrojarlo ahí para que terminara de desaparecer, como era la intención de quienes los sepultaron la primera vez.",0.0,22,27,06,2023
PREGUNTA,"El 13 de junio acudimos al panteón Heriberto Enríquez en Toluca, donde también ha habido sido inhumana nuestra pequeña Florecita, quien fue encontrada sin vida dentro de una caja el 28 de octubre del 2022, muy cerca de la Terminal de Toluca.",0.0,42,27,06,2023
PREGUNTA,"La fiscalía regional, que en un primer momento tenía a cargo la investigación, decidió inhumarla, por fortuna no bajo la misma insensibilidad que en Huehuetoca. Ese mismo día 13 llevaríamos a cabo la inhumación de Florecita, nene de Huehuetoca que era nuestro bebé, al que encontramos así, y al que bautizamos como Ángel, nene de Texcoco al que bautizamos como Miguel; sin embargo, no fue posible inhumar a Ángel, al no contar aún con su perfil genético.",0.0,77,27,06,2023
PREGUNTA,"Hoy tenemos ocho bebes inhumados en el Parque Memorial de Gayosso, solamente dos de ellos identificados y con sentencia a sus asesinos, Lupita ‘calcetitas rojas’, y César Emiliano. Este panteón se ha convertido en una especie de santuario para ellos gracias al esfuerzo de la comisión y de la fiscalía, y obviamente de nuestra labor de no dejar a estos bebes solos.",0.0,62,27,06,2023
PREGUNTA,"Nos falta mucho para evitar que nuestros niños nos sigan siendo arrebatados de formas crueles. Admiramos y aplaudimos a quienes sin importarles nada más que el bienestar de nuestros niños ayuda a salvarlos como ocurrió en Centro, Tabasco, en días pasados cuando vecinos de Ian, de cuatro años, lo rescataron. El pequeño era constantemente violentado por su padrastro y su madre, en aquel momento había sido encadenado dentro de su casa.",0.0,71,27,06,2023
PREGUNTA,"Los vecinos, luego de pedir el apoyo a las autoridades y estas al negárselo, optaron por abrir la casa liberando al inocente, quien ya se encuentra bajo resguardo de las autoridades estatales; sin embargo, el padrastro y la madre siguen prófugos.",0.0,41,27,06,2023
PREGUNTA,"Así es como cada uno de nosotros debemos actuar para evitar que nos sigan tirando en calles, barrancos, canales a nuestros pequeños. Obviamente por el maltrato que recibió Ángel, interpondremos la denuncia correspondiente, ya se interpuso.",0.0,36,27,06,2023
PREGUNTA,"Presidente, y bueno, ya para terminar, ella es Estrella, fue localizada el 28 de junio del 2020 debajo de un puente en los límites del Estado de México y la Ciudad de México. No hemos logrado dar con su identidad y con su familia, Estrella, la beba de Aragón.",0.0,49,27,06,2023
PREGUNTA,"Ella es Love, fue localizada entre Querétaro y el Estado de México el 27 de octubre, perdón, el 27 de noviembre del 2021; también, hasta la fecha no hemos logrado dar con la identidad de la pequeña, ni con su familia, obviamente, sus asesinos.",0.0,44,27,06,2023
PREGUNTA,"Ella es Florecita, la pequeña que fue localizada el 28 de octubre del 2021, perdón, 22, en Toluca, en el Estado de México; tampoco hemos logrado dar con quien la dejó en una caja, muy cerca de la terminal de Toluca.",0.0,41,27,06,2023
PREGUNTA,"Él es Ángel, el pequeño que fue inhumado sin perfil genético y al que fuimos a rescatar de esa fosa común. Pedimos también en este caso la intervención del enlace que tenemos con la gente de la secretaria. Nos dijeron que el primer paso era solicitar el apoyo del Insifo; sin embargo, si no logramos que nos den también ese perfil, ojalá podamos contar con su apoyo, secretaria, para, pues no sé si por medio de la Fiscalía General de la República o de la Guardia pudiéramos lograr dar con el perfil genético de este pequeñito.",0.0,96,27,06,2023
PREGUNTA,"Y, finalmente, él es Miguel, fue localizado el 7 de febrero de este año en Texcoco, le pusimos Miguel porque necesitamos darles una identidad.",0.0,24,27,06,2023
PREGUNTA,"Y, bueno, este pequeñito también ya es mayor, tiene aproximadamente cinco años; también estamos solicitando el apoyo de todos para que nos ayuden a dar con la identidad de todos estos pequeñitos y con sus familias y asesinos.",0.0,38,27,06,2023
PREGUNTA,"Y para terminar, presidente, él es Gabriel, fue asesinado por dos perros pitbull en días pasados en Chihuahua y todos los días por medio de nuestras redes sociales solicitamos información a la Fiscalía de Chihuahua, ojalá nos pudieran ayudar para saber. Los padres de este pequeño fueron los que hicieron esta imagen, quienes empezaron a solicitar auxilio para que se haga justicia, ya que esos perros habían sido ya denunciados por los vecinos de esta comunidad; sin embargo, no se había, ni se hizo nada, asesinaron el pequeño Gabriel cuando estaba jugando, él tenía cuatro años. Y hasta la fecha sigue en libertad la dueña de los perros y los perros también. Ojalá nos pueda ayudar, presidente, con esto.",0.0,119,27,06,2023
PREGUNTA,"Agradezco mucho la atención y estamos en contacto para los temas pendientes. Muchas gracias, presidente.",0.0,15,27,06,2023
PREGUNTA," Gracias. Presidente, buen día.",0.0,4,27,06,2023
PREGUNTA,"Luis Valdés, del diario 24 Horas.",0.0,6,27,06,2023
PREGUNTA,"Tengo algunas preguntas. Primero, retomando un poco el tema del método de elección de la oposición, días antes el bloque denunciaba que el proceso de Morena sería ilegal y ahora que han emprendido algo similar. ¿Contempla la posibilidad de que el INE considere que ambos procedimientos violen la ley? Y de ser así ¿qué haría el movimiento al respecto?",0.0,59,27,06,2023
PREGUNTA, ¿Cuándo la envía?,0.0,3,27,06,2023
PREGUNTA, (inaudible),0.0,1,27,06,2023
PREGUNTA, ¿Les va a solicitar que se los bajen?,0.0,8,27,06,2023
PREGUNTA, ¿Bajo qué figura se hace la…?,0.0,6,27,06,2023
PREGUNTA, ¿En el transcurso de la mañana lo van a hacer?,0.0,10,27,06,2023
PREGUNTA, ¿Lo informaría este 1º de julio?,0.0,6,27,06,2023
PREGUNTA, ¿Y cuándo le respondan?,0.0,4,27,06,2023
PREGUNTA," ¿Pero podría tener alguna consecuencia, presidente, en los hechos o sólo es para que les informen…?",0.0,16,27,06,2023
PREGUNTA, ¿El escrito sería a la corte o a la presidenta de la corte?,0.0,13,27,06,2023
PREGUNTA," En materia electoral, a partir de estas facultades que tiene la Segob, ¿se podría hacer un (inaudible) para que el Tribunal Electoral o el INE dijera si se incurre o no en alguna falta?",0.0,34,27,06,2023
PREGUNTA," Porque el proceso electoral formalmente empieza hasta septiembre, y esto no está regulado.",0.0,13,27,06,2023
PREGUNTA, (Inaudible) con la presidenta de la corte.,0.0,7,27,06,2023
PREGUNTA," Entonces, ¿descarta sanciones del INE al bloque conservador, a Morena?",0.0,10,27,06,2023
PREGUNTA, (inaudible) los tiempos reales.,0.0,4,27,06,2023
