Participante,Texto,Sentimiento,Palabras,Dia,Mes,Anio
PREGUNTA,"Quieren, por lo pronto, que nos paguen las pensiones que ya deberían estar corriendo, y mientras ellos están dispuestos a negociar que se llegue a un acuerdo sobre las pensiones caídas, por decirlo así, de todo lo que no se les ha pagado desde los 90.",0.0,46,20,05,2021
PREGUNTA,"Entonces, si usted…",0.0,3,20,05,2021
PREGUNTA," No, pues ya los deben de estar escuchando, usted dígale a este señor.",0.0,13,20,05,2021
PREGUNTA, Muy bien presidente. Pues muchas gracias.,0.0,6,20,05,2021
PREGUNTA," Por respeto a su audiencia y a los funcionarios, si me permite, mañana, por favor, presidente.",0.0,16,20,05,2021
