Participante,Texto,Sentimiento,Palabras,Dia,Mes,Anio
PRESIDENTE ANDRES MANUEL LOPEZ OBRADOR, Buenos días.,0.0,2,22,02,2021
PRESIDENTE ANDRES MANUEL LOPEZ OBRADOR,"El día de hoy vamos a informar sobre los programas sociales, los apoyos que se entregan de manera directa a la población. Como es sabido, estamos destinando el presupuesto a apoyar al pueblo y lo estamos haciendo así, de manera directa, sin intermediarios, para que la gente reciba lo que por justicia le corresponde, completo, porque anteriormente, además de que era poco lo se le destinaba al pueblo, no llegaba completo o no llegaba, se quedaba en el camino; ahora todo es personalizado, hay una dispersión de recursos directo a los beneficiarios en todos los programas, y vamos a informar de esa dispersión de recursos en este trimestre.",0.0,108,22,02,2021
PRESIDENTE ANDRES MANUEL LOPEZ OBRADOR,"Porque nos ha funcionado el apoyar abajo. Con la pandemia hemos logrado fortalecer la economía popular y hemos evitado que haya crisis de consumo, y la gente abajo de la pirámide, de la base, la mayoría de la gente, los más pobres, no han tenido problemas para conseguir sus alimentos y el consumo básico, eso ha quedado de manifiesto.",0.0,59,22,02,2021
PRESIDENTE ANDRES MANUEL LOPEZ OBRADOR,"Es una estrategia completamente distinta a la que se aplicaba durante el periodo neoliberal, que se presentaba una crisis y pedían crédito, endeudaban al país para rescatar a los de arriba, a los de la punta de la pirámide, de la cúpula, a costa de abandonar a los de abajo y de cargarles la deuda a los de abajo, como fue lo del Fobaproa. Se cayó la economía, pero, en vez de atender al pueblo, de rescatar al pueblo, rescataron a banqueros y a grandes empresarios, y todavía convirtieron esas deudas privadas en deuda pública y estamos todavía pagando por esa enorme deuda.",0.0,103,22,02,2021
PRESIDENTE ANDRES MANUEL LOPEZ OBRADOR,"Ahora se presenta una crisis precipitada por la pandemia y, en vez de seguir con lo mismo, porque hasta me lo planteaban los tecnócratas, sus voceros y desde luego representantes de las corporaciones empresariales y financieras que solicitáramos deuda, dijimos: No, vamos a ahorrar, a seguir combatiendo la corrupción, a que no hay lujos en el gobierno y lo que se reúna vamos a destinarlo abajo para que no tengamos crisis de consumo, crisis de bienestar social.",0.0,77,22,02,2021
PRESIDENTE ANDRES MANUEL LOPEZ OBRADOR,"Hemos podido salir adelante con esta estrategia. Hay países, no quiero presumir, pero hay países que se endeudaron con motivo de la pandemia, que les creció, aumentó la deuda muchísimo, no resolvieron el problema social y no están creciendo; nosotros no contratamos deuda adicional, no tuvimos crisis por falta de recursos para la gente más necesitada, no hubo asaltos, saqueos de comercio, no faltaron los alimentos.",0.0,66,22,02,2021
PRESIDENTE ANDRES MANUEL LOPEZ OBRADOR,"El sector agropecuario, el que produce los alimentos, creció en un dos por ciento y vamos a seguir creciendo, ya nos estamos recuperando. En enero recuperamos como 70 mil empleos, en lo que va de febrero ya llevamos como 110 mil nuevos empleos y calculamos que va a crecer la economía este año alrededor del cinco por ciento. Entonces, sí nos funcionó la estrategia, no van a tener ese crecimiento en otros países y quedaron endeudados.",0.0,76,22,02,2021
PRESIDENTE ANDRES MANUEL LOPEZ OBRADOR,"Nuestra economía está sana y ahora en este trimestre vamos a lo mismo, vamos a destinar en tres meses alrededor de 200 mil millones de pesos, abajo, que es lo que les vamos a informar ahora, porque se van a adelantar recursos, porque además vienen las elecciones y no podemos entregar apoyos en la veda electoral. Entonces, en estos meses, hasta que se pueda, vamos a dispersar alrededor de 200 mil millones.",0.0,72,22,02,2021
PRESIDENTE ANDRES MANUEL LOPEZ OBRADOR,"Y calculamos -porque eso es lo otro que es muy importante- que van a llegar al país otros 200 mil millones de pesos de remesas y eso también va abajo. Ya lo hemos dicho, se benefician 10 millones de familias que reciben en promedio 350 dólares de lo que mandan nuestros hermanos migrantes, paisanos, que les agradecemos mucho. Entonces, todo eso va abajo.",0.0,63,22,02,2021
PRESIDENTE ANDRES MANUEL LOPEZ OBRADOR,"Entonces, 200 de Programas de Bienestar directos y 200 de remesas, es una muy inversión para apoyar la economía popular y seguir creciendo, y ya doy a conocer mi pronóstico: este año, crecimiento de cinco por ciento.",0.0,37,22,02,2021
PRESIDENTE ANDRES MANUEL LOPEZ OBRADOR,"También, antes de eso, como lo hacemos todos los lunes, se va a informar sobre quién es quién en los precios de los combustibles, se va a informar cómo van las obras que se están construyendo, se va a informar que están llegando las vacunas, que eso es también muy importante.",0.0,51,22,02,2021
PRESIDENTE ANDRES MANUEL LOPEZ OBRADOR,"Quiero dar la bienvenida al presidente de Argentina, Alberto Fernández, que llegó hoy muy temprano. Es nuestro invitado especial para la ceremonia de conmemoración de los 200 años de la proclamación del Plan de Iguala.",0.0,35,22,02,2021
PRESIDENTE ANDRES MANUEL LOPEZ OBRADOR,"Nos va a acompañar en Iguala en miércoles, pero también va estar con nosotros mañana, lo invité y aceptó estar en esta conferencia, nos va a acompañar en la mañanera de mañana, la mañanera que hacemos todos los días, va a estar el presidente de Argentina con nosotros.",0.0,48,22,02,2021
PRESIDENTE ANDRES MANUEL LOPEZ OBRADOR,"Mañana formalmente se le da la recepción. Hoy va a tener actividades, va a ir a un laboratorio en donde se están envasando las vacunas AstraZeneca, es un laboratorio que tiene relación con Argentina.",0.0,34,22,02,2021
PRESIDENTE ANDRES MANUEL LOPEZ OBRADOR,"Es un acuerdo que se logró con la Universidad de Oxford, con empresas farmacéuticas, también con fundaciones, como la de Carlos Slim, el gobierno de Argentina, también nosotros participamos y él va a ir a visitar este laboratorio donde están envasando las vacunas AstraZeneca.",0.0,44,22,02,2021
PRESIDENTE ANDRES MANUEL LOPEZ OBRADOR,"Termino, antes de darle la palabra a Ricardo Sheffield y de continuar con la información, termino expresando nuestra tristeza por el fallecimiento del senador Radamés Salazar Solorio, senador por Morelos, un compañero de lucha de tiempo atrás; además, de familia de luchadores sociales, familiar del maestro Othón Salazar. Entonces, nos duele mucho la pérdida de Radamés y envío un abrazo a todos sus familiares.",0.0,64,22,02,2021
PRESIDENTE ANDRES MANUEL LOPEZ OBRADOR,"Lo mismo a los familiares de oficiales, de soldados, de médicos que perdieron la vida, personal de salud en el desplome de un avión de la Fuerza Aérea ayer en Veracruz.",0.0,31,22,02,2021
PRESIDENTE ANDRES MANUEL LOPEZ OBRADOR,"Recuerdo aquí sus nombres: Adolfo Rivas Miranda, capitán piloto aviador, originario de la Ciudad de México; Germán Aboyte Flores, teniente piloto aviador, originario de Celaya, Guanajuato; Gumaro Acosta Peña, médico militar, mayor, también originario de la Ciudad de México; Gustavo Rosas Valle, Altotonga, Veracruz, de ahí es originario Gustavo Rosas Valle, también capitán de Sanidad; Armando Yobari Rodríguez Alfaro de Ameca, Jalisco, teniente de infantería.",0.0,65,22,02,2021
PRESIDENTE ANDRES MANUEL LOPEZ OBRADOR,Nuestro abrazo con todo nuestro afecto a sus familiares.,0.0,9,22,02,2021
PRESIDENTE ANDRES MANUEL LOPEZ OBRADOR,"Vamos a escuchar a Ricardo Sheffield, como siempre, terminamos con lo que se informa el lunes, el quién es quién en los precios de energéticos, luego los videos y posteriormente los secretarios y responsables de los programas de bienestar van a informarles.",0.0,42,22,02,2021
RICARDO SHEFFIELD PADILLA," Muy buenos días, señor presidente; muy buenos días a todas y a todos ustedes.",0.0,14,22,02,2021
RICARDO SHEFFIELD PADILLA,"La gasolina regular la encontramos con el precio más alto y el margen más alto en Combustibles BP, en Iztapalapa, en la Ciudad de México, 22 pesos 42 centavos por litro con un margen de tres pesos 65 centavos, margen bastante alto si lo comparamos con la más económica que está en Centro Tabasco, de franquicia Pemex, 18 pesos 46 centavos por litro con un margen de 16 centavos en la gasolina regular.",0.0,73,22,02,2021
RICARDO SHEFFIELD PADILLA,"En la Premium, en la gasolina Premium Combustibles BP otra vez tiene el precio más alto y también en Iztapalapa, Ciudad de México, se pasan de rosca en Iztapalapa, 23 pesos 79 centavos por litro, cuatro pesos 66 centavos de margen, seguro que no le pierden estos señores; Pemex tiene, en cambio, la gasolina Premium en Medellín de Bravo, Veracruz, a 18 pesos 55 centavos por litro, con un margen de 15 centavos.",0.0,73,22,02,2021
RICARDO SHEFFIELD PADILLA,"Para el diésel, Combustibles BP en Servicios Especiales, en Escárcega, Campeche, lo tiene a 22 pesos 62 centavos por litro, con un margen de tres pesos 12 centavos; mientras que con un margen de 17 centavos franquicia Pemex en Tuxtla Gutiérrez, Chiapas, tiene a 28 pesos 38 centavos el litro.",0.0,50,22,02,2021
RICARDO SHEFFIELD PADILLA,"En esta semana que cerró, si lo vemos por marcas, las tres marcas que tuvieron el promedio de precios más altos fue Redco, Chevron y CorpoGas, mientras que las más económicas y se han mantenido así todo este año, G500, Exxon Mobil y Orsan.",0.0,44,22,02,2021
RICARDO SHEFFIELD PADILLA,"Haciendo un corte el 19 de febrero, el precio de la mezcla mexicana de petróleo, 59 pesos con 40 centavos, bastante alto, hace un año estaba en 45 dólares 44 centavos, ahora 59 dólares 40 centavos; en consecuencia, ese mismo día, febrero 19 el diésel 20.81, la Premium 20.58 y la regular en promedio 20 pesos con cuatro centavos.",0.0,59,22,02,2021
RICARDO SHEFFIELD PADILLA,"Ya saben ustedes, la regular tiene incentivo ya desde hace dos semanas, es la tercera semana, y ahora también afortunadamente el diésel tiene ya incentivo en esta semana, lo cual es muy importante, porque el diésel impacta directamente al precio de la canasta básica y esto ayuda, este incentivo, al diésel, con el aumento que se ha tenido al petróleo a nivel internacional.",0.0,63,22,02,2021
RICARDO SHEFFIELD PADILLA,"Hemos atendido a través de la app de litro por litro, que los invitamos a seguirla descargando de manera gratuita en ambos sistemas iOS y Android, recibimos 323 denuncias, las atendimos a través de 159 verificaciones o visitas.",0.0,38,22,02,2021
RICARDO SHEFFIELD PADILLA,"Lamentablemente tres gasolineras no se dejaron verificar y dos no se dejaron colocar los sellos, para que lo tomen muy en cuenta los consumidores porque ahí hay serias irregularidades, no hay litros de litro y hay que cuidarse de eso.",0.0,40,22,02,2021
RICARDO SHEFFIELD PADILLA,"Servicios Paraíso en Xalapa, Veracruz, en avenida Manuel Ávila Camacho, sin número, fue de los que no permitieron poner los sellos; igual que una gasolinera en San Luis Potosí, San Luis Potosí, Súper Servicio Abastos, precisamente en la Central de Abastos Abarrotes 210, es el domicilio de gasolinera, estas no están dando litros completos y no permitieron terminar el procedimiento y colocar los ellos de inmovilización, pero ya los estaremos visitando junto con la Asea, la CRE y la Guardia Nacional.",0.0,81,22,02,2021
RICARDO SHEFFIELD PADILLA,"Abel Clemencio Pérez Montes en Colón, Querétaro, no se dejó verificar; Servicio Reynoso Madrigal en Zacoalco de Torres, Jalisco, tampoco se dejó verificar; Servicios Las Palmitas también en Zacoalco de Torres Jalisco no se dejaron verificar para que los consumidores eviten ir a esos lugares porque no hay la confianza de que estén operando conforme lo marcan las normas y las leyes de nuestro país.",0.0,65,22,02,2021
RICARDO SHEFFIELD PADILLA,"Tomando en cuenta la app, que no tomen referencia al margen, sino solamente el precio final al público, la más barata, Mobil, en San Mateo Atenco, 18 pesos con 17 centavos para la gasolina regular y 18.56 Mobil en Morelia, Michoacán. Muy bien por Mobil.",0.0,45,22,02,2021
RICARDO SHEFFIELD PADILLA,"Más cara 23 pesos 29 centavos BP en Iztapalapa en la Ciudad de México y 22 pesos con 24 centavos de Pemex en Apaxtla, Guerrero.",0.0,25,22,02,2021
RICARDO SHEFFIELD PADILLA,"Si vemos ahora la gasolina Premium, la más barata, 18.69 de franquicia Pemex en Medellín de Bravo, Veracruz; y de Repsol, 18.89, en Veracruz, Veracruz, las más caras; 24.69 de BP en Iztapalapa Ciudad de México; y 23 pesos con 39 centavos de Shell en Naucalpan, Estado de México.",0.0,49,22,02,2021
RICARDO SHEFFIELD PADILLA,"Finalmente, para el diésel, la más barata 18.99 de Valero en Apaseo el Alto Guanajuato y 19.25 de Mobil en Ocoyucan, Puebla.",0.0,22,22,02,2021
RICARDO SHEFFIELD PADILLA,"Las más caras 23.88 de Pemex en Toluca en el Estado de México y de G-500 23 pesos con 17 centavos en Múgica, Michoacán.",0.0,24,22,02,2021
RICARDO SHEFFIELD PADILLA,"Como ven, de todas las marcas puede haber quien dé muy barato y quien dé caro, por eso hagamos apoyo con la app de Litro por litro.",0.0,27,22,02,2021
RICARDO SHEFFIELD PADILLA,"En el gas LP, quién es el quién es el gas LP, para tanques estacionarios el precio más alto, 13 pesos con 75 centavos por litro en Pitiquito, Sonora, con un margen nada más de seis pesos con seis centavos; comparado con Gas Campanita, que ha salido varias veces, simpático el nombre de esta empresa, en Cañitas de Felipe Pescador, en Zacatecas, con un precio al público de 10 pesos 94 centavos por litro, un margen de un peso 42 centavos.",0.0,81,22,02,2021
RICARDO SHEFFIELD PADILLA,"Y ahora para cilindros de gas tenemos el precio más alto en Gas Continental del Pacífico en Magdalena, Sonora, un precio al público de 25 pesos 46 centavos con un margen de nueve pesos 31 centavos por kilo; y Combugas en Huejúcar, Jalisco, a 19 pesos con 52 centavos por kilo, es el precio más bajo, con el margen más bajo de dos pesos con siete centavos.",0.0,67,22,02,2021
RICARDO SHEFFIELD PADILLA,"Y tenemos una ligera baja en los precios promedio del Gas LP, es una buena noticia, el 3 de febrero estaba en 22 pesos 29 centavos y ahora en 22 pesos 22 centavos para cilindros; mientras que en estacionarios el promedio en el país era de 11 pesos 92 centavos y esta semana que cerró el promedio fue de 11 pesos 88 centavos, y esos centavos van ayudando a la economía de todas las familias y del país en general.",0.0,80,22,02,2021
RICARDO SHEFFIELD PADILLA,"Realizamos 82 visitas de verificación, en las cuales nueve por ciento resultó con infracción, que fueron siete, una no se dejó verificar, un tres por ciento de cilindros que encontramos en mal estado.",0.0,33,22,02,2021
RICARDO SHEFFIELD PADILLA,Buen día.,0.0,2,22,02,2021
PRESIDENTE ANDRES MANUEL LOPEZ OBRADOR, Vamos a los videos.,0.0,4,22,02,2021
PREGUNTA, La Secretaría de la Defensa Nacional informa los avances en la construcción del Aeropuerto Internacional ‘Felipe Ángeles’ al 22 de febrero de 2021.,0.0,23,22,02,2021
PREGUNTA,"En la pista norte y central, plataformas y rodajes se realizan los trabajos de conformación de terraplén, tendido de las capas de base hidráulica, de concreto magro y de alta resistencia como superficie de rodamiento, así como la instalación del cableado eléctrico y colocación de bases para los sistemas de luces.",0.0,51,22,02,2021
PREGUNTA,"En la terminal de pasajeros se continúa con la instalación de la pantalla modular tipo led y mostrador de abordaje, fabricación de la escalera panorámica y colocación de jardinería en la sala de última espera.",0.0,35,22,02,2021
PREGUNTA,"En el eje troncal de circulación y obras complementarías se ejecuta el acabado final de las losas del viaducto elevado, colocación de postes de alumbrado y parapetos metálicos, y la instalación de tuberías para redes eléctricas, hidráulicas y sanitarias.",0.0,39,22,02,2021
PREGUNTA,En la vialidad y barda perimetral se trabaja en la construcción de la barda prefabricada de concreto armado y colocación de la reja con picos de seguridad.,0.0,27,22,02,2021
PREGUNTA,"En la interconexión vial, tramo caseta Tultepec-Santa Lucía, se lleva a cabo la construcción con concreto hidráulico, así como la realización de los cortes de control para evitar fisuras sobre la última capa de rodamiento.",0.0,35,22,02,2021
PREGUNTA,"A la fecha se han generado 76 mil 991 empleos civiles, faltan 392 días de construcción.",0.0,16,22,02,2021
PREGUNTA, Gobierno de México.,0.0,3,22,02,2021
PREGUNTA, Avance en la construcción de la refinería de Dos Bocas.,0.0,10,22,02,2021
ROCIO NAHLE GARCIA," Desde el área de almacenamiento va el reporte, 19 de febrero.",0.0,11,22,02,2021
PREGUNTA," Se continúa con la recepción de muñones y placas de Ecuador de los tanques esféricos correspondientes al área de almacenamiento, de igual manera se realizan trabajos de doble turno en la obra mecánica en la colocación de placas de acero en los anillos de 32 tanques verticales.",0.0,47,22,02,2021
PREGUNTA,"Como parte de la construcción superficial, se han seguido aperturando trabajos de descabece y cimentaciones superficiales en varios tramos del rack principal de tuberías en la planta química de desintegración catalítica y se trabaja en la construcción de las cimentaciones de las torres de enfriamiento CT-203 y CT-205 respectivamente.",0.0,49,22,02,2021
PREGUNTA,"También se trabaja en las cimentaciones y muros de las subestaciones eléctricas de las plantas coquizadora y combinada, y en la construcción de los tanques de la planta de tratamientos de aguas amargas.",0.0,33,22,02,2021
PREGUNTA,En el área de edificios se realizó el colado del último piso del cuarto de control y se continúa con el vaciado de concretos en columnas y muros perimetrales en el edificio que será el cerebro operativo de la refinería.,0.0,40,22,02,2021
PREGUNTA,"Respecto al complejo de los cuatro edificios administrativos, se ha concluido la estructura civil primaria y se trabaja en los soportes que recibirán los vidrios especiales.",0.0,26,22,02,2021
PREGUNTA,"El laboratorio está divido en cuatro secciones para el análisis químico, de ensayo y calibración en las pruebas químicas de análisis de los productos de petróleo y agua residual para el control de calidad.",0.0,34,22,02,2021
PREGUNTA,"Se realiza el trazo, nivelación y excavación para el desplante de losa de cimentación y en los edificios contra incendio y telecomunicaciones se realiza el armado de acero y vaciado de concreto en columnas.",0.0,34,22,02,2021
PREGUNTA,En el paquete de integración se llevó a cabo la descarga de maquinaria y acondicionamiento de área de almacenamiento de tubería del tramo 3 del gasoducto que irá del complejo de Cactus a la refinería de Dos Bocas.,0.0,38,22,02,2021
PREGUNTA,También continúa de manera simultánea la construcción del área de captación y bombeo del acueducto.,0.0,15,22,02,2021
PREGUNTA,Se inició la construcción del enrejado y barda perimetral en las áreas que conforman la refinería.,0.0,16,22,02,2021
PREGUNTA,Y en materia de sustentabilidad continúa el cultivo de plantas de ornato en el vivero.,0.0,15,22,02,2021
PREGUNTA, Gobierno de México.,0.0,3,22,02,2021
PREGUNTA," Tren Maya, reporte de avances, semana 27 de 157.",0.0,9,22,02,2021
PREGUNTA,"En el tramo 1, avanzan los trabajos de terracería, formación de terraplén, desmonte, acostillamiento de tuberías y las labores de rescate de flora y fauna.",0.0,25,22,02,2021
PREGUNTA,"En el tramo 2, continuamos el desmontaje de la vía antigua, la formación de pedraplén y terraplén, así como la fabricación de durmientes.",0.0,23,22,02,2021
PREGUNTA,"En el tramo 3, proseguimos con la excavación de material rocoso, la construcción de pasos vehiculares y finalizamos las obras de drenaje transversal en distintos subtramos.",0.0,26,22,02,2021
PREGUNTA,"En el tramo 4, realizamos trabajos se subrasante y subyacente, actividades de terracería y avanzamos en la demolición de carpeta asfáltica.",0.0,21,22,02,2021
PREGUNTA,"En el tramo 4, que va de Izamal a Cancún, se llevan a cabo labores para la ampliación de la autopista, preparamos la instalación de cuatro plantas de prefabricados para la fabricación de 560 trabes de puente y 216 kilómetros de barrera central, y están en proceso de montaje dos patios de prefabricados.",0.0,53,22,02,2021
PREGUNTA,"En cuanto a la producción de materiales, trabajan cuatro trenes de trituración para obtener agregados pétreos que conformarán las distintas capas de pavimentos y concretos.",0.0,25,22,02,2021
PREGUNTA,"Los empleos totales generados por el Tren Maya en sus cuatro tramos constructivos ascienden a 36 mil 859, de los cuales un 70 por ciento es mano de obra local. El Tren Maya contribuye a la reactivación económica del sureste.",0.0,40,22,02,2021
PREGUNTA,El Tren Maya avanza.,0.0,4,22,02,2021
VOZ DE MUJER, Gobierno de México.,0.0,3,22,02,2021
VOZ DE MUJER," Construcción del Tren Interurbano México-Toluca, reporte semanal.",0.0,7,22,02,2021
VOZ DE MUJER,"Tramo 1, 36 kilómetros. Avance a la fecha: 99.7 por ciento.",0.0,11,22,02,2021
VOZ DE MUJER,"Talleres y cocheras. Se concluyeron las cubiertas de las estructuras para el torno rodero y pintura, se prosigue con las instalaciones eléctricas en el interior de las mismas, se continúa con la instalación de cubiertas en las naves del túnel de lavado y módulo de sanitarios.",0.0,46,22,02,2021
VOZ DE MUJER,"Vía y catenaria, avance a la fecha: 43.4 por ciento.",0.0,10,22,02,2021
VOZ DE MUJER,"Colocación de vía. Con el apoyo de marcos ajustables, se alinean y nivelan los rieles largos soldados para colocarlos en su posición final, previo al colado de plintos de concreto en el kilómetro 27.3.",0.0,34,22,02,2021
VOZ DE MUJER,"Tramo 3, 17 kilómetros. Avance a la fecha: 52.4 por ciento.",0.0,11,22,02,2021
VOZ DE MUJER,"Frente 2, carretera federal. Se colocaron las últimas columnas de este frente y se montaron tres capiteles en jornadas nocturnas.",0.0,20,22,02,2021
VOZ DE MUJER,"Subestación eléctrica de tracción 2. Se continúa con el perfilado de taludes para permitir la implantación de vegetación, los accesos para la SET2 fueron estabilizados con cal viva para aumentar su capacidad de soporte.",0.0,34,22,02,2021
VOZ DE MUJER,Arteaga y Salazar. Se coló la quinta trabe y se inició con el cimbrado y armado de acero de refuerzo para la losa del cuerpo oriente del paso vehicular.,0.0,29,22,02,2021
VOZ DE MUJER,Estación Santa Fe. Se continúa con el colado de las contratrabes que unen las pilas de la estructura para sostener las vialidades elevadas en el acceso de vehículos a la estación.,0.0,31,22,02,2021
VOZ DE MUJER,"Cada día se trasladan alrededor de cinco millones de personas entre el Valle de Toluca y la Ciudad de México, usando hasta cuatro horas en estos recorridos, equivalente a pasar 24 horas a la semana dentro del transporte. El trayecto del Tren Interurbano entre terminales se realizará en 39 minutos.",0.0,50,22,02,2021
VOZ DE MUJER,Secretaría de Comunicaciones y Transportes.,0.0,5,22,02,2021
PREGUNTA, Gobierno de México.,0.0,3,22,02,2021
PREGUNTA, Gobierno de México.,0.0,3,22,02,2021
PRESIDENTE ANDRES MANUEL LOPEZ OBRADOR," Nada más agradecer el apoyo, la solidaridad de los gobiernos de la India, de Rusia y de China por su apoyo para hacernos llegar vacunas. Ellos tienen necesidad de vacunar a su población, estamos hablando de países que tienen más población que la nuestra y, sin embargo, nos están ayudando.",0.0,50,22,02,2021
PRESIDENTE ANDRES MANUEL LOPEZ OBRADOR,"Esto es lo que estamos planteando en la ONU, que no se acaparen las vacunas, que se distribuyan, que alcancen a todos, porque hay 10 países que se han quedado con el 80 por ciento de las vacunas, 70 países hemos recibido el 20 por ciento, hay alrededor de 120 países que no han recibido una sola dosis. Recordemos que México presentó una resolución en la ONU para crear un mecanismo de distribución de vacunas y evitar el acaparamiento.",0.0,79,22,02,2021
PRESIDENTE ANDRES MANUEL LOPEZ OBRADOR,"Agradecemos por eso la solidaridad de estas tres naciones, como agradecemos a Argentina por la forma en que estamos trabajando de manera conjunta en la vacuna AstraZeneca y también en otras vacunas.",0.0,32,22,02,2021
PRESIDENTE ANDRES MANUEL LOPEZ OBRADOR,"No vamos a dejar de recibir vacunas, es importante también informarlo. Ya empezamos con la vacunación y no se va a detener. Hemos avanzado ya con la vacunación de adultos mayores, estas vacunas que están llegando también están destinadas a adultos mayores.",0.0,42,22,02,2021
PRESIDENTE ANDRES MANUEL LOPEZ OBRADOR,"Hoy por la noche o en la madrugada llegan vacunas de Rusia, el martes llegan también vacunas de Pfizer para terminar de vacunar a los que ya recibieron la primera dosis y también para seguir vacunando a adultos mayores. El propósito es que para abril todos los adultos mayores del país tengan cuando menos una dosis aplicada con el propósito de reducir los fallecimientos.",0.0,64,22,02,2021
PRESIDENTE ANDRES MANUEL LOPEZ OBRADOR,"Recuerdo que, de conformidad con la recomendación de los especialistas, si vacunamos a toda la población de 60 y más, se reduce la mortalidad por COVID en un 80 por ciento. Entonces, estamos siguiendo ese protocolo, esa recomendación.",0.0,38,22,02,2021
PRESIDENTE ANDRES MANUEL LOPEZ OBRADOR,"Y es cuestión de esperarnos, van a haber vacunas para todos y no hay preferencia para nadie, y es evidente. Nos ha dado COVID a los servidores públicos del gobierno del más alto nivel, al presidente, al secretario de Marina, al secretario de la Defensa, al subsecretario responsable de la campaña contra el COVID y a muchos otros, y no se ha abusado.",0.0,63,22,02,2021
