Participante,Texto,Sentimiento,Palabras,Dia,Mes,Anio
OCTAVIO ROMERO OROPEZA,"La que sigue, por favor.",0.0,5,31,08,2021
OCTAVIO ROMERO OROPEZA,"Bueno, ¿qué tenemos?",0.0,3,31,08,2021
OCTAVIO ROMERO OROPEZA,"Cuarenta camiones tipo torton que nos permitirán el traslado de cilindros desde Tula y Tepeji al Valle de México; de hecho, ya están en funciones.",0.0,25,31,08,2021
OCTAVIO ROMERO OROPEZA,Tenemos 69 camionetas de reparto con capacidad de hasta 70 cilindros cada una y nuestros cilindros nuevos.,0.0,17,31,08,2021
OCTAVIO ROMERO OROPEZA,"La que sigue, por favor. Tenemos infraestructura en proceso de habilitación. Conforme vaya creciendo este proyecto vamos a tener una terminal de venta de gas en Venta de Carpio, en San Juan Ixhuatepec, en la ‘18 de Marzo’, en la terminal de venta de Añil, en la CEDA de Iztapalapa y en Barranca del Muerto. Esta es una imagen de la terminal Añil donde cargamos nuestras camionetas.",0.0,67,31,08,2021
OCTAVIO ROMERO OROPEZA,"La que sigue, por favor. Bueno, la estrategia consiste, ya decíamos, vamos a iniciar en Iztapalapa, tenemos definidas mil 680 rutas, cada camioneta de reparto tendrá 24 rutas al mes, con lo que vamos a poder atender a la mayor parte de las familias más pobres.",0.0,46,31,08,2021
OCTAVIO ROMERO OROPEZA,"Las siguientes alcaldías serán Azcapotzalco, Gustavo A. Madero, Milpa Alta, Xochimilco y Tláhuac, y posteriormente iremos incluyendo las demás alcaldías.",0.0,20,31,08,2021
OCTAVIO ROMERO OROPEZA,"La que sigue, por favor. Bueno, nuestra estrategia en cuanto a la capacidad de reparto, iniciamos con una capacidad entre cinco y 10 mil barriles diarios. En cilindros… Perdón, en septiembre vamos a pasar de 10 a 20 mil cilindros, en octubre de 20 a 30 mil, noviembre de 30 a 40 mil y diciembre de 40 a 50 mil barriles, con lo que tendríamos el objetivo en enero del 2022 llegar a 1.2 millones de viviendas en todas las alcaldías de la Ciudad de México.",0.0,86,31,08,2021
OCTAVIO ROMERO OROPEZA,¿Cuáles son las ventajas de Gas Bienestar?,0.0,7,31,08,2021
OCTAVIO ROMERO OROPEZA,"Bueno, en primer lugar, kilos de a kilo. La idea es que todos los cilindros lleven exactamente los de 20 kilos, 20 kilos, y los de 40, 40.",0.0,28,31,08,2021
OCTAVIO ROMERO OROPEZA,"En esta imagen podemos ver un cilindro vacío con un peso inicial de 19 kilogramos con 300 gramos y una vez que ya está llenado el tanque el peso final es 30 con 300, es decir, 20 kilos exactamente.",0.0,39,31,08,2021
OCTAVIO ROMERO OROPEZA,"Y para garantizar que no haya ‘ordeña’ de estos tanques, van a llevar un sello de hermeticidad, un sello térmico.",0.0,20,31,08,2021
OCTAVIO ROMERO OROPEZA,"La que sigue, por favor. Bueno, otra ventaja, cilindros seguros. Ya lo decíamos hace un momento, en una primera etapa vamos a entregar cilindros nuevos, se recogerán usados que serán sometidos a un proceso de rehabilitación buscando eliminar los riesgos en los hogares mexicanos.",0.0,44,31,08,2021
OCTAVIO ROMERO OROPEZA,"Estas son las condiciones en las que estamos recibiendo los cilindros, estos son los que estamos entregando. Una vez que pase el proceso de rehabilitación se les retira la pintura y el óxido, se les cambia la válvula, se les checa la presión hidrostática, se pintan y se rotulan. Los cilindros que no pasan estas pruebas son chatarrizados con el objetivo de sacarlos de la circulación del mercado.",0.0,68,31,08,2021
OCTAVIO ROMERO OROPEZA,"Entonces, tenemos un pequeño video donde se muestra este proceso.",0.0,10,31,08,2021
OCTAVIO ROMERO OROPEZA,"Estos son los cilindros que recogimos en la fase en los tres días de fase de prueba, en estas condiciones los recogimos. Se pueden dar cuenta del mal estado en que se encuentran.",0.0,33,31,08,2021
OCTAVIO ROMERO OROPEZA,"Aquí estamos retirando la válvula, aquí estamos probando las válvulas, las que sirven y las que no sirven.",0.0,18,31,08,2021
OCTAVIO ROMERO OROPEZA,"En este caso esta válvula no sirve porque, estando cerrada, con esta presión tiene filtraciones; en este segundo caso la válvula está en condiciones. Las que no sirven se retiran y las que sirven se rehabilitan.",0.0,36,31,08,2021
OCTAVIO ROMERO OROPEZA,"Aquí comienza el retiro de pintura y de óxido proceso que llama granallado, así entran y así salen.",0.0,18,31,08,2021
OCTAVIO ROMERO OROPEZA,"Y aquí, si pudiéramos congelar esta imagen, es importante, porque la prueba hidrostática consiste en llenar los cilindros con agua. Estos cilindros son de 20 kilos, se les mete una presión de 30 y aquí se observa cómo este cilindro y este tienen agujeros, al meterles la presión del agua se da la filtración, esto sería el equivalente a si tuvieran gas, de manera que estos cilindros se retiran del mercado.",0.0,71,31,08,2021
OCTAVIO ROMERO OROPEZA,"Continuamos con el video, por favor. Bueno, aquí tenemos unas imágenes, si las pudiéramos congelar, de las condiciones de la base, de la parte de abajo del tanque, la base del tanque, los agujeros, aquí tenemos una imagen donde esto es un parche con algún tipo de pasta para evitar el agujero, para evitar la salida del gas, que no es efectiva; aquí tenemos otro agujero.",0.0,66,31,08,2021
OCTAVIO ROMERO OROPEZA,"La que sigue, por favor o, mejor dicho, continuamos. Aquí están los cilindros que no pasaron la prueba, estos van a chatarrización, se marcan y pasan a fase de deshecho con esta máquina que los deja en estas condiciones.",0.0,39,31,08,2021
OCTAVIO ROMERO OROPEZA,"Aquí esta imagen nos muestra algo interesante. Le soldan una placa metálica con la finalidad, no tanto de tapar agujeros, sino de que el cilindro pese más. Ya decíamos anteriormente que el peso promedio de un cilindro es 19 kilos con 300 gramos. Pues está placa pudiera estar pesando un par de kilos y eso resta volumen al gas con el que se llena.",0.0,64,31,08,2021
OCTAVIO ROMERO OROPEZA,"La que sigue, por favor. Aquí estamos empezando a pintar por dentro del cilindro, aquí viene ya la fase de pintura de los cilindros que pasaron la prueba, aquí viene el cambio de válvula, en este caso es una válvula nueva que se le está instalando con el torque preciso. Este es el proceso ya del rotulado del cilindro y así quedan los cilindros al final del proceso.",0.0,68,31,08,2021
OCTAVIO ROMERO OROPEZA,"Estas son nuestras camionetas de reparto, son nuevas, recién adquiridas, tienen capacidad para 70 cilindros cada una.",0.0,17,31,08,2021
OCTAVIO ROMERO OROPEZA,"Y, bueno, otra de las ventajas, el Gas Bienestar va a ser un gas que rinda más, rinde más, en primer lugar, porque estamos cuidando la calidad del gas, hemos hecho pruebas contra otras marcas y el Gas Bienestar tiene mayor poder calórico. Entonces, estamos cuidando mucho la calidad del gas y esto se va a traducir en mayor duración por parte de las familias.",0.0,65,31,08,2021
OCTAVIO ROMERO OROPEZA,"Que los kilos sean de kilo, lo que decíamos, la carga completa que también va a dar más rendimiento.",0.0,19,31,08,2021
OCTAVIO ROMERO OROPEZA,"Y, desde luego, el tema de la hermeticidad de los cilindros a través de la rehabilitación, que va a dar seguridad y más rendimiento, porque se va a perder el gas este que se está fugando.",0.0,36,31,08,2021
OCTAVIO ROMERO OROPEZA,"Y, finalmente, el precio justo. Aquí tenemos tres cuadros, este es el precio anterior a que el presidente de la República decretara los precios máximos. Hasta el 31 de julio un gas, un cilindro de 20 kilos costaba en promedio -en algunos lugares más- 540 pesos y el de 30 kilos, 810 pesos.",0.0,53,31,08,2021
OCTAVIO ROMERO OROPEZA,"Los precios máximos hoy día están en 20 kilos, 447; 30 kilos, 671 con 40 centavos; y nosotros estamos saliendo en este mismo periodo a 400 pesos los 20 kilos, 600 pesos los 30 kilos. Entonces el precio es bastante accesible.",0.0,41,31,08,2021
OCTAVIO ROMERO OROPEZA,"Y, finalmente, este es el vestuario que van a llevar nuestros compañeros choferes y ayudantes, su camisola.",0.0,17,31,08,2021
OCTAVIO ROMERO OROPEZA,"Bueno, aquí están los compañeros. Estos son los cilindros de 20 y de 30. Muchas gracias compañeros. Y, bueno, pues ahí están la camisola, el overol, su faja de seguridad, su casco y gorra y sus guantes. Muchas gracias, compañeros.",0.0,40,31,08,2021
OCTAVIO ROMERO OROPEZA,"Perfecto. Pues yo creo que ya estamos terminando, presidente. No sé si siga algo más.",0.0,15,31,08,2021
OCTAVIO ROMERO OROPEZA,"Ah, tenemos un video, señor presidente. ¿Nos permite usted que lo pasemos?",0.0,12,31,08,2021
PREGUNTA, La economía familiar es la base del desarrollo de la nación.,0.0,11,31,08,2021
INTERVENCION HOMBRE, Aquí están los tlacoyitos que trajo la abuela.,0.0,8,31,08,2021
INTERVENCION MUJER," Con el Gas Bienestar, que está más barato, me alcanzó para más.",0.0,12,31,08,2021
PREGUNTA, Porque a partir de ella se construyen los cimientos para el progreso del pueblo.,0.0,14,31,08,2021
PREGUNTA,"Por eso, el Gobierno de México ha creado Gas Bienestar para que pagues lo justo y dejes de preocuparte por los altos precios del gas.",0.0,25,31,08,2021
INTERVENCION MUJER," ¡El gas! ¡Córrele, se acabó el de la casa, si no, luego nos quedamos sin gas!",0.0,16,31,08,2021
INTERVENCION MUJER, ¿Quién quiere café de olla?,0.0,5,31,08,2021
PREGUNTA," Pemex, por el rescate de la soberanía.",0.0,7,31,08,2021
OCTAVIO ROMERO OROPEZA," Señor presidente, quedaría el enlace con Iztapalapa. Se encuentra la jefa de Gobierno, Claudia Sheinbaum, y la alcaldesa para el tema de la inauguración.",0.0,24,31,08,2021
OCTAVIO ROMERO OROPEZA,"Es cuanto, presidente.",0.0,3,31,08,2021
OCTAVIO ROMERO OROPEZA,Muchas gracias.,0.0,2,31,08,2021
CLAUDIA SHEINBAUM PARDO," Presidente, muy buenos días; muy buenos días al director de Pemex, al ingeniero Octavio Romero.",0.0,15,31,08,2021
CLAUDIA SHEINBAUM PARDO,"Primero que nada, queremos agradecerle. Estamos aquí en la plaza central de Iztapalapa con la alcaldesa Clara Brugada y todos los compañeros de Pemex, y algunos vecinos y vecinas y trabajadores de Pemex.",0.0,33,31,08,2021
CLAUDIA SHEINBAUM PARDO,"Primero, quisiéramos agradecer a usted, presidente, a Pemex, por haber elegido la Ciudad de México como el primer lugar en donde se empieza a distribuirse Gas Bienestar.",0.0,27,31,08,2021
CLAUDIA SHEINBAUM PARDO,"Es un hecho histórico porque hace décadas que Pemex no distribuía al menudeo el gas LP. Como sabemos, la reforma energética liberó el precio del gas LP y, en vez de bajar, lo único que hizo fue subir los precios, en la Ciudad de México llegó a costar uno de 20 kilos hasta 600 pesos. Así que Gas Bienestar viene a apoyar la economía popular y viene a apoyar también para nosotros la soberanía de nuestro país.",0.0,77,31,08,2021
CLAUDIA SHEINBAUM PARDO,"Ya se hicieron, como bien dijo el director de Pemex, dos días de prueba con la alcaldesa de Iztapalapa y el equipo, que han sido muy importantes para poder ver el funcionamiento, y a partir del día de hoy ya comienza a distribuirse en diversas zonas de Iztapalapa.",0.0,48,31,08,2021
CLAUDIA SHEINBAUM PARDO,"Así que agradecemos realmente. Estamos muy, pero muy contentos de este Gas Bienestar en la Ciudad de México.",0.0,18,31,08,2021
CLAUDIA SHEINBAUM PARDO,"Informarle que el trabajo que hemos venido desarrollando con Pemex nos va a permitir que de aquí a enero, a principios de enero, pueda distribuirse en toda la Ciudad de México, inicia en Iztapalapa y posteriormente estaríamos en Azcapotzalco, Gustavo A. Madero, Milpa Alta, Xochimilco, Tláhuac, Cuajimalpa y así hasta que en enero lleguemos a las siguientes alcaldías, Tlalpan, Álvaro Obregón, Venustiano Carranza, Iztacalco, Benito Juárez, Coyoacán, Cuauhtémoc y en la Miguel Hidalgo.",0.0,73,31,08,2021
CLAUDIA SHEINBAUM PARDO,"Así que muchísimas gracias. Es realmente un día histórico para la Ciudad de México, un día histórico para el país, el apoyo a la economía popular y a la soberanía de nuestro país.",0.0,33,31,08,2021
CLAUDIA SHEINBAUM PARDO,"Así que muchas gracias, señor presidente.",0.0,6,31,08,2021
CLAUDIA SHEINBAUM PARDO,"Y muchas felicidades a Pemex, porque en tan sólo 55 días Pemex de nuevo pone en alto el nombre de México.",0.0,21,31,08,2021
CLAUDIA SHEINBAUM PARDO,Muchas gracias.,0.0,2,31,08,2021
CLAUDIA SHEINBAUM PARDO,"Si me permite, le daremos la palabra un momentito a Clara Brugada.",0.0,12,31,08,2021
CLARA BRUGADA MOLINA," Hola, presidente, buenos días. Le mandamos un caluroso saludo desde Iztapalapa.",0.0,11,31,08,2021
CLARA BRUGADA MOLINA,"Queremos agradecerle la entrada del programa Gas Bienestar aquí en Iztapalapa, que es donde más se necesita.",0.0,17,31,08,2021
CLARA BRUGADA MOLINA,Y el día de hoy estamos festejando dos acontecimientos que tienen que ver con el precio del gas:,0.0,18,31,08,2021
CLARA BRUGADA MOLINA,"El primero es que desde que usted informó la entrada del Gas Bienestar el precio del gas bajó. Como ya se decía, en julio un tanque de 20 kilos estaba entre 550 y 600 pesos, hoy está entre 530 y 560 pesos, es decir, 100 pesos menos y esto tenemos que destacarlo, porque esto ya es un gran logro y esto ayuda directamente a la gente con menos recursos.",0.0,69,31,08,2021
CLARA BRUGADA MOLINA,"Y en contra de los que defienden los postulados de la mano libre del mercado que regula los precios y promueve la prosperidad, aquí tuvo que entrar la mano de un gobierno justo, democrático y honesto, como usted encabeza, para que pudiera regularse los precios.",0.0,45,31,08,2021
CLARA BRUGADA MOLINA,"Y el segundo acontecimiento es la entrada el día de hoy formal del Gas Bienestar. Aquí con este tanque, por ejemplo, de 20 kilos a la población le va a costar 400 pesos, más barato que cualquier privado, pero además con un peso completo y los cilindros nuevos o en buen estado.",0.0,52,31,08,2021
CLARA BRUGADA MOLINA,Así que muchísimas gracias y desde Iztapalapa decimos: Viva la Cuarta Transformación de la vida pública de este país.,0.0,19,31,08,2021
CLARA BRUGADA MOLINA,Gracias.,0.0,1,31,08,2021
PRESIDENTE ANDRES MANUEL LOPEZ OBRADOR," Muy bien. Muchas gracias, Claudia, Clara, muchas gracias por todo el apoyo que se ha brindado a Pemex para que se pueda hacer realidad este programa que inicia en Iztapalapa. Por algo será.",0.0,33,31,08,2021
PRESIDENTE ANDRES MANUEL LOPEZ OBRADOR,Pues vamos a la sección de preguntas. Quedó pendiente la compañera Blanca Valeria Aguirre.,0.0,14,31,08,2021
PREGUNTA," Gracias, presidente. Buenos días a todos. Bianca Valeria Aguirre, de La Octava.",0.0,12,31,08,2021
PREGUNTA,"Presidente, en el año 2019 usted donó para el municipio de Naucalpan un rancho que en su momento perteneció a narcotraficantes, en octubre próximo ya arranca actividades como la Universidad de Naucalpan.",0.0,32,31,08,2021
PREGUNTA,"Esta universidad se encuentra junto a un área boscosa que el gobierno de Naucalpan ha propuesto que se adhiera al área natural protegida Parque Nacional de Los Remedios, decretada en 1938 por el general Lázaro Cárdenas y que, a más de ocho décadas de creada, ha perdido más de 80 por ciento de su área original.",0.0,56,31,08,2021
PREGUNTA,"Es por ello que, a manera de resarcimiento de tanta pérdida de área verde, hoy urbanizada, se propone que el Parque Nacional de Los Remedios llegue hasta las puertas de la universidad.",0.0,32,31,08,2021
PREGUNTA,"Además, un grupo de ambientalistas, junto con el gobierno municipal están proponiendo un proyecto de rescate y recuperación de este parque que, además, ha sido rodeado de sitios históricos, como la Basílica y el Acueducto de Remedios, así como el Cerro de Moctezuma, zona arqueológica bajo resguardo del Instituto Nacional de Antropología e Historia.",0.0,54,31,08,2021
PREGUNTA,"La pregunta es: ¿estaría usted dispuesto a apoyar desde la federación la concretación de este grupo de proyectos ambientales, educativos y culturales?",0.0,22,31,08,2021
PREGUNTA,"Y también, ¿qué petición le haría a la Secretaría de Educación Pública, a la Sedatu y a la Semarnat?",0.0,19,31,08,2021
PREGUNTA,Así como también preguntarle si tiene pensado usted acudir a la universidad a dar el banderazo de arranque de actividades.,0.0,20,31,08,2021
PREGUNTA,"Y tengo otra pregunta que se la haría en un momento, por favor. Gracias.",0.0,14,31,08,2021
PRESIDENTE ANDRES MANUEL LOPEZ OBRADOR," Bueno, pues felicidades por la universidad y sí estamos comprometidos en conservar áreas verdes, en crear áreas de protección, áreas naturales protegidas.",0.0,22,31,08,2021
PRESIDENTE ANDRES MANUEL LOPEZ OBRADOR,"Vamos a pedirle a la secretaria del Medio Ambiente, María Luisa Albores, que haga la propuesta, el proyecto y vamos a garantizar lo que nos están solicitando. Es viable, porque va de acuerdo a la intención que tenemos de preservar, de conservar la naturaleza, de no destruir el medio ambiente.",0.0,50,31,08,2021
PRESIDENTE ANDRES MANUEL LOPEZ OBRADOR,"También aprovecho para decirle a los ciudadanos, a la gente de San Luis Potosí que vamos a continuar hasta convertir en área natural protegida la Sierra de San Miguelito, que es un compromiso y que va a ser como lo está demandando la gente de San Luis, es decir, no se van a conservar áreas de la sierra para proyectos inmobiliarios.",0.0,61,31,08,2021
PRESIDENTE ANDRES MANUEL LOPEZ OBRADOR,"Todo va a ser como reserva natural, toda la Sierra de San Miguelito, estamos trabajando en ese propósito y ya pronto vamos a dar a conocer el programa y, desde luego, el caso que estás planteando.",0.0,36,31,08,2021
PREGUNTA," Y también preguntarle, aprovechando que están aquí las autoridades de Salud, si nos pudieran hablar acerca de la variante Lambda, ya que el fin de semana pasado se informó que en la Ciudad de México ya hay un caso, también hay uno en Colima y ayer se informó acerca de Oaxaca, que ya también se dio un caso.",0.0,58,31,08,2021
PREGUNTA,"Y a propósito también de la variante nueva que se halló en Sudáfrica, C1.2, la cual dicen que podría inhibir la efectividad de las vacunas, quisiéramos información acerca de eso.",0.0,30,31,08,2021
PREGUNTA,"Y aprovechando que están aquí, bueno, pues el canciller también, porque ha hablado sobre el tema en materia de aviación civil, saber cómo va este tema de la categoría 1, alcanzar en materia de seguridad. Se habla de que a inicios de agosto llegaron personal técnico de la Administración Federal de Aviación estadounidense para el acompañamiento a la recuperación de esta categoría.",0.0,62,31,08,2021
PREGUNTA,"Por favor, y gracias.",0.0,4,31,08,2021
PRESIDENTE ANDRES MANUEL LOPEZ OBRADOR, Hugo primero y luego Marcelo.,0.0,5,31,08,2021
HUGO LOPEZ-GATELL RAMIREZ," Gracias, presidente. Con gusto.",0.0,4,31,08,2021
HUGO LOPEZ-GATELL RAMIREZ,"Gracias, Bianca Aguirre. Gusto de verla.",0.0,6,31,08,2021
HUGO LOPEZ-GATELL RAMIREZ,"Con gusto. Las variantes del virus SARS-CoV-2 van a seguir apareciendo y ahora se están numerando con estas letras griegas. Efectivamente, en México, igual que en por lo menos una docena de países, ya se ha identificado la variante Lambda.",0.0,40,31,08,2021
HUGO LOPEZ-GATELL RAMIREZ,"Al igual que comentamos con la variante Delta, que en su momento cobró gran popularidad, no existe ninguna demostración de que estas nuevas variantes tengan mayor agresividad, que causen más daño, que causen una mayor probabilidad de que las personas terminen en un hospital o pierdan la vida.",0.0,48,31,08,2021
HUGO LOPEZ-GATELL RAMIREZ,"La variable Delta en su momento sí se reconoció que puede ser más trasmisible, hasta un 60 por ciento más trasmisible, pero no causa enfermedad más grave.",0.0,27,31,08,2021
HUGO LOPEZ-GATELL RAMIREZ,"Esta nueva que apareció en Sudáfrica tiene otro sistema de clasificación, pero, lo mismo, no se ha demostrado que sea más agresiva.",0.0,22,31,08,2021
HUGO LOPEZ-GATELL RAMIREZ,"En México se realiza vigilancia genética de los virus respiratorios. Desde hace muchos años nuestro Indre, el laboratorio nacional, es parte de las redes de vigilancia global de virus respiratorios desde 1954 y seguimos haciendo vigilancia durante la pandemia de COVID. Si hubiera en algún momento algo que destacar de riesgo para la población, no duden que lo comunicaríamos puntualmente.",0.0,60,31,08,2021
HUGO LOPEZ-GATELL RAMIREZ,Muchas gracias.,0.0,2,31,08,2021
PREGUNTA, ¿No tendríamos que tomar alguna medida extraordinaria por el momento?,0.0,10,31,08,2021
HUGO LOPEZ-GATELL RAMIREZ," No, no hay ninguna medida extraordinaria que tomar y todas las vacunas que han hecho pruebas específicas para su capacidad de responder ante las nuevas variantes han mostrado que tienen esa capacidad.",0.0,32,31,08,2021
HUGO LOPEZ-GATELL RAMIREZ,Hasta el momento no hay ninguna indicación de que alguna de las vacunas que se usan en México o en alguna parte del mundo tuvieran menor capacidad de inducir inmunidad frente a las variantes.,0.0,34,31,08,2021
PREGUNTA," Perfecto. Gracias, doctor.",0.0,3,31,08,2021
MARCELO EBRARD CASAUBON," Bueno, brevemente diría lo siguiente: Estados Unidos y México, como ustedes saben, tienen muchos convenios, acuerdos en materia de aviación civil, pero explico lo que me estás preguntando.",0.0,28,31,08,2021
MARCELO EBRARD CASAUBON,"Tanto Estados Unidos como México tenemos normas para autorizar vuelos de nuestras líneas áreas a otros países, entonces hay unas observaciones que hizo la agencia norteamericana ¿a quién?, a la Agencia Federal de Aviación Civil, que depende de la Secretaría de Comunicaciones y Transportes y por eso estamos en la categoría 2. Esto se hace para en tanto se resuelven las observaciones, son técnicas.",0.0,64,31,08,2021
MARCELO EBRARD CASAUBON,"Entonces, se hizo un equipo por instrucciones del presidente de la República. E stá la Secretaría de Comunicaciones y Transportes, la AFAC y estamos acompañando con la Embajada en Washington y la Dirección General que ve los temas con Estados Unidos.",0.0,41,31,08,2021
MARCELO EBRARD CASAUBON,¿En qué estamos ahorita?,0.0,4,31,08,2021
MARCELO EBRARD CASAUBON,"Ya hay un convenio para trabajar juntas las dos agencias, ya hubo visitas técnicas, va a haber otras y estimamos que en el primer semestre del año entrante podremos recuperar la categoría 1, que quiere decir ¿qué?, que las líneas áreas de Estados Unidos respecto a las operaciones en México estarían viendo a nuestro país como categoría 1, quiere decir como si fuese o como si estuviésemos en los mismos niveles que los demás países que tienen esa categoría, empezando por Estados Unidos.",0.0,83,31,08,2021
MARCELO EBRARD CASAUBON,"Entonces, sí nos interesa y por supuesto estamos trabajando con ese calendario, estamos en ruta, estamos en camino de lograr que México esté en el primer semestre del año entrante de nuevo en nivel 1.",0.0,35,31,08,2021
PREGUNTA," Perfecto. Gracias, gracias, presidente.",0.0,4,31,08,2021
PRESIDENTE ANDRES MANUEL LOPEZ OBRADOR, Luego tú y luego un compañero y luego una compañera.,0.0,10,31,08,2021
PREGUNTA," Buenos días, señor presidente; buenos días a todas y a todos.",0.0,11,31,08,2021
PREGUNTA,"Mi nombre es Diego Elías Cedillo, de Tabasco Hoy, Campeche Hoy, Quintana Roo Hoy y Diario Basta en la Ciudad de México, de Grupo Cantón, señor presidente.",0.0,27,31,08,2021
PREGUNTA,"En atención a que en próximas horas usted presentará el tercer informe de gobierno, me gustaría preguntarle, señor presidente, si se siente orgulloso y satisfecho de los logros que ha habido en su gobierno, y también cuáles consideraría usted que serían los retos venidos en esta segunda etapa de su gobierno, aunado también al reciente nombramiento de un tabasqueño, Adán Augusto López Hernández, en la Secretaría de Gobernación, si este personaje lo apoyaría en esta segunda etapa de su gobierno.",0.0,80,31,08,2021
PREGUNTA,"Sería mi primera pregunta, presidente.",0.0,5,31,08,2021
PREGUNTA,Gracias.,0.0,1,31,08,2021
PRESIDENTE ANDRES MANUEL LOPEZ OBRADOR," Bueno, yo creo que hemos avanzado, mañana voy a informar.",0.0,10,31,08,2021
PRESIDENTE ANDRES MANUEL LOPEZ OBRADOR,"Aprovecho para comentar que no vamos a tener conferencia mañana porque se va a rendir el informe a las 10:00 de la mañana, va a ser en el recinto Juárez de este palacio. Va a estar limitado a los miembros del gabinete porque no se puede hacer todavía ninguna concentración.",0.0,50,31,08,2021
PRESIDENTE ANDRES MANUEL LOPEZ OBRADOR,"Entonces, mañana vamos a informar al pueblo de México. Invito a todos para que escuchen, para que puedan ver este informe.",0.0,21,31,08,2021
PRESIDENTE ANDRES MANUEL LOPEZ OBRADOR,"Estoy satisfecho con lo que hemos logrado porque, aún con la pandemia, que ha causado mucho dolor, mucha tristeza, que fue muy impactante porque se cayó la economía del país, el crecimiento económico en 8.5 por ciento, aún con esta situación muy difícil de remontar, no sólo estamos saliendo adelante; pronto, ya todos los indicadores económicos expresan de que estamos en franca recuperación de la economía.",0.0,66,31,08,2021
PRESIDENTE ANDRES MANUEL LOPEZ OBRADOR,"Se nos devaluó el peso, en esos momentos llegó a estar a 25 pesos por dólar y se controló, y ya puedo decir que no hay devaluación, lo voy a comentar mañana. No se había visto una situación así desde hace más de 30 años, no ha habido devaluación en dos años nueve meses.",0.0,54,31,08,2021
PRESIDENTE ANDRES MANUEL LOPEZ OBRADOR,"Y ya estamos recuperando los empleos y ya los pronósticos de crecimiento para este año están en alrededor del seis por ciento, crecieron las reservas del Banco de México en 20 mil millones de dólares en el tiempo que llevamos, en fin, hay recuperación económica.",0.0,45,31,08,2021
