Participante,Texto,Sentimiento,Palabras,Dia,Mes,Anio
PRESIDENTE ANDRES MANUEL LOPEZ OBRADOR, Buenos días.,0.0,2,31,08,2021
PRESIDENTE ANDRES MANUEL LOPEZ OBRADOR,"Vamos a informar, como todos los martes, sobre la situación de la salud; en especial, el comportamiento de la pandemia, el plan nacional de vacunación y también hoy vamos a dar a conocer lo del programa del Gas Bienestar, que ya inicia en la Ciudad de México, en Iztapalapa. Se va a informar sobre estos dos asuntos de interés público, lo de salud y lo del Gas Bienestar. Entonces, comenzamos con salud, con el doctor Jorge Alcocer.",0.0,77,31,08,2021
JORGE ALCOCER VARELA," Con su permiso, señor presidente.",0.0,5,31,08,2021
JORGE ALCOCER VARELA,Muy buenos días a todas y a todos ustedes.,0.0,9,31,08,2021
JORGE ALCOCER VARELA,"Como señala el señor presidente, hoy hay mucho que informar y en el Pulso de la Salud en forma breve hoy actualizamos el tema de los medicamentos adquiridos por el sector salud, como lo hemos hecho desde hace cinco semanas.",0.0,40,31,08,2021
JORGE ALCOCER VARELA,"En la primera lámina, les recuerdo que la demanda del sector salud incluyó mil 840 claves y se han recibido 77.8 millones de piezas al día de ayer.",0.0,28,31,08,2021
JORGE ALCOCER VARELA,"En la segunda tabla se presentan las órdenes de suministro con las cuales los insumos son referidos para cada una de las instituciones. Y como pueden ver, hasta el 20 de agosto habíamos recibido -la semana pasada- 295 millones 740 mil 398 piezas y ayer se agregaron, en el curso de la semana, 95 millones 25 mil 303 piezas más, derivadas de seis mil 400 órdenes para ello, de un suministro generadas en la semana, lo que da un total de 390 millones 765 mil 701 piezas recibidas hoy y que se muestran en la tabla del lado derecho, para cada una de las instituciones.",0.0,105,31,08,2021
JORGE ALCOCER VARELA,Muchas gracias.,0.0,2,31,08,2021
HUGO LOPEZ-GATELL RAMIREZ," Con su permiso, presidente.",0.0,4,31,08,2021
HUGO LOPEZ-GATELL RAMIREZ,"Muy buenos días, secretarias, secretarios, colegas.",0.0,6,31,08,2021
HUGO LOPEZ-GATELL RAMIREZ,"Vamos a comentar sobre el estado que guarda la epidemia y sobre todo la importancia de este regreso a clases, cómo luce respecto a las previsiones que tenemos en términos epidemiológicos.",0.0,31,31,08,2021
HUGO LOPEZ-GATELL RAMIREZ,"Como hemos venido comentando en las últimas cinco o seis semanas, la curva epidémica de casos estimados empezó a declinar hace un mes y ya hoy tenemos señales claras de que está en un proceso de reducción, y anticipamos que esa reducción va a continuar a lo largo de las siguientes semanas.",0.0,52,31,08,2021
HUGO LOPEZ-GATELL RAMIREZ,"Si podemos ver la curva que presentamos habitualmente, lo que vemos es que abrimos la semana con una reducción de 18 por ciento, en este momento 17 por ciento, y probablemente terminará la semana con al menos 10 por ciento de reducción en la comparación de la semana 33 contra la 32, en este momento vivimos en la semana 35, esto quiere decir ya una tendencia sostenida a la reducción.",0.0,70,31,08,2021
HUGO LOPEZ-GATELL RAMIREZ,"En este momento ya tenemos 30 entidades federativas de las 32 que tienen una curva epidémica en descenso, a diferencia de sólo 17 que teníamos en la semana pasada.",0.0,29,31,08,2021
HUGO LOPEZ-GATELL RAMIREZ,"Lo mismo en la gráfica de hospitalizaciones, lo que vemos es que ya la curva epidémica de ocupación hospitalaria está más allá del punto máximo de la tercera ola y se encamina también en una tendencia de descenso con 30 entidades federativas en las que la ocupación hospitalaria empieza a reducirse.",0.0,51,31,08,2021
HUGO LOPEZ-GATELL RAMIREZ,"Y un elemento adicional que hemos venido explicando a lo largo de estos mes y medio es cómo la epidemia en personas menores de 18 o de 20 años es una situación muy diferente a la que se presenta en mayores, en personas adultas. Y esto es una fortuna porque las personas menores de edad no tienen un riesgo elevado de padecer enfermedad COVID y sobre todo que esta pudiera ser grave o incluso letal.",0.0,75,31,08,2021
HUGO LOPEZ-GATELL RAMIREZ,"De múltiples maneras, con múltiples indicadores se muestra esto. Lo que vemos en esta ocasión son los informes de mortalidad durante 2020 y vemos las distintas causas por las que desafortunadamente personas menores de 20 años pierden la vida.",0.0,39,31,08,2021
HUGO LOPEZ-GATELL RAMIREZ,"Lo vemos por distintos grupos de edad, están menores de un año, donde las causas relacionadas con el parto y el nacimiento son la causa número uno y esta es la causa más significativa; en cambio, COVID-19 está en poca representación.",0.0,41,31,08,2021
HUGO LOPEZ-GATELL RAMIREZ,"Para los siguientes grupos de edad vemos en el lado derecho de uno a cuatro años y en las siguientes imágenes de cinco a nueve y 10 a 14. Los accidentes son la causa número uno, lo han sido por muchos años, los accidentes son la causa número uno de mortalidad en personas menores de edad.",0.0,56,31,08,2021
HUGO LOPEZ-GATELL RAMIREZ,"Y compara en cerca de 10, en algunos casos 15 o 20 veces con lo que puede ocurrir con COVID-19, lo vemos sobre todo en la siguiente y última, que es en 15 a 19 años, las muertes por accidente son cinco mil 500 durante el año y, en cambio, COVID-19 son 258, es decir, es una proporción mucho más grande.",0.0,61,31,08,2021
HUGO LOPEZ-GATELL RAMIREZ,"El mensaje clave para padres, madres de familia es: COVID-19, comparado con la realidad que viven todas las personas de edad es una causa de mortalidad muy baja, muy pequeña, como digo, 10 o 20 veces menor, y otras situaciones son de mayor importancia. Esto de ninguna manera quiere decir que sea deseable que una persona y sobre todo un menor de edad pierda la vida, pero sí ayuda a visualizar los distintos riesgos que enfrentamos a lo largo de la vida y a lo largo del día o del año cómo COVID-19 no es una causa sustantiva de riesgo.",0.0,100,31,08,2021
HUGO LOPEZ-GATELL RAMIREZ,"Termino informando sobre la vacunación. Ayer arrancamos la semana, que se anticipa será muy buena semana porque tenemos una dotación sustancial de vacunas esta semana, casi seis millones y llevamos ya -la siguiente- casi 85 millones de vacunas que han sido aplicadas, que corresponde a 57.8 millones de personas que han sido vacunadas.",0.0,53,31,08,2021
HUGO LOPEZ-GATELL RAMIREZ,"Y esto representa 65 por ciento de la población adulta que ya ha sido protegida contra COVID-19 de una meta que tenemos de cubrir al 31 de octubre a toda la población adulta con al menos la primera dosis, la mayoría van a ser ya con el esquema completo antes de que termine octubre.",0.0,54,31,08,2021
HUGO LOPEZ-GATELL RAMIREZ,"Llevamos casi 100 millones de dosis de vacunas recibidas y esta semana -es la última que presento, el calendario- tendremos cinco millones 885 mil vacunas. Pfizer ha reestablecido ya una dotación que se acerca al millón y medio de dosis por semana y tendremos también una dotación muy sustancial de la vacuna Astra.",0.0,53,31,08,2021
HUGO LOPEZ-GATELL RAMIREZ,"Seguimos con el plan de vacunación y estaremos muy atentos desde luego que con el inicio de la escuela no haya brotes. En caso de haberlos, desde luego están todos los mecanismos listos para atender cualquier brote que pudiera haber en escuelas para que esto no pudiera no salirse de control.",0.0,51,31,08,2021
HUGO LOPEZ-GATELL RAMIREZ,"Gracias, presidente.",0.0,2,31,08,2021
PRESIDENTE ANDRES MANUEL LOPEZ OBRADOR, Adelante.,0.0,1,31,08,2021
MARCELO EBRARD CASAUBON," Muy buen día. Con su permiso, señor presidente. Buenos días a todas, a todos.",0.0,14,31,08,2021
MARCELO EBRARD CASAUBON,"Brevemente, bueno, el día de hoy vamos a superar, como ya saben ustedes, los 100 millones dosis, la siguiente meta a cumplir: terminar 2021 con 150 millones de dosis, esto resultado de una estrategia que ha encabezado el presidente de la República.",0.0,42,31,08,2021
MARCELO EBRARD CASAUBON,"Sólo para recordar: el presidente invitó al presidente Alberto Fernández para el tema de la producción en México de AstraZeneca entre México y Argentina, habló con el presidente de China, el presidente Biden, presidente Vladimir Putin. Esta estrategia es la que nos condujo a que tengamos hoy el número que tenemos y a nivel nacional a que se produjeran o se envasaran AstraZeneca y CanSino.",0.0,65,31,08,2021
MARCELO EBRARD CASAUBON,"Las relaciones bilaterales nos permitieron, como ya dije, con Argentina la cadena de producción aquí, 20 millones de vacunas que nos mandó China a través de Sinovac, la producción en México de CanSino, con Estados Unidos las donaciones y fases 3 en México, que les recuerdo, ahora lo voy a mencionar de Novavax y Janssen, y tenemos donaciones por poquito más de cinco millones de dosis, que la India nos mandara 870 mil dosis en febrero del 2021",0.0,78,31,08,2021
MARCELO EBRARD CASAUBON,"Y en los organismos internacionales, la resolución mexicana de Naciones Unidas, el planteamiento del presidente en marzo 2020 en G-20 y la actividad de la comunidad de Estados Latinoamericanos y Caribeños.",0.0,31,31,08,2021
MARCELO EBRARD CASAUBON,"Se sigue ampliando el portafolio mexicano también. Tenemos ya autorizados por Cofepris fase 3 ensayos Walvax, esta es ARN mensajero; esta otra de China también, que se va a hacer la fase 3 en México; Sanofi, de Francia, también va a iniciar fase 3; y nos comunicaron que la vacuna cubana Abdala tiene ya una opinión favorable por parte del Comité de Moléculas Nuevas, así que su autorización pareciera ser ya muy cercana.",0.0,73,31,08,2021
MARCELO EBRARD CASAUBON,"Por último, entre los países que tienen más de 100 millones de habitantes México es el quinto lugar en el porcentaje de población total que ha recibido el esquema completo de vacunación, somos el quinto de los que tenemos 100 millones o más de habitantes.",0.0,45,31,08,2021
MARCELO EBRARD CASAUBON,"Próximamente recibiremos de Estados Unidos, 21 de septiembre, donación de un millón 750 mil, Moderna, que ya se aplicó la primera dosis, y entre el 6 y el 13 de septiembre llegan a México cuatro millones 600 mil de los Estados Unidos, AstraZeneca.",0.0,43,31,08,2021
MARCELO EBRARD CASAUBON,"De manera que este sería la síntesis, señor presidente, dónde estamos al día de hoy.",0.0,15,31,08,2021
MARCELO EBRARD CASAUBON,Muchas gracias.,0.0,2,31,08,2021
LUIS CRESENCIO SANDOVAL GONZALEZ," Con permiso, señor presidente.",0.0,4,31,08,2021
LUIS CRESENCIO SANDOVAL GONZALEZ,"Continuamos con el informe de distribución de las vacunas. Aquí tenemos el total de dosis recibidas el día 24 y 25 de agosto, tres millones 578 mil 520 dosis que fueron lotificadas en Incan y en Birmex, y estuvieron listas para distribución tres millones 367 mil 280 dosis.",0.0,48,31,08,2021
LUIS CRESENCIO SANDOVAL GONZALEZ,"Estas fueron distribuidas el día jueves 26 por vía aérea, se organizó una ruta para atender tres estados, que fueron Durango, Coahuila y Nuevo León, llevando un total de 641 mil 740 dosis.",0.0,33,31,08,2021
LUIS CRESENCIO SANDOVAL GONZALEZ,"Por vía terrestre se organizaron para atender a dos entidades que acudieron a las instalaciones del Incan, que fue Morelos y Michoacán; otra más para atender a cuatro entidades que acudieron a Birmex, que fue el Estado de México, Puebla, Querétaro y Guanajuato.",0.0,43,31,08,2021
LUIS CRESENCIO SANDOVAL GONZALEZ,"Y saliendo de Birmex se organizaron cinco rutas para atender a seis estados: la primera a Jalisco, la segunda a Veracruz y Tabasco, la tercera hacia Oaxaca, la cuarta hacia Chiapas y la número cinco hacia Guerrero, haciendo un total de dosis de dos millones 725 mil 540 que se distribuyó.",0.0,51,31,08,2021
LUIS CRESENCIO SANDOVAL GONZALEZ,"Entonces, tenemos que la distribución del día jueves fue a 15 entidades federativas, con un total de tres millones 367 mil 280 dosis, se materializaron 17 rutas terrestres, que fue dada la seguridad por personal del Ejército, de la Armada y de la Guardia Nacional, se realizaron cuatro operaciones aéreas con un total de cuatro horas y 10 minutos, empleando un total de 514 hombres, 51 vehículos y una aeronave.",0.0,70,31,08,2021
LUIS CRESENCIO SANDOVAL GONZALEZ,"Es todo, señor presidente.",0.0,4,31,08,2021
DELFINA GOMEZ ALVAREZ," Buenos días, señor presidente; buenos días, compañeros de gabinete; buenos días, compañeros de medios de comunicación y a todos los que nos ven a través de este medio.",0.0,28,31,08,2021
DELFINA GOMEZ ALVAREZ,"Doy precisamente informe sobre el programa de lo que es el regreso o el inicio de ciclo escolar. Les quiero informar que los estados que iniciaron precisamente el día de ayer fueron 30 estados, recordando que en el caso de Baja California Sur y Sinaloa precisamente por el huracán Nora no regresaron; sin embargo, el día de ayer por la noche me informaban que afortunadamente creo que todo está ahorita trabajándose bien y el fin de semana o más tardar el lunes, presidente, le informo que ya regresan estos estados.",0.0,90,31,08,2021
DELFINA GOMEZ ALVAREZ,"En lo que se refiere a las cifras, yo les comento, son preliminares y ahorita les explico por qué.",0.0,19,31,08,2021
DELFINA GOMEZ ALVAREZ,"En lo que se refiere a las escuelas ahorita llevamos 119 mil 497 escuelas que tuvieron ayer como registro que ya abrieron precisamente el inicio: en docentes, 970 mil 617; en alumnos, 11 millones 426 mil 26.",0.0,37,31,08,2021
DELFINA GOMEZ ALVAREZ,El factor que quedaría un poco es precisamente el de alumnos,0.0,11,31,08,2021
DELFINA GOMEZ ALVAREZ,¿Por qué?,0.0,2,31,08,2021
DELFINA GOMEZ ALVAREZ,"Haciendo una cuenta precisamente ayer, un corte, salían alrededor de más de 20 millones de alumnos; sin embargo, hasta queremos confirmarlo bien, porque hay pequeños que el día de ayer no se presentaron, sino se presentan hoy en esa parte de que está a la mitad y la mitad.",0.0,49,31,08,2021
DELFINA GOMEZ ALVAREZ,"Entonces, todavía esta semana vamos a estar en ese proceso de precisamente confirmación de datos. No queremos dar datos erróneos, queremos dar datos muy precisos.",0.0,25,31,08,2021
DELFINA GOMEZ ALVAREZ,Y estos son los datos que así se contabilizaron ahora sí que niño por niño y que son los reales. Ya en próximas horas estaremos dando y actualizando dicha información.,0.0,30,31,08,2021
DELFINA GOMEZ ALVAREZ,"Les quiero comentar un poquito a través de precisamente fotografías y videos que se tomaron en precisamente los estados con la finalidad de dar fe de que hubo esa situación de participación tanto de maestros como de autoridades educativas, gobernadores, presidentes municipales, lo que son Semarnat, que es un programa también, que habíamos firmado un convenio en donde se había establecido, entre otras acciones, el que al momento de regresar a clases se iba a sembrar un árbol. En algunas instituciones no solamente sembraron uno, sino sembraron hasta 10, dependiendo el área que tuvieran para poder hacerlo.",0.0,97,31,08,2021
DELFINA GOMEZ ALVAREZ,"Y aquí vemos. Bueno, yo la verdad me siento muy emocionada y muy agradecida con los que integran la comunidad escolar por todo el esfuerzo que hicieron para este precisamente regreso.",0.0,31,31,08,2021
DELFINA GOMEZ ALVAREZ,"Aquí tenemos algunas fotos en donde nos muestran que estuvieron presentes nuestras autoridades de los gobiernos, estuvieron presentes precisamente los participantes del Consejo de Participación de Salud, estuvieron presentes algunos pequeñitos como una representación de los alumnos, cuidando la sana distancia, por eso no se hicieron ceremonias a lo mejor con mucho número de participantes, muchos niños ya estaban desde la 7:00 de la mañana, ya estaban en su clase, tuvimos oportunidad de pasar a los salones precisamente a darles un mensaje. Tuvimos representantes precisamente de lo que es Semarnat y estos son de todos los estados.",0.0,97,31,08,2021
DELFINA GOMEZ ALVAREZ,"Yo aprovecho para comentar que efectivamente, insisto, este es un trabajo de equipo, es un trabajo que no se hizo de un día para otro. Aquí desde lo que fue la vacunación de nuestros maestros y que agradezco mucho aquí a Salud, a Guardia Nacional, a lo que es Bienestar y todos los que participaron, a nuestro presidente también, que tomó en cuenta como tercer elemento prioritario a los maestros. Recordemos que el primero fue adultos mayores, el segundo fue lo que es salud y el tercero fueron nuestros maestros y eso hizo posible que ahorita estamos viendo resultados.",0.0,99,31,08,2021
DELFINA GOMEZ ALVAREZ,"Después de todas estas actividades que se realizaron, bueno, nos viene una parte de lo que es el proceso de evaluación o de seguimiento y ya más adelante, después de todas estas fotografías, los niños muy contentos.",0.0,37,31,08,2021
DELFINA GOMEZ ALVAREZ,"Tuve oportunidad de platicar con algunos pequeños y algunos jóvenes, y de verdad estaban muy emocionados del reingreso, algunos chiquitos de preescolar decían: ‘¿Esta es una escuela?’ porque no habían entrado, otros estaban en tercero cuando fue esto, lamentablemente, ahorita ya están en quinto. Entonces, fue una situación muy emocionante.",0.0,50,31,08,2021
DELFINA GOMEZ ALVAREZ,¿Qué acciones nos quedan pendientes?,0.0,5,31,08,2021
DELFINA GOMEZ ALVAREZ,"Efectivamente, el censo escuela por escuela. Recordemos que Veracruz es un caso especial, así como Puebla e Hidalgo. Visitar precisamente, haciendo lo que es el censo por escuela.",0.0,28,31,08,2021
DELFINA GOMEZ ALVAREZ,"Hay algunos municipios, en especial son 10 municipios los más afectados en Veracruz, que es lo que se está realizando y ahí va a participar también La Escuela es Nuestra en ese censo junto con el gobierno del estado de Veracruz, de Puebla y ahorita vamos a ver también los afectados por Nora.",0.0,53,31,08,2021
DELFINA GOMEZ ALVAREZ,"La segunda detección de abandono escolar, eso también se está viendo y en estos días ya se va a poder dar o definir el número.",0.0,25,31,08,2021
DELFINA GOMEZ ALVAREZ,"Insisto, ahorita se está haciendo el proceso de recibir a los pequeñitos, de ver cuántos faltan, hoy llegan otros más y, bueno, eso nos va a permitir ver si efectivamente el niño no llegó porque le tocaba hoy o porque no va a llegar y entonces ya estaremos en condiciones, a finales de esta semana, ya a empezar a hacer precisamente esa detección y esa búsqueda de nuestros pequeñitos que no llegaron y saber la causa, y orientarlos a que lleguen.",0.0,81,31,08,2021
DELFINA GOMEZ ALVAREZ,"Y ahí va a ser muy importante la participación precisamente de Unicef, que nos ha estado apoyando.",0.0,17,31,08,2021
DELFINA GOMEZ ALVAREZ,"La otra son las visitas a las escuelas, en donde estaríamos haciendo monitoreo. Si ustedes recuerdan, cuando vinieron aquí los compañeros de Unicef nos hacían cuatro propuestas, uno era mejorar la comunicación, que efectivamente, bueno, vamos a fortalecer las redes y vamos a fortalecer todo lo del correo, que es una parte importante de la Secretaría de Educación Pública.",0.0,59,31,08,2021
DELFINA GOMEZ ALVAREZ,"Los otros es los protocolos que se tendrán que dar seguimiento y se tendrá que supervisar qué es lo que vamos a hacer en el tercer y cuarto punto, visitas a escuelas y dar el seguimiento.",0.0,36,31,08,2021
DELFINA GOMEZ ALVAREZ,"Y la otra es precisamente fortalecer los aprendizajes, que es muy importante; pero yo le comentaba ayer a algunos compañeros y padres de familia que ahorita lo importante y lo que yo hago esa petición es que tanto nuestros maestros como nuestros padres de familia fortalezcamos, más que otra cosa, la seguridad y la parte afectiva de nuestros niños.",0.0,59,31,08,2021
DELFINA GOMEZ ALVAREZ,"Muchos pequeñitos de verdad que estaban muy emocionados de expresar sus sentimientos, ya se intercambiaron teléfonos, bueno, ya están muy emocionados. Y sí tenemos que orientarlos precisamente a esa situación de manejo de emociones, pero también de protocolo.",0.0,38,31,08,2021
DELFINA GOMEZ ALVAREZ,"Y nos queda, yo insisto, nos queda un buen sabor de boca de saber que los niños ya empiezan a decir: ‘¿Sabes qué?, toma tu sana distancia, utiliza bien tu cubrebocas, hay que lavarnos las manos’.",0.0,36,31,08,2021
DELFINA GOMEZ ALVAREZ,"Llevaban su lunch ellos, eso también tuvimos la oportunidad de verlo. Agradezco a los padres de familia que están haciendo ese esfuerzo de enviarlos con su lunch y algo, refrigerio nutritivo.",0.0,31,31,08,2021
DELFINA GOMEZ ALVAREZ,"Entonces, queda todavía un camino que tenemos que recorrer, esto es un proceso, pero me queda muy, muy claro que, si cada uno de nosotros hacemos lo que nos toca, padres de familia, maestros, autoridades, lo vamos a hacer de la mejor manera y creo que va a haber muy buenos resultados.",0.0,52,31,08,2021
DELFINA GOMEZ ALVAREZ,"Continuaremos con esa comunicación que ha habido desde un principio aquí con la Secretaría de Salud, que a quien agradezco precisamente para tener el monitoreo de, en cualquier caso, que llegue a aparecer, que efectivamente tocamos madera y así que no sea, pero cualquier cosa estar al pendiente y así como también el tener lo que es el protocolo con algunos elementos de plataforma que vamos a trabajar de manera concreta con algunas organizaciones para poder mejorar lo que ahorita tenemos.",0.0,81,31,08,2021
DELFINA GOMEZ ALVAREZ,Agradezco mucho su atención.,0.0,4,31,08,2021
DELFINA GOMEZ ALVAREZ,"Gracias, señor presidente.",0.0,3,31,08,2021
PRESIDENTE ANDRES MANUEL LOPEZ OBRADOR," Esto es lo que podemos informar sobre salud y ahora, si les parece, vamos a dar a conocer lo del inicio del programa Gas Bienestar.",0.0,25,31,08,2021
PRESIDENTE ANDRES MANUEL LOPEZ OBRADOR,"Esto lo va a explicar el director de Pemex, Octavio Romero Oropeza. Le damos la palabra.",0.0,16,31,08,2021
OCTAVIO ROMERO OROPEZA," Muy buenos días a todas y a todos, representantes de los medios de comunicación.",0.0,14,31,08,2021
OCTAVIO ROMERO OROPEZA,Señor presidente de la República:,0.0,5,31,08,2021
OCTAVIO ROMERO OROPEZA,"El pasado 7 de julio anunció usted el arranque de operaciones de la empresa Gas Bienestar en un término no mayor a 90 días. Hoy, a los 55 días de su instrucción, estamos arrancando oficialmente los trabajos de la empresa Gas Bienestar, cuyo objetivo es distribuir cilindros de gas LP de 20 y 30 kilos entre las familias más pobres, garantizándoles seguridad, calidad, volumen y precios justos.",0.0,67,31,08,2021
OCTAVIO ROMERO OROPEZA,"Iztapalapa es el objetivo inicial de la primera etapa, que tendrá por alcance las 16 alcaldías de la Ciudad de México.",0.0,21,31,08,2021
OCTAVIO ROMERO OROPEZA,"Previo a este arranque, el día de hoy tuvimos tres días de prueba con los siguientes resultados:",0.0,17,31,08,2021
OCTAVIO ROMERO OROPEZA,"El viernes 27 de agosto salimos en fase de prueba con 33 camionetas en 33 rutas, ofertamos dos mil ocho cilindros, se vendieron mil 957, lo que equivale al 97 por ciento del volumen ofertado.",0.0,35,31,08,2021
OCTAVIO ROMERO OROPEZA,"El sábado fueron 44 camionetas, cubrimos 48 rutas, dos mil 882 cilindros, se vendieron dos mil 857, que es el 99 por ciento del total de cilindros.",0.0,27,31,08,2021
OCTAVIO ROMERO OROPEZA,"Y el lunes, ayer, 30 de agosto, 62 camionetas salieron a ruta, se cubrieron 68 rutas, fueron cuatro mil 613 cilindros, de los cuales se vendieron cuatro mil 529, es decir, el 98 por ciento.",0.0,35,31,08,2021
OCTAVIO ROMERO OROPEZA,"En promedio, en estos tres días de prueba se ofrecieron nueve mil 503 cilindros, se vendieron nueve mil 343, que es el 98 por ciento del total.",0.0,27,31,08,2021
OCTAVIO ROMERO OROPEZA,"Queremos agradecer a la jefa de Gobierno, Claudia Sheinbaum, y a la alcaldesa de Iztapalapa, Clara Brugada, todo el apoyo que nos han brindado y que nos continuarán dando para la elaboración de las rutas y la difusión de Gas Bienestar.",0.0,41,31,08,2021
OCTAVIO ROMERO OROPEZA,"De la misma manera, agradecer a la Guardia Nacional todo el apoyo brindado en el resguardo de nuestras unidades que transportan los cilindros de Gas Bienestar desde las terminales de distribución de gas en Tepeji, Tula, hacia la Ciudad de México.",0.0,41,31,08,2021
OCTAVIO ROMERO OROPEZA,"En el caso del gobierno de la Ciudad de México adicionalmente agradecemos el apoyo e el acompañamiento de la policía en cada ruta y al H. Cuerpo de Bomberos, quienes ayudaron en la capacitación a choferes y repartidores sobre el manejo de cilindros.",0.0,43,31,08,2021
OCTAVIO ROMERO OROPEZA,"Agradecemos también a la Secretaría de Energía, de Comunicaciones y Transportes, a los órganos reguladores CRE y ASEA, y a las instancias del Gobierno de México que nos apoyaron durante proceso.",0.0,31,31,08,2021
OCTAVIO ROMERO OROPEZA,Muchísimas gracias.,0.0,2,31,08,2021
OCTAVIO ROMERO OROPEZA,"Bueno, les tenemos una pequeña presentación. Esta es la infraestructura existente hoy en día para la empresa Gas Bienestar. Desde luego, la principal infraestructura es el gasoducto que viene desde Cactus hasta Guadalajara pasando por Veracruz, por Puebla, Hidalgo, Guanajuato y hasta Jalisco. Aquí producimos gas LP y lo transportamos hasta Jalisco.",0.0,52,31,08,2021
OCTAVIO ROMERO OROPEZA,"Para el arranque contamos con la siguiente infraestructura en Tula y Tepeji que nos permitirá la demanda inicial, es decir, cuatro llenaderas de andén con capacidad de llenado entre 10 mil y 14 mil cilindros diarios. Estas son las llenaderas, estas son las llenaderas que tenemos en Tula y Tepeji.",0.0,50,31,08,2021
OCTAVIO ROMERO OROPEZA,"La que sigue, por favor. Tenemos un módulo de mantenimiento de cilindros, este es un equipo mucho muy importante, porque nosotros estamos en esta primera fase de salida entregando cilindros nuevos y recogiendo cilindros usados que se rehabilitan en este equipo y más adelante vamos a ver un pequeño video donde se ve a detalle en qué consiste esta rehabilitación.",0.0,60,31,08,2021
