Participante,Texto,Sentimiento,Palabras,Dia,Mes,Anio
ROCIO NAHLE GARCIA," Sí, buenos días.",0.0,3,12,10,2021
ROCIO NAHLE GARCIA,"Nosotros en México producimos la electricidad a través de diferentes fuentes. En este momento, la generación de electricidad a través de hidroeléctricas es del nueve por ciento; sin embargo, la Comisión Federal de Electricidad tiene capacidad hasta para más del 18 por ciento, tan sólo en hidroeléctricas podemos subir un 10 por ciento más.",0.0,54,12,10,2021
ROCIO NAHLE GARCIA,"Nosotros vamos a cumplir con todos los acuerdos que se han firmado: el acuerdo de generar electricidad a través de la energía limpia, el 35 por ciento para el 2024, no tenemos problema para ello. En este momento tenemos el 32 por ciento de la infraestructura instalada para generar energía limpia.",0.0,51,12,10,2021
ROCIO NAHLE GARCIA,"Y la Comisión Federal de Electricidad también, a través de sus plantas, con eficiencia energética, porque también hay que hablar de ese tema, la transición energética no solamente se lleva a cabo con diferentes tecnologías, sino también con la eficiencia energética tanto CFE, Pemex, industrias privadas, están cambiando sus equipos a mayor eficiencia energética.",0.0,54,12,10,2021
ROCIO NAHLE GARCIA,No vamos a tener problema para ello.,0.0,7,12,10,2021
ROCIO NAHLE GARCIA, Los presupuestos.,0.0,2,12,10,2021
