Participante,Texto,Sentimiento,Palabras,Dia,Mes,Anio
OLGA SANCHEZ CORDERO, A las 10:00.,0.32823650481604266,3,10,12,2020
OLGA SANCHEZ CORDERO," Con su venia, señor presidente.",0.32823650481604266,5,10,12,2020
OLGA SANCHEZ CORDERO,Muy buenos días a todas y a todos.,0.32823650481604266,8,10,12,2020
OLGA SANCHEZ CORDERO,"La independencia judicial en México y la protección de los derechos de todos son asuntos en los que, como ustedes saben, he ocupado mi vida personal y profesional. Por ello, tengo en muy alta estima ambos valores y nunca, nunca voy a dejar de lado, me encuentre donde me encuentre. Por eso fui juzgadora por más de dos décadas y me precio de haber conservado una independencia a prueba de todo.",0.32823650481604266,71,10,12,2020
OLGA SANCHEZ CORDERO,"Me precio, igualmente, de haber contribuido con algunos criterios al debate de muchos temas jurídicos; particularmente, el debate de los derechos con una visión garantista. Por eso sé lo valioso que resulta preservarlo.",0.32823650481604266,33,10,12,2020
OLGA SANCHEZ CORDERO,"Digo lo anterior y me disculpo en lo que cabe por el uso de la primera persona, pero también he defendido la indispensable necesidad, y por eso estamos aquí el día de hoy, la imperiosa necesidad de discutir con profundidad los temas que los jueces resuelven de manera razonada y con argumentos.",0.32823650481604266,52,10,12,2020
OLGA SANCHEZ CORDERO,"Por eso es que, a solicitud del señor presidente de la República, recibimos a diversas personas, algunas dedicadas al oficio periodístico, como ustedes, que fueron atendidas desde el mismo día en que fue expuesto en este espacio su caso.",0.32823650481604266,39,10,12,2020
OLGA SANCHEZ CORDERO,"De uno de ellos es que quiero dar cuenta esta mañana. Se trata del señor Rafael, así lo llamaré convencionalmente por su protección de datos personales, hijo de una periodista que aquí expuso su caso.",0.32823650481604266,35,10,12,2020
OLGA SANCHEZ CORDERO,"Antes de hacerlo, quisiera dejar en claro dos cosas:",0.32823650481604266,9,10,12,2020
OLGA SANCHEZ CORDERO,"Que las opiniones que expresaré en este espacio público son a título personal y como servidora pública del gobierno federal, pero las vierto con todo el respeto a la autonomía del Poder Judicial.",0.32823650481604266,33,10,12,2020
OLGA SANCHEZ CORDERO,"Que esta intervención busca sólo fomentar un debate necesario en toda democracia participativa y deliberativa respecto de aspectos relevantes de la vida pública, como son los procesos judiciales y la participación de abogados y jueces en ellos.",0.32823650481604266,37,10,12,2020
OLGA SANCHEZ CORDERO,"Dicho lo anterior, trataré de ser breve en exponer algunos pormenores del asunto, que se pueden extraer de la información a la que hemos tenido acceso.",0.32823650481604266,26,10,12,2020
OLGA SANCHEZ CORDERO,"En 2008, Rafael fue detenido en Valle de Bravo, donde se le aseguraron armas de uso exclusivo del Ejército, Armada y Fuerza Aérea, así como droga. Tras esa detención, fue acusado por los delitos de delincuencia organizada y portación de arma de fuego de uso exclusivo del Ejército, Armada y Fuerza Aérea.",0.32823650481604266,52,10,12,2020
OLGA SANCHEZ CORDERO,"En 2013 se le dictó sentencia, imponiéndole un total de 17 años de prisión y el pago de 350 días de multa, misma que, revisada con posterioridad, quedó reducida a 16 años.",0.32823650481604266,32,10,12,2020
OLGA SANCHEZ CORDERO,"Posteriormente promovió un incidente conocido como incidente de simultaneidad de penas, por virtud del cual el órgano jurisdiccional que conoció del asunto determinó descontar el tiempo de prisión preventiva que había compurgado hasta entonces por ambos delitos.",0.32823650481604266,37,10,12,2020
OLGA SANCHEZ CORDERO,"Dicha resolución fue impugnada por la fiscalía, pero fue confirmada por un tribunal unitario y con ello la pena de prisión quedó determinada en 10 años computables a partir de la fecha de su detención.",0.32823650481604266,35,10,12,2020
OLGA SANCHEZ CORDERO,"En posteriores recursos, uno de los cuales llegó al conocimiento de la Suprema Corte, se llevaron a cabo distintas alegaciones que concluyeron en la determinación de la incorrección de los tribunales acerca del alegato de tortura.",0.32823650481604266,36,10,12,2020
OLGA SANCHEZ CORDERO,"La Suprema Corte consideró que esto debía haber sido revisado por los tribunales colegiados y el unitario y el juez de distrito, y le ordenó revisar y ordenó volver a analizar este alegato de la tortura a la luz de la doctrina constitucional que durante años la Corte ha venido construyendo, inclusive cuando yo integraba la Suprema Corte.",0.32823650481604266,58,10,12,2020
OLGA SANCHEZ CORDERO,"Esto tuvo como consecuencia la reposición de procedimiento con un efecto en la libertad del sentenciado, quien, de no haber mediado esta resolución, por supuesto ya en este momento podría haber alcanzado su libertad.",0.32823650481604266,34,10,12,2020
OLGA SANCHEZ CORDERO,"Hace poco, su defensa promovió una petición urgente de libertad, misma que fue negada, aduciendo que no existía sentencia firme que estableciera el quantum de la pena y que por esta razón no se podía acordar favorablemente esta petición.",0.32823650481604266,39,10,12,2020
OLGA SANCHEZ CORDERO,"Aquí me detengo un minuto para señalar un par de cuestiones que en derecho son siempre debatibles, dos posturas divergentes que subrayan la necesidad de este debate que hoy propongo:",0.32823650481604266,30,10,12,2020
OLGA SANCHEZ CORDERO,"La posición de una visión formalista del derecho contra una visión garantista que ponga, por delante de los formalismos, pero siempre de las mismas reglas del derecho, argumentos más dúctiles que favorezcan los derechos de las personas.",0.32823650481604266,37,10,12,2020
OLGA SANCHEZ CORDERO,"Esta postura, recogida de algún modo en el artículo 1º constitucional, otorga la posibilidad al derecho de practicar la justicia y no los meros formalismos.",0.32823650481604266,25,10,12,2020
OLGA SANCHEZ CORDERO,¿A qué voy?,0.32823650481604266,3,10,12,2020
OLGA SANCHEZ CORDERO,"A que en el caso concreto la consideración, desde luego ajustada a derecho, desde un cierto ángulo interpretativo de que la pena, por virtud del interlocutor que resolvió el incidente de simultaneidad, quedó reducida a 10 años aproximadamente, es el criterio que debería de haber privado, pues incide directamente sobre la libertad del sentenciando y no aquel el que considera como inexistente la sentencia que lo determinó por haber sido dejado sin efecto en virtud de la revisión constitucional.",0.32823650481604266,79,10,12,2020
OLGA SANCHEZ CORDERO,"En esa virtud y bajo un orden de ideas, una visión muy estricta, la sentencia quedó sin efectos y con ello la determinación de cuántos debía pasar en prisión; pero desde otra visión menos formalista, se lograría que, con la reposición del procedimiento, no le impusieran una pena mayor a la que ya había obtenido y que había compurgado conforme al incidente de simultaneidad y penas.",0.32823650481604266,66,10,12,2020
OLGA SANCHEZ CORDERO,"Una cuestión jurídica debatible ciertamente, pero fáctica, indubitable, es que ya ha pasado más tiempo en prisión del que había determinado una sentencia interlocutoria; es decir, esta persona prácticamente -o no prácticamente- ya había compurgado toda la pena de la sentencia interlocutoria y hoy, por la reposición del procedimiento y por la decisión de los jueces de que ya no existía esa sentencia, sigue en prisión y privado de su libertad.",0.32823650481604266,71,10,12,2020
OLGA SANCHEZ CORDERO,"Esto, porque el tribunal de alzada precisó en la inteligencia que, de reiterarse la sentencia de condena, atenta al principio de non reformatio impetus, no reformar para peor, no podría agravarse el sentenciado su condición; es decir, que, de dictarse otra sentencia condenatoria, esta no debería imponerle más pena de la que ya fue impuesta.",0.32823650481604266,55,10,12,2020
OLGA SANCHEZ CORDERO,"Soy consciente de que en derecho las cuestiones interpretativas son difíciles de dirimir de manera definitiva, pero también estoy convencida de que es posible buscar alternativas dentro del derecho que favorezcan situaciones justas que tutelen con mayor eficacia los derechos.",0.32823650481604266,40,10,12,2020
OLGA SANCHEZ CORDERO,"Creo que la Suprema Corte, con estos criterios en los que yo participé, resolvió adecuadamente en el sentido de que esta persona… Que se investigara la tortura, porque esta persona alega, incluso ya se le habían practicado los protocolos de Estambul, alega haber sido torturada.",0.32823650481604266,45,10,12,2020
OLGA SANCHEZ CORDERO,"Así que, para cumplir con la instrucción presidencial, se dio atención al caso que hoy comento en la Secretaría de Gobernación por distintas áreas de la Subsecretaría de Derechos Humanos -aquí presente el señor subsecretario Alejandro Encinas- llegando a la conclusión de que se traten asuntos que se encuentran en conocimiento de órganos jurisdiccionales y con el respeto que he antepuesto y que siempre voy a defender a la autonomía y a la independencia de los jueces, simplemente he puesto en el contexto de ustedes.",0.32823650481604266,85,10,12,2020
OLGA SANCHEZ CORDERO,"Con esto, señor presidente, le informo que desde el primer día hemos dado cumplimiento a su instrucción de atender y que desde esta tribuna pública hacemos un llamado al Poder Judicial a agilizar el trámite de solución, no de este caso en particular, sino de todos los asuntos en los cuales la demora en la impartición de justicia esté trayendo como consecuencia la afectación de un derecho tan importante como la libertad personal.",0.32823650481604266,73,10,12,2020
OLGA SANCHEZ CORDERO,"Sirva esta interpretación para hacer también un llamado a dejar muy claro que el papel de los abogados es muy importante, sobre todo en los procesos penales, y que debe ser mejorado en muchos sentidos, principalmente en el aspecto de la calidad de las estrategias y argumentos que se vierten ante los jueces.",0.32823650481604266,53,10,12,2020
OLGA SANCHEZ CORDERO,"Debemos estar muy pendientes de todas las voces que claman justicia en el pueblo de México. Este ejercicio propositivo sólo tiene por objeto generar un debate democrático sobre cuestiones esenciales para cualquier democracia, como son los debates sobre las sentencias de los juzgadores.",0.32823650481604266,43,10,12,2020
OLGA SANCHEZ CORDERO,"Muchas gracias, señor presidente.",0.32823650481604266,4,10,12,2020
OLGA SANCHEZ CORDERO," ¿Me permite, señor presidente?",0.32823650481604266,4,10,12,2020
OLGA SANCHEZ CORDERO," De verdad que el asunto que nos trae aquí la mamá de Rafael es verdaderamente una injusticia por todos lados por los que se vea, porque la reposición del procedimiento es precisamente para investigar la tortura y ya hay cuatro protocolos de Estambul que determinaron que efectivamente fue torturado.",0.32823650481604266,49,10,12,2020
OLGA SANCHEZ CORDERO,"Entonces, es paradójico que, por una parte, ya estuvo 10 años cumpliendo la sentencia del incidente, ahora tiene 13 años privado de su libertad y ya las sentencias son inexistentes en virtud de la revocación que ese hizo para reponer el procedimiento.",0.32823650481604266,42,10,12,2020
OLGA SANCHEZ CORDERO,"La respuesta, presidente, es la siguiente:",0.32823650481604266,6,10,12,2020
OLGA SANCHEZ CORDERO,"El indulto procede cuando hay sentencias definitivas. En este momento todas las sentencias son inexistentes por la reposición del procedimiento. Entonces, ahí sí estamos en un tema.",0.32823650481604266,27,10,12,2020
OLGA SANCHEZ CORDERO,"  Estamos tratando de ver, porque estamos muy de la mano con la Defensoría Pública. La Secretaría de Gobernación y la Defensoría Pública del Poder Judicial en muchas ocasiones están coordinándose precisamente en los casos, pero el caso de este muchacho es verdaderamente una tragedia jurídica, presidente, no hay sentencias.",0.32823650481604266,49,10,12,2020
OLGA SANCHEZ CORDERO,"Entonces, si me permite, vamos a ver cuáles alternativas tenemos. El indulto procede únicamente con sentencia definitiva.",0.32823650481604266,17,10,12,2020
OLGA SANCHEZ CORDERO,"Entonces, déjeme analizar y con muchísimo gusto traemos una respuesta a la señora. Y desde luego estamos viendo todas las posibilidades jurídicas para obtener la libertad de su hijo.",0.32823650481604266,29,10,12,2020
OLGA SANCHEZ CORDERO," Presidente ¿me permite? Yo creo que, con el tema de tortura, presidente, un juez sensible le otorgaría la libertad de inmediato, con los protocolos de Estambul, se lo otorgaría de inmediato.",0.32823650481604266,31,10,12,2020
OLGA SANCHEZ CORDERO," Yo creo que la principal reparación es la justicia misma, la principal reparación y por supuesto en un momento determinado la calidad de víctima por un proceso penal verdaderamente adverso y, digamos, violentado o que violenten los derechos humanos de la forma en que se ha violentado podría tener esta calidad de víctima, y podría ser obviamente además una persona que pudiera tener derecho a la reparación y a la indemnización inclusive.",0.32823650481604266,72,10,12,2020
OLGA SANCHEZ CORDERO,Pero lo que sí es cierto es que yo creo que la principal reparación es precisamente que se le brinde justicia a una persona y esa todavía no podemos cantar victoria en esa relación.,0.32823650481604266,34,10,12,2020
OLGA SANCHEZ CORDERO,"Pero sí quieres también, Alejandro, que estábamos comentando.",0.32823650481604266,8,10,12,2020
