Participante,Texto,Sentimiento,Palabras,Dia,Mes,Anio
RICARDO SHEFFIELD PADILLA," Buenos días, señor presidente. Muchas gracias. Buenos días a todas y a todos ustedes.",0.0,14,02,10,2023
RICARDO SHEFFIELD PADILLA,"‘Quién es quién en el precio de los combustibles’. La gasolina regular la semana pasada estuvo a 22 pesos 55 centavos el litro y ustedes pueden constatar lo que señaló el señor presidente, una estabilidad ya por muchos meses, años, en estos precios donde sólo ha aumentado el índice inflacionario, incluso por abajo del índice inflacionario; 24 pesos con 69 centavos la Premium y 24 pesos el diésel.",0.0,68,02,10,2023
RICARDO SHEFFIELD PADILLA,"El precio internacional muy presionado, andan muy locos en el mercado internacional, otra vez a la alza, corte 28 de septiembre, 88 dólares 12 centavos de dólar el barril de la mezcla mexicana del petróleo, pero funcionando muy bien el incentivo fiscal, que esta semana es del 47.2 por ciento para la regular, 26.1 por ciento para la Premium y 57.1 por ciento para el diésel.",0.0,66,02,10,2023
RICARDO SHEFFIELD PADILLA,"Las tres marcas más careras la semana pasada fue Petro SevenWindstar y Chevron, mientras que las tres aliadas de los consumidores fueron Repsol, BP y ExxonMobil.",0.0,26,02,10,2023
RICARDO SHEFFIELD PADILLA,"Vamos a ver ya a nivel de cada estación de servicio, de cada gasolinera y el margen que cobran. En el caso de la gasolina regular Petro Seven, en Saltillo, Coahuila, con un precio al público de 24 pesos 76 centavos, muy, muy caro, son los más pasados de rosca de todo México, otra vez, cuatro pesos 25 centavos de margen, es una verdadera exageración, compárenlo con los 23 centavos de margen de franquicia Pemex en la Unión de San Isidro Montes de Oca, en Guerrero, 21 pesos 44 centavos el litro, una gran diferencia.",0.0,95,02,10,2023
RICARDO SHEFFIELD PADILLA,"En el caso de la Premium, el precio más alto, con el margen más alto, tocó a una de franquicia Pemex, en Monterrey, Nuevo León, un precio al público de 26 pesos 89 centavos, un margen de dos pesos 50 centavos, mientras que G500 es el que tiene el mejor precio y el menor margen en Tampico, Tamaulipas, un precio al público de 23 pesos 18 centavos el litro, un margen de 19 centavos. Esta información nos empodera y además la tienen ustedes en la app de Litro por Litro para decidir dónde nos conviene comprar el combustible, quiénes son aliados de los consumidores.",0.0,104,02,10,2023
RICARDO SHEFFIELD PADILLA,"En el caso del diésel, Corpogas, en Cancún, Quintana Roo, con un precio al público de 25 pesos 47 centavos, tiene un margen de dos pesos 90 centavos, comparado con el margen de 19 centavos de franquicia Pemex, en Tuxtla Gutiérrez, Chiapas, un precio al público de 23 pesos 69 centavos.",0.0,51,02,10,2023
RICARDO SHEFFIELD PADILLA,"Recibimos a través de esa app de Litro por Litro, que pueden bajar en Android y en iOS, 215 denuncias o quejas, de las cuales atendimos con 314 visitas o verificaciones. Tuvimos una gasolinera que no se dejó colocar los sellos, esto fue en Catemaco, en Veracruz; ya nos andaban echando allá a los brujos, pero ya volveremos muy pronto para poder terminar ese proceso. Y también no se dejó colocar sellos una gasolinera, allá de mis paisanos en San José Iturbide, Guanajuato.",0.0,83,02,10,2023
RICARDO SHEFFIELD PADILLA,"También seguimos revisando los servicios sanitarios que estén limpios, que de preferencia no los cobren, les den un adecuado mantenimiento.",0.0,20,02,10,2023
RICARDO SHEFFIELD PADILLA,"Vamos a ver ahora en el gas LP, el corte 27 de septiembre, el precio internacional lo convertimos a pesos y lo convertimos a kilos y es de 21 pesos con dos centavos, mientras que el promedio para cilindros de gas en todo el país, el promedio fue de 17 pesos 94 centavos, esto en los cilindros da incluso por debajo de los 400 pesos que ya lleva varios meses el cilindro de 20 kilos en los 400 pesos; en esta ocasión, la semana pasada incluso por abajo el promedio de esos 400 pesos.",0.0,94,02,10,2023
RICARDO SHEFFIELD PADILLA,"Y ese mismo día, convirtiéndolo a litros y a pesos, fue de 11 pesos con 39 centavos el promedio de las 220 regiones, y esto es para cilindros de gas que tuvo el promedio nacional en nueve pesos 71 centavos.",0.0,40,02,10,2023
RICARDO SHEFFIELD PADILLA,"Realizamos 928 visitas o verificaciones, todos cumpliendo perfectamente con el respeto al precio máximo, que es un esquema que ha funcionado muy bien ya por un tiempo largo. Yy hay aun así quien da por debajo de ese precio máximo, aliados de los consumidores que los encontramos en Zacatecas, en Jalisco, en Coahuila, en Tamaulipas, en Hidalgo, en Guerrero, en Guanajuato, en el Estado de México, ahora muchos aliados del consumidor en muchos estados. Un ejemplo de ello, Aure Gas, en Morelos, Zacatecas, tiene un precio al público de nueve pesos 76 centavos el litro, cuando el precio máximo es de 10 pesos 64 centavos, casi un peso por abajo del precio máximo, muy bien por ellos.",0.0,117,02,10,2023
RICARDO SHEFFIELD PADILLA,"Y también en cilindros de gas tenemos ejemplos de aliados de los consumidores en Morelos, en Yucatán, en Guerrero, en Jalisco, en el Estado de México, en Chihuahua, en Guanajuato. Ejemplo de ello, Gas Modelo, en Coatlán del Río, Morelos, 16 pesos 98 centavos el kilo, el precio máximo 17 pesos 73 centavos, más de 50 centavos por abajo del precio máximo por kilo.",0.0,64,02,10,2023
RICARDO SHEFFIELD PADILLA,"Realizamos esas 928 verificaciones, inmovilizamos dos vehículos que no estaban calibrados, un instrumento para pesar los cilindros y 2.3 por ciento de cilindros en mal estado que se retiraron del mercado.",0.0,31,02,10,2023
RICARDO SHEFFIELD PADILLA,"Vamos a ver ahora los 24 productos que más consumen las familias mexicanas en nuestro país. Tenemos que el Índice Nacional de Precios al Consumidor para Bebidas y Alimentos tuvo un muy ligero aumento; sin embargo, el precio máximo y mínimo de los 24 productos, gracias al trabajo y la alianza de los distribuidores y de los fabricantes de estos 24 productos, se mantiene con una ligera tendencia a la baja. Vamos a verlo por regiones.",0.0,76,02,10,2023
RICARDO SHEFFIELD PADILLA,"En la zona centro Walmart, en Naucalpan, en el Estado de México, tiene el precio más alto, mil 25 pesos con 70 centavos, mientras que los mismos 24 productos en Mega Soriana, en Coacalco, en el Estado de México, tienen el precio más bajo, 860 pesos.",0.0,46,02,10,2023
RICARDO SHEFFIELD PADILLA,"En la zona centro norte, Walmart, en Zacatecas, Zacatecas, tiene el paquete en mil 31 pesos con 40 centavos, mientras que Soriana, en Culiacán, Sinaloa, lo tiene en 862 pesos con 70 centavos.",0.0,33,02,10,2023
RICARDO SHEFFIELD PADILLA,"El precio más alto en la zona norte es también de Walmart, en Tijuana Baja California, mil 12 pesos con 30 centavos, mientras que el más bajo se de Soriana, en Chihuahua, Chihuahua, a 810 pesos con 50 centavos.",0.0,39,02,10,2023
RICARDO SHEFFIELD PADILLA,"Por último, en la zona sur sureste, Walmart tiene el precio más alto en Oaxaca, Oaxaca, mil 30 pesos con 85 centavos, vean ustedes, aún ahí está por debajo de los mil 39; y Soriana tiene el precio más bajo de la zona sur, sureste que está en Boca del Río, Veracruz, 805 pesos con 80 centavos.",0.0,57,02,10,2023
RICARDO SHEFFIELD PADILLA,"Cada semana estamos visitando físicamente las tiendas y vamos a ver los productos para poderles empoderar a todas y a todos ustedes como consumidores con los mejores precios, igual que hacemos cada semana en las gasolineras y en los expendedores de gas LP.",0.0,43,02,10,2023
RICARDO SHEFFIELD PADILLA,"Por eso, en esta ocasión toca hacer la premiación a quienes obtuvieron el mejor lugar en cuanto a precio a nivel nacional. Esto es una estación específica, una gasolinera específica, que en el caso de bajo octanaje, en este trimestre para la gasolina regular lo tiene Servifácil, de Tuxtla Gutiérrez, Chiapas, viene representado por Roberto García-Velarde Martín del Campo, gerente comercial de Servifácil, y lo invitamos a que reciba este reconocimiento de manos del señor presidente. Y ojalá se ponga más dura todavía la competencia.",0.0,85,02,10,2023
RICARDO SHEFFIELD PADILLA,(ENTREGA DE PREMIO),0.0,3,02,10,2023
RICARDO SHEFFIELD PADILLA, Muy bien por ser aliados de los consumidores.,0.0,8,02,10,2023
RICARDO SHEFFIELD PADILLA,"Y ahora en lo que toca al combustible Premium, al de alto octanaje. Quien dio en el trimestre el mejor precio promedio en todo México, eso quiere decir que mantuvo el menor margen, no sólo aplicó el incentivo, sino hasta le bajó poquito de ahí, fue “Tauro”, una gasolinera en Durango, Durango, y el precio fue de 24 pesos 76 centavos el promedio de la Premium.",0.0,66,02,10,2023
RICARDO SHEFFIELD PADILLA,"Viene Valeria Karina Campos Reyes representando a esta gasolinera, es la gerente operativa. Bienvenida. Felicidades. Gracias por ser aliada de los consumidores.",0.0,22,02,10,2023
RICARDO SHEFFIELD PADILLA,(ENTREGA DE PREMIO),0.0,3,02,10,2023
RICARDO SHEFFIELD PADILLA," Y ahora para el diésel fue una gasolinera en Pánuco, Veracruz, de la franquicia Pemex, su promedio de precio en el trimestre fue de 23 pesos con 26 centavos el litro. Viene representando a esta de franquicia Pemex su gerente de Operaciones, Rafael Loya Torres. Gracias por ser aliado de los consumidores en el diésel. Felicidades.",0.0,56,02,10,2023
RICARDO SHEFFIELD PADILLA,(ENTREGA DE PREMIO),0.0,3,02,10,2023
RICARDO SHEFFIELD PADILLA," Y en el caso de los 24 productos de la canasta básica, muy dura la competencia, qué bueno por todos nosotros como consumidores que se haya puesto dura la competencia, eso es bueno, eso es lo que hace que vayan bajando los precios y que sean aliados de los consumidores en este trimestre que concluye, el aliado de los consumidores, se los voy a decir después de leer el tercero y el segundo lugar, dura la pelea.",0.0,77,02,10,2023
RICARDO SHEFFIELD PADILLA,"El tercer lugar fue de Bodega de Aurrera, su precio promedio en el trimestre, 884 pesos para los 24 productos.",0.0,20,02,10,2023
RICARDO SHEFFIELD PADILLA,"El segundo lugar fue para Chedraui, 867 pesos con 48 centavos.",0.0,11,02,10,2023
RICARDO SHEFFIELD PADILLA,"Y el primer lugar, con una diferencia de menos del uno por ciento, muy bien, aliados de los consumidores en este trimestre, Soriana, 861 pesos con 50 centavos. Viene de parte de Soriana su director de Precios, Luis Fernando Tatay Fidalgo.",0.0,41,02,10,2023
RICARDO SHEFFIELD PADILLA,Bienvenido y gracias por ser aliados de los consumidores.,0.0,9,02,10,2023
RICARDO SHEFFIELD PADILLA,(ENTREGA DE PREMIO),0.0,3,02,10,2023
RICARDO SHEFFIELD PADILLA, Con esto concluimos. Y se empieza el nuevo trimestre.,0.0,9,02,10,2023
RICARDO SHEFFIELD PADILLA,Muchas gracias. Buen día.,0.0,4,02,10,2023
