Participante,Texto,Sentimiento,Palabras,Dia,Mes,Anio
PRESIDENTE ANDRES MANUEL LOPEZ OBRADOR, Muy buenos días.,0.9593118401950588,3,04,09,2019
PRESIDENTE ANDRES MANUEL LOPEZ OBRADOR,"Vamos a escuchar el planteamiento de Alejandro Encinas acerca de la liberación de un presunto implicado en la desaparición de los jóvenes de Ayotzinapa que dejaron en libertad. Ayer que me preguntaron sobre este tema, dijimos que hoy se iba a informar.",0.01359341829310659,42,04,09,2019
PRESIDENTE ANDRES MANUEL LOPEZ OBRADOR,"Entonces, le damos la palabra a Alejandro.",0.3685829890184419,7,04,09,2019
ALEJANDRO ENCINAS RODRIGUEZ," Con su autorización, señor presidente.",0.42593460805528316,5,04,09,2019
ALEJANDRO ENCINAS RODRIGUEZ,Muy buenos días tengan todas y todos ustedes.,0.9062130058864615,8,04,09,2019
ALEJANDRO ENCINAS RODRIGUEZ,"Como ya es del dominio público, el pasado 30 de agosto el juez 1º de Distrito en Procesos Penales Federales de Tamaulipas, el juez Samuel Ventura Ramos a través de la secretaria de acuerdos de este juzgado dictó una sentencia absolutoria en favor de Gildardo López Astudillo conocido como ‘el Gil’, quien es reconocido que operaba como jefe de la plaza de Guerreros Unidos en la ciudad de Iguala al momento de la desaparición de los 43 estudiantes de Ayotzinapa.",0.0004312682555107359,80,04,09,2019
ALEJANDRO ENCINAS RODRIGUEZ,"El juez determinó que no existían elementos para acreditar el delito de delincuencia organizada, desestimó 44 pruebas en contra de López Astudillo que buscaban acreditar el delito de secuestro, se circunscribió solamente analizar 162 de los 791 tomos que forman parte de la averiguación y consideró que se había aplicado el delito de tortura, a pesar de la Procuraduría General de la República de entonces realizó el examen médico psicológico reconocido como Protocolo de Estambul, donde se acreditó que no había sido torturado, aunque hay que reconocer que faltó todavía hacer en este protocolo la prueba de audiometría.",0.0010903914365608608,98,04,09,2019
ALEJANDRO ENCINAS RODRIGUEZ,"Este es un precedente muy grave, es una sentencia absolutoria de uno de los principales perpetradores del delito de la desaparición forzada.",0.08441231564071967,22,04,09,2019
ALEJANDRO ENCINAS RODRIGUEZ,"Lamentablemente no es el único caso, sino que además de que sentará precedente para que se pueda establecer sentencias absolutorias a los demás implicados, viene a fortalecer una tendencia que ya se había venido registrando con la libertad de otros detenidos en el caso de Ayotzinapa.",0.010551699568839158,46,04,09,2019
ALEJANDRO ENCINAS RODRIGUEZ,"Vamos a hacer rápido una recapitulación. Ustedes recordarán como entre el 26 de septiembre de 2014 y el 30 de agosto del 2018 se consignaron a 169 personas, de las cuales fueron detenidas 142, particularmente civiles vinculados al cártel de Guerreros Unidos de la región, así como policías municipales de Iguala y de Cocula.",0.11744154076297722,54,04,09,2019
ALEJANDRO ENCINAS RODRIGUEZ,"Los delitos fundamentales que se les fincaron entonces fue el de delincuencia organizada vinculada con delitos a la salud, los delitos previstos en la Ley Federal de Armas y Fuegos y el de la Ley de Secuestro.",0.05612683642449904,37,04,09,2019
ALEJANDRO ENCINAS RODRIGUEZ,"De las 142 personas detenidas, la Procuraduría General de la República entonces procesó a 70 personas por el delito de secuestro a los normalistas; sin embargo, a lo largo de estos años el proceso judicial que han seguido estos detenidos, que se había basado en 107 pruebas recabadas por distintas averiguaciones previas, el día de hoy solamente subsisten como pruebas 44 de las 107. y vale la pena destacar que son fundamentalmente detenciones que han ido excluyendo de las pruebas las detenciones de falsa flagrancia, se ha desestimado la comisión en 22 detenciones ilegales por forma irregular, en 29 casos de tortura y distintos casos de violación indebida en la puesta a disposición.",0.027301831935614692,113,04,09,2019
ALEJANDRO ENCINAS RODRIGUEZ,¿Qué ha significado esto?,0.541333260777616,4,04,09,2019
ALEJANDRO ENCINAS RODRIGUEZ,Que a la fecha han sido liberados 53 presuntos delincuentes de los 142 detenidos; y ahora con el precedente de la libertad ya absolutoria de Gildardo López Astudillo existen los elementos para que la autoridad judicial pueda liberar a otros 50 detenidos en este proceso.,0.0031918670106535776,45,04,09,2019
ALEJANDRO ENCINAS RODRIGUEZ,¿Qué implica esto? ¿Qué evidencia esto?,0.20980980398309176,6,04,09,2019
ALEJANDRO ENCINAS RODRIGUEZ,"Particularmente una indebida integración de la investigación por parte de las autoridades ministeriales basadas en irregularidades y graves violaciones a la ley. Hay que decirlo con toda claridad, la mal llamada verdad histórica se construyó con base en la simulación, en la fabricación de pruebas, en la tortura, en beneficio de los perpetradores y en contra del derecho de las víctimas.",0.018299891767136655,61,04,09,2019
ALEJANDRO ENCINAS RODRIGUEZ,"Habiendo elementos claros y suficientes para fincar y deslindar responsabilidades por los delitos cometidos, la actuación indebida de la autoridad judicial ha generado condiciones para que con una muy laxa interpretación de la ley se puedan retirar los cargos que se le imputaron a los detenidos.",0.0004799646691079712,46,04,09,2019
ALEJANDRO ENCINAS RODRIGUEZ,"Y también esto implica una revisión profunda de los criterios judiciales que tienen que aplicarse. Y aquí debe tomarse en consideración que la aplicación de la justicia no puede reducirse solamente a la interpretación de la ley, se trata de impartir justicia, no de interpretar la ley, y debe prevalecer siempre el interés superior del derecho de las víctimas por encima del derecho de los victimarios. Yo creo que son de los temas fundamentales que tenemos que definir.",0.015568455431409207,78,04,09,2019
ALEJANDRO ENCINAS RODRIGUEZ,"Y podemos hacer el día de hoy un exhorto a la Fiscalía General de la República para que reencauce la investigación, subsane las omisiones y permita una investigación diligente para poder deslindar las responsabilidades que se cometieron por parte de autoridades o civiles en esta desaparición.",0.005098016971490859,46,04,09,2019
ALEJANDRO ENCINAS RODRIGUEZ,"Y queremos anunciar que, por instrucciones del presidente de la República, iniciaremos ante la Fiscalía General de la República y el Consejo de la Judicatura federal los recursos legales correspondientes para que se inicie la investigación de los funcionarios de la Fiscalía General de la República y de los jueces en el caso del Poder Judicial federal, para deslindar las responsabilidades en estos casos, donde en lugar de garantizar el derecho a la verdad y la justicia a las víctimas, se está generando un pacto que favorecerá al silencio y la impunidad en la comisión de este delito.",0.0006514324178502971,98,04,09,2019
ALEJANDRO ENCINAS RODRIGUEZ,"Por parte de la Comisión Presidencial por la Verdad y la Justicia en el caso de Ayotzinapa, seguiremos haciendo las investigaciones y diligencias que están en proceso, pero requerimos que la autoridad judicial y la Fiscalía General de la República hagan su trabajo y no permitan que estos hechos queden impunes.",0.010794134108896849,51,04,09,2019
ALEJANDRO ENCINAS RODRIGUEZ,"Es cuanto, señor presidente.",0.01045651494289542,4,04,09,2019
PRESIDENTE ANDRES MANUEL LOPEZ OBRADOR," Bueno, sobre este tema, si tienen algo que…",0.7510323499244054,8,04,09,2019
PREGUNTA," Buenos días a todos. Alberto Morales, del periódico El Universal.",0.5879999147696473,10,04,09,2019
PREGUNTA,"Subsecretario, para preguntarle si en este reencauzamiento y en estas investigaciones que está pidiendo tanto a la visitaduría, como al Consejo de la Judicatura, se incluye, por ejemplo, en la parte de la PGR al quién fue su titular y también a quién llevó la investigación, a Tomas Zerón y a Jesús Murillo Karam.",0.02525256912960589,54,04,09,2019
ALEJANDRO ENCINAS RODRIGUEZ," Sí, hay que recordar que ya la visitaduría de la propia Fiscalía General de la República inició un procedimiento contra Tomás Zerón por haber actuado indebidamente en todo el proceso de investigación del caso de Ayotzinapa, y esto derivará sin lugar a dudas en el fincamiento y deslinde de responsabilidades, no solamente contrario, sino con los funcionarios que resulten responsables de haber alterado el debido proceso en esta investigación.",0.004062392826945499,69,04,09,2019
PREGUNTA," Buenos días. Antonio López, del periódico La Razón.",0.3594842063541949,8,04,09,2019
PREGUNTA,"Preguntarle, subsecretario. La CNDH en su último informe había señalado que ocho personas fueron torturadas, de esas ocho personas, ‘el Gil’; Gabriel León Villa ‘el Gaby’; y Felipe Rodríguez Salgado fueron liberados.",0.009013243409427121,32,04,09,2019
PREGUNTA,"Cuando la CNDH da a conocer ese informe, la PGR, la entonces PGR dice que de esas ocho personas solo una había sido torturada; sin embargo, de esas ocho, tres ya fueron liberadas.",0.002340666858457319,33,04,09,2019
PREGUNTA,"¿Esto sienta precedente -tal como usted lo dijo- para que estas, las cinco personas que aún permanecen detenidas puedan quedar en libertad? Eso por una parte.",0.3393694754416378,26,04,09,2019
PREGUNTA,"Y también preguntarle si el motivo principal de la liberación fueron estos actos de tortura; además estas ocho personas es una parte, porque hay 28 más que de acuerdo con esta investigación recibieron tratos crueles e inhumanos.",0.04428563955739301,37,04,09,2019
PREGUNTA,¿Por esta fincación de responsabilidades a través de tortura podrían quedar en libres también estas personas?,0.31513798472475807,16,04,09,2019
PREGUNTA,Gracias.,0.441790940003079,1,04,09,2019
ALEJANDRO ENCINAS RODRIGUEZ," No solamente esas cinco personas, sino las 50 que actualmente se encuentran bajo proceso; y no solamente por el delito de tortura, porque lo que estimó el juez fundamentalmente fueron las pruebas que lo vinculaban a los delitos de delincuencia organizada y secuestro.",0.09603248901477704,43,04,09,2019
ALEJANDRO ENCINAS RODRIGUEZ,Ese es el tema fundamental.,0.7789531588643839,5,04,09,2019
PREGUNTA," Gracias, para consultar directamente si el fincamiento de responsabilidades va a alcanzar a Jesús Murillo Karam, por un lado.",0.718892619819683,19,04,09,2019
PREGUNTA,"Y por otro, si el riesgo de liberación de más involucrados en el caso Ayotzinapa incluye al exalcalde de Iguala, Abarca.",0.012929164326665793,21,04,09,2019
ALEJANDRO ENCINAS RODRIGUEZ," En el caso de Abarca hay que recordar que el delito por el que está él detenido y procesado es fundamentalmente por el homicidio de Arturo Hernández Cardona, quien fuera síndico municipal en Iguala y no necesariamente por los vínculos con la desaparición de los 43 estudiantes.",0.06977870953003311,47,04,09,2019
PREGUNTA, ¿No habría riesgo de que saliera?,0.6023237969653191,6,04,09,2019
ALEJANDRO ENCINAS RODRIGUEZ," En este caso, hasta ahora no hay ningún indicio de los que tenemos referentes de las 50 personas que pudieran tener alguna circunstancia de posible liberación por esta interpretación indebida de la ley.",0.023636189577220815,33,04,09,2019
ALEJANDRO ENCINAS RODRIGUEZ,"Y en el otro caso, por supuesto que en el momento que se acrediten, no solamente las violaciones al debido proceso, sino la fabricación o sembrado de pruebas en la formulación de la verdad histórica, va a alcanzar a todos los responsables de este dictamen que emitió la procuraduría.",0.04452939057986619,49,04,09,2019
PREGUNTA," Buenos días, presidente; buenos días, subsecretario.",0.16127788990933117,6,04,09,2019
PREGUNTA,"Se dice que Tomás Zerón tiene actualmente camionetas blindadas, escoltas a su servicio, al igual que sus familiares, usted acaba de decir que también se podría tener ahí un alcance de la justicia.",0.17848313737553997,33,04,09,2019
PREGUNTA,¿Esto es cierto? Y si se le van a quitar esos servicios que obviamente estamos pagando los mexicanos.,0.09456556380377248,18,04,09,2019
ALEJANDRO ENCINAS RODRIGUEZ," La información que tenemos es: se le ha brindado un amparo para que se le mantenga esa protección, que deriva de una disposición reglamentaria para los servidores que ocuparon cargos de riesgo en la Procuraduría General de la República. El fiscal ordenó el retiro de esos servicios de escolta y de protección; sin embargo, un juez lo ha amparado par que se mantengan.",0.020328289539232096,63,04,09,2019
PREGUNTA, Gracias. Buenos días.,0.841655765462777,3,04,09,2019
PREGUNTA,"Preguntarle, subsecretario. ¿Hasta este momento qué tanto se parece la verdad histórica que sostuvo Murillo Karam a lo que ustedes han indagado respecto de lo que pasó con los muchachos? ¿Dónde están?",0.196806187910986,32,04,09,2019
PREGUNTA,"Hay revelaciones importantes, entiendo que son investigaciones que pertenecen también a la fiscalía, pero ¿hay hallazgos importantes que se alejan de esa verdad histórica?, aunque me no me dé el detalle.",0.5082562801097337,31,04,09,2019
ALEJANDRO ENCINAS RODRIGUEZ," No hay ninguna identidad con la llamada verdad histórica, los puntos de partida y de líneas de investigación son diametralmente distintos; y la verdad histórica choca con la propia realidad, la realidad que estamos viviendo con esta impunidad que se está brindando a los victimarios.",0.3628297472723244,45,04,09,2019
PREGUNTA, Se decía mucho en el pasado que habían participado elementos militares en la desaparición de los muchachos.,0.6972595294646504,17,04,09,2019
PREGUNTA,¿Esto se cae por sí solo?,0.2654752982411013,6,04,09,2019
ALEJANDRO ENCINAS RODRIGUEZ," Los elementos de las Fuerzas Armadas, desde el general secretario hasta los mandos en Iguala han brindado toda la información que se les ha requerido al respecto.",0.3318743567898328,27,04,09,2019
ALEJANDRO ENCINAS RODRIGUEZ,"No solamente hemos tenido ya reuniones directas con el general secretario y el Estado Mayor de la Defensa Nacional, se ha visitado las instalaciones del 27 Batallón de Infantería de Iguala y se ha dado respuesta a todos los requerimientos de información que la comisión ha planteado a las Fuerzas Armadas.",0.08415923674836653,51,04,09,2019
PREGUNTA, Hola. Yo quería preguntar un poco en relación también al informe que se dio sobre las fosas.,0.33150945465569565,17,04,09,2019
PREGUNTA,"Sí, se entiende el hecho de que Ayotzinapa es un hecho emblemático, porque los otros 40 mil desaparecidos son desaparecidos que tenían una situación social que nos les permitía tener una voz; ahora los colectivos tratan de darles una voz, pero el crimen organizado llegaba a los pueblos, imponía su ley a sangre y fuego, resolvía las cosas matando a la gente o llevándosela para que trabajara para ellos, y la gente no tenía ninguna defensa.",0.007798901350267895,76,04,09,2019
PREGUNTA,"En cambio, la situación en Ayotzinapa que pudo derivar en lo mismo, cambió porque se volvió un hecho político; y los desaparecidos de Ayotzinapa son desaparecidos políticos, no sólo sociales. Entonces, el hecho de Ayotzinapa es emblemático.",0.01029255940732726,37,04,09,2019
PREGUNTA,"Si en este hecho no se hace justicia, si en este hecho no se logra separar el poder del Estado del poder del crimen organizado, por así decirlo, en el ámbito judicial, ¿qué esperanza tienen los demás desaparecidos?",0.15755912927685908,38,04,09,2019
ALEJANDRO ENCINAS RODRIGUEZ," Nosotros no vamos a cejar en nuestro esfuerzo y nuestra responsabilidad por esclarecer los hechos de Ayotzinapa, como también mantendremos todo el apoyo a las víctimas, desaparición forzada en el país, independientemente de la investigación del caso de Ayotzinapa.",0.06187661940575262,39,04,09,2019
PREGUNTA," Y una pregunta más. No está directamente relacionada con el caso, pero si se está trabajando ya en el proceso de la ley de amnistía o se piensa seguir con el proceso de liberación, digamos, revisando caso por caso.",0.009608993367351572,39,04,09,2019
ALEJANDRO ENCINAS RODRIGUEZ, Se está trabajando en el proyecto de ley de amnistía.,0.007622261173472458,10,04,09,2019
PREGUNTA, Gracias.,0.441790940003079,1,04,09,2019
ALEJANDRO ENCINAS RODRIGUEZ, La última.,0.541333260777616,2,04,09,2019
PREGUNTA," El informe del alto comisionado de Naciones Unidas habla de una doble injusticia en México y cuestiona los avances en las investigaciones, y por su parte el diario alemán Frankfurter Allgemeine Zeitung dice que en México prevalece el orden establecido por Francisco Sahagún Baca.",0.24383503729579384,44,04,09,2019
PREGUNTA,"¿Qué respondería ante ello, señor subsecretario?",0.03799162703557801,6,04,09,2019
ALEJANDRO ENCINAS RODRIGUEZ, Pues prevalece fundamentalmente en el ámbito de la impartición de justicia y este es un hecho evidente.,0.2771021277644664,17,04,09,2019
ALEJANDRO ENCINAS RODRIGUEZ,"Aquí lo que estamos debatiendo hoy, si bien es el respeto pleno a los derechos humanos, es la prevalencia del interés superior de las víctimas de violaciones graves a derechos humanos por encima de los derechos de los victimarios. Y eso tiene que entenderlo el Poder Judicial, porque lo que tiene que hacer es impartir justicia, no malinterpretar discrecionalmente la ley.",0.006096039201250153,61,04,09,2019
PREGUNTA," Entonces, ¿habría que recurrir a la Judicatura, señor subsecretario, para condenar esos malos jueces o ministros de la Corte?",0.00132834739620035,19,04,09,2019
ALEJANDRO ENCINAS RODRIGUEZ," Es la instrucción del presidente de la República. Iniciaremos los procesos de investigaciones correspondientes con jueces, ministerios públicos y los funcionarios responsables de la Fiscalía General de la República.",0.01094964554281083,29,04,09,2019
PREGUNTA, ¿Cuándo lo…?,0.541333260777616,2,04,09,2019
ALEJANDRO ENCINAS RODRIGUEZ, Va a ser de inmediato.,0.6460062821497502,5,04,09,2019
PREGUNTA," … tanto de la procuración de justicia, como de la impartición de justicia, ¿ustedes van a presentar las quejas?",0.016425292989070146,19,04,09,2019
ALEJANDRO ENCINAS RODRIGUEZ," Evidentemente en el caso específico de esta liberación es un juez, y he dado su nombre, es el juez -déjeme decirlo para no fallarle- Samuel Ventura Ramos, juez 1º de Distrito en Procesos Penales Federales en Tamaulipas, que tendrá seguramente una gran interpretación de la ley, pero no va a poder explicar este acto de injusticia con las víctimas.",0.010762244083552069,59,04,09,2019
ALEJANDRO ENCINAS RODRIGUEZ,Seguirá toda la investigación con todo el aparato de la PGR.,0.011782558563184314,11,04,09,2019
PREGUNTA," Una más, subsecretario. De estas 53 personas que permanecen detenidas, dice que 50 podrían quedar en libertad.",0.0488428545709817,17,04,09,2019
PREGUNTA,¿Cuáles son las tres personas de las que ustedes tienen seguridad que seguirán?,0.29392273230184535,13,04,09,2019
ALEJANDRO ENCINAS RODRIGUEZ," Ahí está la lista, la hemos anexado. Toda la información aquí es pública y por supuesto, está la presentación del acceso de todo el público, tenemos la relación puntual.",0.9159121255632814,29,04,09,2019
ALEJANDRO ENCINAS RODRIGUEZ,"Muchas gracias, señor presidente.",0.42659809592117026,4,04,09,2019
PRESIDENTE ANDRES MANUEL LOPEZ OBRADOR, Muy bien. Ahora sí en lo general.,0.8493417211873225,7,04,09,2019
PREGUNTA," Buenos días, presidente, Jocelyn Gutiérrez de Político.MX.",0.09811878538616965,7,04,09,2019
PREGUNTA,Para preguntarle. Ayer Jorge Winkler fue removido como fiscal de Veracruz. Él responsabilizaba a usted y al gobierno de Cuitláhuac García de lo que le pudiera pasar.,0.004661086012504197,27,04,09,2019
PREGUNTA,"Queremos preguntarle qué le responde, ¿esto tiene que ver con el quién es quién en la justicia?",0.043635810744353486,17,04,09,2019
PREGUNTA,"Y si me permite realizarle dos preguntas más, por favor.",0.31216186633039245,10,04,09,2019
PRESIDENTE ANDRES MANUEL LOPEZ OBRADOR," Nosotros somos respetuosos de las autonomías, de las independencias de otros poderes, en este caso de las fiscalías estatales.",0.10823181478085052,19,04,09,2019
PRESIDENTE ANDRES MANUEL LOPEZ OBRADOR,"No tenemos nosotros el propósito de intervenir para quitar a funcionarios públicos, de organismos independientes, de organismos autónomos.",0.03339407828305714,18,04,09,2019
PRESIDENTE ANDRES MANUEL LOPEZ OBRADOR,"Lo que consideramos es que se cometieron errores en el pasado, porque se nombraron fiscales tanto para la impartición de justicia como para el combate a la corrupción a modo; es decir, fiscales propuestos por los gobernadores para que les garantizaran impunidad y eso está perjudicando mucho, el que haya una intromisión en las labores de justicia de grupos de intereses creados, de intereses políticos, que eso no debe de suceder.",0.009308009537859855,71,04,09,2019
PRESIDENTE ANDRES MANUEL LOPEZ OBRADOR,"Es como este asunto que acabamos de tratar. En términos puramente legales podríamos decir: Es la fiscalía, es el Poder Judicial; sin embargo, es un asunto de justicia muy grave y por eso vamos a presentar formalmente una denuncia a la Fiscalía General y al Poder Judicial en este caso que expuso Alejandro.",0.012657151386034713,53,04,09,2019
PRESIDENTE ANDRES MANUEL LOPEZ OBRADOR,"En el otro asunto, que tiene que ver con lo de Veracruz, fue -según entiendo- el congreso local que tomó esa decisión, pero es un hecho de que ha habido ahí una confrontación entre las autoridades locales y este fiscal, que fue heredado desde la administración anterior, que fue propuesto por el anterior gobernador.",0.1962541568970464,54,04,09,2019
PRESIDENTE ANDRES MANUEL LOPEZ OBRADOR,"Y esto no sólo se dio en Veracruz, sino en todos lados, es una práctica que viene desgraciadamente de lejos, porque no hay en los estados, con algunas excepciones, autonomía de los poderes, en los estados sigue siendo el titular del Ejecutivo el poder de los poderes.",0.3911230088431638,47,04,09,2019
PRESIDENTE ANDRES MANUEL LOPEZ OBRADOR,"Y estamos actuando de manera distinta en lo que corresponde al Poder Ejecutivo federal, pero ojalá y esto se aplique a nivel estatal, que haya esta división, que haya este equilibrio entre los poderes. Es un proceso que se tiene que ir logrando poco a poco.",0.4839977393239281,46,04,09,2019
PREGUNTA, Una segunda pregunta.,0.30415764791879857,3,04,09,2019
PREGUNTA,¿Cuál es su postura ante la dimisión voluntaria de Porfirio Muñoz Ledo a la Mesa Directiva de San Lázaro?,0.054149729893698886,19,04,09,2019
PRESIDENTE ANDRES MANUEL LOPEZ OBRADOR," Pues ese es otro caso parecido. Nosotros no tenemos por qué intervenir; sin embargo, yo creo que la transformación de México pasa por el estricto apego a la legalidad, es decir, que se acabe con la simulación, esa máxima que viene desde la época de Porfirio Díaz, de que la ley se respeta en la forma para violarse en el fondo. Nadie puede estar por encima de la ley, al margen de la ley nada y por encima de la ley nadie.",0.005044000069002662,82,04,09,2019
PRESIDENTE ANDRES MANUEL LOPEZ OBRADOR,"Entonces, yo celebro -aunque corresponda a otro poder- el que se haya resuelto respetar la ley en el caso del Poder Legislativo; es decir, que no se haya modificado la ley orgánica en el Poder Legislativo, porque eso no debe de permitirse.",0.4675876547472213,42,04,09,2019
PRESIDENTE ANDRES MANUEL LOPEZ OBRADOR,"Aunque ahí nosotros no tenemos facultad, sí podemos dar nuestro punto de vista; entonces, celebro mucho el que ya se haya resuelto esa controversia. Y no entrar en componendas de ningún tipo, aplicar lo que está en la Constitución y en las leyes.",0.11661865905153244,43,04,09,2019
PREGUNTA," Por último, presidente, para preguntarle cuál es su opinión sobre la iniciativa que propone reducir o eliminar los legisladores por plurinominales en ambas cámaras",0.041265444260559926,24,04,09,2019
PRESIDENTE ANDRES MANUEL LOPEZ OBRADOR," No lo veo mal, nada más que esa es una iniciativa que están presentando en el Poder Legislativo, pero yo creo que se deben revisar todos los excesos que existen en el país.",0.4613464593562543,33,04,09,2019
PRESIDENTE ANDRES MANUEL LOPEZ OBRADOR,"Se debe de revisar en su momento el papel de los órganos electorales, que cuesta mucho mantenerlos, el instituto electoral en México es de los más costosos del mundo, lo mismo en el caso de los poderes.",0.12063151820217873,37,04,09,2019
PRESIDENTE ANDRES MANUEL LOPEZ OBRADOR,"Se tiene que aplicar una política de austeridad republicana de Estado y reducir los gastos manteniendo principios y llevando a la práctica la democracia, porque antes que no había democracia se usaba mucho la simulación, los aparatos, pero era para cooptar, para tener maiceados a todos. Ahora ya no hay ese propósito de cooptación",0.011785983434855209,54,04,09,2019
PRESIDENTE ANDRES MANUEL LOPEZ OBRADOR,"¿Para qué organismos tan grandes, onerosos? ¿para qué tantos organismos?",0.1164314836982852,10,04,09,2019
PRESIDENTE ANDRES MANUEL LOPEZ OBRADOR,Si lo que se busca es que haya justicia y que haya democracia -son los valores fundamentales- no se requiere de tanto aparato. Yo no veo mal el que se lleven a cabo estas reformas.,0.35232012312951844,35,04,09,2019
PREGUNTA," Buenos días, presidente. Alberto Rodríguez, de SDP Noticias.",0.39874308365802846,8,04,09,2019
PREGUNTA,"¿No fue precisamente la inclusión de estos plurinominales que abrió, no fue parte del proceso que abrió a esa nueva democracia?",0.1440832975773008,21,04,09,2019
PREGUNTA,"Es decir, antes podía ganar por un voto el PRI y se tenía a un diputado y no había una representación para el 49 por ciento que había votado por una opción contraria.",0.07160475016088284,33,04,09,2019
