Participante,Texto,Sentimiento,Palabras,Dia,Mes,Anio
PREGUNTA," Construcción del Tren Interurbano México-Toluca, reporte semanal.",0.0,7,20,12,2021
PREGUNTA,Vía catenaria y obra electromecánica. Avance: 46 por ciento.,0.0,9,20,12,2021
PREGUNTA,"Instalación de vía. Continúa la colocación de rieles y fijaciones de la vía izquierda sobre el viaducto 4; posteriormente, se realizarán los colados de concreto para el anclaje de la vía.",0.0,31,20,12,2021
PREGUNTA,"Portal Toluca. En la transición entre el viaducto 5 y el túnel para la vía 1 avanza la instalación de vía, así como las canalizaciones para los sistemas de comunicación y control.",0.0,32,20,12,2021
PREGUNTA,"Tramo 3, 17 kilómetros. Avance de obra: 53.7 por ciento.",0.0,10,20,12,2021
PREGUNTA,"Estación Santa Fe. Continúa el suministro de estructuras de acero desde Guadalajara, una vez en campo se ensamblan mediante soldadura aplicada por personal certificado en condiciones controladas. Sobre los ocho apoyos principales se colocarán las plataformas metálicas del vestíbulo, andenes y techumbre de la estación.",0.0,45,20,12,2021
PREGUNTA,"Estación Vasco de Quiroga. Avanza el movimiento de terracerías para la conformación de plataformas. Se excavaron las dos primeras zapatas de los apoyos principales de la estación. Las pilas de cimentación profunda son descabezadas para unir el acero de refuerzo con el armado de las zapatas, integrándolas estructuralmente.",0.0,48,20,12,2021
PREGUNTA,Lanzadora de dovelas. Continúa el ensamble del equipo para el lanzamiento de dovelas desde la presa Tacubaya hasta la estación Vasco de Quiroga.,0.0,23,20,12,2021
PREGUNTA,Presa Tacubaya. Continúan trabajos de desazolve y limpieza en el vaso de la presa donde se desplantará el viaducto en doble voladizo sobre su cortina.,0.0,25,20,12,2021
PREGUNTA,El Tren Interurbano propiciará que dejen de circular cerca de 13 mil automóviles que diariamente transitan por la autopista México-Toluca.,0.0,20,20,12,2021
PREGUNTA,"Secretaría de Infraestructura, Comunicaciones y Trasportes.",0.0,6,20,12,2021
PREGUNTA," El Istmo de Tehuantepec tiene una posición relevante para el cruce de pasajeros y mercancías. Con alrededor de 300 kilómetros, es la parte más estrecha de México que conecta el golfo con el pacífico.",0.0,34,20,12,2021
PREGUNTA,"A continuación, se informa el avance de obras al 20 de diciembre de 2021.",0.0,14,20,12,2021
PREGUNTA,"En el puerto de Salina Cruz recolectamos distintos tipos de piedra para continuar la construcción de 1.6 kilómetros del Rompeolas Oeste. Estas piedras son acarreadas hacia los patios de acopio donde, gracias al frente de básculas, clasificamos de acuerdo con su tamaño y peso. Al día de hoy hemos clasificado 381 mil 36 toneladas de roca de los tipos núcleo, secundaria, berma y coraza las cuales se encuentran listas para su vertimiento marino.",0.0,73,20,12,2021
PREGUNTA,En esta obra hemos generado 392 empleos directos y dos mil indirectos.,0.0,12,20,12,2021
PREGUNTA,La rehabilitación de las vías en el ferrocarril en el Istmo de Tehuantepec continúa.,0.0,14,20,12,2021
PREGUNTA,En el tramo1 realizamos maniobras con ayuda de un balancín para el alienado de durmientes y el montaje del riel.,0.0,20,20,12,2021
PREGUNTA,"En el tramo 2 formamos la capa de subbalasto sobre la plataforma, la cual tiene capacidades de drenaje,",0.0,18,20,12,2021
PREGUNTA,En el tramo 4 descargamos el balasto en la vía nueva.,0.0,11,20,12,2021
PREGUNTA,En el tramo 5 desmantelamos la vía antigua y acondicionamos la superficie para la conformación de la plataforma.,0.0,18,20,12,2021
PREGUNTA,En esta obra hemos generado 856 empleos directos y mil 368 empleos indirectos.,0.0,13,20,12,2021
PREGUNTA,El Programa Istmo aprovecha la posición estratégica del Istmo de Tehuantepec para incrementar el bienestar económico y social de las y los istmeños.,0.0,23,20,12,2021
PREGUNTA, La Comisión Nacional del Agua informa el avance en la construcción de la presa Santa María Proyecto Baluarte-Presidio.,0.0,18,20,12,2021
PREGUNTA,La presa tiene un avance físico de 36 por ciento.,0.0,10,20,12,2021
PREGUNTA,"En el portal de entrada se ha concluido la embocadura del túnel 1 y continúa la colocación de acero de refuerzo, cimbra y concreto hidráulico en la desembocadura de los túneles 2 y 3. De igual forma, se instalan los marcos metálicos por donde se deslizarán los obturadores que cerrarán los túneles.",0.0,52,20,12,2021
PREGUNTA,"En el portal de salida se realiza la excavación en taludes del canal de descarga, así como la colocación de material de rezaga y enrocamiento para la conformación del bordo de protección de los túneles 2 y 3.",0.0,38,20,12,2021
PREGUNTA,En el túnel 1 se llevan a cabo trabajos de barrenado para drenes y limpieza general del túnel.,0.0,18,20,12,2021
PREGUNTA,"En el túnel 2 continúa la excavación de la sección inferior, la colocación e inyección de anclas de fricción de concreto lanzado y de empaque para columnas metálicas.",0.0,28,20,12,2021
PREGUNTA,"En el túnel 3 se logró la comunicación de los dos frentes de excavación con el uso de explosivos y continúa la colocación de concreto lanzado, marcos metálicos y concreto de empaque en la sección superior, así como de malla electrosoldada y concreto de empaque para columnas metálicas en la caverna.",0.0,51,20,12,2021
PREGUNTA,"En la ataguía aguas arriba continúa la colocación y compactación de material de respaldo, así como de enrocamiento de prevención, además de la colocación de acero de refuerzo y concreto para los brocales en donde se ubicará la pantalla plástica.",0.0,40,20,12,2021
PREGUNTA,"En la margen izquierda de la cortina se realizan trabajos de excavación, barrenado y colocación de maya electrosoldada y concreto lanzado sobre taludes. En la margen derecha se continúa la excavación, así como la carga y acarreo de material.",0.0,39,20,12,2021
PREGUNTA,"En el vertedor 2 continúa la colocación de cimbra, acero de refuerzo y concreto hidráulico para muros de gravedad, derecho e izquierdo en el canal de llamada, así como la excavación en la zona aguas arriba del vertedor.",0.0,38,20,12,2021
PREGUNTA,En el canal de descarga se realiza la limpieza para la colocación de concreto en la losa de piso.,0.0,19,20,12,2021
PREGUNTA,"Se han traslado al sitio de la presa los 16 elementos que conforman el obturador, así como la viga pescadora que servirá para su colocación en los marcos metálicos.",0.0,29,20,12,2021
PREGUNTA,A la fecha se han generado tres mil 400 empleos en la construcción de la presa.,0.0,16,20,12,2021
ROSA ICELA RODRIGUEZ VELAZQUEZ," Con su permiso, señor presidente. Tengan todas y todos muy buen día. Saludo a mis compañeros del gabinete y a los representantes de los medios de comunicación.",0.0,27,20,12,2021
ROSA ICELA RODRIGUEZ VELAZQUEZ,"Como hacemos cada mes, informaremos hoy los resultados del trabajo coordinado en el que participan todas las instituciones de seguridad del Gobierno de México, así como los gobiernos de los estados y municipios mediante las Mesas de Paz estatales y regionales, y el reporte es resultado de la labor de instituciones integrantes del Gabinete de Seguridad Nacional que preside diariamente a las 6:00 de la mañana el señor presidente.",0.0,69,20,12,2021
ROSA ICELA RODRIGUEZ VELAZQUEZ,"Ahí están los titulares de la Secretaría de Seguridad, de Gobernación, de la Secretaría de la Defensa Nacional, Secretaría de Marina, la Guardia Nacional, el Centro Nacional de Inteligencia y la Consejería Jurídica.",0.0,33,20,12,2021
ROSA ICELA RODRIGUEZ VELAZQUEZ,"Los tres órdenes de gobierno nos coordinamos para articular la inteligencia con el fortalecimiento de la presencia territorial de las fuerzas operativas, de las fuerzas de seguridad y el trabajo conjunto también permite coordinarnos con las autoridades competentes para dar seguimiento a las investigaciones que sancionan el crimen y abaten la impunidad.",0.0,52,20,12,2021
ROSA ICELA RODRIGUEZ VELAZQUEZ,"Ahora le daría la palabra al general Bucio, comandante de la Guardia Nacional.",0.0,13,20,12,2021
LUIS RODRIGUEZ BUCIO, Muy buenos días.,0.0,3,20,12,2021
LUIS RODRIGUEZ BUCIO,"La presentación del día de hoy comprende, como ya lo mencionó la secretaria, el esfuerzo nacional de combate al narcotráfico y las actividades de seguridad pública del gobierno federal desde el 1º de diciembre del 2018 hasta el 1º de diciembre de 2021.",0.0,43,20,12,2021
LUIS RODRIGUEZ BUCIO,"Abarca los puntos que se establecen en el Plan Nacional de Paz y Seguridad 2018-2024 y en la Estrategia Nacional de Seguridad Pública, abarca la creación de la Guardia Nacional, las operaciones basadas en el uso de inteligencia, esfuerzos coordinados de manera interinstitucional, el acuerdo del 11 de mayo del 2020 en el que referente a la participación de las Fuerzas Armadas en tareas de seguridad pública, respeto a derechos humanos y el apego a la Ley Nacional del Uso de la Fuerza.",0.0,83,20,12,2021
LUIS RODRIGUEZ BUCIO,"Por lo que corresponde a la Guardia Nacional, en cuestión de efectivos, lo vemos. La Guardia Nacional inició 2019 o terminó el año 2019 con 88 mil 557 elementos, para el 2020 alcanzó los 99 mil 169 y en el presente año la Guardia Nacional tiene efectivos de 113 mil 863. Aquí aclarando que en este efectivo se contabiliza también plazas presupuestales que la Policía Militar tiene en su estructura, principalmente personal de grados y especialidades que irá pasando a la Guardia Nacional conforme disponga de ellos.",0.0,87,20,12,2021
LUIS RODRIGUEZ BUCIO,"De manera que la Guardia Nacional continúa con una fuerza operativa de casi 100 mil elementos, sí, habiendo iniciado en el año 2019 con 74 mil, un poco más, y en 2020, 98 mil 282.",0.0,35,20,12,2021
LUIS RODRIGUEZ BUCIO,"Coordinaciones regionales, la meta de las 266 coordinaciones regionales ya se alcanzaron. En el 2019 se establecieron 150, otras 50 en 2020 y en este año ya se establecieron las 66 que faltaban para tener las 266.",0.0,37,20,12,2021
LUIS RODRIGUEZ BUCIO,"En la construcción de compañías, la meta del 2019 eran 81, se cumplió totalmente; la meta del 2020 eran 91, solamente quedan dos en construcción; la meta del 2021, 76, ya se construyeron 43, están en construcción 33, que serán concluidas en los primeros meses del 2022; y para el 2022 se tienen proyectadas 151 nuevas compañías y para el 2023, 95, para tener nuevamente otras 246 compañías nuevas, construidas.",0.0,70,20,12,2021
LUIS RODRIGUEZ BUCIO,"También considerar que el Ejército pondrá a disposición o ya ha puesto a disposición de la Guardia Nacional 100 instalaciones para alojamiento de compañías, de manera que al terminar el 2023, inicios de 2024, la Guardia Nacional debe de tener 594 instalaciones de nivel compañía.",0.0,45,20,12,2021
LUIS RODRIGUEZ BUCIO,"Debido a las funciones, a las facultades y las responsabilidades de la Guardia Nacional, ha sido necesario crear algunas unidades especiales. A la fecha tenemos ya constituido un Batallón de Seguridad turística, este principalmente está destinado ahorita al estado de Quintana Roo.",0.0,42,20,12,2021
LUIS RODRIGUEZ BUCIO,Tenemos también un Batallón de Seguridad a Instalaciones Estratégicas.,0.0,9,20,12,2021
LUIS RODRIGUEZ BUCIO,"Otro Batallón de Seguridad Aeroportuaria, que incluye ya aquí al personal considerado para dar la seguridad interior y exterior del aeropuerto ‘Felipe Ángeles’.",0.0,23,20,12,2021
LUIS RODRIGUEZ BUCIO,"Para la seguridad en carreteras tenemos considerados tener 20 batallones, total de más de siete mil elementos.",0.0,17,20,12,2021
LUIS RODRIGUEZ BUCIO,Un Batallón de Seguridad Ecológica.,0.0,5,20,12,2021
LUIS RODRIGUEZ BUCIO,Un Batallón de Protección al Patrimonio Cultural.,0.0,7,20,12,2021
LUIS RODRIGUEZ BUCIO,"Y un Grupo Especial de Investigación de Delitos contra Mujeres, este está constituido exclusivamente por mujeres, los efectivos son los iniciales y se irán incrementando de acuerdo a las necesidades y capacidades de la Guardia Nacional, haciendo hincapié que este personal también tendremos que tener y tenemos cuidado en que tengan la capacitación especializada para la función que realizan.",0.0,59,20,12,2021
LUIS RODRIGUEZ BUCIO,Sería cuanto para la Guardia Nacional. Me permito ceder la palabra a mi general secretario.,0.0,15,20,12,2021
LUIS CRESENCIO SANDOVAL GONZALEZ," Con su permiso, señor presidente.",0.0,5,20,12,2021
LUIS CRESENCIO SANDOVAL GONZALEZ,"Dentro de la estrategia de seguridad pública aquí mostramos lo que ha sido el Plan de Apoyo a Zacatecas, donde se inició el plan el 25 de noviembre, 25 días de operaciones llevamos.",0.0,33,20,12,2021
LUIS CRESENCIO SANDOVAL GONZALEZ,"Y aquí vemos la comparación de lo que tenía el estado de Zacatecas en homicidios vinculados a delincuencia organizada, 141 homicidios, considerando la misma cantidad de 10, 25 antes de iniciar la operación; aquí, a partir de que iniciamos la operación, se han presentado nada más 78 homicidios vinculados a delincuencia organizada, una reducción del 45 por ciento. Entonces consideramos que va siendo efectivo este Plan de Apoyo con la presencia del refuerzo que se hizo ahí en el estado.",0.0,80,20,12,2021
LUIS CRESENCIO SANDOVAL GONZALEZ,"También, dentro de la estrategia de seguridad pública se dio la atención a nueve estados, aquí vemos cómo vamos en esos nueve estados. Mencionar Guanajuato, ha reducido 3.6 por ciento, Baja California 14 por ciento, Chihuahua 16 por ciento, Michoacán 3.7 por ciento, Jalisco cuatro por ciento, Sonora 13 por ciento, Zacatecas 45 por ciento, Quintana Roo 38 por ciento. Son homicidios vinculados a delincuencia organizada. Y el Estado de México es el único que ha ido en incremento, con 10.1 por ciento.",0.0,83,20,12,2021
LUIS CRESENCIO SANDOVAL GONZALEZ,"Aquí vamos a informar del esfuerzo nacional, lo que hemos hecho a través de los años comparando también los últimos tres años de la administración anterior. Y aquí hay cuatro rubros en los cuales hay una tendencia a la baja o hemos asegurado menos.",0.0,44,20,12,2021
LUIS CRESENCIO SANDOVAL GONZALEZ,"Aquí considerar que en lo que es la marihuana o algunos de los productos o las drogas, han tenido menos demanda en el mercado, ha cambiado el consumo y ha cambiado la producción a nivel mundial, se han ido para la producción y consumo de drogas más letales, pero también con mayor facilidad para hacerlas y con un costo que les permite mayores ganancias.",0.0,64,20,12,2021
LUIS CRESENCIO SANDOVAL GONZALEZ,"En esos rubros tenemos resultados positivos dentro de la estrategia. Hemos aumentado fentanilo, metanfetaminas, cocaína, heroína, embarcaciones, vehículos, detenidos, armas de fuego, granadas, cartuchos, numerario y aeronaves.",0.0,27,20,12,2021
LUIS CRESENCIO SANDOVAL GONZALEZ,"Ahorita vamos a ver todas las gráficas para hacer… donde estamos haciendo la comparación. Pero sí recalcar que hubo un cambio en el consumo, hubo un cambio en los mercados de droga por esa facilidad de producir drogas sintéticas.",0.0,39,20,12,2021
LUIS CRESENCIO SANDOVAL GONZALEZ,"Aquí vemos las hectáreas de marihuana que fueron destruidas. En los tres últimos años de la administración pasada, 12 mil 264 hectáreas; ahorita llevamos seis mil 784 hectáreas.",0.0,28,20,12,2021
LUIS CRESENCIO SANDOVAL GONZALEZ,"En kilógramos de marihuana, un millón 364 mil 802 kilógramos; en los primeros tres años, 583 mil 543 kilógramos.",0.0,19,20,12,2021
LUIS CRESENCIO SANDOVAL GONZALEZ,"Y aquí tenemos lo que ha sido de pérdida, lo que estimamos que le quitamos a la delincuencia como ganancia, 697 millones 947 mil 440 dólares americanos.",0.0,27,20,12,2021
LUIS CRESENCIO SANDOVAL GONZALEZ,"Aquí en amapola, 73 mil 440 hectáreas de amapola en los últimos tres años de la administración anterior, 36 mil 211 hectáreas en los tres primeros años.",0.0,27,20,12,2021
LUIS CRESENCIO SANDOVAL GONZALEZ,"En goma de opio, mil 452 kilógramos de goma de opio y, en comparación con lo que llevamos, mil 102 kilógramos.",0.0,21,20,12,2021
LUIS CRESENCIO SANDOVAL GONZALEZ,"En laboratorios, 287 laboratorios en la administración anterior; en lo que llevamos de estos tres años, 203 laboratorios. Aquí mencionar que los laboratorios que se han descubierto o se han asegurado en esta administración han sido con mayores capacidades, lo que nos ha permitido asegurar una mayor cantidad de productos de metanfetaminas que ahí se elaboran.",0.0,56,20,12,2021
LUIS CRESENCIO SANDOVAL GONZALEZ,"Aquí vemos en lo que es el fentanilo, una de las drogas más letales que se tienen. En los tres últimos años, 559 kilógramos fueron asegurados, tres últimos años de la administración anterior; lo que llevamos en la actualidad de los tres primeros años, tres mil 497 kilogramos de fentanilo. Ha ido en aumento el aseguramiento de fentanilo, también las estrategias han ido tendientes a detectar estas drogas tanto en la producción, en los laboratorios, como ya mencionaba, como en el movimiento que se hace para hacerlos llegar a los mercados de consumo.",0.0,93,20,12,2021
LUIS CRESENCIO SANDOVAL GONZALEZ,Tenemos un 525 por ciento arriba en esa comparación y en una pérdida de la delincuencia de mil 398 millones de dólares.,0.0,22,20,12,2021
LUIS CRESENCIO SANDOVAL GONZALEZ,"En lo que es metanfetamina, también otra de las que se producen con facilidad y que da muchos recursos a la delincuencia, aquí tenemos 54 mil 521 kilogramos de metanfetaminas asegurados en los últimos tres años de la administración pasada; en esta administración 128 por ciento, que equivale a 124 mil 735 kilogramos de esta droga.",0.0,56,20,12,2021
LUIS CRESENCIO SANDOVAL GONZALEZ,"En cocaína, también un aumento del 77 por ciento en estos tres años con 65 mil 20 kilogramos de cocaína, en comparación a los 36 mil 700 kilogramos que se habían asegurado al final de los tres años finales de la administración anterior.",0.0,43,20,12,2021
LUIS CRESENCIO SANDOVAL GONZALEZ,"En heroína, de igual manera, 26 por ciento más de heroína asegurada en esta administración, en estos tres primeros años llevamos mil 398 kilogramos de heroína, en comparación con mil 107 que se habían asegurado los tres últimos años.",0.0,39,20,12,2021
LUIS CRESENCIO SANDOVAL GONZALEZ,"En lo que es embarcaciones 37 por ciento más de embarcaciones aseguradas, 248 llevamos en estos primeros tres años, se habían hecho en los últimos tres años de la administración anterior 180.",0.0,32,20,12,2021
LUIS CRESENCIO SANDOVAL GONZALEZ,"Y en vehículos, de igual manera, 180 por ciento más, 82 mil 416 en esta administración; en la anterior, 29 mil 445.",0.0,22,20,12,2021
LUIS CRESENCIO SANDOVAL GONZALEZ,"En detenidos, aquí también tenemos un 194 por ciento más de detenidos, 63 mil 379 detenidos en los tres años de la administración, en comparación con 21 mil 548 de la anterior administración.",0.0,33,20,12,2021
LUIS CRESENCIO SANDOVAL GONZALEZ,"En armas de fuego, un 80 por ciento más de aseguramiento, son 26 mil 27 armas que se han asegurado, muchas de ellas, el 70 por ciento, consideramos que son procedentes de Estados Unidos, de fábricas estadounidenses; y en comparación con lo de los tres últimos años de la administración anterior, 14 mil 411.",0.0,54,20,12,2021
LUIS CRESENCIO SANDOVAL GONZALEZ,"En granadas también ha habido un aseguramiento importante, 38 por ciento más de estos implementos bélicos, mil 751 granadas aseguradas en los primeros tres años, en comparación con mil 262 de la administración anterior.",0.0,34,20,12,2021
LUIS CRESENCIO SANDOVAL GONZALEZ,"Y cartuchos, aquí es 422 por ciento más. En la administración anterior aseguraron dos millones 50 mil 204, los últimos tres años, y en los primeros tres años llevamos 10 millones 702 mil 792 cartuchos asegurados a la delincuencia organizada.",0.0,40,20,12,2021
LUIS CRESENCIO SANDOVAL GONZALEZ,"En moneda nacional, en los aseguramientos de moneda nacional y de dólares, también ha sido un incremento; esto es importante porque se le asegura el recurso con el que opera la delincuencia. En moneda nacional, 620 por ciento más de aseguramientos, llevamos 461 millones 985 mil 380 pesos asegurados a la delincuencia en estos primeros tres años, y en comparación con la administración anterior, 64 millones 143 mil 899. El incremento ha sido importante.",0.0,74,20,12,2021
LUIS CRESENCIO SANDOVAL GONZALEZ,"Y en dólares americanos también un incremento del 282 por ciento, 59 millones 163 mil 297 dólares asegurados a la delincuencia y la comparación con la administración anterior, son 15 millones 462 mil 304 dólares.",0.0,35,20,12,2021
LUIS CRESENCIO SANDOVAL GONZALEZ,"En aeronaves, un 143 por ciento más, 159 aeronaves aseguradas en estos tres años de aplicar la estrategia, en comparación de 65 con la administración anterior. Y aquí citar que muchas de esas aeronaves tienen matrícula estadounidense que operan en el espacio aéreo mexicano para hacer sus vuelos ilícitos, y también ha habido una coordinación con centro y Sudamérica a través del Sistema Integral de Vigilancia Aérea de la Fuerza Aérea Mexicana para poder hacer muchos de estos aseguramientos.",0.0,79,20,12,2021
LUIS CRESENCIO SANDOVAL GONZALEZ,"En cuanto a la actividad de inteligencia en todos estos resultados que se han mencionado, el 31 por ciento o en el 31 por ciento de estos resultados ha estado presente actividades de inteligencia de todos los órganos: de la Secretaría de Marina, de la Secretaría de la Defensa Nacional, el CNI, de la Guardia Nacional, todos participando.",0.0,58,20,12,2021
LUIS CRESENCIO SANDOVAL GONZALEZ,"Se han hecho las detenciones importantes de cinco líderes de organizaciones, aquí los tenemos en la lámina, cinco jefes regionales, nueve jefes de plaza, mil 59 integrantes relevantes de células delictivas.",0.0,31,20,12,2021
LUIS CRESENCIO SANDOVAL GONZALEZ,"En total, tenemos mil 78 objetivos prioritarios que han sido detenidos en base a las actividades de inteligencia que realizan todas las instituciones de seguridad que están dentro de la estrategia integral de seguridad pública.",0.0,35,20,12,2021
LUIS CRESENCIO SANDOVAL GONZALEZ,"Las detenciones, estas representan el 106 por ciento en comparación con los 522 elementos de la delincuencia organizada capturados en la administración anterior.",0.0,23,20,12,2021
LUIS CRESENCIO SANDOVAL GONZALEZ,"Aquí tenemos lo que se ha logrado en aseguramientos con inteligencia: 87 laboratorios, 143 aeronaves, 56 mil 567 kilogramos de cocaína, 76 mil 88 kilogramos de metanfetaminas, dos mil 168 kilogramos de fentanilo.",0.0,33,20,12,2021
LUIS CRESENCIO SANDOVAL GONZALEZ,"También las actividades de inteligencia han estado desarrollando apoyos directos a seguridad pública y aquí mencionamos un hecho relevante: que ayudaron todos los órganos de inteligencia de las instituciones a hacer el esclarecimiento de los hechos en donde se agredió a una familia en Bavispe, logrando a través de la inteligencia la captura de 25 agresores que tuvieron que ver con ese hecho delictivo.",0.0,64,20,12,2021
LUIS CRESENCIO SANDOVAL GONZALEZ,Como conclusiones:,0.0,2,20,12,2021
LUIS CRESENCIO SANDOVAL GONZALEZ,"La Guardia Nacional, considerando estos tres años y en comparación de lo que se ha proyectado para el 2024, lleva un avance del 70 por ciento. El 31 por ciento de los resultados, como ya cité, son producto o donde ha estado empleándose la inteligencia para lograr esos resultados.",0.0,49,20,12,2021
LUIS CRESENCIO SANDOVAL GONZALEZ,Y en forma general tenemos un 142 por ciento más de resultados que la administración anterior y esto se ha logrado por la coordinación de todas las autoridades que participan en la estrategia.,0.0,33,20,12,2021
LUIS CRESENCIO SANDOVAL GONZALEZ,"Y la contribución de lo que es Ejército, Fuerza Aérea y Armada en los resultados del esfuerzo nacional representan el 66 por ciento, en el 66 por ciento de esos resultados han estado las Fuerzas Armadas, y esto es de acuerdo o de conformidad al acuerdo del 11 de mayo del 2020 donde nos establecen cómo hacer las cosas de conformidad a lo que está establecido en nuestra Constitución, en el 5º transitorio.",0.0,73,20,12,2021
LUIS CRESENCIO SANDOVAL GONZALEZ,"Entonces, este es el aporte de las Fuerzas Armadas para esa parte.",0.0,12,20,12,2021
LUIS CRESENCIO SANDOVAL GONZALEZ,"Y si comparamos lo que le hemos asegurado a la delincuencia en recursos, corresponde, haciendo una comparación con los programas de bienestar para personas adultas mayores, el 99.4 sería lo que le hemos quitado a esa delincuencia.",0.0,37,20,12,2021
LUIS CRESENCIO SANDOVAL GONZALEZ,"Y en números, en dinero, serían seis mil 362 millones de dólares que se le han quitado a esta delincuencia dentro del combate contra ellos.",0.0,25,20,12,2021
LUIS CRESENCIO SANDOVAL GONZALEZ,"En el índice de letalidad, esto es importante, cómo se ha ido presentando el índice de letalidad en los tres últimos años. Pero haré referencia, primero, 2011. Aquí vemos las líneas, la parte de la línea roja es los que han fallecido, la línea verde son los heridos y los detenidos, la línea punteada son la cantidad de agresiones que han tenido las diferentes instituciones y la línea azul es el índice de letalidad.",0.0,74,20,12,2021
LUIS CRESENCIO SANDOVAL GONZALEZ,"Y aquí podemos observar cómo en el 2011 es donde se presenta la mayor cantidad de muertos, también hay una cantidad importante de agresiones, aquí el índice de letalidad estaba en 285, es decir, el índice de letalidad es la fórmula de sumar los civiles heridos más los detenidos y ahí se saca un número que nos va a dar: o positivo, que es mayor cantidad de fallecidos; o negativo, menor cantidad.",0.0,72,20,12,2021
